,Unnamed: 0,date,context
2463,4662,1858-12-09-seq-1.txt,"sentiment of politicians: of men who hate slavery because it is popu lar to hate, of demagogues who talk "
2464,4663,1858-12-09-seq-1.txt,"purposes, it is certain that the sub ject of slavery lies in the very midst of them, acting as a perpetual "
2465,4664,1858-12-09-seq-1.txt,"tions that are filled by the popular Vote, and the political anti-slavery sentiment, or rather the politician's "
2466,4671,1865-12-07-seq-1.txt,"Iayiurjugnimsiurei,itieiiuua - laved. It ii at this tim dents -rekited in thi .sketch oc "
2467,4672,1856-01-10-seq-2.txt,"answer is patent. The National De-' juesrs.iiuwK r Aiiuuugu unugai, of the ij. ,n making the treaty, Ition of slavery should form no part of doing this, and say tliat it was no un at the feet of the Gamaliel oflt-.. .n t f Ont r,: a : iir It ar,.tnnf Tt w 9 t,.,i,i.fp.l ot. "
2469,4674,1856-01-10-seq-2.txt,"isiana, to illustrate that the balance of power, between freedom and slave- ence 10 slavery ana ice ruguivei. r u tt, i xiua. n s icauj icicu mm moiiim vi wl-iout iruui oau i wlusuo "
2472,4677,1856-01-10-seq-2.txt,"1 T! i.t 1 1 ;UpiuiUU UU IUB Slave question. ""We now condemn the repeal "
2473,4678,1856-01-10-seq-2.txt,"""We now claim to be neither rro- slavery nor anti-slaverv in our edito- rials. "
2474,4679,1856-01-10-seq-2.txt,"""We now protest against the agita tion f;the question of slavery in Congress, or of anv other sectional "
2475,4680,1856-01-10-seq-2.txt,"Lawism. JTuntsville Advocate. Re-Opening of Slavery Agita-! field, the regularly elected delegate "
2476,4681,1856-01-10-seq-2.txt,"horrible atrocities of the institution of slavery,' bnt the following sent ences, uttered by the Hon. Joshua "
2478,4692,1858-03-18-seq-1.txt,""" "" . Shall suITui-ing. printers here beloW f ""Ilave ro reijrjss above? The angel bands replied, - : "
2479,4693,1856-03-20-seq-3.txt,"bill, or deed, as directs, the manumis sion of slaves, to bd void. : They have also repealed all laws prohibiting the "
2480,4694,1856-03-20-seq-3.txt,also repealed all laws prohibiting the importation of slaves into that State. . An; extensive revival of : religion is 
2481,4699,1860-02-02-seq-3.txt,"love him, but because 1 hate his mas ter and hale slavery? , . .- "" - -:. 1 1 am aware that through his organ "
2482,4701,1861-03-14-seq-1.txt,"of choice, not, of necessity. The bor der 6lave Siatev can supply the whole South with all tbe corn, pork "
2483,4703,1861-03-14-seq-1.txt,"IU V1U VUOfcVUA wa w www J 1 slave can be the means of bringing b received his freedom, he arrived at "
2484,4704,1861-03-14-seq-1.txt,"b received his freedom, he arrived at the conclusion that, the galler-slave had furnished the clue, which turned "
2485,4707,1853-09-29-seq-1.txt,"e, Mr. Ueve- jiin really gl;td to see)!oii. lave miss e tried -to "
2486,4708,1856-07-17-seq-1.txt,holding States which would bo a city of refuge for runaway slaves. You create by law a central point 
2487,4709,1856-07-17-seq-1.txt,"petitions i ; , ; v. 1st To declare slaves ITiEE. who had gone to sea with tbi con "
2488,4710,1856-07-17-seq-1.txt,6th. S To' PROHIBIT tho buying and selling of slaves in . the District and other territories of 'the 
2489,4711,1856-07-17-seq-1.txt,"My Mary by the meadow gate. Mr. Bachanan on . Slaveryja the ' ' District "" "
2490,4712,1856-07-17-seq-1.txt,"were poured into Congress to abolish slavery ia tho"" District of Culambia. Mr. Buchanan thus emphatically and "
2491,4713,1856-07-17-seq-1.txt,"miles square a District carved but of two slave holding Slate, and surrounded by them on all sides, "
2492,4714,1856-07-17-seq-1.txt,"surrounded by them on all sides, slavery, shall be abolished ! What would be the effect of granting their "
2493,4715,1856-07-17-seq-1.txt,tha peaco and Safety of their citizens. You establish a spot within tho slave holding States which would bo a 
2494,4717,1856-07-17-seq-1.txt,"of your convenience, and not. for their own destruction When slave ry ceases to exist under the laws' of "
2495,4719,1856-07-17-seq-1.txt,"Texas solely on . the ground that slavery existed io that country. oth. To abolish ' slavery "" in the "
2497,4732,1857-08-27-seq-2.txt,". The South thus stateVthe present current prices of slaves in the Rich moud,Va market, which is the great "
2498,4733,1857-08-27-seq-2.txt,"so well fed and clothed, and on the whole 60 happy, as the slave popula tion"" of-the .United States."" "
2499,4735,1857-08-27-seq-2.txt,"dirdctod more agaauet tne nwster than , in favor of the slave, the end is secur-'j CCi, even though'thl latter is left tOj "
2500,4739,1852-03-25-seq-4.txt,"1i,i - i ' aVCnUtj i lavender It iiinii. neiuli, uriganum, pepper- Feb. 12. "
2501,4740,1852-03-25-seq-4.txt,"TUOU ..... . k)r., d'ain; ; Sp'S; ainn.onia, lavender com luip , LA 1 . C ; N.eniiii.; :-((uil!s white, Siomach Tubes,; i Auct "
2502,4741,1856-12-11-seq-2.txt,"lin Review, notice suspicious' move ments ou tho part of slaves in vari ous quarters, which squint;. at insur "
2503,4742,1856-12-11-seq-2.txt,"couraging an insurrection among slaves, can W clearly established, we have no hesitation in spying that tho "
2504,4745,1856-12-11-seq-2.txt,"Tinsley, Esq, of Cascade, in this coun ty, as a slave. , Ilia Honor instituted very rigid iuquices""intot her . motives, "
2505,4746,1856-12-11-seq-2.txt,"should not become chargeable to the county, she should become his slave. lhe woman is 41. years old,- heal "
2506,4747,1856-12-11-seq-2.txt,papers talk- cf re opening the foreign slave tradev ' Should ' such ba the casei we' shall expect to setf a -general 
2507,4748,1856-12-11-seq-2.txt,"illumination in Boston. It is a noto rious fact that the African slave trade has been,. is now, and ia all probabil "
2508,4749,1856-12-11-seq-2.txt,"that Abolitorrifcts should be' ia favor of the slave trade,: with all the middle passage, but the inconsistency is, Dot "
2509,4750,1856-12-11-seq-2.txt,"passage, but the inconsistency is, Dot real. 1 : Iteve ' the slave trade, v and they enlarge the sphere of their com "
2510,4751,1856-12-11-seq-2.txt,"that , vicinage. - ' Ho gave a ticket to a slave, -w ho, however, got no further than Kingston, when he ; was arres "
2511,4752,1856-12-11-seq-2.txt,"Uou;,.(uj .?3F9MrH.i!U reaa-red cf tt. rl Medical men testiued that ho wasvf-Uhaser.auda lienretafced cn th. slave mrl day otDcfmbcrucst, offer for tilt to "
2512,4763,1860-08-30-seq-2.txt,"the Cincinnati Platform, ''the right of the people to make a slavo Territory r free Territory, is perfect and com "
2513,4764,1860-08-30-seq-2.txt,"as the Constitution required as to fugitive slaves. Now, how stood Dickinson on the "
2514,4765,1860-08-30-seq-2.txt,"to draw a distinction Territory to make a or to deny to it the slave Territory or a free benefit or the previa- Territory, vsperfect and "
2515,4766,1860-08-30-seq-2.txt,"S. JohnBrll on Pro-slavert LAW 15 Kansas. On the 21st of February, "
2516,4767,1860-08-30-seq-2.txt,"of Representatives, repealing all tbe pro-slavery laws that had been pasted by tbe Territorial Legislature "
2517,4768,1860-08-30-seq-2.txt,"onco sectional in his views on the slavery question, and that hi friends ought not, therefore, to be so intoler "
2518,4769,1860-08-30-seq-2.txt,Tbe people of tbe free States are op posd to slavery. It is written ii their State Constitutions and in all 
2519,4770,1860-08-30-seq-2.txt,"rights of the South in thnt region, to represent them as advocating slavery or slavery extension. This would, ol "
2521,4772,1860-08-30-seq-2.txt,terras the charge that they were the I advocates of slavery extension. We of the South all understand 
2522,4773,1860-08-30-seq-2.txt,lUa Ilea OlKfcCS IV auvp-. iug upuiwuo of the South on the subject of slave-1 ry. it would j oo aosura to maKe 
2523,4774,1860-08-30-seq-2.txt,"fratricidal warfare upon the South on account of slavery. All we asked in 1848 was, that they would not "
2524,4775,1860-08-30-seq-2.txt,"in 1848 was, that they would not legislate on the subject of slavery to establish or prohibit it in the Territo "
2525,4777,1860-08-30-seq-2.txt,"dress to sustain tbe compromise ami fugitive slave law: and an abolition reporter took out a few sentences, "
2526,4778,1860-08-30-seq-2.txt,"advocates of the election of Mr. Douglas, in the slaveholding States It is for him, because it can best con "
2527,4779,1860-08-30-seq-2.txt,"with such supporters as thn Confed eracy in the slaveholding States, they insult the intelligent people by ask "
2528,4795,1854-01-26-seq-2.txt,"11UUU ""-""""""""V usually does no;t militate nkinst the justiqeihoundary between the fi4o and slave 'But why do they describe "
2529,4796,1854-01-26-seq-2.txt,"""""Ployed to describe the count v, i should be lJought; to: bearHrect,cd l1llon Amt' irv between the free and slave . ' , -,. J -. ' ' lean. A of the !procceding. And bo, it oc- States.' "
2530,4797,1854-01-26-seq-2.txt,"Brighahi Young talks to the In-:,f Thibodeaiix, La., it ii stated, ' Jtah in a way that is more 'lave indicted lor gambhu sorting bills ot the dillerent banks ol forcible than elegant: 'I say to the! "
2531,4798,1854-01-26-seq-2.txt,"Tho contributions of San Fnmcis- A slave, aged 1 1, and a-- bl.u k- ; smith by trade, sold at Augusta, "
2532,4802,1859-05-05-seq-1.txt,"wife rero as black as any of their slaves, and ways conducted thcni- "
2533,4803,1859-05-05-seq-1.txt,"The assumption of authority to exclude slavery, which had been asserted and practiced under the "
2534,4804,1859-05-05-seq-1.txt,"iTorrUor.ninbKa, h.iwcrei""''g that time h. could not detect before, to act Preference to slavery.!' in ""'J1, h?te It conferred no more power upon the &h s:ls hee th!ltlshof do,es ? "
2535,4805,1859-05-05-seq-1.txt,"Southjund if it attempted to establish slavery in a Territory where the pop ular sentiment was hostile to it, sig "
2536,4806,1859-05-05-seq-1.txt,"to live WlttlOUt eatlllr. bhe IS a South had no- slave, belonging to a dry goods mer- A merchant h id a dispute with a her death in seeking for it, she was1 J-poundr rifle, and the shot was j went ant and too ;it fir granted i Congress witlr chant by the name of 'Johnson, ofj Quaker respecting the settlement of immoveably determined. Of course j covered with lead nod had six flan- j Ijat they would le victorious any "
2537,4813,1857-08-06-seq-2.txt,When did the North discover the avful sin of slaveiy? As soon ns they bad finished 
2538,4814,1857-08-06-seq-2.txt,Did .twelve of the thirteen States hold slaves when the United States Constitution was adopted? 
2539,4815,1857-08-06-seq-2.txt,Did the Northern States sell their slaves to the Southern for high prices? Yes. 
2540,4816,1857-08-06-seq-2.txt,names of such as they are to bring Who are and have been making to the polls properly marked. Ac- themselves rich from'elave labor and comnanvinir each list 
2541,4817,1857-08-06-seq-2.txt,"States from coming"" into the Union with Constitutions permitting felave- ry? . : ' - , - "
2542,4821,1857-08-06-seq-2.txt,Does the Constitution grant any power to Congress to legislate slavery out of any Territory? 
2543,4824,1857-08-06-seq-2.txt,selling negroes. - ' slave States? The North 
2544,4825,1857-08-06-seq-2.txt,M.J W J J- slave States? - - The North. 
2545,4826,1857-08-06-seq-2.txt,"dust, in order to carry out fanatical ideas about slavery: HIS weigm Wnen ne Uieu, :i& uw.uy .ucuinu wuu Bumsi u oo uuu.tiani jljcje of cmfc,rt Jtteccy or necei-! wazun xes. Srreth?ns A.u ..a "
2546,4827,1857-08-06-seq-2.txt,n The Supreme Court n?t Slave holders The Washington Union 
2547,4828,1857-08-06-seq-2.txt,"says, the majority of the Supreme Ccurt are not owners of Blaves, as has been repeatedly asserted. Four "
2548,4829,1857-08-06-seq-2.txt,"and the Chief Justice has not owned a slave for thirty years. They came to him by inheritance, but he volun "
2549,4838,1851-11-11-seq-3.txt,"cloves, ci.paiba. cubels. lesamme, jumper. lavender,, lemon, netilii origanum, pepper mini, rhodium, rose pure, rosemary .sassatrat "
2550,4839,1858-04-22-seq-2.txt,"tain . rtflVnsiva resolutions Dassed by that body on the subject of slavery. The Synod at Knoxville, from what "
2551,4840,1858-04-22-seq-2.txt,"Ultla ;izit oa tbd Ul understood matter cf slavery, esithe; following fron tbEvabvUla, Indiana, Jurf "
2552,4841,1858-04-22-seq-2.txt,"nfactare of politicttl platforms, thnt ""freedom is national and slavery stc tionaL"" It will do to ""round off a "
2553,4842,1858-04-22-seq-2.txt,"just over ;tha line in Pike county. nntl-slavery party state' the propo-jGeo., from drinkioR poisonous Jiquor, bition fairly if they are ' in fivor pf-aod last night a citizen of .this coun- "
2554,4843,1858-04-22-seq-2.txt,Constitution allowed T the institution of slaverybut in voting for the Le coropton Constitution with the CriU 
2555,4844,1858-04-22-seq-2.txt,"tenden amendment they have swal lowed negroes, slavery and .""all, at a single gulp, and their friends let-off "
2556,4845,1858-04-22-seq-2.txt,He lived but a short 1 -Northers Slave : Tsaders. The Baton Roege (Lh) Advoe:ite in icf- 
2557,4852,1858-04-15-seq-2.txt,"r the slave representation and the surrender of fugitive slaves, altering ' the' apportionment to correspond, "
2558,4853,1858-04-15-seq-2.txt,"ew, an Abolitionist of Cincinnati. ? Among the slaves wero three negro girls, oae a remarkably beautiful and "
2560,4856,1858-04-15-seq-2.txt,"else than Mormon elders in disguise. Thus, among the rabid anti-slavery factions of New England and the "
2561,4857,1858-04-15-seq-2.txt,"we meet with an inveterate hater of negro slavery we find a sneaking free lover, or a skulking Mormon of "
2562,4858,1858-04-15-seq-2.txt,"vecport charged with the murder of a slave, was tried and resulted in the conviction of the accused for man "
2563,4859,1858-04-15-seq-2.txt,Robb. ' This was a case of some im-! portance to the slaveholders. The accused was an overseer and pleaded 
2564,4860,1858-04-15-seq-2.txt,accused was an overseer and pleaded in defense that the fclave was resist ing his authority when he gave this 
2565,4861,1858-04-15-seq-2.txt,theJory to this effect: That the slave when his life was threatened or endangered oy tne muiction of a 
2566,4871,1862-12-04-seq-2.txt,". mac lrceuun migui be given to ev- iNu.auao t 5 tiibaC ery slave. At tins remark, or.e prompt to recognise new-born na-: . t i.f r.mirnAcn 0 cn,M tions, and that Gladstone's sreech '3urlcai "
2567,4873,1852-02-19-seq-1.txt,". The population of New Orleans is 111,G97, of which 17,000 are slaves. and yet gloomier aid denser than the . iK1to sileijice, occupying themselves iii "
2568,4876,1858-11-11-seq-1.txt,"thousand' inhabitants, of whom two thoiisaud were slaves. . Twenty while persons and one hundred and fifty "
2569,4879,1855-08-30-seq-4.txt,COFFEtTT tJ E lave jnst received COIiis Is J ' v prime Rio and 20 Baes Havana .Sai . 
2570,4880,1851-05-20-seq-2.txt,". . , 1 v,vw.;..- - ,1.,t Mr-seats in our tne v.oinpiomii jxcusuie uuu tfrminns, naving aj. -iT-.oc-i u,:-r ,t of the Fugitive Slave Law of the imporlance of an enter-, approaching Legip :u!-e, says : j ( : i'l' the party, it be- "
2571,4881,1851-05-20-seq-2.txt,jo trreat dread we lave to. encumberir g tlie'J State with 
2572,4882,1851-05-20-seq-2.txt,'I'!' : icution of the fugitive slave lay.-r I Every ' one! who has consulted the 
2573,4883,1851-05-20-seq-2.txt,"J 7 "" I ' t slave act is, at mis moment, uie uonu Jir Tt can not be repealed "
2574,4886,1857-03-05-seq-1.txt,"tf.em said Mha.t' he would die first but that he would lave his own way a' part of the time,"" and after eaying "
2575,4887,1853-11-10-seq-2.txt,"in tho persistant agitation ol t.u. Slavery quest ion, am! 'therefore bos lit.. ( ... i-v ri tnesL ileUtve to lilt "
2576,4888,1853-11-10-seq-2.txt,"i lave had occasion 10 iyiy "" j ;i'jsnMh j.r.idudio i! h.nv lar beyoi. l ages had brooded ove'r the inimU of. hands thedvingdom of Denmark ti loieioioie, anii .iii o, jt,0 pcror iai. to "
2577,4889,1853-11-10-seq-2.txt,"is regarded as a means of eseapink slavery, riml ihe priests pass pearly half their lives in a state of intoxi "
2578,4891,1851-02-18-seq-2.txt,"N It! is slaves 'oB the Soaitli are in Decter con tb s poison ns fmnnunx av th l.-.kt ciition, piivsicauv ana mentally, mau "
2579,4892,1851-02-18-seq-2.txt,"by river. From the nortln are said tojbe not regarded as slaves, casf corner o( thc'State to EI PasoJ Wniv wrr, 's about eight hundred and sixty "
2580,4894,1851-02-18-seq-2.txt,"i i n ic ituuiiii vii iii R-j''ui ui I'uiti au - i r r o 7' j Soiitiiern Slavery, notorious fact., that the "
2581,4895,1851-02-18-seq-2.txt,"i1! less mess to the 1,000 hogs than htltli10 hl lave he 1 "
2582,4896,1851-02-18-seq-2.txt,"f slavery which i,s quite as odious as j Djeinocratip Reyiew,; whicli contains "
2583,4897,1851-02-18-seq-2.txt,"c wiU be employed, to assist i hu f- 11 11 a J0:i 1 resolution : ,i '-. . -, 1VJ. . pub.iect of slavery, ap; roved Jr.nua L-OnstrucllOll ,ol additional l GOO. be. and the came is hereby re "
2584,4898,1851-02-18-seq-2.txt,in in slave 1 fiM 
2585,4899,1851-02-18-seq-2.txt,"i their imnipnsc temple next summer. i,ab( ut four hundred miles from Saij As to slavery, the number of black A ntomo lo the nearest point ol rscw ..... j-.v,,... . -.' .' ,, ik-- !':.' i i- -4 .1.- 'J.!. 1 ..t....t. "
2586,4907,1855-10-11-seq-1.txt,"ual who led the abolition mob which forced air. Wheeler s slaves from his possession recently in Philadelphia, "
2587,4908,1855-10-11-seq-1.txt,"&ryjoi Printing, of all kinds, neatly themselves aground with the peopl done on Tno.M reaS0DaDle of the South, upon the slavery ques iniv'o Paicr will be discontinued until all t ion. under the name of Yhig, and "
2588,4909,1855-10-11-seq-1.txt,"bill, which is the last that was given on the Slavery question, in Congress. The South wanted the slavery restric "
2590,4911,1855-10-11-seq-1.txt,"Both of these bills prohibit any everything to defeat it They made legislation upon the slave question motions, called yeas and nays, and by squatters, but authorized these imally got things in such a hx that "
2591,4912,1855-10-11-seq-1.txt,"' IT. mm Union with or without slavery, as the the House, they never could get a ..... I i t. i ii i i r Pi. "
2592,4913,1855-10-11-seq-1.txt,"But let us now observe the vote pnen s knowledge ot parliamentary law upon the Fugitive slave bill, and it is and tact, the Free-Soil AVhigs and o - - - . . . "
2593,4914,1855-10-11-seq-1.txt,"$G19,81G, nccordmg to the returns of 0f parties in Congress for the past the assessors, ui mis aggregate, no ten yearg ja relation to the alavery tv,. oQii nr. ;a ; Timwioa . 7 "" "
2594,4916,1855-10-11-seq-1.txt,"admission into the Union. - Her Constitution recognized slavery. As usual, the Northern Whigs opposed "
2595,4917,1855-10-11-seq-1.txt,"usual, the Northern Whigs opposed her admission, -on account of slavery. But the Democrats, almost toa man, "
2596,4918,1855-10-11-seq-1.txt,"country and Mexico, territory may be acquired, in wbich slavery does not exist: And, whereas, Congress, "
2597,4919,1855-10-11-seq-1.txt,"future time, forbidding the existence of slavery in free territory; there fore, '' "
2598,4920,1855-10-11-seq-1.txt,"over which shall bo established: Ter riitrial Government, slavery, or in-; voluntary servitude, except 9 a pun- "
2599,4921,1855-10-11-seq-1.txt,"voluntary servitude, except 9 a pun- neither slavery nor involuntary servi-FKnow-Nothing friends, that their tude, in the territories hereby ceded, State of New York that they seem "
2600,4922,1855-10-11-seq-1.txt,"Cass, Dickinson and Douglas. The Northern Democrats, who voted for whiie the Northern migs and Abo- lollowingis a classincation of the the ugitive Slave law. It appears i::nT,:ctQ nmdv'ntu i- u.. n: r a.! ca r n.: ""w""""Jk-1"" . v - o y "
2601,4923,1855-10-11-seq-1.txt,"Moore, a lady of diminutive stature: Slavery question, m ISD'J, Mr, Jack- And are the old Whigs going thus kcon that ha favored them: but , . . ,- TO nana, m urey may muieiiw "
2602,4924,1855-10-11-seq-1.txt,r j . a . I Slave Din mteen to one against us. The following is the classification 
2603,4925,1855-10-11-seq-1.txt,"isfied attempted again to repeal the Fugitive Slave Law, and the following is the vote of the House, where the "
2604,4926,1855-10-11-seq-1.txt,"Southern 'Whigs. ...... 24 none Here, again, on the Fugitive SlaveJ Law, it .will be seen, that . while we "
2605,4940,1856-08-14-seq-3.txt,"' ; Slaves,"" I will, on the 15th l;y of Scj- lumber, 150, offer for sale to the h'ghest "
2606,4941,1856-08-14-seq-3.txt,"residence of the undersigned, the TWO and a lien will be retained upon said Slaves until the purchase monev is raid. "
2607,4942,1857-12-24-seq-3.txt,"jams Muu you, meaiy nose, uooipermarns ; j,.e TVriffl perceivable py enrt u wessuig, JJ U!S J and slave I will, on Uho first Monday the North by A. P. Hay. Levied ou by Jas. vev. 1, 1001. iiuueuaiou. .t . . Cf J.i unary next, at the court-houso id rinkerton, a Uonstable of Lincoln county. "
2610,4946,1858-12-09-seq-4.txt,"securities will be required of the purchaser, and a lien reUined onsaul Slaves f.irthpur chsse moner. R. FARQUHAKSON. "
2612,4948,1860-11-29-seq-3.txt,"l 1- Sale of Slaves j Qu Saturday, the 29th day bf "
2613,4949,1860-11-29-seq-3.txt,it of 12month. JK-fitSLvriiVntiiablc Slaves 1 v . - - 
2614,4950,1852-02-12-seq-3.txt,"Cloves, copail a, cobebs, jtssamiue, juniper, lavender, lemon, jieioli, orjganum, pepper mint, rhodium, rode pure, rosemarysassalras, "
2615,4951,1852-02-12-seq-3.txt,".1- I . lr . .1 : "" ' mi u.u jie oa,i hamn; Spts ammonia, lavender com luip-, Watered I pl:ns; jut.r.-,- Squills white. Stomach Tule, "
2616,4952,1852-12-02-seq-2.txt,"r. Lemmon, the owner of the slaves! liberated by the decision equated wit! dgei Payne? - "
2617,4953,1852-12-02-seq-2.txt,"losin the slaves; that the law was ir Vor in New York, and was hi "
2618,4954,1852-12-02-seq-2.txt,protect me in the possession and property of my slaves; 'and that the Mayor of that City would sec j that it 
2619,4955,1852-12-02-seq-2.txt,"New York, procure a passage for my--self, family and slaves, in some ship going at once from that port to N.' 0- "
2620,4956,1852-12-02-seq-2.txt,"to that port, upon which myself, fam ily and slaves could be placed that night He; replied that he would "
2621,4957,1852-12-02-seq-2.txt,"that j he would send round for my family, slaves .and baggage, to the City bf Richmond, and transfer eve "
2622,4958,1852-12-02-seq-2.txt,"steamer jMcmphis. sailed, leaving ml sell, lankily and slaves, and whil she was departing from the whailf, "
2623,4959,1852-12-02-seq-2.txt,i -i . . . ! . . . h his anti-slavery sentiments leeds on the battle-fieJd. 
2624,4960,1852-12-02-seq-2.txt,"'principles -were -convictions."" On ect; 1 . Makes provisions fbr ap thc subject of slavery, lie was known ! peals in cirtaiu cases. ' ' to be sound, because he was in favor "
2625,4961,1852-12-02-seq-2.txt,"VOld. ! New Yens Slave Case. We call , i "
2626,4978,1856-07-10-seq-3.txt,"gling to get into power? 7 Ou the; slavery, question, what change do they propose ia the legis "
2627,4979,1856-07-10-seq-3.txt,"Do they wish to. repeal' tha""' fugitive slave law? Repeal the Kansas act so do most of their papers, orators "
2628,4982,1859-05-26-seq-3.txt,"quired of the purchasers, aa.l a lien retained upon said Slaves nntil tin purchase money ia paid. DANIEL J. WI1ITTINGTON, "
2629,4983,1859-06-09-seq-3.txt,"oline and her two children, Alice and Eliza- urn BaiJ Slaves until the purchase moppy is The Sulphur Well "
2630,4984,1853-07-28-seq-1.txt,"idMfcl,, 'L:tm.''' Every other step -has , been j 4 l-Vltakeu. and tho-abolition of Slaven' 1 spirit. , . - . ... ... i ' i ; "
2631,4985,1857-06-11-seq-4.txt,"mathematician, or a mad philosopher, is the slave of some woman or other. ""Don't crow before you are out of "
2632,4987,1861-10-31-seq-2.txt,"1 would fight to restore this Union , with slavery in it.' The sentiment ; of the State."". "
2633,4989,1858-02-04-seq-3.txt,"AT the comer fprtncrly ccc-f ie1 by Ne;I, :Jfootea 4 Wright, lave jnZO recei-dttb3 lab-st; stock or- Cjma : I "
2634,4990,1853-04-28-seq-1.txt,"'ods"" -Said Mr S j We are worth scarce j' ten dollars, (lion invariably J left the inland r.;ct 'Say to slave y when it shows -Uu,ei u g.vn hoed and dcnfinds its pound of ilesh, !nn s Am where i,rj "
2635,4991,1853-04-28-seq-1.txt,"period of'AftyltU'o vears,' sevrinl'f en : ..IinAi.r;ir!ce of hav ine: been written ! of the head editors- cl'leading Buitloi vears as' clerk b oler bis -latin r, l;e ' wih:!hl:ick ink.' Ya hlave ihn papers as evidence ei'the -entioua iato Daniel IcHaend thjftjjfiv e j planaticn of the phenomenon to thoj ness of the press of that city.J fi?iLav,e! made ; the.ir appe't iarie- "
2636,4993,1860-04-05-seq-1.txt,"zeu and resident of thw city, happen- j ii-igtou licked Wm. Smith."" ed to own a negro slave; and in a, ' "" "" ' business transaction, he happened to vent-one ladies caliiig them- "
2637,4994,1860-04-05-seq-1.txt,"izen, also a Wentworthite. The!;iml aruulsd Ehhsrt, Ind., gave a Vail slave is ia a slave State and we wttk ;""a ,uufed heir m:;U nresume bo-will be traded eff forIiK""os- n out 'grass-widows "
2639,4999,1861-06-06-seq-1.txt,The fifat question iavolves the question of our Ircedom or slavery separation from a frovernuient 
2640,5000,1861-06-06-seq-1.txt,in a government all free and another povernmeat all slave.'' Thev've Come Arms for ma: 
2641,5003,1851-03-25-seq-2.txt,"coh-j population of 'Mobile is 20,114 new .jwhiles 13,710; slaves C,S0-i In ! '! 18-10 it Ua .! a population of 12,672, "
2642,5006,1853-02-24-seq-2.txt,"nwu Li-u.1 HV'r ine; an 1 believe me, gen tru-k has been itlaved upon theTowa ' 1.: . b. . Ilmisfi of: Redisentatives. in the!Fct u "
2643,5007,1851-01-14-seq-2.txt,"session, passed an fact giving) those ' ""inhsb itanls"" of that State arrested a fiigiiiye slaves the benefit of tha habeas corpus, arid of eyiery "
