,Unnamed: 0,date,context
1374,3099,1859-10-13-seq-1.txt,"to put down rudeness, and lay the pridie upon license. But women are slaves to dress. Women are willing to b? flattered. "
1375,3102,1860-11-23-seq-2.txt,"the existence of a ""liiglier law,'' an intention to:: prevent the introduction of slavery in the Territories, an irrepressible conflict between white "
1376,3104,1857-12-03-seq-1.txt,is this the ease in relation to estic slavery?an institution which ed when tin American Constitution 
1377,3105,1857-12-03-seq-1.txt,"another. In preserving and protecting >roperty of our fathers in negro slaves, deem ourselves entitled to the respect "
1378,3109,1857-09-17-seq-2.txt,"that there would be, as early an 1SD7, a proposition tieriouuly niado to revive the slave tiad> / I erluiiily enlOitaiiii'd no such idea, nor did, 1 am "
1379,3110,1857-09-17-seq-2.txt,"Htateit Government was the first to declare the ' slave trade to he piracy, so far as the citizens of the United States woro concerned so it was fully j "
1380,3111,1857-09-17-seq-2.txt,". w. ......v lldllUll, IIIMMII Oil IIIC slave trade, whoso treaty engagements had giv- ! eu Great Britain the right to visit iiml search.? ; "
1381,3112,1857-09-17-seq-2.txt,", the course of several Northern journals, which i uro now professing anxiety to have tho slavery I question settled, (-peaking of it as a source of "
1382,3113,1857-09-17-seq-2.txt,"j now and forever, their denunciations against i slavery ; let tlieni dissolve their organisations against it ; let them leave it where the Constitution "
1383,3114,1857-09-17-seq-2.txt,"j had promulgated the opinion that the I'onstituj tiou carries slavery wherever iL goes, and he wished this monstrous doctiiuo repudiated. The "
1384,3115,1857-09-17-seq-2.txt,"he claimed under the Constitution. 1 resist the interference with slave labor in those Slates where it exists, but am inflexibly opposed to the "
1385,3116,1857-09-17-seq-2.txt,"admission of other sluve States, or the acquisition of territory for the formation of slave States"" "
1386,3117,1857-09-17-seq-2.txt,"lie entertained no doubt of the power of Conpress to prohibit slavery in the Territories, or that it ought to e.vcreiso that power, lie also "
1387,3118,1857-09-17-seq-2.txt,"a border-rulliau bo bad made forays in Kansiis, not to carry slavery or keep it out, but to look for coal, lie had lound it all along the Mistiouri "
1389,3131,1861-05-10-seq-2.txt,"boon many weeks in ses&un, the whole of: the slaveholdiog States of the late Union ' will resoonil to the call of honor and aftVc- I "
1390,3134,1850-06-01-seq-1.txt,"l^enator. Resolutions havo been adopted in :every non-slaveholding State,, instructing their Ropresentotn^s, in Congress to vote in "
1391,3135,1850-06-01-seq-1.txt,"two years ago. X repeat the assertion, that every nou-slaveholding State has passed resolutions of an unmistakable abolition character. "
1392,3136,1850-06-01-seq-1.txt,"step had been regular, on the isolated ground that she was a slaveholding State. I- have other evidences, Mr. Chairman, of "
1393,3137,1850-06-01-seq-1.txt,"I? liUWUVLT, U)U UiCUL U1 ir?UikUt? Ul Kt They seek to emancipate oar slaves -it? true, but concede tE*\t it cannot be done "
1394,3140,1850-06-01-seq-1.txt,"j^l^ t .Ins ing up of fugitive slaves. ""What is the con stitu tional provision upon that subject: in o "
1395,3141,1850-06-01-seq-1.txt,oni any state officer who may aid the owner in recovering hia.runaway slave. The State officers of all the States swear to support 
1396,3142,1850-06-01-seq-1.txt,"the feeling of the Northern States upon this subject. When a slave escapes, friends receive him with open arms, and clandestinely "
1397,3143,1850-06-01-seq-1.txt,"convey him beyond the reach of his lawful _QP.nor<--. jJLQjo slave, perchauce, is overtaken, or hunted out~oTms Slcret hiding place, "
1398,3144,1850-06-01-seq-1.txt,all the States is an aggression upon the North :?that our fugitive slaves are always promptly surrendered upon the demand of the owner. 
1399,3145,1850-06-01-seq-1.txt,"the. Mexican laws are in force, and they exclude slavery. This is the opinion entertain ca oy vcnerai \^ass aim an uie non-micrvcntion "
1400,3146,1850-06-01-seq-1.txt,"proviso aims to accomplish, viz: the exclusion of the slave States, from all the territory acquired oppose its a "
1401,3147,1850-06-01-seq-1.txt,"Union?and why? For no other reason than that slavery lias teen excluded by her constitution. It"" hor people had assembled "
1402,3148,1850-06-01-seq-1.txt,power to determine tho question whether slavery should or should not exist within her limits. If that decision had been to exclude 
1403,3149,1850-06-01-seq-1.txt,"limits. If that decision had been to exclude slavery, no murmur of complaint would have been heard from any Southern man ; but 1 "
1404,3150,1850-06-01-seq-1.txt,"been heard from any Southern man ; but 1 undertake to say here, if slavery had been tolerated, we should have found, just as unanimous "
1405,3152,1850-06-01-seq-1.txt,"but ti'Qir constitutional scruples forbid direct legislation ill abolishiug slavery. Now, sir, I have a great contempt for the "
1406,3153,1850-06-01-seq-1.txt,"I directly. ' . The institution of slavery beiJlga "" hational shamo and a ilatiohal disgrace"" in the "
1407,3154,1850-06-01-seq-1.txt,legislation. The value of our slave property is some sixteen hundred millions of dollars; this is to bo destroyed 
1408,3155,1850-06-01-seq-1.txt,"gentlemen will recur to ihe history of the country, they will learn that the anti-slavery JfjVlY -was contemptible and insignificant, "
1409,3156,1850-06-01-seq-1.txt,"of his constituents ns to oppose even the abolition of slavety in the States. : I will hero digress, Mr. Chairman, to reply "
1410,3180,1856-10-23-seq-2.txt,"with greater activity and zeal than that of anti-slavery literature, and it is therefore llio plain and imperative duty of tho Southern "
1411,3181,1856-10-23-seq-2.txt,"holding up to scorn and ridicule tiie institution of slavery?when wo behold the increasing power of this party, and hoar it "
1412,3182,1856-10-23-seq-2.txt,"policy that shall emancipate three millions and a half of slaves. And Mr. Sewarp, the grand high priest of Fremont and abolitionism, "
1413,3183,1856-10-23-seq-2.txt,"says, upon Mr. Fremont's election, slavery will bo overthrown cither peacefully and lawfully under the Constitution, "
1414,3184,1856-10-23-seq-2.txt,"Hc, "" ?)? u>ore States?down with slavcry-^ij. js a nation*Vjbfo^ which jt is our naisaion to wipe out.* ^Rapjh are "
1415,3185,1856-10-23-seq-2.txt,"her honor and rights, and ultimately, to reduce us lo equality with our slaves, and authorize them to claim, as now by "
1416,3186,1856-10-23-seq-2.txt,"either for our honor, our happiness, or tlic institutions of slavery. Indeed, in view of llie fate of the Roman lie-public, "
1417,3187,1856-10-23-seq-2.txt,"ami more, that a Republic can well exist without the institution of slavery. A very largo proportion of the North constitutes "
1418,3197,1857-03-12-seq-2.txt,"lK?uiiu<;o in 170-2. iiti.l tli*> voluntary emailiif tin- slaves ii|"" in 1SM I, 411ii'ii tin* ?ri""u^ni|?liy of tlm cnll'tv onltinv "
1419,3198,1857-03-12-seq-2.txt,"pouinls in ITS!); I.ut s?l!i r t'n? servile in <=nr reel ion ami the liberation of the slave*. supply was almost eutiivlv Mitennple<l, "
1420,3199,1857-03-12-seq-2.txt,"erto appeared in- xplicahle in Uiitish j>??li? y ! ,, relative to slavery and ttic slave trade in i llrazil as well as Central America. Wish- | "
1421,3200,1857-03-12-seq-2.txt,"the half of the present century, to procure v the nix>liti<>11 of slavery in thii l.'nit.i.l i :i "
1422,3201,1857-03-12-seq-2.txt,"supply of iiuli'4 ?, sliu lias succeeded in li- w nally supprcssim; tho slave trade of Brazil, ' j, and hopes t<> died its ultimate abolition i i; "
1423,3202,1857-03-12-seq-2.txt,"Honduras, binding the latter to prohibit ' ,, slavery. Ii is tliis feature of I'ritixli policy, ! ? too, thai has caused her diplomatists to be j ,, "
1424,3203,1857-03-12-seq-2.txt,"of cotton, a /mint (I'a/ijftii from which ^ \e may, with the assistance of slave labor t] mid the management peculiar to our plan- |, "
1425,3204,1857-03-12-seq-2.txt,"Mr. IJiviianan asserts the docfiine, that Congress is neither '*to legislate slavery into any Territory or State, nor to exelmle it. therefrom, "
1426,3205,1857-03-12-seq-2.txt,"I lie question us to wlieti, or at what time the pen- ! pie of a Territory shall decide the slavery quosfor tliciiiselvvh Th's, says lie, is a matter of < "
1427,3206,1857-03-12-seq-2.txt,"tion, with a view to its admisstmi .w ? : the L'nion. lie deprecates slavery agitation,and j holds that ' throughout tin; whole progress of ( "
1428,3207,1857-03-12-seq-2.txt,"human licing, it hits been the prolific source of J ureal evils to the master, to the slave, anil to the j whole country. It Ins alienated and estranged "
1429,3208,1857-03-12-seq-2.txt,"broad n platform, us to ailiuit all law-ahiiliug | t< men, whether pro-slavery or freu noil. The im- : iiK'iliutu consequence lias been the rocepiion into j < ' "
1430,3209,1857-03-12-seq-2.txt,"position of tho true men of the original pro- 'J' slaveiy party. The history of tho present I.u- j gisluture, (which adjourns to-night,) has been a j *"" "
1432,3225,1856-06-26-seq-3.txt,"niough to slide Kansas clean into South .Caroli in, where we can iniikc a slavebolding State out >f her, ond by that time they'll have Groceries "
1433,3228,1856-05-01-seq-2.txt,will be held on the first Monday in October next. If the slaveholding Slates will send Us two thousand emigrants?that 
1434,3229,1856-05-01-seq-2.txt,attention to the scheme of populating Kansas with pro-slavery emigrants. Tin; result of our conference 1 will embody in 
1435,3230,1856-05-01-seq-2.txt,"can get, | think there is certainly a majority of |>p slavery iiku in the Territory, and, as llioy arc ???t like the Abolitionists, "
1436,3231,1856-05-01-seq-2.txt,contest at the ballot box the majority to the. pro-slavery party. The ( lection for member* of the Legislature 
1437,3233,1856-05-01-seq-2.txt,"houri rivers is now occupied by a decidedly | pro-slaver}- population. On the South : nide of the Kansas river, and especially "
1438,3234,1856-05-01-seq-2.txt,"as far as pos?ible to induce all who have a small number of slaves to come out. To tfuch this is a peculirlydesirablecountry, and "
1439,3235,1856-05-01-seq-2.txt,"tfuch this is a peculirlydesirablecountry, and ihey need to have no fear of their slaves escaping. The actual presence of a good "
1440,3236,1856-05-01-seq-2.txt,"escaping. The actual presence of a good number uf slave* would At once setllo the ijuestiun,If "
1442,3249,1851-04-19-seq-1.txt,"bis lock*> are prematurely gray, his genial humours sour, and slaving it till be bas become a morose of reckless man, for "
1443,3251,1861-07-26-seq-2.txt,"arms against the United States was taken up. Truqjbull offered an amendttitat, that slave em ployed to.aid the rebellion should be forfeited "
1444,3253,1857-05-28-seq-4.txt,"to secure his liberty. Resolved, That \he slaveholder should be made to dream of death in his sleep, and "
1445,3254,1857-05-28-seq-4.txt,"and souls of men have resolved upon the endless enslavement of their victims, and with diabolical meanness and wickedness "
1446,3255,1857-05-28-seq-4.txt,"arms with which to win their freedom in . an open and honorable manner, Ibe slave is justifiable in the uso of jwiy or every secret "
1447,3260,1865-11-03-seq-1.txt,"e. . o The emancipation of our slaves will, in & 1 probability, abstract greatly from the S "
1448,3261,1865-11-03-seq-1.txt,id colored people who have been so sud- bi enly released from slavery in their igno f? nee nnd destitution' This is alike due w 
1449,3265,1857-04-23-seq-1.txt,"i,l ?' 11 11 ?1 1850, tliero were more slaves in Woslcm' than Kustern Texas, and the number has "
1450,3266,1857-04-23-seq-1.txt,"Germans of San Antonia, and to charge their opposition to slavery against the wholo German population. It happened, also, "
1451,3267,1857-04-23-seq-1.txt,"Texas?that is, claim the right to discuss the slave institution. He was no sootier engaged in it, however, than the mass of "
1452,3268,1857-04-23-seq-1.txt,"II. Krod Oswald, Esq., the present worthy proprietor, who suppressed the slavery agitation and made the Gazette a National "
1453,3269,1857-04-23-seq-1.txt,every issue involving tho prosperity an perpetuity of slavery. They are a peapei ble and inoffensive population ; and when . 
1454,3270,1857-04-23-seq-1.txt,"our German citizens. Moat persons there regard them as opposed to slavery, and the impression is that we have some fifteen "
1455,3271,1857-04-23-seq-1.txt,"the impression abroad that Western Texas is unsound upon the slavery question, owing to the freesoil feelings of the Germans. "
1456,3280,1859-01-06-seq-4.txt,ations to invoke their gods in temples. Despots grant their slaves days of interims a sion for the same purpose. 
1457,3283,1856-04-17-seq-3.txt,"'enough to slide Kansas clean into South l -aroli >iin, where we can make u slaveholding State uui of her, and by that time they'll have (iroceric! "
1458,3284,1856-04-17-seq-3.txt,"iSodit and Saluratiis enough lo raise il again, am Ret up u slavery exciteiiienl, Cigars enoilgl {get out of the way, Vesuvius, they're right afiei "
1459,3288,1856-01-10-seq-2.txt,"liberty to use the words admirer, lover, adorer, worshipper, slave, ?fcc.. tfce., or any complimentary little epithet, scores of which "
1460,3289,1856-01-10-seq-2.txt,party?notorious otdy for his extreino ul truism upon the 6ul?ject of slavery. II< introduced and passed a resolution in th< 
1461,3290,1856-01-10-seq-2.txt,"Geddixgs, in which he says "" that th< North intended to abolish slavery in all tin Territory of the Federal Government, ami "
1462,3291,1856-01-10-seq-2.txt,"South quit the Union."" lie says in anothoi part of his speech : "" I say to the slaves o' Virginia, defend yourselves. I would tc "
1463,3292,1856-01-10-seq-2.txt,"Virginia, defend yourselves. I would tc God I could proclain to every slave in Vir ginia to-day, you have the right of selfdefence, "
1464,3293,1856-01-10-seq-2.txt,"Election contest, the soundness of theii Northern allies upon the question of slavery vainly boasted of tho nationality of the "
1465,3294,1856-01-10-seq-2.txt,"ground railway, mean nothing moro than we ? that some unfortunate fugitive slaves, who of ?being infatuated by their false notions of "
1466,3295,1856-01-10-seq-2.txt,"ed, must the professions of Abolitionists he, ,]t., p when they would allure the slave to tlee nm t a humane master, and yet deny that slave la'; "
1468,3297,1856-01-10-seq-2.txt,"I If South Carolina were to pass a law lib- {ji( , crating every slave within her limits, with ,ls pi a proviso mat nicy siiouni ue irausporieu 10 i>ei "
1469,3298,1856-01-10-seq-2.txt,"( guishcd as she is for her negro-philanthropy, )r(!( whose bowlings against the sin of slavery ||)( . are heard throughout the length and breadth for "
1470,3299,1856-01-10-seq-2.txt,"alls upon the ladies of the North to inako use of nothing that is produced by slave labor. lie needn't expect them, ssiys Prentice, "
1471,3314,1858-03-18-seq-1.txt,"*05,000,000, and s:ive<l you. Thirty- ! fc nillion dollars we, the slaveholders j ;i| r South, have. pat into the charity l>ox ! \-i "
1472,3315,1858-03-18-seq-1.txt,"11 the brightest page of human history? liat wo, the slaveholders of the South, took tir countrv in lu?r infjinov nml "
1473,3316,1858-03-18-seq-1.txt,"character of his party and tin? opposite one* ; laid the whole of tho-?e frauds upon the proslavery party. To listen lo him, yon would "
1474,3317,1858-03-18-seq-1.txt,"on the other side of the Chamber, is to agitate the question of slavery. I have very great doubts whether the leaders oil the "
1475,3318,1858-03-18-seq-1.txt,"' would have been sustained; hut its coining 1 here a slave State, it is said, will kill tliat "" party, and that is the reason they have re' "
1476,3319,1858-03-18-seq-1.txt,"and their true reason here is to agitate * slavery. For one, I am not disposed to r discuss that question here in any abstract "
1477,3320,1858-03-18-seq-1.txt,exhorts us to submit to?the cone*. [ liou of slavery in its present territory veil to the reconstruction of the Sup 
1478,3321,1858-03-18-seq-1.txt,"Nav, sir, what guarantee have we tha will not emaucipale our slaves, or, at make the attempt? AVts cannot reh "
1479,3322,1858-03-18-seq-1.txt,"a ?liilc-iviiL talc. They an; ours by sill tin; laws of nature; slave labor will go over every foot of this groat valley where it, will "
1480,3324,1858-03-18-seq-1.txt,">wcy all her purposes. AVe use them for ! purpose, and call them slaves. We are | fashioned at the South vel ; it is a word ^ "
1481,3325,1858-03-18-seq-1.txt,"manual laborers and operatives, as you j 1 them, aro slaves. Tlio diflerence be- j een us is, that our slaves are hired for ^ "
1483,3327,1858-03-18-seq-1.txt,"uld meet in a lifetime in the whole South. t r slaves are black, of another, inferior race/ ^ o status in which wo huvo placed thorn "
1484,3328,1858-03-18-seq-1.txt,"5 condition in which God first created sm, by being mado our slaves. None , of r it race on tho w^iole ^?co of tho globe n "
1485,3329,1858-03-18-seq-1.txt,"any trouble byUheir aspiratioip.. Your slaves aro'whito, of your own rac$: u are brothers of ori^* blood. They are j "
1486,3353,1865-10-12-seq-1.txt,"the principal of which was an acquies cence in the nbolitior* of slavery, which had been- accomplished by the'military authorities. "
1488,3355,1865-10-12-seq-1.txt,"tbem, and mow that we propose k> return with out slavery, ihey still obJcct.' In this emergency, the Stale needs the assistance of all-her "
1489,3356,1865-10-12-seq-1.txt,"mestizdes, etc ; 800,000 civilized Indians: COO,000 mixed'slave population ; 2,000,000 African slaves. Iu 1867-'08, the standing army "
1492,3366,1856-07-17-seq-1.txt,"Marshals, that they arc weli satisfied that | at least fifteen slave vessels have sailed fiuiu this port within the last twelve months, and "
1493,3367,1856-07-17-seq-1.txt,"convicted at Philadelphia, a short lime since? of being engaged in slave trading; \*et there j were no circumstances which would justify "
1494,3368,1856-07-17-seq-1.txt,"called the attention of Mr. Crampton, at j Washington, to the fact that slavers were | fitted out in this city, and asking his inter- j "
1495,3369,1856-07-17-seq-1.txt,"schooner, capable of bringing over 500 slaves from Africa to Cuba?the vessel to be provided with water, and thus prepared, "
1496,3370,1856-07-17-seq-1.txt,"Mr. Crawford rematked it? connection with his despatch : ""Almost al! the slave expeditions for some time past have been fitted "
1497,3371,1856-07-17-seq-1.txt,"yard, specially undertaking such business for the slavers."" Most of the vessels fitted out in the United "
1498,3372,1856-07-17-seq-1.txt,"Most of the vessels fitted out in the United States for the slave trade, sail from New Vnrlf l.nf ? /.nnoiil.A.l.l"" - ? - "" "
1499,3373,1856-07-17-seq-1.txt,", feet in reducing tlio number of vessel ' adapted to the slave business to be fount t in market. They are sunk, burned, or rui "
1500,3374,1856-07-17-seq-1.txt,"ashore. It is but a few days since an ac : count was published of a slaver, fully litlet . up for her business, which had been force* "
1501,3375,1856-07-17-seq-1.txt,1 j 'Hie manner of fitting out slavers in Neu j York may lie briefly narrated. In mos 
1502,3376,1856-07-17-seq-1.txt,"by another vessel with provisions, large boilers, timber r""r :i "" slave deck,"" and bricks and lime to set the furnaces. She "
1503,3377,1856-07-17-seq-1.txt,"To still further diminish the chances of detection, slave vessels no longer carry irons or shackles, as formerly, which, if found, constituted "
1504,3378,1856-07-17-seq-1.txt,"ivory, peanuts, <fce., are converted into slavers, when opportunity offers. The preparation of these vessels, in the city, is "
1505,3379,1856-07-17-seq-1.txt,"weie discharged, though tho vessel was condemned. Cargoes of slaves aro obtained and discharged. so as to evade capture, by the exchange "
1506,3380,1856-07-17-seq-1.txt,""" bunting reading."" It appears obvious that the slave tradfi. ns couductod at tho present time, and for "
1507,3398,1857-08-27-seq-2.txt,"of such contemptible faclionisis! JScccher is a Vunfcee dyed in the wool, and Greeley tinslave of Down Hast opinions, with a soul Ion "
1508,3399,1857-08-27-seq-2.txt,"with iv free Stale and its people, and resolved to he again sold into slavery, if not permitted la remain here and enjoy his freedom, lie says ho "
1509,3402,1853-03-24-seq-2.txt,"tho American government, particularly claims arising out of false, seizures under the slave trade treaty and under custoq^ house regulations, V* "
1510,3404,1857-08-06-seq-2.txt,"utterly ignoiuut of their own. Wo boast of our Hbhoronee <?f iit'^ro slavery ; wo romance, wo moralize, and wo actually weep over tin- talesof Al'rirail "
1511,3405,1857-08-06-seq-2.txt,"stlHeriiif;, but we cannot a I ford a passing thought for the millions of white slave*, who eonmituto the masses of our laboring population. "
1512,3406,1857-08-06-seq-2.txt,"fate, and beyond the reach of a rational remedy. It appears that the ivhito slave's destiny was the result of an absolute decree of Providence?an "
1513,3407,1857-08-06-seq-2.txt,"llag that braved a thousand years,'' &c., or ' liritous never shall ho slaves""? phrases resorted to Ijy our popularity-hunters, "
1514,3408,1857-08-06-seq-2.txt,"dupes. Mr. J<-lfery tells the working men that they arc in reality slaves, and he points out. a rational mode of obtaining national liberty, if they "
1515,3409,1857-08-06-seq-2.txt,"\Va!.ki;k, and quietly submitted to his authority. The correspondent slates also that the pro-slavery party liad given up the contest for slavery beforo "
1517,3411,1857-08-06-seq-2.txt,"th? arrival of Gov. Wai.kkr, that the country is not suited for slaves?that Judg? Elmohk's negroes hud most of them been frost-bitten during "
1518,3412,1857-08-06-seq-2.txt,"cor, ou 7th street, ill this city, died after a few days illness. The nurse, a negro slave, who was devotedly uttaclied to her liltlo charge, waspresent "
1519,3413,1857-08-06-seq-2.txt,insensibility. Every care and attention was immediately luviahQd upon this faithful slavo that a good master and mistress could bestow. A physician 
1520,3414,1857-08-06-seq-2.txt,hud taken it* llight from this earth. The remains of this devoted slave were yosterday followed to the grave by the members of the family she had 
1521,3415,1857-08-06-seq-2.txt,"- .. W(> Mi<urnui VAaiil|'IU l/l the relations existing between misters and slaves at tlic South, though it is not often we havo to "
1522,3416,1857-08-06-seq-2.txt,"made to engraft in IhcCbitKtitulioii, a provision to recognize slavery. Messrs. llull ifcCSillis have issued a prospectus for a now Democratic paper "
1523,3417,1857-08-06-seq-2.txt,"he says, on the passago of the Nebraska Hill, that Ivansg& wotUd becoma.a slave State, and )io still thiuk?t1iat ,4if African slavery be ultimately ex "
1525,3438,1858-04-22-seq-2.txt,"Minister, Lord Napier, andtien. Cass, relative to the slave Uade, has readied tin; cliniaeierie in a long, able and convincing note from the venerable "
1526,3439,1858-04-22-seq-2.txt,"opens up and reviews the whole subject of (he slave trade anil it.? prohibition. (?en. (Jasf shows conclusively, by facts and figures, that wi "
1527,3440,1858-04-22-seq-2.txt,"have been maintained on the const of Africa in good failli to prohibit the Iridic iu slaves, whiU F.nirlish ships have only protected French slaver.' "
1529,3442,1858-04-22-seq-2.txt,"protected rather than prohibited French Iridic in slaves?while wo were attempting to curry out in good faith, our treaty obligations. "
1530,3443,1858-04-22-seq-2.txt,"iii<-iii. llial. the AiiH'iit'sin flat; is iim-iI on Ilu-Atii <-:iit roast as a enver to slavers ??l"" all nations, ami j inaiiit.iiiiinu that tin- I nil<>il Slates is hot.nil to "
1531,3444,1858-04-22-seq-2.txt,"""It is believed lliiil the only way I"" clfeclually slop III.- slave trait"" is Iwilliilraw 111 s<|il:alr<>ii IVoiii lln1 African coast, ami station i he % .,. >?.*!?>? "
1532,3445,1858-04-22-seq-2.txt,seek for recruits in Canada among the fugitive slaves of the United States ? Or will tliey asseri that there ulso ' Kroouicu' oidy were soujdi 
1533,3457,1851-05-17-seq-1.txt,whicb involved danger. The abolition of slavery was the end to place the master of the 8outh on the level witft that agrarian 
1534,3459,1858-04-15-seq-2.txt,"-fanatics of Holland who desired to kindle in Ihe American mind hostility to slavery, and (litis sow (he seeds of antagonism between the northern "
1535,3460,1858-04-15-seq-2.txt,"We-t. India emancipation was followed immediately, in this country, by ihe organization of anti-slavery societies, and a lilile later, in the natural "
1536,3461,1858-04-15-seq-2.txt,"to their application to our politics. ""The qnes aiuiiwof slavery*' is altogether local in its nature. It belongs exclusively to the States. In its application "
1537,3462,1858-04-15-seq-2.txt,"The iilack Republican doctrine, until now, has been that Congress may exclude slavery from a 'lVrritory. ami reject the application of a slave "
1539,3464,1858-04-15-seq-2.txt,"by the roots. It first denies the right of Congress to'decide the slavery question, referring ihe decision to tho local community; mid it, sec-.jm.IIV "
1540,3465,1858-04-15-seq-2.txt,"-wh'-eh it authorizes, provides for tlie admission of .1 slave Stato. It was voted foi by the Black Republican party, among whom were "
1541,3466,1858-04-15-seq-2.txt,"""Mr. Giddings.?I will never consent th*t Ohio shall associute with another slave State. "" Mr. Bingham.?I will not vote for the admission "
