,Unnamed: 0,date,context
1241,2335,1859-04-07-seq-2.txt,"ba reqnired of the purchaser, and a re tained, or each ilave for tb piircbaso moiiey. ""... - ' H. -FAUQUUAItSOX. "
1242,2358,1862-11-06-seq-1.txt,": they- Succeed r in;', abolishing slavery irr riolatidw of 'the Consti tution rand ; elcy atihgtth jiegrbvto "
1243,2359,1862-11-06-seq-1.txt,"4? . - vWehave learned that slavery ! ""istcad of bting "
1244,2362,1858-12-02-seq-4.txt,"r -- ''ttk K'V W'VtX ' tV . ' . ' ""irr', . years, and And vabont 7 Year?;1' V qvrh'icb wilLbemjuhcd ins'j. - ' 2 3 3 S- ,TrT . , f- !P EBiSaislaves l.be soldon a crcljt! P'i more good an,! so.er.t WE have just received a larga "" ' iW ui' ti! ,-JH-ln. Bond with approved "" .mtrT""e7nV W be' iw.u'rcl cf ibopuwaam, "
1245,2364,1858-12-02-seq-4.txt,"purchase money. .V.Zt'Q Tho title to said Land and Slaves is believ ed to be go 3d, but I shaft only make such ti "
1246,2367,1856-10-16-seq-1.txt,"made a speech recently in New Ilaven, in, which he said: ""Gentlemen,-1 attached myself "
1247,2368,1856-10-16-seq-1.txt,"always and ever opposed to the, exteti sion of Slavery, and I 'say here to night the Whig party, of the North "
1248,2369,1856-10-16-seq-1.txt,would prevent the further extension of. slavery. Applause. An Interesting Scene. At a meet 
1249,2371,1852-11-18-seq-2.txt,"do the uses of Slavery. tand clear on the record, with a per "
1250,2372,1858-09-02-seq-3.txt,"lAdonging to the eateof John Cole, dec. Tekms: Said Slaves w ill be eold on a cred it of tvrelve months the purchaser giving "
1252,2374,1858-09-02-seq-3.txt,"ueo. Terms: Said Slave will to sold on a cred it of twelve mouths, the purchaser riving "
1253,2375,1858-09-02-seq-3.txt,"bond aud approved security, and a lien re tained ujion the Slave until the purchase taon ev id ifciid. "
1254,2376,1862-04-10-seq-3.txt,"htie aru-.v. We he :pe this bill will 'become a law. Large slave es tates, wilbf.o representatives in "
1255,2377,1862-04-10-seq-3.txt,"Gen: Fremont -made speech1 ashincb ,n etteis totluoitV ffiako ''SS w,f, M.v.r, ire,-red o do at InD-sbnthe oilier day in laver em press depu t tuo co,.diton of -Bk-if M.n,,.bia ,i..iM..rr.i..i.vB..,k..do k:hl A(rr, Tn-V ,.f ri.-.;- i,M4;rr i,i,t;ni. r the emancipated nes there as The Salt Vorks in Ciarke Hm. mh ivivn.Kcrthfrr Batk...d. . iT' lAiX! Ti lHi li "
1256,2379,1852-10-14-seq-3.txt,"i action of Judge Lynch. ; The lives j 1 yu llowimr-j which we find in the i , - .i The slaves ! "" . . noi "
1257,2382,1863-02-12-seq-1.txt,"p Stolen ml Deported Slaves. , The N. Y: Herald, in a late ari- "
1258,2383,1863-02-12-seq-1.txt,"would have nd legal efficacy..' Con -Land dependent only upon their own stqueutly, if slave, property should ! courage and resources. r Aud yet be if ken away from tbe citizens of j they were ' to he' utterly. Conquered "
1259,2384,1863-02-12-seq-1.txt,"a m ni- f-nm our r tiehd dutinff "" ! . "" J. ' , , , 1 "" 1 , , Slaves. taken from pur ciyzenS cuting. kittoul llffilf, ncu Uood, pourcd out the ""war till have fo be accountee. lor!like wa!eri. defeat, taxation, sepul- "
1260,2386,1859-02-17-seq-4.txt,"belongirg to the estate of Taiiel Farrar, dec. Tubms: Said slaves il! be sold on a cred it of twelve months, the purchaser pivirj; "
1261,2388,1859-02-17-seq-4.txt,"bond and approved security, and s lien retaiu ed upo& each Slave until the purchase money ia paid. "
1262,2390,1852-04-29-seq-2.txt,of the jails of the State fur the- '-ri-fincment of fugitive slaves. A sim-il.-sr biil was vetoed by the whig; Oov- 
1263,2391,1852-04-29-seq-2.txt,"that measure a final settlement j of; thoukarjd men. In these times of the slavery question, when put to the profound peace, through the iiiisman: trial.: For nroof ftf this. iv wfr: 'in Lnr-omrni. nf ihn ' Wor 1V-n.irimonf "
1264,2392,1852-04-29-seq-2.txt,"in Philadelphia, of whipping his wife, us as becomes citizens of a j slave : that city have recently been om-an(j ortjerea to be iujnoiicd one! holding c.ommunity, they will not be pcllcd to suspend business and mhkei aJ. . "
1265,2393,1852-04-29-seq-2.txt,we; would reier such to the history of both parties upon the slavery ques tion. In Congress the constitutional ii 
1266,2399,1860-11-29-seq-2.txt,"In ""Attli'l lea"" tvln.rn I.rittfin1a preparations for dissolving their bust- the nonlaveholding States shall 'governs people nnd they are respon ness relations with the ctminreial recogmzo usnstheir peers and equals, ... ' . . "
1267,2400,1860-11-29-seq-2.txt,"of our fellow citizens who rekido ia . licationi 'he ncm-vhiveltlding Stati k; Southern slavery, ob a rule, is the They -have denounced aDd are wildest aud tho most beui'Voleiitsys-. "
1268,2401,1860-11-29-seq-2.txt,"abetted, and nre uow justifying and j Weut worth's paper, bold'y advocates npproving tho trua8on?b!e and mur-jthe ovtrlhrow of slavery in the denus ftray. of the infamous John, States ns the doctrine of tho rtpub "
1269,2402,1860-11-29-seq-2.txt,"uuciion, c.uepi Biy such niucies as""r duuh ayumsi me aouit, a war my have beon imported or ordered 1 of the free States against the slave in good. faith by those of our fi llow-jSVaM, war of extermination, to be "
1270,2403,1860-11-29-seq-2.txt,"we will do everything in onr power become all free or all slave."" Now, if Mr.- Douglas has done "
1271,2408,1863-03-19-seq-2.txt,"I the case 'of John A .Johnson, at:m'r of Ariii Johnson, dec bill forenleoC Slaves 1 will i ... .... . . . "
1272,2409,1863-03-19-seq-2.txt,"said Marr. Wiley, HndDavy'in one lot. I ' The al.ove t toned Slaves will be soM npon 5 rer Kchj required to b' mil io "
1273,2410,1857-08-06-seq-3.txt,"he bad d been the slave of a'ridiculous.iacgels,. and these witnesses, tlwt you hallucination. "
1274,2412,1857-11-05-seq-2.txt,the Free State candidates. The ex citement among the p'roslavery men is intense; they threatened vengeance 
1275,2414,1859-03-17-seq-2.txt,"us, but tmnoui intenuon 01 ouuns , . . and eloped with tis wife.fpaciGo settlements of the vexed it is a fact that the new party relie82yye suppoSe he is one of the 'threejquestion of 6lavery, the Democratic udoq Abolition :i sentiments, in tbejtboasand, aad that his motto ia waciparty has been the. architect of two "
1276,2415,1859-03-17-seq-2.txt,"since, was placarded under the cap-1 tion, ""Have we slave catchers among His name, person?.! appear "
1277,2416,1859-03-17-seq-2.txt,"given, with the iatiimtion that fcn was ia search ol a fugitive slave. Some of the Republican papers . speak "
1278,2417,1859-03-17-seq-2.txt,"L Ilobsou, of Richmond, Va., as a slave hunter here, was one of the most mean, cowardly, and unjustifia "
1279,2422,1853-11-17-seq-4.txt,"I. V , lave been I;mi!i "
1280,2423,1858-03-18-seq-2.txt,Uuion. The Soutfi will gain a dominion- for slavery more exte&sive than thrae such States as Kentucky. 
1281,2424,1858-03-18-seq-2.txt,termine how long Kansas will remain a: slave State. The question now is as to her admission as a slave State. 
1283,2426,1858-03-18-seq-2.txt,". Let us first get her into the Union as a slave .State, and we will then talk of retaining her. ' The question of "
1284,2427,1858-03-18-seq-2.txt,"thereof.0 It will not bo more diffi- cult to Keep ner as a slave state, n n ,is right so to keep her, than it will be "
1285,2428,1858-03-18-seq-2.txt,"distinct We repeat that when we get Kansas as a slave State, it will be time enough to talk about so retaining "
1286,2429,1858-03-18-seq-2.txt,"Senate. By lowering the standard of i Democratic orthodoxy on the slavery question, he thought he could secure "
1287,2430,1858-03-18-seq-2.txt,"laws. ' - :' . ""i. .: - - The African Slave Trade in Foil! 1 v "" ' "
1288,2431,1858-03-18-seq-2.txt,"South has already opened the Afri can slave trade, and . that a regular J depot has been eatallithud on Perl "
1289,2432,1858-03-18-seq-2.txt,"The Express says: The New Or leans slave traders are smart, but New York is something ahead ot "
1290,2442,1862-04-10-seq-2.txt,"1 y General Hunter has armed indiscriminate rcblerv and ' mur- main body, sav Jrom Mr. Phiiips, coaverted into nurses, the gunboats tanw me loi o;ving dipat h: . ""-t,, h ,1 - to X ,W rt ' ; ' Gekal: It has come to my slaves hr the murder of their dcr. ' "" - to iWis i'an Yard. Cai,k being there to defend th capitol, ! 1 4.ie tcamb:it -1 uir.vcd last . ""Z'S'lt Z k:;..wLd..;e that many of cur citi- masters, and has thus done all m A general order iVsscel bv the Guriey and Iiambrick marched provisions ranidV adva-chi- vvV m&. aDout rnr ociock ' trj""f i'jre -V "
1291,2444,1862-04-10-seq-2.txt,"w;.ns ensured .in peacdul avooa-hi power to iiiangurate a servilo Secretary 'of WT;.r'tf the United their men North, and halted col- rVr,w. fp & jt:liro Agent.emanon Oan.Uh:id:4., 1 f iX rr ti.,ns, lave ix--n aiTCste-d and im-war, which is wo.se than that States in the city of Washington, uuin in the wods near to the.1 Y T .t . J, a"" ucd Irom ' V;:;, . primed .Wcause they refused to of the ravage, inasmuch asitsup-er- on the very day that the cr.rtel road side; Captain Guriev then1 If,' ,Y' Tnom;e .nce was ; ue Uuro Gazette othce, pivvieiis ""K'r"" hiJV 1 "
1292,2446,1859-01-13-seq-2.txt,"nC ;.v5WS,?nCdby the do.it.H .. of ,.Uo , slaves on his plan tatiori21 0 'in '.nODi 1 r .' ' '"" , ,,- . ',"" -' "" . , per, ujr ;)i-i,vyv, wciux u viavi - xavUS , J.r;t.--Air.. mjrenioUS' "
1293,2447,1859-01-13-seq-2.txt,"and one from the State of New Hamp shire, upon the subject of slavery and connected therewith. I bnve not "
1294,2448,1859-01-13-seq-2.txt,"the pamphlet con'cerniog tho'Brovn I6w and Pry rW slavery discussion,"" ou the 'ground thaf it is ; a 'dangerous "
1295,2453,1862-01-16-seq-2.txt,"ty of the rebels, and the enfran chisement of slaves, by an act of Congress. , The National Intelli "
1296,2456,1860-12-27-seq-3.txt,"vho ""temJ tlie'firea"" and supply 19'PBbIic Sales t . - 6s for di8ply; occaioM. lave ""toj See adTertisemenls in tlU rwper, beg further time, ilost lama an J . for varioub sales take place early "
1297,2457,1861-01-10-seq-2.txt,"They have denied the"" rigbt of property in oar slaves, and denied their constitutional obligation to de "
1298,2458,1861-01-10-seq-2.txt,"i - oar territories, was a slave aggres sion on the Northern! used it as a "
1299,2460,1861-01-10-seq-2.txt,and have obstructed the execution of the fugitive slave l tw by mobs and murder. 
1300,2461,1861-01-10-seq-2.txt,"Federal Judicitry a a ""citadel of slavery."", impeached its integrity, and mocked . its judgments and "
1301,2462,1861-01-10-seq-2.txt,"great political party on the grand central idea of hostility to slavery, and they are marching with all their "
1302,2463,1861-01-10-seq-2.txt,"Is it to protect, or to destroy .the institution of slaver)? Lt theii own representative men answer. "
1303,2464,1861-01-10-seq-2.txt,"will, sooner or later, become entimly a slave -holding nation, er entireiy a free Itbor nation."" "
1304,2465,1861-01-10-seq-2.txt,", torioa and out of them whenever you i may go to extend slavery. - It has driven you back in California and "
1305,2466,1861-01-10-seq-2.txt,"State quitting the condition of a ter ritory, and epurniBg slavery, will be welcomed into our plural unit and "
1306,2467,1861-01-10-seq-2.txt,"joining hands together, will become a elt of fire about ihi slave States, in which slavery must die. "
1308,2469,1861-01-10-seq-2.txt,"making - a Senatorial majority of j twenty against the slave States, majority against them of perhaps "
1309,2470,1861-01-10-seq-2.txt,"result in such an accumulation of Northern anti-slavery strength,' in every department of the govern "
1310,2471,1861-01-10-seq-2.txt,to prepare deliberately for the abo lttien of slavery from. Delaware to Texas. This is exactly tchal . this 
1311,2472,1861-01-10-seq-2.txt,have both anticipated anj feared as tbe result of the slavery agitation at the North. The efforts of the abo 
1312,2473,1861-01-10-seq-2.txt,"rights, the equality, tbe safety or the klave States. Whether well or ill founded the opinion,- the people of "
1313,2474,1861-01-10-seq-2.txt,"a century at the JVorM on the sub ject of Southern slavery;, etch year with increasing bitterness; the spirit "
1314,2475,1861-01-10-seq-2.txt,"lke declaration by Abraham Lincoln that the systems of slave labor and fr? Iaber 0;innot ex',8t onder the "
1315,2476,1861-01-10-seq-2.txt,"authority, and is to be submitted to members from the border slave States, requesting tbeir respective "
1316,2495,1855-09-13-seq-2.txt,Farmers from Southern States are moving In with numbers f slaves to cultivate the prolific soil of the broad 
1317,2496,1855-09-13-seq-2.txt,"attempts to interfere with or entice away slaves. Also the importing or introduction into the new territory ofling across, throwing the whole train "
1318,2497,1855-09-13-seq-2.txt,any abolition document tending to in cite slaves to rebellion against author ity made punishable with death. 
1319,2504,1856-10-09-seq-3.txt,"ri and other States, together with the Kansas pro-slavery party, set tied in the territory. Gov. Geary "
1320,2505,1856-10-09-seq-3.txt,very little towards making Kansas a slave State. If they make a free State of it she will eel the effects 'of 
1321,2508,1859-11-17-seq-2.txt,"the average price of lacda and taxa ble slaves for each county. From a '""Note"" embraced in said "
1322,2509,1859-11-17-seq-2.txt,cow it is $8 19. In 1848 the aver age value of taxable slaves was $467 44; now it is $854 65. 
1323,2510,1859-11-17-seq-2.txt,"ing that portion of the State, arming and preparing slaves for rebellion, and a3de: ' "
1324,2511,1859-11-17-seq-2.txt,brings to this city captured runaway slaves. They say they have friends here who will free them. 
1325,2514,1859-11-17-seq-2.txt,"nation of Dr. Palmer, at Memphis, a slaveholder, who is clearly implica ted as one of Ossawatomie Brown's "
1326,2522,1857-11-19-seq-1.txt,"Federal patronage received by; the North and . South; . Free of Slave State::, : ; r : . "
1327,2523,1859-08-04-seq-2.txt,steal your horse nor philanthro pist h run off your slaves. When we see the helpless imbecil 
1328,2525,1859-08-04-seq-2.txt,"not our position. We advocate pro tection to property in slave labor in the territories, as we do protection to "
1329,2528,1857-06-04-seq-1.txt,"ter in Kentucky . about to be sold to a slave dealer, and, having very plau sible letters in his possession, succee "
1330,2530,1860-03-08-seq-2.txt,"article with the following truisms: ""Without slaves there could bo no snch cotton crop as New England "
1331,2531,1860-03-08-seq-2.txt,", And seven hundred more arc pro- tessioually. engaged in stealing slaves irom the border States. "
1332,2532,1860-03-08-seq-2.txt,"lie cloEe of , their report, review the action of the several non-slaveholding States which have nullified the Pu "
1333,2533,1860-03-08-seq-2.txt,States which have nullified the Pu gitive Slave Law and the Constitu tional compact on which it is founded. 
1334,2535,1860-03-08-seq-2.txt,real prosperity. 'Slave Hcktesg in Massachcsetts. Tbe (ommiltee on federal relations 
1335,2536,1860-03-08-seq-2.txt,open the petitions for thi law 'to prevent slave hunting in JVIa&sachu setts . The Chairman of . the com 
1336,2537,1860-03-08-seq-2.txt,and tbe duty or the State to open ly repudiate the fugitive slave law as coning in conflict iritlhe high- 
1337,2538,1860-03-08-seq-2.txt,"tin minister of this city, who is rad-i there is morning pnyer each morn ical on tbe slavery question, actually jing of the week. , In some of tbe wrote a letter to Gov-Wise, soon ar - "
1338,2539,1860-03-08-seq-2.txt,"repose of virtuous communities. Slavery in New Enqlano. Pres- ident Lord, of Dartmouth College, "
1339,2540,1860-03-08-seq-2.txt,nas oeen wnuog anoiner leuer in favor of slavery. - He says tbat New England wui yet De compelled to 
1340,2541,1860-03-08-seq-2.txt,". . mama introduce slavery, ibe children and grand-children of the present aboli- "
1341,2551,1851-04-01-seq-4.txt,"A clergyman in New England when slaves were owned there, i ad a negro by tl:e name of Jack, v.'hp "
1342,2554,1854-03-02-seq-2.txt,"of; which 70 were slaves number of UWfcJlU gf, "
1343,2556,1854-03-02-seq-2.txt,"are no such bad sinks of iniquity in any of the slave States, about which there is so much ""agitation' now-a- "
1344,2557,1854-03-02-seq-2.txt,Missouri Compromise the phjo of sep arating the Free from the Slave States bv a ueoKiiaphical line had ibeen re- 
1345,2558,1854-03-02-seq-2.txt,"who jiolat sd the &jlemin compact and opening a icw the twhJle slavery agi tation, rendered 'the abandonment of "
1346,2562,1856-03-06-seq-2.txt,"is employed in supplying the necessi ties of the slaves of the South, and pocketing the profits, loses no oppor-r "
1347,2563,1856-03-06-seq-2.txt,' repeal all laws prohibiting the impor- Jtation or introduction of slaves into tha tJCFuXlTUIlE! 
1348,2564,1856-03-06-seq-2.txt,"to nationalize by adopting the Twelfth or Slavery Plank. Finding this ""no go, tn ?y are now aiiempuug iu na "
1349,2565,1856-03-06-seq-2.txt,"the abolitionists. Their leaders relied upon anti slavery prejudices, of what ever party, and gained the election "
1350,2566,1856-03-06-seq-2.txt,"tional party a geographical party --a great Northern anti slavery party. They declared it to be their purpose, "
1351,2567,1856-03-06-seq-2.txt,"whether the North, consul tingMts . hostility to slavery, would consent to -. become a great party, making "
1352,2569,1856-03-06-seq-2.txt,"tumty to insult the citizens of the slave States, who are compelled to re- y upon its hospitality. ; - . . :.. "
1353,2570,1856-03-06-seq-2.txt,tendencies. The platform adopted ignores the slavery question and de nounces' the repeal of the Missouri 
1354,2571,1856-03-06-seq-2.txt,ranch near that town. i Slavery is Gcorou. -A bill to ' repeal all laws prohibiting the impor- 
1355,2580,1853-09-08-seq-3.txt,":.ih.;. lave Mautillas. Co.-s,: (!,l!ars, Cuffs, Ch. i: - o'in ""S.'..-h ati'i N. ! "
1356,2581,1855-02-22-seq-2.txt,"J ""Every one of the candidates had been knowrr as nu anti-slavery rman, and it may be jsafe fo say of the whole "
1357,2582,1855-02-22-seq-2.txt,"ically,;with;any other party than an anti-slavery party1, we should like to kuow it.- : xne xreesosi party sem "
1358,2585,1860-05-03-seq-1.txt,"preaching abolitionitm, red iccitir ; slaves to insarrect ioiu U3 was .r-' . rested and heU to b-iil iu tLeVagi of. "
1359,2588,1860-07-05-seq-4.txt,tinI uatit tbe purchase money is paid. The title to said Slaves isbulieved to beeod.but i snaii convey oniy sucn as is Tested in me 
1360,2589,1851-07-01-seq-2.txt,"been convicted ot beating one of his slaves to death, and sentenced to the penitentiary for five years. I "
1361,2590,1851-07-01-seq-2.txt,"1 1 1 i' ... i ... i , . slavery, that we have put it j in the piwer of the North to cut Ker I "
1362,2591,1851-07-01-seq-2.txt,"ifornia until they, through their agent T. ButIerKing,' got an , anti-slaver Constitution. "
1363,2592,1851-07-01-seq-2.txt,of the Prpident secured - an -i anir - slavery Cnstitution. JSQ- Tiio Editcr:of the Lincoln 
1364,2593,1851-07-01-seq-2.txt,"charged the grand Jury, among oth er things, that the Fugitive Slave law is constitutional; that it would "
1365,2594,1851-07-01-seq-2.txt,"runs through the Cheroktc country. Penally for Slave Whipping Mr. Simeon Southey, a wealthy citizen "
1366,2600,1854-10-12-seq-4.txt,"circumstance, and lave Hie lanor S ; remark as follow "
1367,2601,1859-12-01-seq-2.txt,"dience to .Christian principle in be half of slaves and the Ireedom ot: - , "
1368,2602,1859-12-01-seq-2.txt,"and vicinity, owing to the ui?covery of a plot conceived by the slaves to destroy tho residence of a planter m "
1369,2605,1859-12-01-seq-2.txt,"God hath stretched forth bis hand; His spirit blessed the avergingglave, A""d Wallace led the band I "
1370,2608,1859-03-24-seq-2.txt,"the celebrated case of ""Dred Scott,"" ou tbe rights of slaveholders and the statu of slavery in' the Territories, "
1372,2610,1859-03-24-seq-2.txt,pies . announced in that decision Slavery and the rights of slavehol ders are protected by tbe Constitution 
1373,2614,1852-09-30-seq-4.txt,into which; lighted and guided me oJHfafd if! b be p unged lhc;i lave evcr.had any high ai d noble .l.vil.' i Vifill It ..nul.l t.:. .t. J.... l. i 
1374,2615,1854-09-14-seq-2.txt,"What! will a man play tricks, will he indulge We fire no' flLolocrist for slavery A silly fond conceit of bis fair form. r o ... . ( l i ' "
1375,2616,1854-09-14-seq-2.txt,"ly of the wigwams formed in the free States, and among anti-slavery men; though in a Presidential election, the "
1376,2617,1854-09-14-seq-2.txt,the unfortunate prisoner been a fu gitive slave instead of a white man too poor (o pay a trifling debt the 
1377,2621,1858-01-21-seq-2.txt,"old, a native of South Carolina, and a fugitive slave, died ia Providence, R. I., on Christmas day, a victim of! "
1378,2622,1858-01-21-seq-2.txt,"--; Tho Jefiorson City,(Mo.,) Enquir cr, a pro slavery paper, fays: SdiWties near Fort Scott, that tho po-uoiw, vyimu iweivo munius "
1379,2623,1858-01-21-seq-2.txt,lino nwiir xn no iini'm Sjrna of the y.o!oat itati-slavery men who were witne-sing the hunger 
1380,2627,1860-07-12-seq-1.txt,"tbe Southern States' bad tbe.. right to carry tbeir.slaves into . the. Terri tories of the Uidoxj, and that neither "
1381,2628,1860-07-12-seq-1.txt,":4; The Constitution ; of- the 'Uni ted States recognizes elaves as prop erty, and pledges the Federal Gov "
1382,2629,1860-07-12-seq-1.txt,"perty of h citizen in the .Territory Territorial Legislature over the in which is prohibited by the-Const!-istitotion of slavery in its borders, tution. The Government and theand io their prekrenee or. dislike of "
1383,2631,1860-07-12-seq-1.txt,". alaves when, he removes ito the ter- ritory tit. question to reside, is' an ex "
1384,2632,1860-07-12-seq-1.txt,; ritorial gislature .to impair or do jfitroy the rights . of slaveholders in the Ttrritorks. We proceeded to 
1385,2633,1860-07-12-seq-1.txt,"whether its"" constitution prohibits or reocgnizes the jutitulion of flaveiy. ; 4th. That t hrt Democratic party "
1386,2634,1860-07-12-seq-1.txt,"execution Ot tb lU:itlV Slave law, are hostile ch racter,-' subversive "
1387,2635,1860-07-12-seq-1.txt,would bo content with the' assertion iu th Piatforro-r-that lavehoicers in tbe Southern States' bad tbe.. right 
1388,2642,1858-10-07-seq-4.txt,"will be required of the purchasers of said land and slaves, and a lieu retained for the purchase money. "
1389,2643,1858-10-07-seq-4.txt,"Sept. 16, 1838. Chancery Sale of Land and Slaves. IN pursuance cf a decree of the Chancery "
1390,2645,1858-10-07-seq-4.txt,"15,000 Of tbes Machines lave lxe: sold SnJ are ia profitable use iu aM pait of th world. "
1391,2647,1857-02-05-seq-1.txt,"prophet. See as above. books-but should be lad to be set1!'055600""' W9 8!,ouM cot W0Dder ifiPort. IIe keeps twelve slaves ' con-' to rights by bntter information' encefortU. there was a decided de-jstantly employed m findicg the bugs; "
1392,2648,1857-02-05-seq-1.txt,"to rashness, on the battle field, and. wVk l"" '"" treated all wbo Approached him with niade me her slave; suffice it to say, gentlemanly .courtesy. . ' V. Hhut 1 loVed her wtb' m? ffhole be; "
1393,2652,1852-04-08-seq-2.txt,"Alr. Macready must hold in lTS: moreover, were able to work The Slave. We find the following gouge out his eyes. 1 he parties "
1394,2653,1859-03-03-seq-4.txt,"'Ahem I yes. Well, what abdut the slave trade? Do the inhabitants still sanction the inhuman traffic?' "
1395,2655,1858-12-23-seq-2.txt,", c ? Ipedm th suburbs of the town of slaves. f?ome threats acunst the ... . o-n r n. .t A MnrrellGang Passing as Gipsies. "
1396,2658,1855-09-06-seq-1.txt,"agony - he repiieoi v uo, ir,-. a thinking about the poor slaves ot ine. My surprise' and alarm""; which "
1397,2661,1852-05-27-seq-4.txt,"Irom the fair modelings of Venus de Medici and the Grefrk Slave, to the vast-chested Apollo o! "
1398,2662,1855-03-01-seq-1.txt,"ble sunV' in addition. Rafei, who rarelv nlaved.' and Ihen. only : for small stakes!, urged his friend to dis "
1399,2663,1860-06-07-seq-2.txt,Lt it b-i remembered That tin: negroes er.3 slaves ia Africa sold by their chiefs who frequently pu; 
1400,2664,1860-06-07-seq-2.txt,"ton, Jefferson and otb -r fou riders of our Republic who held slaves, were gigantic villisos, and if tber doc "
1401,2666,1860-06-07-seq-2.txt,"tration of their doctrine, have hdd lh it negro slavery was 'the sum oi all viUianies, aud hence Washing "
1402,2668,1860-06-07-seq-2.txt,"of the Peace, elected to fill vacancy,! Ti:e Ameeican ?lays Trade Is 1 hold their cflic and lave the light its functions for tl.e! "
1403,2669,1860-06-07-seq-2.txt,upon Beil aiid Evt.-r.:t.' THE INI t btii. lti-j Alricnn slave trade' ' ) ears 
1404,2670,1860-06-07-seq-2.txt,"tion of the rights of thu masses, Party spirit sectionalism and slavery agitation have brought the country "
1405,2671,1860-06-07-seq-2.txt,a bill -teds passed annulling' ike laws for the roii ctiou of slavery e n acted by theL glnture of Ne w Mexico! Aes 
1406,2678,1858-05-13-seq-1.txt,a bill to prevent free negroes from holding slaves in that State. The practice must he - quite common to 
1407,2679,1858-05-13-seq-1.txt,"serve him the -balance of his days, lie preferred to come .back to slavery and risk being taken down South "
1408,2680,1858-05-13-seq-1.txt,"""Mr. President. I is onnosd to ery ooatQcra mm was in duty bouml dm Vrrt rflsfiliiii.in !ra T to oo, , iho measure w ould lave been- thus reported: "
1409,2681,1858-05-13-seq-1.txt,is decidedly novel. Geoe3 Holding Slaves. The Louisiana Legislature has passed 
1410,2685,1851-01-21-seq-2.txt,"acturilv. 1 t'isirici ol loiuinoi or in ttic States, ior 'Sow Or-i l prevent tnei jiranj-periation ol slaves to i- il.-l.-iv another 'jv iheir lal lul owners, nor toinrc- "
