,Unnamed: 0,date,context
1891,4223,1857-10-01-seq-2.txt,"that neither competition nor a cold climate ran kill negro slavery; el*e, why will they not nlWw it tho experiment of a Yankee winter und "
1892,4252,1856-09-04-seq-2.txt,"Jefferson, aud Jackson, and Calhoun, and Nathaniel Macon aud tho slaveholders of tho South have kept them out of power, "
1893,4253,1856-09-04-seq-2.txt,"clear field ; the northern laboring classes, unaided by the slaveholders, will be helpless iu our hands. We will rule the nation "
1894,4254,1856-09-04-seq-2.txt,"We repeat, who, for fifty years, liave. been checkmated by the slaveholders of tin Soutb. it is to be expected that they should "
1895,4255,1856-09-04-seq-2.txt,"that the atlf-styled Republican party entertaiu the same notion uf negro slavery that Washington, Jefferson, Patrick Henry, dtc., "
1896,4256,1856-09-04-seq-2.txt,"ihe southern statesmen of that day, confounded negroes with ''slavery,"" or presence of that race with the social relations "
1897,4257,1856-09-04-seq-2.txt,"white men) was better adapted, and this they mistook for ""slavery,"" or as this was an evil, they confounded it with the relation "
1898,4258,1856-09-04-seq-2.txt,"under the then circumstances, naturally enough mistook slavery, instead of negroes, as an evil, will any ono dare to "
1899,4259,1856-09-04-seq-2.txt,lialll. >se anti-slavery llepubliery is lo litem an evil.* 
1900,4260,1856-09-04-seq-2.txt,"j iiviu jiv/utiuai tllUUVl'd, W J1U UVU opposed to negro slavery because they are in favor uf white slavery, because, for fifty "
1902,4263,1856-09-04-seq-2.txt,"""If we cau use the government to limit 'slavery,' to pen up the negroes so as to render the negro labor unprofitable and "
1903,4277,1861-01-25-seq-4.txt,sire and purpose ?>f the people of Alah;>ma to meet tho slaveholditig States of the Soutli who approve of such purpose in 
1904,4280,1856-11-27-seq-2.txt,ji ^Wa Soutij ; there are too many large I slaveholder; and the institution needs lo .i^jb^^itahiiitated liy a diftusion amongst a 
1905,4281,1856-11-27-seq-2.txt,"wmi a view 10 me uenent 01 me institution, and as an incentive to our slaveholders to follow up and develop anollier resource we "
1906,4282,1856-11-27-seq-2.txt,"reierrcu 10 was general in its terms, and wade no mention of slavery or tho sli.vo trade; l>ut Congress, having a wise instinct "
1907,4283,1856-11-27-seq-2.txt,"r.:vv. of the Union. Meantime, .though slavery had existed in all the original Northern Stales, lliey "
1908,4284,1856-11-27-seq-2.txt,"-v * had been very profitably abolishing it, mainly by selling their slaves at high prices to those who could more usefully employ "
1909,4285,1856-11-27-seq-2.txt,"was not adapted to white labor, and the ingress of slave labor being inhibited, she has been set back iu material development j "
1910,4286,1856-11-27-seq-2.txt,"foreign birth in the free Stales was l.SGO,- j 397 ; in the slave Slates, 378,205, showing j the relative increase of the North and "
1911,4287,1856-11-27-seq-2.txt,"been detrimentally affected by the prohibition of tho slave trade, or (he exclusion of that class of laborers demanded by her institutions, "
1912,4288,1856-11-27-seq-2.txt,"in fact and has been equally obvious in results. As to the morality of the slave trade, that presents no more dilHculty than the "
1913,4289,1856-11-27-seq-2.txt,that presents no more dilHculty than the question of slavery itself. One is involved in the other. Slavery must be defended in 
1914,4290,1856-11-27-seq-2.txt,"perpetuate it. If the latter is the correct view, as it must be to make slavery, defensible, the African slave ceases to be u "
1916,4292,1856-11-27-seq-2.txt,"solely of expediency; and, therefore, the South has a right to an increase of slave labor as long ;is there is an increasing detnjarwl "
1917,4293,1856-11-27-seq-2.txt,"aeries of ldblo articles, has been one of the *reat;evils of slavery at tho South, though jjy.no means a necessary evil. Its scarcity "
1918,4294,1856-11-27-seq-2.txt,"; '"" .- 3- iq4.Ul?triou8 and provident, niiirht , ""hay^lield the relation of slavelioMvr. ""As . it ia,--there are too many non-sluvuholders "
1919,4296,1856-11-27-seq-2.txt,.i^jb^^itahiiitated liy a diftusion amongst a ' The measure of slave Cgxempjii^pi pa which we have heretofore 
1920,4297,1856-11-27-seq-2.txt,The Slave Trade.?The Southern papers alk of re-opcninjr the foreign slave trade. tlioiiM I- ? 
1921,4298,1856-11-27-seq-2.txt,"ce a general illumination in Boston. It is notorious fact, that the African slave ratio has been, Is now, and in all probabilly "
1922,4299,1856-11-27-seq-2.txt,"tliat Abolitionists should be ip favor . f tlie slave trade, with all the Ijorrdra of ' le middle passage, but the inconsistency , "
1923,4300,1856-11-27-seq-2.txt,"le middle passage, but the inconsistency , not real. Revive the slave trade, ""and i loy enlarge the splicro of their commercial "
1924,4323,1856-09-11-seq-4.txt,"enouuh to slide Kansas clean into South Curoli na, w here we can make a slaveholdiug State on of her, and hy that time they'll have Groceries "
1925,4324,1856-09-11-seq-4.txt,"Soda and Salnrutus enough to raise it again, ant get up a slavery excitement, Cigars cnougl (?r?-t out of the way, Vesuvius, they're right nfiei "
1926,4328,1859-04-21-seq-1.txt,"a sl;,ter heieabout."" ""Shu's no slaver, Captain."" 1 14 Why do you think so ?"" "
1927,4330,1856-11-13-seq-1.txt,"Philanthropy.?John Randolph, of Virginia, manumitted his slaves by will, and made provisions for their refugo and "
1928,4331,1856-11-13-seq-1.txt,"the migration or settlement of any manumitted slaves within her borders,.there* by defeating the humane intention of the "
1930,4338,1858-05-27-seq-2.txt,flag. The pretext for this insolence is thai our vessels were suspected of heing slavers. It will ho Keen by tho official dispatches wo publish 
1931,4339,1858-05-27-seq-2.txt,"tivc naval engagements. It is surmised by son here, that the suppression of the slave Irado is mere pretence on the part of Great Britain "
1932,4340,1858-05-27-seq-2.txt,"apprenticeship; hut no one doubts that they are, and will continue to he, slaves in every Sense of the word, and ft?t all time. These negroes "
1933,4341,1858-05-27-seq-2.txt,"_ sentiment of Mississippi is almost universal in its ,f approval of the revival of the African slave trade. .. The wealthy want it bt-cause if i.fiords them "
1934,4342,1858-05-27-seq-2.txt,"f labor for their own smaller tracts of laid. These H ure the facts connected with the AFriean slave , trade revival in this country. Is it not time, that "
1935,4343,1858-05-27-seq-2.txt,"free persons of color.ill thai State, of their own free will, to select musters and become slaves, some of the free blacks are availing themselves "
1936,4344,1858-05-27-seq-2.txt,"Probable Division.?A correspondent in speaking of tho compromise on the slavery question, effected at the recent General Conference of the "
1937,4354,1858-03-18-seq-3.txt,"net, his wife, I Rill for Specific r*. ) delivery of slave TXi'ytU Cannon, R. M. / "
1938,4356,1856-08-07-seq-3.txt,"Soda and Salnrutus enough t*> raise il again, and j get up a slavery excitement, Cigars enough i "
1939,4357,1856-08-07-seq-3.txt,"cnntiL'h to slide Kansas clean into South ('aroli an, where we can iimko a slavcholdiug State out of lier, and by tliat. time they'll haw CJroeeries "
1940,4359,1861-07-05-seq-1.txt,"the North are heaping too much stress on ! England's dislike to slavery, and if they | j think wo are goin^ to hob nob with a peo- I "
1941,4361,1859-10-27-seq-2.txt,"contributions would have been levied on the ' slaveholdeis and llieir propeiIv Appropriated to i defray expenses, and carry on the war of fioe- ] "
1942,4363,1859-10-27-seq-2.txt,"laughable if it were not *o dull. It of course abolishes slavery, unci says ilint, eveivhodv of (nature ngeslinll vole fur u President and Vice "
1943,4364,1859-10-27-seq-2.txt,"was to be thr*e years. All persons who voluntarily delivered up their slaves were lo he registered in u book, and have protection. All per "
1944,4369,1856-03-27-seq-1.txt,"taxes, and tlusy have no mure voice or influence in the government'than their slaves. The Captain General, Governors, and all "
1945,4370,1856-03-27-seq-1.txt,them to enter the Union with constitutions prohibiting slavery! They a*k to participate in all the principles of '.lie old 
1946,4371,1856-03-27-seq-1.txt,"thi teen, saying, at the same time, ""We are holier than you;"" ""The hlot of slavery is not on our escutcheon."" To the present "
1947,4372,1856-03-27-seq-1.txt,"not on our escutcheon."" To the present slave Slates, they, in cil.ct, say, ""You, it is true, have given to the Union, or have been "
1948,4373,1856-03-27-seq-1.txt,"laminate us with your vile institution of , slavery."" If the new State were within the Fii?id Zone, where the negro would he at "
1949,4374,1856-03-27-seq-1.txt,"ness to (lit! instill, f>>r the prohibition would be unnecessary. Tile prohibition of slavery is always cither a wanton insult, or a gross "
1950,4375,1856-03-27-seq-1.txt,"its parents. ii we hi iix* ,-xiiiui aumu iii.'ii slavery is | immoral or inexpedient in new States, we ( "
1951,4376,1856-03-27-seq-1.txt,"tloiiK-ntic institutions. Hereafter, in admitting any Northern State prohibiting slavery, it should he with ail understanding on the "
1952,4377,1856-03-27-seq-1.txt,"South, the ail mission of any State excluding I slav< ry. is the assertion that slavery is morally wrong ami inexpedient. "
1953,4378,1856-03-27-seq-1.txt,"lie narrow limits of the city and satisfy erself 011 the slave stale of the South, at 1 lie same time enjoy herself among its | "
1954,4379,1856-03-27-seq-1.txt,"jent commenced a regular lecture upon s in lie sin of slavery?that negroes were the i in (juals of the white man, and should he ! n, "
1955,4392,1863-03-27-seq-1.txt,"iiic own consumption or thai ojhja""family, emplo\e?6 of'slaves. * * "" v*.' II, Thnt no officer. ?hftlH ftt tijae, "
1956,4395,1858-04-29-seq-3.txt,"riei, his wife, y BtW for Spocific 1 vt. \ delivery of slave. Elijah Cannon, R. M. ) "
1958,4399,1857-08-27-seq-1.txt,"this county, bringing a household servant, a slave with him. On his arrival in New York he told his slave that sho was then in "
1960,4401,1857-08-27-seq-1.txt,"should she prefer to leave him. Slio preferred slavery to being a free negro, and he ""brought her to Vermont. She has "
1961,4402,1857-08-27-seq-1.txt,Thus much to show how luuch these pretended anti-slavery men teem to think of a negro th slavery. 
1963,4404,1857-08-27-seq-1.txt,"was not offered a seat, and 1'eflT the church. And yet-this denomination U theanti-slavcry denomination of New Euglhfld, and the "
1964,4405,1857-08-27-seq-1.txt,"* vi iuw msn noi (o have been a slave. Tliey tbinfe a great deal of a slave ftegro, but a free nqp-o need "
1966,4414,1857-05-07-seq-1.txt,"it is supernatural?not a miracle pf demon slaves driven umder the lash of ^ome magaci#u taskmaster, but the'miracle "
1967,4415,1857-05-07-seq-1.txt,"And, with their open-air life, slump speaking, slave-controlling and other calls upon their outward and visible dignity and authorilativeness, "
1968,4419,1860-02-09-seq-3.txt,"families. Al*o, tlio number of Dogs owned l>y tlieir slaves. Free persons of color fntisl pay llinir taxes in "
1969,4422,1865-10-26-seq-1.txt,there was not an much danger as was supposed. Tho?e corning out of slavery cannot do without tyo'k. They cannot lie dowu iu dissipation. 
1970,4424,1850-06-01-seq-2.txt,"that nothing short of the emancipation of slavery, even in the StaU-s, will sati*fy this fanatical crew. To reason with such "
1971,4425,1850-06-01-seq-2.txt,"at the cud of the imprisonment, his claim to the service of the slave, will remain as at present. The slave confessed the theft. Ilis "
1973,4427,1850-06-01-seq-2.txt,"reported in the United States Senate, on the subject of slavery, purporting to bo h ! rnmnmtnistp nrn ii* ...J*!. **- n? "
1974,4428,1850-06-01-seq-2.txt,"to the Southern master the rendition of^jt*J^raJP*^ fugitive slave; nor would the enforccmeni^TO^^--1?^!^^; this manifest duty by the whole power, bow "
1975,4429,1850-06-01-seq-2.txt,"Congress is not onlv disregarded, but jt-i* . ust d ;:s a pretext for intefeung with slavery in tho States, and when, a) a part of "
1976,4430,1850-06-01-seq-2.txt,"port, the Southern master is to be arraiCTed- vgsNBaK??j by his own slave, in his own State, befoWvaW^HBSIfi the judicial tribunals of the United States "
1977,4438,1856-11-06-seq-1.txt,"first introduced into America by Spanish slaveholders, who emigrated with their negroes. A royal edict of Spam authorized "
1978,4439,1856-11-06-seq-1.txt,"of the United States, an account of the early traffic of Europeans in slaves is given. In the middle ages, the Venitians purchased "
1979,4440,1856-11-06-seq-1.txt,Spain. In England the Anglo-Saxon nobility sold their servants as slaves to foreigners. The Portuguese first imported 
1980,4441,1856-11-06-seq-1.txt,The Portuguese first imported negro slaves from Western Africa into Europe in 1442. Spain soon engaged in the 
1981,4442,1856-11-06-seq-1.txt,"was discovered, tbe Indians of Hispauiola were imported into Spain and made slaves. The Spaniards visited tbe coast of North "
1982,4443,1856-11-06-seq-1.txt,"America, and kidnapped thousands of the Indian?, whom they l)ii:i?^orted into slavery in Europe and tho West Indies. Columbus "
1983,4444,1856-11-06-seq-1.txt,"in Europe and tho West Indies. Columbus himself enslaved five hundred native Americans, and sent them into Spain, that "
1984,4445,1856-11-06-seq-1.txt,"into foreign bondage, continued for nearly two centuries. Negro slavery was first introduced into America by Spanish "
1985,4447,1856-11-06-seq-1.txt,"A royal edict of Spam authorized ncjjrv slavery in America, lOUiJ, ivtng Ferdinand himself sent from Sevillo fifty "
1986,4448,1856-11-06-seq-1.txt,"Ferdinand himself sent from Sevillo fifty slaves to labor in tlic mines. In 1511, the direct traffic in slaves between Africa and "
1988,4450,1856-11-06-seq-1.txt,1518. The mistaken benevolence of Las Casas extended the slave trado which had been accomplished. Sir John Hawkins 
1989,4451,1856-11-06-seq-1.txt,"was uie nrst J^nghsinnrui tUat engaged in tbe slave trade. In 1052 lie transported a 1 largo cargo of Africans to Ili?paniola, Iu "
1990,4452,1856-11-06-seq-1.txt,the colonies the guilt of participating in the slave trade. In 1045 they imported a (sargo of uegro.ps. I'hrotyghput Massacbup 
1991,4453,1856-11-06-seq-1.txt,"tcr period there were both Indian an<I flfc, gro slaves in Massachusetts. Jn 1620 a P Dutch ship entered James river, and landed "
1992,4454,1856-11-06-seq-1.txt,"I twenty negroes for sale. This was the I epoch of the introduction of slavery into Virginia. For many years, the Dutch were "
1993,4478,1856-10-30-seq-4.txt,"enouL'h tn slide Kancas rloaii into South t'aroli j mi, where we eun make a slaveliohliui; State out of Iter, ami hy that time they'll have Groceries "
1994,4480,1863-05-29-seq-1.txt,the nshes of her unconquered hc*r<? should be trampled upon by hirelings and slaves. Old ocean would murmur curses against 
1995,4483,1856-10-16-seq-4.txt,"s Soda nnd Salaratu.s enough to raise it again, ami f yet up a slavery excitement, Cigars enough I (get out of the way, Vesuvius, they're right after "
1996,4484,1856-10-16-seq-4.txt,"ji. i>in ut (luiiucuif uui iiucrai, owing no slavish or servile allegiance to parties or politiciaUH. It will advocate measures, not men; "
1997,4487,1857-05-28-seq-1.txt,"Government with power to emancipate our slaves, and that power once attained, can we doubt that the fate of Jamaica and "
1998,4490,1859-11-10-seq-1.txt,"Southern States io pillage and plunder, and murder, the unprotected slaveholder in the Territories woufrf ffiire badly if left to court* of Juslice. "
1999,4491,1859-11-10-seq-1.txt,"with iedoubled zeal ihe frfcnds of protection to slavery in the States and Territories. When the confederacy, as at present governed, subjects "
2000,4493,1859-11-10-seq-1.txt,of tho disturbing and dangerona quel. .ion of slavery is in the acknowledgment of ita constitutional rights and their protection. Thia 
2001,4497,1856-06-05-seq-1.txt,"American,) in lieu of the African slave trade ; and as might be expected, like the old slave trade, it is carried or. chicily "
2003,4499,1856-06-05-seq-1.txt,"hailing in all cases, jis far as we arc aware, from the non-slave States, and a largo portion of them from New England "
2004,4500,1856-06-05-seq-1.txt,"the New York Journal of Coinnicree, shows how the materials of the modern slave trade?the Chinese Coolies?are obtained. "
2005,4501,1856-06-05-seq-1.txt,>liii?s. The kipuappcrs bring out the Coolies llie same as at the slave market at Mobile !<>? inspection. They ;ne then made to go 
2006,4502,1856-06-05-seq-1.txt,"i>n board, and three guns, which are lathed so a.s to bear on the slaves if they should imc. a i - i. - e "
2007,4503,1856-06-05-seq-1.txt,"Give eujh hit* full share of the earth and the sky : Nor fatten the slave where the serpent would die ^ Alas! for poor Erin that some arc still seen, "
2008,4512,1865-10-05-seq-1.txt,"ifou have repealed the Oidinanceof Se- Pj sion, abolished slavery,. equalized the 0I resentation. in the Senate,* given the tl "
2009,4513,1865-10-05-seq-1.txt,"tions the principal of which was an acquiaicce in the abolition of slavery, which had :en accomplished by the military QUllim-itie*. "
2010,4514,1865-10-05-seq-1.txt,"to it. Wlien we were in the Union, they msed uj- account of slavery. They waged Hr up?n u* bccuusc we tried to soparate from "
2011,4515,1865-10-05-seq-1.txt,"iem, nud now that w- propone to return with it slavery, tli?-y still object. In this emer>ncy| tho State needs tin; annistnnce of all her "
2012,4520,1858-02-11-seq-2.txt,case of the State t'? Don. Alonzo Foskel. convic' ted of the homicide of a slave: Don. Alonzo Fosickt:?The duty of assigning 
2013,4521,1858-02-11-seq-2.txt,"To day you stand before me to receive tlic judgment of the law for ""killing a slave oil sudden lient and passion."" .7'hi* is no liyhl off<nee! Il "
2014,4522,1858-02-11-seq-2.txt,few abler men in the Senate than Judge Evans Ilia speech on the slavery question was the lies that has ever been delivered in that body. I 
2015,4523,1858-02-11-seq-2.txt,A Bill is now before the Virginia Legislature I to compell free negroes to enslave themselves or I remove from the State. The 1$ II proposes to I 
2016,4524,1858-02-11-seq-2.txt,"any, who may be disposed to do so, to emigrate I | voluntarily, or enslave themselves within the 1 i same period. After three years expire, tli>s I "
2017,4525,1858-02-11-seq-2.txt,"j Bill proposes to sell all free negroes in the State I into slavery, ami deposit the proceeds in the 1 State Treasury. "
2018,4526,1858-02-11-seq-2.txt,the Northern Democracy upon the question of slavery. The Speaker has announced the following gen 
2019,4527,1858-02-11-seq-2.txt,"question whether Kansas should be a free or slave Stale; thai, when he instructed Governor Walkkr iu regard to submitting the constitution "
2020,4528,1858-02-11-seq-2.txt,"to th* people, he had no other object in view but that all-absorbing question of slavery; thu1 Kansas now asks admission into the Union nnd "
2021,4529,1858-02-11-seq-2.txt,"this would carry out the great principle of "" nonintervention hy Congress of slavery in the States or Territories;"" that it would be wise to reflect "
2022,4530,1858-02-11-seq-2.txt,"rejection ; that if a majority of her citiiens desire to nbolish domestic slavery, there is no other mode by which it can be effected so speedily as "
2023,4531,1858-02-11-seq-2.txt,"by the highest authority known to our laws, that slavery now exist* in Kautas by virtue of the Constitution of the United States; that "
2024,4532,1858-02-11-seq-2.txt,"of the Constitution of the United States; that she is at this moment, as much a slave State as Georgia or South Carolina; that if Congress "
2025,4533,1858-02-11-seq-2.txt,"affording the disaffected in Kansas a third opportunity of prohibiting slavery in the Stale, no man can foretell the consequences; that if rejected "
2026,4534,1858-02-11-seq-2.txt,"inanity which lius ever marred the fair name of our District. It appears that a slave, about sixty years of age, belonging to W. D. A. Dean, of "
2027,4535,1858-02-11-seq-2.txt,"summoned a jury to make the necessary inquiries. The result of the inquest wus, that the slave had j come to his death from frequent brutal punish- j "
2028,4536,1858-02-11-seq-2.txt,"lor to that stated above ?Laxcrensvillc Herald v The Enslavement of Free Negroes.?The bill * now before the Virginia Legislature, providing "
2029,4537,1858-02-11-seq-2.txt,"now before the Virginia Legislature, providing for Ilia enslavement of free negroes, under certain circumstances, proposes to hire them out for r "
2030,4538,1858-02-11-seq-2.txt,"any free negro within the liinitatation assigned, d to emigrate voluntarily or enslave himself at his c Ab ine enu oi mreo yt*nrn, an irce o "
2031,4539,1858-02-11-seq-2.txt,"negroes found in the State are to be sold into 2 slavery, Ihe proceeds of the salo to be deposited g to the credit of the State. "
2032,4540,1858-02-11-seq-2.txt,"hurled with ""inveigling, stealing and carrying way,"" three slaves, the property of Mrs. Jueitli ones, hut in llie possession of Dr. Win. E. Hall, "
2033,4541,1858-02-11-seq-2.txt,"o go to Charleston and remain there, which hey did ; and the three slaves and Sanders were here arrested and brought to this place for "
2034,4542,1858-02-11-seq-2.txt,"says: ""That at a sale in this immediate icinity, not a week ago, a lot of 17 slaves sold t an average price of $886.76. Of t'lese, two "
2035,4569,1851-08-08-seq-3.txt,"We don't beat our women, and are there- ti fore slaves; wo are forced to knock under c because we have fastidious scruples about a "
2036,4572,1858-04-22-seq-3.txt,"riot, his wife, > Rill for Specific v*. 5 delivery of slave Elijah Cannon, R. M. ) "
2037,4573,1858-04-22-seq-3.txt,",w $50 Reward ur To any slave, or free porspns of color, who wil f"" furnish the evidence sought nl>ove. "
2038,4576,1858-01-14-seq-3.txt,"I Mornini; at 11 o'clock, nml rnnnnnt with slaves for Alligator, Madison, Tallahassee, St. Augustine, Orange Springs, Micunopy, Newe"" "
2039,4579,1856-04-17-seq-2.txt,to their morbid monomania upon the question of slavery. These impudent scamps have bad the insolence to arm themselves 
2040,4580,1856-04-17-seq-2.txt,"three million one lnimlii.il ami ninety-live thousand nine hundred and lifty one slaves. I'akingsix hundred dollars as the average, "
2041,4581,1856-04-17-seq-2.txt,"iiikI allowing for lliu material increasesince 1S5(>, the total value of slaves in the United Slates at tliis lime is estimated at two "
2042,4582,1856-04-17-seq-2.txt,amount to one hundred and twenty millions. The estimated value of the slaves emancipated in the British West Indies was only 
2043,4583,1856-04-17-seq-2.txt,"lit'tv millions, not half the amount of (he interest of the slave property of the I'nited States. Vet it is estimated l>y all able writer "
2044,4584,1856-04-17-seq-2.txt,"[>ation, was not less than four times the | iiiiioiint of the whole value of the slaves, j Calculate then the enormous financial ruin : "
2045,4585,1856-04-17-seq-2.txt,"lion should he thrown, as is not improbable, | upon the House,) exists in the non-slave- j holding States, whose avowed object is to j "
2046,4586,1856-04-17-seq-2.txt,"holding States, whose avowed object is to j ibolish slavery, to rob six millions of South- ! L-rners of two thousand millions of properly ! "
2047,4599,1856-06-26-seq-1.txt,supply the want of laborers produced in the empire by the abolition of the slave trade in the year 1850. Previous to that 
2048,4600,1856-06-26-seq-1.txt,"trade in the year 1850. Previous to that time, fifty thousand slaves performed the field work, and the price of produce was "
2049,4601,1856-06-26-seq-1.txt,"have died off at the ratio of about 15 per cent., and the cost of slaves has gone lip nearly two hundred per cent. As the "
2050,4602,1856-06-26-seq-1.txt,"toil. The boy who drones over his book, a slave to listless laziness, thereby secures himself a place at the foot of society. Tho "
2051,4609,1861-03-22-seq-2.txt,"York Herald, the fruits, social and commercial ^ of the triumph of anti slavery principles at the North. The secession of the cotton States "
2052,4610,1861-03-22-seq-2.txt,"no leisure or inclination for romances. Tho great anti-slavery crusade, which has been carried on daring the last thirty years, has now "
2053,4611,1861-03-22-seq-2.txt,"er calamity than even a separation of the ^>1 South from the North whether slavery is not ?r eally an incubus cpon-the latter, and at tbe ,n "
2054,4615,1857-01-29-seq-1.txt,"gro proprietcr will not employ the compul- ! sory labor of slaves J"" Hie London Post, the special organ of "
2055,4616,1857-01-29-seq-1.txt,"itence it expressly admits, is a battle between ' , geography and slavery. In the cotir.-c of its reasoning it admits that coffee an<l sugar j | "
2056,4617,1857-01-29-seq-1.txt,"world are beginning to awaken lo I lie I rue ; , issues involved in the discussion of the slave' j j ry question. Cotton sml sugar are I lie ! . "
2057,4618,1857-01-29-seq-1.txt,the negio propiieter employ the compulsory labor of slavvs ? Commercial England has to decide these 
2058,4623,1859-12-15-seq-2.txt,"That Canada is the asylum of our runaway slaves, and is the hot be I of seditons sentiment, il"" not schemes against the peace of a "
2059,4624,1859-12-15-seq-2.txt,"is justified, nut merely in affording a refuse to absconding slaves, but in perc itting their rsseinblage, under the guidance of white men, stimulating "
