,Unnamed: 0,date,context
690,1541,1856-06-12-seq-1.txt,the universal oninion now is. t.lirit. tlm milv . effectual mode of stopping the slave trade | is l?v colonization and the substitution of 
691,1542,1856-06-12-seq-1.txt,! a legitimate traftic in its place. Let coin j iikm'cc have fair play and the slave trade . will cease. 
692,1543,1856-06-12-seq-1.txt,": of Liberia on the coast of Africa. This colony composed of slaves, redeemed or emancipated, is now a little independent "
693,1544,1856-06-12-seq-1.txt,i a certain number of negroes. This enterI prise has had two adevrsaries?the slave i merchants and the excited abolitionists; but 
694,1545,1856-06-12-seq-1.txt,diameter as to its special agency in putting j down the slave trade. Not long ago Chamber's Journal had an elaborate arlicle 
695,1546,1856-06-12-seq-1.txt,"""The effoits to ptit ciown the African slave trade by a blockade have, it is well known, been signally unsuccessful. Britain's "
696,1547,1856-06-12-seq-1.txt,"held out by the sugar trade of Brazil, more 1 slaves arc now exported from Africa than ' ever?the only effect of the blockade bc "
697,1548,1856-06-12-seq-1.txt,"^ along the African const, and causing, wlier' ever it set its foot, the slave trade to dis! appear. Strange to say, it has done this, "
698,1549,1856-06-12-seq-1.txt,""" Instead of weakening us, as allegedi slavery adds greatly to our military strength as a nation. All warlike countries have "
699,1550,1856-06-12-seq-1.txt,"as a nation. All warlike countries have boen slavo States. It furnishes tho sinews by which war is supported. While other ! , "
700,1585,1857-09-03-seq-1.txt,"lhe civil war, l?y making Kansas an asylum j for the slaves of Missouri, and appeal to the Xoilh, which thev boast will send them all "
701,1586,1857-09-03-seq-1.txt,"lemphitcd, litit of the laws ami solemn trca- ( tics of tho United Stales, whore slavery is j protected by tlieni and l>y tlie Federal Constitution, "
702,1587,1857-09-03-seq-1.txt,"fr&m* its northern boundary lo the Gulf, wlicre slavery is not only protected by State government, but also by a solemn "
703,1592,1859-02-17-seq-2.txt,"both races by civilizing and christianizing the slaves and affording an opportunity for the cultivation of the higher power of Ibo mauler, "
704,1593,1859-02-17-seq-2.txt,the thousand and one aimtheinns of ubolitiondcm against the institution of slavery. Tho case alluded to is one of a young man of rather Homhre 
705,1594,1859-02-17-seq-2.txt,"in order to innlce tliein join ir. suppressing the w slave trade, in (he says) lo show tliein how far v. more profitably to themselves they rim exercise ri "
706,1595,1859-02-17-seq-2.txt,"loiibt that tbo vessel oaptureil (the Hufus iuule) was a slaver, If so, she had no right to nrry the American Hag?(lie African slave "
708,1597,1859-02-17-seq-2.txt,"aval force on the const of Africa for a common bjeet?the suppression of the slave trade. So nig as none hut slave traders aro nioleitcul, "
710,1607,1865-11-17-seq-2.txt,"A bill preliminary to the legislation induced . by the emancipation <>f slave?, from the JnJii cittry Committee. wna read. "
712,1611,1851-08-08-seq-2.txt,"joint of view. It would como into tlio Unon as a slave territory; and by maintaining ?n equality between tho slave and free States, < "
714,1613,1851-08-08-seq-2.txt,"night quiet disaffection, and perpetuate the Union. Heretofore slave territory has been :onverted into slavo States, and wo presume "
716,1615,1851-08-08-seq-2.txt,jf a territory liavo the right to act on tho inbject of slavery for themselves. Tho annexation of Cuba would open a vent for tho surplus 
717,1616,1851-08-08-seq-2.txt,of Cuba would open a vent for tho surplus slaves of sonio of tho Southern States ; ind without increasing the number of that : 
718,1617,1851-08-08-seq-2.txt,"the case of Daniel Hawkins, claitnjd as a fugitive slave by William M. Iiis i lean, of Baltimo& oounty, Md., a hearing i "
719,1626,1851-05-03-seq-2.txt,"guilty ill legal parlance of "" counselling to run a\v:iy,:l and sentenced ns follows?Austin, the slave of Mrs. Allen, and Asa, the slave of T E. Owen, "
721,1628,1851-05-03-seq-2.txt,"each to receive one hundred and fifty laBlies and leave the State; and Tally, the slave of John White, to rcceive twenty-five lashes, and bo diecharged. "
722,1632,1858-04-15-seq-3.txt,"riet, his wife, > Hill for Specific vs. ) delivery of slave. Elijah Cannon, R. M. ) "
724,1636,1861-06-28-seq-2.txt,"waged under any circumstances, for the pur pose of emancipating the slaves iu the South ern slave olding States. "
726,1641,1859-09-15-seq-2.txt,"Democratic' eon vein ir>ns*linve endorsed the doctrue of re opening the slave trade, luakm^ a <rtj?lrttion in iu> favor a part of tfifii* platform. j "
727,1643,1858-01-14-seq-2.txt,lilR-rence in tlio apprentice system und tliut of lie unrestricted slave trallic. These apprentices ire captured by African chiefs and sold as npirenlices 
728,1644,1858-01-14-seq-2.txt,"for a limited time, against their consent, l'liey are thus forced into (slavery iu its mo?t nn:;ial form. But to the extract: "
729,1645,1858-01-14-seq-2.txt,"lc'57, we ore advised that the French have prac ically engaged in the slave trade under the name of upjireiitiers, and t hat a ship, the ""Clara,"" "
730,1646,1858-01-14-seq-2.txt,lo ported her. The English are also using nejwes as slaves at Sierra Leone. The Freach and English Ciovernments are participating in a trade 
731,1647,1858-01-14-seq-2.txt,"has been built by tin; French at Lonngo, to lie Used for the safe keeping of the slaves until Llicy are ready for shipment. There is no secret in "
732,1648,1858-01-14-seq-2.txt,"Mr. Seward presented a petition from citizens ^ of New York, for the extinction of slavery by remunerating their owners, which was laid 011 Uie ' "
733,1657,1858-04-22-seq-1.txt,""" at Washington, remarks that tho ill feeling between theslaveholding and non slavehold'n ing sections of the Union, which has been "
734,1660,1858-05-06-seq-1.txt,ho following manner: ;* A oertaih slavo'had olHairiotf >f the Babtists to preach. He was hoMiofV 
735,1662,1851-06-07-seq-3.txt,ether reason why the Patriot should bo eaconrageed : it stimulates the largest slaveholder to ran ont of the State and promote* a tliin population. It 
736,1663,1851-06-07-seq-3.txt,"i? Ui lM$WHty Q^ rtiiogg,. Ue believed that ' the fugitive slave law would be replied by thugfextCongreas, and a new programme of j "
737,1667,1863-12-11-seq-2.txt,"a bill to provido f?*r tho efficient direction ; i and management of slave labor foragricul! tural purposes; also, introduced (he follow- ' "
738,1669,1858-01-28-seq-4.txt,"lln? I nioii, was tin1 niii'viisiii^ :m*I laiicormi ho*tiiitv nf tin' I'tifiuif.s ?il slavnv l?> tlia institution. Tin' niciiai'i's of tin.' Abolition "
739,1670,1858-01-28-seq-4.txt,"wore at last alarmed hy tin- aspect of adairs Ami the anti slavery fanatics betrayed a < gree of confidence ;iti?l coinage, which tin "
740,1671,1858-01-28-seq-4.txt,"of liis cause. Such a man must neeessarih be nhove suspicion in tin: slave States, am free from all ?Ii-ti list <>t"" his nationality ii "
741,1672,1858-01-28-seq-4.txt,"inimical to cither section?not to he in I'avm of forcing .slavery upon any people, imr re luctanl lo maintain il against either tin "
742,1673,1858-01-28-seq-4.txt,"when they arc prepared to apply for admis sion into the Union, they will accept slave ry or reject it. Such was his impartial position "
743,1674,1858-01-28-seq-4.txt,Was elected to protect the South h}- interpo? iirtg the constitution between slavery and it a^sjiilartta ; and we appeal to the Southeri 
744,1675,1858-01-28-seq-4.txt,"># * . \ domestic and* political relations between tl free and slave States, The South loo] southward for the expansion of lier instil "
745,1682,1859-04-07-seq-2.txt,"rlilion of What, is called iln* A|>pie.'liei'Khi|> i\ stein, hut. is in reality ftlnv.-iy and the slave ; si mile in disguise, is one of I,-ill is Napoleon's . < "
746,1684,1856-09-04-seq-4.txt,"Soda and SalarattiRenough to raise it again, and ' ;;et up a slavery excitement, Cigars enough (iret out of the way, Vesuvius, they're right after "
747,1686,1857-07-23-seq-4.txt,"crowd down upon tho border Southern States, to harass tho slaveholder, and to drive out tho institution of slavery before "
748,1687,1857-07-23-seq-4.txt,"region, where the white man cannbt labor.. The slaveholder is to bo dispossessed of the hemp-fields of Kansas. Missouri is to be "
749,1688,1857-07-23-seq-4.txt,"of life. For these she is commercially dependent upon tho slave labor of other countries, who make profit out of her need, and "
750,1689,1857-07-23-seq-4.txt,"It has been the effort of her statesmen to : undermine African slaver}', against which ' she is committed, and to substitute in her j "
751,1690,1857-07-23-seq-4.txt,"system of Coolies or Africans. ""Willi the : downfall of African slavery in the tropical countries of America, and the introduction j "
752,1691,1857-07-23-seq-4.txt,"have long and pcrsistcutl3' exerted ever}- effort to cut oft', hem in and uproot slavery. They have bullied Urazil, dictated the policy "
753,1692,1857-07-23-seq-4.txt,"to the strictly tropical regions, tho slave interest subservient to the direction of of a master section, the North might live "
755,1696,1857-07-23-seq-4.txt,platform nn<l purposes of tho Krwe State party of Katun* in opposition to tho ptoslavery party in oecnpation of tho do laclo 
756,1697,1857-07-23-seq-4.txt,"(JoDuress?one of them the work- of nm slavery filibusters, the bona Jidc settlers of Kansas. And, furthermore, the latter will "
757,1708,1857-11-05-seq-2.txt,"York Tribune, who plies his pen so often and s I eloquently against shivery nixl slave institution! s iys in a lato number of his paper, that by th "
758,1710,1860-12-07-seq-1.txt,GeilM a! AssHllill! V- llifl'l'lifia llm PmFi.rl.nr 'o Communicate to hII ihrt slavehoidinj^ Males certain res- lions adopted tiriani 
759,1711,1860-12-07-seq-1.txt,"of this State at the last regular session, expressing the opinion that the slaveholding Slates should immediately meet "
760,1712,1860-12-07-seq-1.txt,"nf room ; auJ f.ir llif srtm?? reason. male slaves from our uwu Slate eouiil not be letfivcil, "
761,1713,1860-12-07-seq-1.txt,"j'.V.its""; tin* o?rlii*iili;r in*ualty, 1 wimM r?i? roiiitiii-oil thsit Imili the owner of lilt* slave aad the party that liiieshim or her, bh*>nld "
762,1714,1860-12-07-seq-1.txt,law on the suljoct. li not. unfr(-?ju>-ir!y happens thai slave mechanics hire while men to work under 
763,1715,1860-12-07-seq-1.txt,"did; t Tint' introJuulion of slaved from otho f States, wlmlj may not become tn<Mnbcr? o "
764,1716,1860-12-07-seq-1.txt,"J urtit-n with the iion?Javeholdiiig Siald-, le ; Hhern ke? p th*ir slave properly in-lheir borders, him! the only nH'Tiinuvv K-fl then "
765,1717,1860-12-07-seq-1.txt,"x emlmrrHiahig situation, by permitting then to realize the rpon^y vulue for their slave) t by selling thew tou*, aud ibu* prepay .their "
766,1718,1860-12-07-seq-1.txt,"aoy wnv attempts to ereil iiisiilior.iiiiation IdWhiilirriM'iiriii among the slaver. If soine iftt of this k'lid is not pH^Kfil, this people, "
767,1721,1860-12-07-seq-1.txt,"ms equals in carrying our slaves to be any teriitory belonging to the United S'ates, and having protection by "
768,1722,1860-12-07-seq-1.txt,to pr-'toot lis against tho fanaticism ot' tho North. 1 be institution of slavery must bo under the exclusive control of those directly 
769,1723,1860-12-07-seq-1.txt,"cost, and find nothing so intolerable as voluntary slavery,' and that we are not to l e dfctern d ftom thn assertion and main* "
770,1738,1859-03-17-seq-2.txt,"in demanding. Ah my notde fiietul Iiiim stulnl, I fhi* firni'tici' ivf visit in* till sliijis (theslave irudi1 1iAviiii( mvseh inertascd in consequence of the i "
771,1739,1859-03-17-seq-2.txt,"show <>ar ?_ ? *!Ii lettc* ill ilieiti, mid rely upon t their ii ii ii i n^r wrli us to |iul a st..|> in the slave trade. The American t invet iiliienl. Weill us lar "
772,1740,1859-03-17-seq-2.txt,"point of fact, rc.nl-reii tlu in nulisposrii to nut us j in our etulcavofs to jntl i.'owu the slave traili? ! [hear, lie.if. ] '1'hc hest proof, my lonls, that 1 ; "
773,1741,1859-03-17-seq-2.txt,"wall ilie I'nilcd stales, ami which hinds lis Willi ' i a view lo ihc suppression of the slave tra.lc, to j have eighty guiis on the Wef t Coast of Afi'cii, ! "
774,1742,1859-03-17-seq-2.txt,"of the United Suites has, moreover, intimated that iiiasinuch as tlie slave trade ou the coast of ! Culia continues to increase, it is its intention to . ' "
775,1743,1859-03-17-seq-2.txt,"desi crnt ion >! I In: American Hag in the prosecution of the slave trade, mid no language, i am hnpjiy to -.ay. <; u|.) he .stronger than that "
776,1744,1859-03-17-seq-2.txt,"fcl'cnee ?ii the pari of the Stale lower#; an that the fugitive .slave act U'lis deafly con.slit i tional. I Ius is, of I'luiife, a mere oiillun' of tl "
777,1745,1859-03-17-seq-2.txt,"j whether it he to search for seamen, look- fur r slaves, eXi.miiie cnr?o or merely to verify the e 1 nit t ion si I it y <>!' the vessels, is equally oliji-etionable, c "
778,1755,1858-03-18-seq-2.txt,"i and give* the despotic provision of the act in rei gard lo the rendition of fugitive slaves. It pro! videa thai the assessors of each parish shall, at "
779,1756,1858-03-18-seq-2.txt,"Sulr nf Ki i/rofx in jlfixshxiit/il.?The Ox fori Icrcill-y mentions two sales of slaves which re cully look place in Lafayette, at which on "
780,1757,1858-03-18-seq-2.txt,"hnse ilie public mind relative to ils views oi le slavery question, nntl claiming to occupy con rvative grounds. "
781,1763,1859-01-13-seq-2.txt,"it IS a no! i.-nalde fa>:t ill this etnni, that (a ill Tn.vtiseml, ?'| J!?.- slave:- M.-hn, is a Khnilc I1: t > I * 1 ill in, | lii; lln.- >""ii nl' ?| a ndsoti "
782,1765,1863-05-08-seq-2.txt,", J For the | o iee and management . i slaves there shad be cxeir.nt. d one pti> I i on ineii I.it 1:1 or plantation, tl.e so'e pro "
783,1768,1863-12-18-seq-2.txt,"openly for the Union. Of those who were slaves at the beginning of the rebellion 100,000 are now in Unitod States "
784,1769,1863-12-18-seq-2.txt,"attempt to rotract the Emancipation Proclamation, nor to return slavery, <Sco., dcc, Charleston, Dec. 11.?The enemy "
785,1773,1865-10-19-seq-1.txt,"the principnl of which was an acquies cence in the nholi'ioa of slavery, which had been accomplished hy the military authorities. "
786,1774,1865-10-19-seq-1.txt,"State CouMitut?>n. recognized the al>nlition of . slavery hud pvohibiie i iti re-eat atdiehmeut, lly repealing thai of Sftfesaioij, th'e Ordinance "
787,1775,1865-10-19-seq-1.txt,"it. Wluu we wer?.in the Union, they abased us on account of slavery. They waged ?war upon us because wq tried to separate from "
788,1776,1865-10-19-seq-1.txt,"them, and now that we propose to returq with out slavery, They still object' In this emergency, the State needs tbv a*?istanoe of all bar "
789,1781,1857-10-01-seq-4.txt,"cannot. Let slavery in the South alone; it is none , of our business; but show the villainy of j "
790,1782,1857-10-01-seq-4.txt,"better off thin day than were their fathers when slaves?in faot they hold the same t relative position, without tlife benefits nccru- s "
791,1783,1857-10-01-seq-4.txt,"relative position, without tlife benefits nccru- s ing to tliera when slave#. They were so comparatively, that the acts of emnncitation "
792,1784,1857-10-01-seq-4.txt,become as loathsome as Mormonism. Tii<; evils of slavery are nothing compar- ' ed with the evils of negroism. Abolish . 
793,1785,1857-10-01-seq-4.txt,"ed with the evils of negroism. Abolish . slavery to-morrow, and negroism would loom up before the American people as no "
794,1786,1857-10-01-seq-4.txt,"practical <juest ion ever yet did. We should lio compelled to exterminate or rc-cnslavo j them, or the hopes of the English Reviewer | "
795,1787,1857-10-01-seq-4.txt,Look at the dress of the women. Enslaved by tyrannical fashions imported from the central city of immorality and 
796,1796,1859-11-17-seq-2.txt,"the Union in ilio almost iiukrok>-n tccnpniioii of the nnti slavery rcpnhlieati pinty, mid tlie indispensable ontherti section 1:1 the niiiwt ah "
797,1797,1859-11-17-seq-2.txt,"oonilict, limited to ilit> iinti-slu vi t y < :U6 i<l<-is of iho North and the pro slaveiy rliivulry of th?South, can end in mux tliinu (>ut the ie?ohiiionnry "
798,1798,1859-11-17-seq-2.txt,of '.ho Charleston Convent on will 1 >? s? decidedly pro-slavery :?* t? ftiinidi the cue to tho I'i'litllilicniiK as mi ami slavery partv. and 
800,1800,1859-11-17-seq-2.txt,"would be the oveiwhehninij defeat. i>f tiie Southern pro-slavery democracy.?A'. Y. JJtralJ S)//i. From Mexico.?Th>* Tenn^sse*, at Jfew Ortenon, "
801,1801,1859-11-17-seq-2.txt,"J'ickcna C'tmricr. * a Exenit'd ?Wo learn that Dan, n slave. the property of Alviu Mac-ev, which we noiio-d ia u "
802,1802,1859-11-17-seq-2.txt,"watchini! a e'lmic;' to pounce on Sye? d Madjeil I suppose. The captain of the slave nllip was l SpaniHid, nml hoisted American colors whet "
803,1810,1859-08-04-seq-2.txt,of chot-ing a master and being told into slavery. Thia is the main feature of the remedy he proposed by which tlm country conld be rid 
804,1811,1859-08-04-seq-2.txt,"Antrio J*nxon noliiliiy sold their servants as slaves to torcigm-is. The I\ntti?nese fust imported negro slaws, from Western Af'iea into "
805,1812,1859-08-04-seq-2.txt,"was iliscovi-red, tin- Indians of Itispatiiola wero ,, inipoili>il into Spain, iilnl made slaves. The L Spaniards visited tin* const. of North America j, "
806,1813,1859-08-04-seq-2.txt,crated with their negroes. A r?jnl edict of | Spain unlhorizi'il tie-in slavery in America in ( ISIS. Kinir Fercimtnd himself sent from Se- j 
807,1814,1859-08-04-seq-2.txt,"vi:ii* iiiiy MiiV'-s lo innor in the tunics. In 1031, | j, the direct trullic in slaves between Africa and j 11 isi>auiula was enjoined l>v a royal ordinance. "
808,1815,1859-08-04-seq-2.txt,8ir John Hawkins was the fust Kii irishman j that engaged ill the slave Irin'e. In 1 IJ.V.J a lie transported a large cargo of Africans lo | 
809,1816,1859-08-04-seq-2.txt,"of Boston. and Tliomns Keyset"", first brought t the colonies to participate in slavery. In 1054 , they imported a cargo of negroes. Thionghout J "
810,1817,1859-08-04-seq-2.txt,"expense. At a later period, there were both ? Indian mid negro slaves in Massachusetts. In ? a Dutch ship entered James Ilivt-r, nn?l "
811,1818,1859-08-04-seq-2.txt,For ninny years the Dutch ware principally con- ?. cerneil in the slave trade in the market of Vir- t Kinia. ( 
812,1819,1859-08-04-seq-2.txt,"seined l>y iho North. By some revolutionary movement, the slave States could not prevent the adoption of a northern platform. Under { "
813,1820,1859-08-04-seq-2.txt,"\lrica, but take ii on board the Experiment at ea. from a slaver direct from that const; at an) ate, the bird* had flown before they got there "
814,1821,1859-08-04-seq-2.txt,"9 Territorial Legislature tuny rightful exclude f slavery by "" non-action'' and by "" unfriendly leinslutioii."" We admit that ulnverv "
815,1822,1859-08-04-seq-2.txt,"> ua with it. We know very well thnt slavery cannot exist i in a Territory without luws to protect it, and "
816,1823,1859-08-04-seq-2.txt,"Supreme Court, embodied in ihe Dred Scott dei cision, that "" tlie only power over slavery conferred on Congress hy the Constitution is tho "
817,1842,1857-06-04-seq-1.txt,"* * I ,Lifl prison or in the hold of the slave ship so-that be cannot exercise, soon goes raving "
818,1843,1857-06-04-seq-1.txt,"know the workwomen are well paid, well fed, well treated ; there is no slavery .there.' Yet one day last November the house was "
819,1844,1857-06-04-seq-1.txt,"to Mrs. Beecher Stoge as the thorn in the side of slavery, and fall down and worship Bishop Lawnsleeves as the recreator "
820,1845,1857-06-04-seq-1.txt,"over-work, and tfie po6r girls serewd down [ to a needle-antffthread slavery that-flesh aud blood revolt at ? Th?? house stops.? "
821,1850,1856-03-06-seq-2.txt,"j lias a triple design : first, to supply the ^ol t South; secondly, to turn the minds of slave- 1 r holders agaiust slavery ; thirdly, to limit the D'u "
823,1854,1859-12-01-seq-2.txt,"by the Republican party of the agitation of slavery as a principle, and their dele rminaiioii to urge upon that question an "" irrepressible"" "
824,1855,1859-12-01-seq-2.txt,"of the 24th inst., and were caught using certain incendiary language lo a slave, and endeavoring I to excite hun to insurrection, by expressing a "
825,1856,1859-12-01-seq-2.txt,"they endeavor to dulect any illicit traffic w itli slaves. On Jfotion, Iictolved that the proceedings of "
826,1857,1859-12-01-seq-2.txt,"Mr. Huegins, Professor of Pennmanship, vak sent for 3 year#, on a charge of writing a slave a free pa*s and attempting to run him off on ttic "
827,1858,1859-12-01-seq-2.txt,"(Mo.) Omntte nays "" Durjug.isgt week over one hundrjtyl' slaves, from Lewis, .Clark and Scotland countfea, have passed dowu on boats, "
828,1859,1859-12-01-seq-2.txt,"dealer* are traveliag through alt the counties of North Missouri, buying up the slaves rapidly, at high pries*, to be sold again in the South, where "
829,1860,1859-12-01-seq-2.txt,"climate. At dfe present rate of deorea^d' it will not be long before slavery, Only to ? small *tenl, *1}1 become eglinft in Miaaourt "
830,1861,1859-12-01-seq-2.txt,"not the end of it; uo reflecting mind can sup- , pose so. Ou Iho contrary, do not tho antislavery lecturers, editors, and preachers, daily , "
831,1862,1859-12-01-seq-2.txt,Wigfall as their candidate lor the United States Seimtnrship. He is opposdu to the slave trude statutes. 
832,1875,1859-03-24-seq-2.txt,"which even this fast generation has yet !>* held. At a tunc when the slavery issue has ^ swallowed up all other*, when in truth nil politics "
833,1876,1859-03-24-seq-2.txt,"take possession of the government. To effect H( this result the slavery <|iiesliou is to tie "" _ "" *H ' II "
834,1877,1859-03-24-seq-2.txt,"North am) the South must go on, until the < N^rth is all pm-sluvcly or all anti-slavery. For . more than a quarter of a century thev hnve 1 "
835,1878,1859-03-24-seq-2.txt,lieen steadily advancing lo the accomplishment l' of their purposes. Anti-slavery agitation has tl overwhelmed one grent. national organization 
836,1879,1859-03-24-seq-2.txt,"plunder, shall stand shoulder to shoulder in a o glorious st ruggle for place and pay ? Is untislavery agitation lo cease ? Nobody expects it. . "
837,1880,1859-03-24-seq-2.txt,"last three Presidents have come from the It deno lh, it is only fair that the next should come slave thai 1 the South. The rceent votes and speeches tnnn. IV "
838,1881,1859-03-24-seq-2.txt,">!iens. and we need |nuk fur no more e.onclii- '""K attestation of liis iiipHLi limn lln< iinivcriiiil slaves tun ct whicli follows him into retirement. As it human tr "
839,1882,1859-03-24-seq-2.txt,"uhouse of the St<Uo J<egislaturo on Wed- ' '*^lori lay last. The Democracy and the slave- Chinese c ers have met the rising fueling and cncoun- can ships, "
840,1883,1859-03-24-seq-2.txt,"e been transported from the State, shall re- who surel; , lie shall be reduced to slavery. All free writes as I OS who may he residents of the State in while rem "
841,1884,1859-03-24-seq-2.txt,"may select a mnster or mistress in the State, markably r which he is to be regarded as a slave.? now ^ Y. Commercial of God ; I "
842,1885,1859-03-24-seq-2.txt,"p undetected.? Carolinian, S.'t){/? in.it. r in /V- ir Mcj-ico.?Negro slavery is fidized and property i*i slaves amply proii "
844,1887,1859-03-24-seq-2.txt,"Lin visited on the homicide of a white >r stealing or enticing away n slave, the > not less than four years imprisonment, "
845,1888,1859-03-24-seq-2.txt,"I'd as principals. Any person frnudunishing slaves free papers, is liable to riinnt'iil of not less than sis months nor "
846,1889,1859-03-24-seq-2.txt,"i* penally is denounced on whoever, savo r, (rives, sells,or hires to a slave n deadii ; mid alio, the same for trndinir withrilteii "
847,1890,1859-03-24-seq-2.txt,"of Irallie; also, the same for Ibra permit, (. uiiiini' with slaves is pronler a penally of not. over $100 or three "
848,1891,1859-03-24-seq-2.txt,"inprisonmeiil. Sheriffs are to take ensiiuaway slaves : and in twelve mouths, ief appear nftcr an ndvei:t.isemeiit for "
849,1892,1859-03-24-seq-2.txt,"y lie rt<[uirnl to give bond to do it. In raiment <?f ii slave is punished liy a line tli ii it $l,l)irt) and imprisonment of "
850,1893,1859-03-24-seq-2.txt,th-ui 011c year. Slave uwncm are pro( in allowing tiii'ir slaves to 11ire tlicir Disorderly conduct of n slave in puhsoleiicc 
852,1895,1859-03-24-seq-2.txt,"f ii si.iv.-, the punishment of which I'ora li Would bo a fine. Ni> slave cau }{i Ve against a white man. "
853,1896,1859-03-24-seq-2.txt,"Kma?li:ipation is prohibited. A Mini; a free nejmi as a slave, is liable to ihmiI for not less than live nor more than "
854,1897,1859-03-24-seq-2.txt,"i net. limy lie regarded as very anflieientiziui? not: ro slavery in New Mexico. It table, however, that nny benefit will he "
855,1898,1859-03-24-seq-2.txt,"teiii|<orary residents goint; in from d Slates?who may use slaves us domesIh. l'olilicullv, slave owners have liilliutany "
857,1900,1859-03-24-seq-2.txt,lliem there. The present net simply undeniable leixal recognition to slave liele.??S7. J.ouis Itrjm/jiieun. 
858,1901,1859-03-24-seq-2.txt,wilbhiii the laws fur the Mi|>f the slave trade. The Attorney Genua Hint it docs not come within said 
859,1902,1859-03-24-seq-2.txt,"tain Rynders, made the speeches. Senal Brown Assumed ultra pro-slavery ground, S Coehranc argued the question mainly from "
