,date,context
1469,1850-11-09-seq-1.txt,"spoiler."" ""Thou shalt not deliver unto his muster tho servant which is escuped from bis muster unto thee, llu shall dwell with thee "
1473,1850-07-13-seq-3.txt,"most persuaded to take Jho poor thing himself and keep it for a servant till of ago, then lot it go, and ho almost doubts my sanity when I tell "
1475,1856-07-12-seq-1.txt,"d, r to In o Ihem.tl srcf. re the merely legal relation i j,m 0r siayelioliler. io teach their servants to rend ! llip woril of God: to allow- rbem tn nttrmil lti ,ntw "
1478,1860-06-16-seq-1.txt,'sides.' thi Northern bouskeeper labors under disadvantage of being unable to procure servants and sugar at tbe same establishment; but it seems 
1481,1854-07-29-seq-3.txt,"with her long lust husband in 111 at other hind, w hero the servant is freed from his mauler, nnd w hero nil tears are forever wiped from tlioir eyes. "
1483,1857-10-10-seq-1.txt,not Bpenk a singlo word of the beautiful language ot Cervantes. Jlow long tins stato of things will last is hard to tell. Tho authorities in nil cases 
1484,1856-08-09-seq-1.txt,"ed by the governor and other distinguished gentle men, whirh gave their servants permission to at tend n Sunday school. This instrument reeogni-1 "
1487,1851-08-09-seq-4.txt,"Soil Party; hut it will be truly A Free Paper, nnd not tho bondservant of nnyenuse, or party, except thut of Freedom, Truth, and "
1490,1851-06-14-seq-4.txt,"Soil, Party; but it will bo truly A Free Paper, and not the bondservant of anycaiise, or party, except that of Freedom, Truth, and "
1493,1850-11-16-seq-4.txt,"bad arisen lrom our hearts. "" And now. Lord, let thy servants depart in peace ; for our eyes uuve seen thy salvation."" "
1496,1856-12-06-seq-1.txt,"I did not thon know that it was a final one. Tho servants were all sold, as I heard one man sny. at very high niten, though not under the auc "
1497,1856-12-06-seq-1.txt,"blow. One by ono the servants, old and young, gave ine a hearty shake of the hand as I passed the "
1498,1856-12-06-seq-1.txt,"ing now could be a trial yet I was touched when the servants offered mo little mementoes and keep sakes. Ono gave a yard of ribbon, nnnther a ha'.f "
1505,1850-12-07-seq-3.txt,"while you will forbear to kick vi your most devoted mid humble servants quilt to hard, fol we can't benr it."" "
1508,1857-05-09-seq-2.txt,"In'Virginia, in 10S2, it wa declared by statute . mat an servants urougni into tne country, wnetner , negroes, moors, mulattoes or Indian, not being. "
1511,1857-10-31-seq-1.txt,"tho Wilmington and Manchester Bailroad. He was the owner of only three servants ; was said to lit of ""good disposition,"" nnd said he would "
1512,1857-10-31-seq-1.txt,"as ""a very kind nnd tender hearted woman to her servants. If I was sick she would treat the samo as if she was my mother,"" said llich "
1517,1856-01-19-seq-3.txt,"e People. Without rosponsibility.consf.nlly exact ed and -vigorously enforced, tlie servants of the People nre but too (ipt to becnnio their masters. "
1519,1856-01-19-seq-3.txt,"jy tho fundamental law ; and tho responsibility of public servant! is socurcu ny tuc partition oi a ernmental powers, by strict limitations of authority, "
1522,1853-11-19-seq-1.txt,"' It is proper for us to mention, that Mr. Fee had employed Maria as a servant for some time prior to this occurrence. lie hud rendered frequent assist "
1524,1858-04-10-seq-4.txt,"Mo your Aiients fur hull County, are making frum f 8 to $25 per day, and your humble servant ha m de. since the seventh day nf last January, "
1526,1857-06-13-seq-1.txt,"recorded in Genesis that ""God greatly blessod the master, with silver, aud gold, and men-servants and maid-sorvatits"". "
1529,1860-07-28-seq-2.txt,"paid fur his purchase. The mcrchnnt knowing Napper to be a faithful nnd honost servant, rtcCe ded to his wishes, anil purchnsed him from his "
1531,1852-07-10-seq-2.txt,"sonal courtesies, I huvc the honor to remnin, sir, with great esteem, your most nhediont servant, WINFIELD SCOTT. "
1533,1857-09-05-seq-2.txt,"not equully proper to assert those of the drayman, farmers and laborers; household servants, and oth ers? If the slavos crowd out free carpeuters and "
1535,1857-09-05-seq-2.txt,"The Lynchburg Virginian says Anthony is a very valuable servant, about thirty-two years of age, and is said to be one of the best farmers in "
1538,1859-10-22-seq-2.txt,"him to an unkind worl."" A ripe scholar a pro-J found lawyer a faithful servant of hi. client a gentleman. Thi. is a good record solely. May I "
1540,1858-06-26-seq-2.txt,"guid mother sat listlessly by, indifferent to the child, its father, or the servant. 1 spoke to the gentleman, ""That is a fine girl, of yours."" ""Yes "
1542,1853-03-12-seq-4.txt,"lo oiler smaller rewards, and to leave many good servants, well deserving of rewind, altogether without any. The speaker ad "
1543,1853-03-12-seq-4.txt,"the man a sort ol rural police or orderly who culled out the servants, and who showed them to their scats after they had received "
1544,1853-03-12-seq-4.txt,"lent schools tor poor children, and their excel lent institutions for old servants. People do not build inuuixitivn tower in Ihe cnchiiiiliui; "
1548,1853-03-12-seq-4.txt,"nfter him came a Mutely Indy und two gen- Ik-men, with three servant billowing. All were dressed in black, all rode upon brown "
1553,1851-05-03-seq-4.txt,"discusMiig tho very subject themselves upon their datiiubk lounges, when ihu servant en tered und presented the semstress' bill. "
1555,1852-12-04-seq-3.txt,"will timl n kind-hearted, gcnllemai.ly landloid, clerk nnd servants, with in hypocritical clatter of plates, cut., but a well furnished lab'.o nnd "
1558,1851-04-05-seq-4.txt,"Soil Parti; but it will lie truly A Fseb Paper, and not the bondservant of nnycuuse. or party, except that of Freedom, Truth, and "
1561,1855-06-09-seq-2.txt,"stint rf kidnappers. Xtti. why shooli'at they Jiave tkeir rewarOJ W ByAWd they sot have ""servants"" sKrwe tlirm, ad Sjod urn -dilut es J U bat "
1562,1855-06-09-seq-2.txt,"ado over tho conversion of tho heathen in China and lliniioostnn r -servants ana nno carriages art comfortable ; ""ripe strawberries, green peas, "
1564,1855-06-09-seq-2.txt,"sKrwe tlirm, ad Sjod urn -dilut es J U bat tlxic taut these saw) servant rvbbcJef t'oeif rigltia, ia order tbt their oh a-! "
1565,1855-06-09-seq-2.txt,"J tTirirt Jt iefc ujs tiiih!f The It-no a servant, and may now to wearing tliit'form in the V-erson of some heart broken disciple, who is "
1571,1856-04-05-seq-2.txt,"wo, before God, cowardly sneak off, and like un profitable servants, basely surrender this guardian ship, because vain, self-righteous intormeddlers, "
1574,1857-08-22-seq-1.txt,"in which they are wont to congregate, and where they are but servants, and should scatter them selves over the country in.tho capacity of farmers "
1577,1852-08-14-seq-4.txt,"owners nre kind-hearled nml amiable in the highest degree, ond that their servants have the strongest attachment for then). Al tho "
1580,1860-06-02-seq-2.txt,"sas, in construing the personal relation between master and servant to involve an unqualified prop erty in persons, in its attempted enforcement "
1581,1860-06-02-seq-2.txt,"I am, sincerely and respeotfully, Your friend and obedient servant, WILLIAM H. SEWARD "
1584,1860-04-07-seq-2.txt,"old lady is evlderJtly 'hard up,' financially, an attempts to frighten her foroier servant into th payment ot $i,uuu as 'nusn money.' we imag "
1586,1852-07-31-seq-1.txt,1 huvo tho honor to bo Jour friend und obedient servant C. M. t'LAT. O. Ilaittt tUij. 
1588,1856-05-03-seq-2.txt,"blo that tho people as electors, and tho senators and reprosectativcs as .their servants, nnd every court appointed by them from tho highest to the "
1590,1856-05-03-seq-2.txt,"and the land that it teas pleasant; and lowed his shoulder to lear and became a servant unto tri bute."" Jubt so, do our people for the sake of rest "
1593,1858-12-18-seq-3.txt,"exhorted from the pulpit tho wives and childred of frcemasens to quit thorn, and servants to donounc thorn. "
1595,1858-12-18-seq-3.txt,"child of a Jewish family in Italy, where- a Catholic servant girl was employed, on the occasion of tho child s hickness, was sprinkled oy the girl, in ac "
1598,1851-07-19-seq-2.txt,system of peon servitude by ' defining' the re lations between master and servant. Perhaps they may have a fancy for extending it also. 
1600,1854-10-21-seq-2.txt,"out and taken with him ""several of his old family servants."" Of course this is guarantee enough for the South that their rlghls of slaveholding will re. "
1601,1854-10-21-seq-2.txt,"lying nature of slavery. Ho has taken his ""old fam ily servants, ' as though it wns only from huiv.Tinity and personal attachment that this family property "
1606,1851-08-02-seq-2.txt,"town, every municipality, has a right to mako regulations respecting their peons or servants. And perhaps thcro may bo half a dozen differ "
1609,1850-08-03-seq-4.txt,"could take, neatness wss the ruling passion of tbo household. Their only servant, Mi nerva, (the Uoddcss of Wisdom should have "
1610,1850-08-03-seq-4.txt,"On Rabelais, Voltaire, Rousseau, .Licsago, and quaint Cervantes. But if my voice might claim for one "
1612,1855-06-16-seq-4.txt,"inarvo'i, It is this spirit which makes poverty the I'Cst servant to the ideal ol human nature. 1 an. content with this typo, and will only quote in ad "
1614,1850-03-09-seq-3.txt,"propriato to the slave, such cs 1'aul'a injunction to servant to ha obedient to their masters, the injunction to the Jews, to "" chooso bondinen "
1615,1850-03-09-seq-3.txt,"almost LMii m ulv tried to inainuato that their servant wcTc'TaTybt to rea:l tho iillc, but when they woro closely questioned they had to nc' "
1618,1857-10-31-seq-3.txt,"chattels, and last week, discovered certain suspi cioqs movements in a house servant, concluding that he was about takins passage on the ""Under "
1620,1858-10-09-seq-3.txt,liis constituents that he is for and with tho l'cmoa Tacy so long as it is tho hum! lo servant of tho slaveholders it is at presont. llo is with uud fur 
1622,1850-08-24-seq-2.txt,"Durinir this opcrntion the Inmates of the carriage, two servant-men belonging to the Don. it Toombs nnd the Hon. A. Stephens, "
1624,1850-12-07-seq-1.txt,"in mussuchuselts this accursed Bill has found no servants. Cheers. ""Sire, I have found in Bayonne honest citizens and brave soldiers "
1626,1850-12-07-seq-1.txt,"thoreby bo made, miserable Why deprive the i faithful and devoted servant of the benefits of ' ' thnt delightful institution which makes thepeo- "" ""v "
1629,1856-11-29-seq-1.txt,"Soon after I heard some one inquire for me, and the landlady sent a servant to my door to say that a gentleman wished to see me. On learning that "
1631,1857-05-16-seq-4.txt,"' Ln, we bring into bondage nur sons nnd daugh ters to be servants; neither is it in uur power to redeem them ; lor other men huve our lands,"" "
1634,1860-10-13-seq-4.txt,'who had been thus in service for six months might be appropriated as bond-servants. later date the Empress Catherino laid 
1637,1860-06-16-seq-2.txt,"instead of being brutal, would be only tbe faith ful servant oi the Northern thermometer. My deduction from this is tantamount to what "
1639,1860-10-20-seq-2.txt,"tionate relation existing between the master and. bis servant, 'ihe powers that be"" know that they arc surrounded by a dangerous population, whioh' "
1641,1857-10-10-seq-2.txt,"Now, if there is (in h a thing ns political soy rcignty, it cannot reside with the mere servants tho people, the source of all power, but it must "
1644,1857-08-08-seq-4.txt,"ing lesions of truth, purity, oud holiness.all traced In glowing oolors, and to the observant eye of the thoughtful student of Nature, seom as it were "
1646,1852-11-13-seq-1.txt,". r "" Your servant for Christ's itike,"" , The Hon. Ciunt.i s StviNEn, . - ., "
1647,1852-11-13-seq-1.txt,"I ken ii, b t bim die, nnd let ull the rest bp slaves to your bud."" ""No"" said thu servant, "" 1 "" l"" has taken tliu cup shut! not bu "
1648,1852-11-13-seq-1.txt,"lie: o'.bcrs ahull not be start. On the Hllli page. The servant said to lienjamin, ""you mu.-! couii; back with mo to my lord. Ilo "
1652,1850-02-09-seq-4.txt,"anid, tor tho residence of his friend, l'rince Futcrno, leuving one ot Ins servants with of his baggauu at the locnudn, puniosuiir "
1653,1850-02-09-seq-4.txt,"Soon alter my ciuhiiliiiient wiih my host, my servant retiu iied li oiu tho locuudu, and congr.itiilateil n iu on my .'ood ipiai ters, more "
1654,1850-02-09-seq-4.txt,"arrangements."" My servant then went on to itiirrnto wonder ot the host when ubout to prepnre "
1659,1855-06-23-seq-4.txt,"traveling costume, just come home, jaded and dirty, and enquiring of his servant.) ""Well, John, rave 1 been wuntod at all during my ah "
1660,1855-06-23-seq-4.txt,"leaf. Puliuersoii is looking out of tho window. Puuch has Lord John as a servant who has becu absent on au errand ver so long, and who has re "
1663,1851-02-08-seq-3.txt,hit wifo (the latter disguised at a man and the former acting as her servant) before a large au dience in Edinburgh Deo. 80th. Wm. W. 
1665,1851-05-24-seq-1.txt,prudent relaxation on the part of govern ment. If the king's servants will not permit constitutional question to be decided on ac 
1668,1857-10-10-seq-3.txt,"yours ago, and as the Zion's Advocato says, is their servant pecuniarily ns well as tqiiritual ly."" They allow him a salary of from $600 "
1670,1851-11-29-seq-4.txt,"put to usury, ot he obuoctioiis lo the ten- alty of the unprofitable servant, who hid li lra taletil in Hie earth. Whether her ln I "
1672,1856-12-06-seq-2.txt,"of this unnatural Union of iree and slave States; but, while professing to be friends and servants a cause which loves tho light and courts investiga "
1675,1852-05-01-seq-1.txt,"coppersmith, one blacksmith, several field bauds ami bouse servants, beside somo twenty little boy nnd girls of different nges, "
1678,1857-08-29-seq-4.txt,nooonfusioo of identity. So should it be with our servants of tho air and of the earth their cognomens are simple if they are new ; their 
1679,1857-08-29-seq-4.txt,"Man cannot live where they are out. I hey are t once our companions, our servants, and our master. They are ever about ut, ever doing our "
1681,1857-08-29-seq-4.txt,"criticism, because they live in ""houses not made with hands.-' Servants they are most truly, and from carbon to chlorine they stand ready to answer "
1685,1851-03-22-seq-1.txt,"24. Thou Patrick, the Hum-baili(f, called together the servants of the chief Sutra p, his beadles and bis runners nud his scouts mid "
1687,1851-03-22-seq-1.txt,"25. So they went nnd laid hands on one Shadraeh, a servant in nu inn. And they took him a way from his frying-pans, and his "
1688,1851-03-22-seq-1.txt,"2i). Then there arose one Belli, a Centuri on, the servant of the kidnappers, u in in of mean mature, having a very liille hat in his "
1692,1850-02-16-seq-1.txt,"of, to protoct the fugitive from oppression, to save from lictraysl ' the servant who hath escaped Com his master unto them ;"" and to "
1694,1853-08-20-seq-2.txt,"Si.Avr.ar Sectional Freedom National. A faithful-body servant of tho late Vice-President King, it is said, is now living nt Washington, He "
1696,1850-02-02-seq-1.txt,"Imp door in the wall, coiiiiiiiuiieatiii'r w'uh n k, comforllcs hole, in which the servants loih.ed and cookvd. Not wishing to overhear "
1697,1850-02-02-seq-1.txt,"for physical than intellectual life, nnd three stout house servants, any two of whom, mil linois, would have kept n house liko a pal "
1702,1853-11-19-seq-2.txt,"whether we are content to seek their conversion I all the servants, ibe musters, the Church nnd the been brought to a saving knowledge of the ttospel. "
1705,1855-05-26-seq-3.txt,"ter that commands men to submit to kings, and servants to submit to masters with till fear. ili said many would join a rich and popular church, "
1706,1855-05-26-seq-3.txt,"do this, ministers from the pulpit do this. The most liolv, zealous, self-saenficinjr servants of God aro classed with Garrisonites, Parker Pillsburyites ! "
1711,1857-04-25-seq-4.txt,"when Parliament is in session, he lives in London in bis town-house. Hero he has a host of servants; and they wear tho gaudiest livery white coats "
1713,1857-04-25-seq-4.txt,"From 1820 until the other day Mr. Rwerts found such vocation as servant or porter, as meted out to the colored man in the free States. "
1716,1857-09-05-seq-1.txt,"solent froe blacks who were employed in the capao-i ity of servants, this is no unusual circumstance. Every year somethiugof the sort occurs, and we, "
1719,1857-05-23-seq-4.txt,my object was to sco tho place ; until nt last servant ushered us into the working cabinet of Suo. 
1721,1857-06-13-seq-2.txt,"laws of the State of Tennessee, or & special act, will Buffer it, these servants will be legally man umitted, provided that they, by their upright con "
1722,1857-06-13-seq-2.txt,"supposition, the State of Tennessee will not per mit the emancipation of these servants, and they do not wish to go away, in that case they may con "
1723,1857-06-13-seq-2.txt,unity win approve. The security my servants will have that if they act uprigntiy during their probation 1 will give 
1724,1857-06-13-seq-2.txt,"tice. I am living under lb new order of thing. The servants art delighted better pleased, tbey assure me, thaa they would have been with sud "
1725,1857-06-13-seq-2.txt,"tem. 1 tie system is, in my view, better for the servant than immediato manumission. Its results secure, also.as far as may be possible.the interests "
1726,1857-06-13-seq-2.txt,"of the community into which the liberated slave is to enter. For, during thin trial of the servant be has his master's protection from imposition and "
1730,1857-06-13-seq-2.txt,"fulfill this my lost will and testament, in reference to the servant who may be left under the unao omplished intentions of these measures of eman "
1732,1857-06-13-seq-2.txt,"leavened the whole lump, and raised the mind of the servant to a just knowledge of his situation, the tone of feeling toward the Gospel is very dif "
1741,1860-06-23-seq-2.txt,"Noah, through Canaan, who was cursed by Noah, to be the 'servant' that is the word employed of bis brethren, and that tbis malediction has fal "
1742,1860-06-23-seq-2.txt,"self was actually changed into a 'chattel,' whereas be is simply made tbe 'servant' of bis brethren secondly, that net meroly Canaan, but all bis pos "
1745,1858-12-18-seq-2.txt,"tuously every day ; while our officers (the poor servants of tbe Slave Power) , were . ploughing through the deep mud, oyer . hills and valleys ir "
1746,1858-12-18-seq-2.txt,"to no one but her father, as she was the most valu able house servant that be owned, and for her faithfulness in his business since she had been in "
1750,1856-11-22-seq-4.txt,"net of veir id'.O, Anne (ireen, a servant of .Sir Head, v.'a- ti-e d I'ul' the murder of her ln"". "
1752,1856-05-03-seq-3.txt,"law-makers, but are they always good and faithful servants ? Aro there not, moreover, mauy short comings on our part? Do we, do the people, who "
1754,1856-05-03-seq-3.txt,"tho Padlock, in which Mungo appeared as a Black servant. This epilogue is so annronriato to tlm! caso that I cannot but givo it to the reader. "
1757,1853-01-29-seq-2.txt,"ought to be the rewuril of merit und virtue 1 urn, my Lord, your obedient servant, AN :.UUSU WOMAN, "
1758,1853-01-29-seq-2.txt,"1 remain, Sir, your faithful servant, II. G. 1). Nov. 29. "
1761,1853-02-19-seq-4.txt,"her lumber loreed her door, dcsptlo the re monstrance of ll.o servant, who protested thai llm Countess wintted lo he nlnue. To "
1763,1850-06-01-seq-1.txt,"your prosperity and happiness, with which 1 Ttour humble servant, WM. H. SEWARD. "
1765,1856-01-12-seq-4.txt,"pair, an old man unci woman husband ami wile .U meu ,.y ti cn.se.ves, wit limit emu or servant, """"""""""""'""ft """".'"" ,tlln,K . - r ot urn. i "
1767,1856-04-05-seq-3.txt,"if Your obedient servant, D. R. ATCHISON. "
1769,1859-04-30-seq-4.txt,"able, for gentlemen have a right to seek amuse ment ns they choose ; but this girl, this servant of mino, really, the makes mo blush that I am a wo "
1770,1859-04-30-seq-4.txt,"question mo,"" I replied. ""Girl, are you not my servant, working fur tho homo I givo you ? Aro you not accountable to mo "
1771,1859-04-30-seq-4.txt,"me something of my money, rather than other servant! who have always shown themselves strict ly honorable in everything."" "
1775,1857-08-22-seq-4.txt,"to be admitted, would fill a volume. ""The poor. dear man !""said one of his servants ""they want me in suow uim lor money. "
1778,1852-08-14-seq-1.txt,"platform, tor you dou'l know hi opinions.' lint, 'it is enough for the servant Ihat be be as his master.' A Mr. Webster bad caught "
1780,1850-03-16-seq-2.txt,w ino nnd oysters that w ould be Kiven nt Colum bus to secure tho favor of the public servants It is well known that much legislative uid Is 
1781,1850-03-16-seq-2.txt,"cinnati despise nil such hioaus of securing jiu ti from tho legislature. Our servants are elected to do oquul justice to all, and a measure "
1782,1850-03-16-seq-2.txt,"vant in his parental mansion, and then as lody servant for his young master, or half brother, who chose tho houorablo profession of horse-racer "
1788,1850-11-02-seq-3.txt,"himself uttered from Mount Sinui, "" Thou shalt deliver unto his mimtcr tho servant that huth escaped from his muster unto thee."" "
1790,1861-04-06-seq-1.txt,"did not make bar advanoee to ber equals, nor even to ber father' more Intelligent servants. She se lected tbe most brutalized, over whom ber author "
1791,1861-04-06-seq-1.txt,"turned from town one evening io a partial state intoxication. His body servant gave him eome offence. He was divested of bis clothes, exacpt "
1795,1859-09-10-seq-1.txt,"Saint Paul did to Philemon, tolling them to treat black people ""not now as servants but as breth ern,'' and lot the preacher not forget to set the "
1798,1852-07-31-seq-4.txt,"exercise, cold water, and plain diet ; making my servants and neighbors as happy os can (which is chiefly by being uncommonly "
1799,1852-07-31-seq-4.txt,"brought trom l.gypt nml Abyssinia nro cm ployed clnelly us house servants, never in ""gang,"" ns on our Southern plantations; "
1802,1852-07-31-seq-4.txt,The colored man w ho is u sluve has nearly as high a seat as the hired house-servant who is white A white man does not feel degra 
1806,1850-08-03-seq-1.txt,"ty, where schools are open, and where the servants of the Lord teach the true orthodox laitn, would you seize him and thrust him "
1808,1850-08-03-seq-1.txt,"was permitted to abscond. "" Possibly it was so ordered, that your servant should leave you for a season, that he might be re-united "
1811,1851-06-21-seq-2.txt,"mention the Jewish code to fur as it rclutcs ' servants from tho heathen,' and tho American fugitivo slavo law, at a continuation of the "
1812,1851-06-21-seq-2.txt,"turers, F.ditors or agents. It is ono of com mon interest. These nre but the servant of tlio whole, chosen to labor for their common "
1816,1857-02-28-seq-4.txt,"Bequests for the portioning of poor girls and virtuous servant-maids are, indeed, not ut all un common. In the village ol Sawburgh, in Norfolk, "
1817,1857-02-28-seq-4.txt,"ker gentleman, who loft a sum of money, the in terest of which is shared ann-tig the servant girls in the place who get married. The amount is not "
1820,1856-08-16-seq-3.txt,"littlo further North were convinced that they are servants, and not 'gentlemen' in disguise. Wo hope that this all'.vir will teach them prudenco."" "
1823,1856-01-19-seq-4.txt,"of play-thing, a dull, an idol, and now in tho ile '.graded character of his servant. But lm would 1 confess her transmutation into his equal: and, "
1824,1856-01-19-seq-4.txt,"wrath. On returning late in the night, the house was quiet all had retired, save the servant. She scarcely closed her lovely eyes during the night, "
1827,1850-03-23-seq-3.txt,"forty years, wo it lint icttlcr, and had boon a publio servant for many years in tho ofllco of Justice of tho Peace and Land Agency. Ho "
1829,1851-07-12-seq-3.txt,"church courts on this subject, and the duty of church members to regard their servants as immortal beings, and furnish them with "
1832,1860-05-26-seq-1.txt,powers which the charter has conferred upon us. Tbe offioers of tbe Society are the servants of the Society . Tbey oannot legally be its masters. 
1833,1860-05-26-seq-1.txt,"ing all hor residence in Guatemala, and had pro ven herself a very faithful and dovoted servant, Soon after the Ariel got out to sea, this Captain "
1834,1860-05-26-seq-1.txt,"an expression of apprehension about losing hor servant in New York, and the plan she had form ed to avoid such a serious privation, which she in "
1835,1860-05-26-seq-1.txt,"npon her soon after leaving Aspinwall, and desir ed her permission to introduce ber servant girl to the stewardess, (also colored,) to which Mrs Clark "
1836,1860-05-26-seq-1.txt,"fact in her arms, and another small child besides, entirely destitute of a servant to render her the necessary assistance in time of need. After ex "
1843,1860-10-13-seq-1.txt,"With the highest regard, I remain, Your obedient servant, ELI THAYER. "
1845,1857-05-16-seq-1.txt,"mi', unsviers occur: Q. Aro not servants bound to obey their mas vets? A. Yes tho P.iblo exhorts se.-vnntj la bo obodi- "
1846,1857-05-16-seq-1.txt,"... . (J. II servants buffer unjustly, what, oro they lo ll-J I "
1847,1857-05-16-seq-1.txt,"A. Should servants ever run nway ? No if they do, they sin against Ged and "
1849,1857-05-16-seq-1.txt,"vant disobey? A. No tho Biblo says, ""Servants bo subject tu your masters w.th nil tear, not only to tlio ijood "
