,date,context
1230,1851-04-17-seq-1.txt,is always sure to feel the first blow. It is to this observant class of men that we now address ourselves. It is to those 
1231,1865-10-11-seq-3.txt,"Very respectfully, Your obedient servant, W. DENNISON, "
1232,1855-03-21-seq-2.txt,"in secret. whose object is the abduction of colored servants, travelling with their masters, who are sup. r osed to be slaves. "
1234,1858-11-03-seq-3.txt,requisite to gratify thme taste of the epicureau will ej&iupplied in abidhdance. -The servants.orthe C.RLINA I IOT EL are noted for their polite and 
1236,1858-07-14-seq-3.txt,requisite to gratify the taste of the epicturean will be supplied in abundance. The servants of the C AROLINA H OTE L are noted for their polite and 
1237,1858-07-14-seq-3.txt,"tolerably quick spoken. He has been raised in the house, and is a valuable dining-room servant and stood ostler. "
1239,1858-05-19-seq-3.txt,requisite to gratify the taste of the epicurean w be supplied in abundance. The servants of tL C A ROLINA HOTEL are noted for their polite at 
1241,1858-08-11-seq-5.txt,"nd have not ye*t known it to fail in effecting a >eedy cure. I have also given it to my servants, blen they have camplained of being unwell, and "
1243,1859-12-14-seq-2.txt,"tions,"" lie haud them idivested of their upper garmenits by a couple oft servants, in atten-~ dance and -thirty-nine"" huaid on according to "
1245,1861-02-13-seq-1.txt,"With profound esteem, Your obedient servants, L. T. WIGFALL. 0 0. C. CLAY, Ja. "
1246,1861-02-13-seq-1.txt,"Very resh ecifully, Yonr ob.-dient servants. (Signed) 1IEN. FrTZ'AT'ICK. "
1247,1861-02-13-seq-1.txt,"s under your charge. Your obedient servant, (Signed) F. W. PhKENS. "
1250,1861-02-13-seq-1.txt,"e are, with great respect, Your obedienhet servant, ,. WIGFALI.. j A. IVERSON. "
1251,1861-02-13-seq-1.txt,"Very respectfully, 'Your obedient servant, ISA AC W. HAYNE, "
1252,1854-01-25-seq-4.txt,"A large supply of heavy Woolen Shawla,-f'or servants ; -. Superior Welch and Ganze Flannels; - "
1254,1856-04-30-seq-1.txt,"kitched fire-place, for the deacon had now no th servant or helper, and in the gray winter of his jj life, the whole burtnen of managing his place "
1255,1857-03-18-seq-2.txt,"which the citizens of a Republic may pay to the faithful servants of the National Commonwealth ; and, so far as is due to those who are now about "
1257,1857-03-18-seq-2.txt,"80 were instanstly killed, and the rest badly mangled g' A t rish servant girl was requestesd by a lad1 to go to tite sf tour dry good stores andI tuhtain ai"" bec "
1258,1851-03-27-seq-2.txt,"is, that the Union's correspondent is more observant than the rest of us to discover who are the leaders. We have been using- all "
1259,1863-01-07-seq-2.txt,A Sign in the Heavens. An observant genilemant gives us ani account of a rmarkable phenomenoen which p assed over this 
1260,1851-01-02-seq-3.txt,"Ironer, and a yound girl to attend to small chil Idren. For such servants good wages will ho given and kind treatment ensured. Enquire at "
1262,1852-06-10-seq-4.txt,its place when no longer required. A servant drops the broomn just where her labors with it happen to end-within the 
1263,1852-06-30-seq-2.txt,"I am, with the highest respect; Your most obedient servant, FRANK IERC.., T '11uh. J. S. Barbour, J. Thompson, Ailpheus "
1264,1858-01-27-seq-4.txt,"Gaiters and Punp-sule Boots. Also, Ilouse servants Shoes, of every description. N. B.-Ladies ant Alisscs Gaiters and Slippers "
1266,1859-10-12-seq-1.txt,"borers, $3, farm hands from $30 to *40. per month, and found, servants from $25. to $40 per month, and fomnd ; cooks from "
1268,1858-04-21-seq-2.txt,sual hour alarmed thme whiole~house; Scholars and servants came rushing en masse from all parts of the building. Every one'looked fright 
1269,1858-04-21-seq-2.txt,"mA. U .UL, .. A 4eam LIe people leaving the I house; shortly after, one of the servants came to No 12, and told us thant ""several of the girls s "
1270,1858-04-21-seq-2.txt,"husband was using very profane language to the servant who had been left in charge of him. Some of the girls went to the drawing room, "
1273,1851-01-02-seq-1.txt,"ascended the ste and rang the bell with a trembling hand a servant obeyed the summons, and h 'ed, ""Can I see Mrs. "
1274,1851-01-02-seq-1.txt,"will see!"" While waiting rj~the servant's return the moments wer as hours, for he felt "
1275,1851-01-02-seq-1.txt,that everything de to him in life depen ded on this inte .. The servant re turned and requi his name-his agita 
1276,1851-01-02-seq-1.txt,"pale and agitated, .*e 'was sitting up when the servant broughlher the card; as her Dyes fell npori'tho- 'ime she had dearly "
1277,1851-01-02-seq-1.txt,"then ashanied of e sing her feelings to he servant, she sar into her chair, and Mid, "" Ask him to.' Ik up."" "
1278,1856-06-25-seq-5.txt,"Afso, the best plan foi- the rpiritual lnstruction of our servants. S. P. GETZ EN, Moosarvron. "
1280,1859-02-23-seq-1.txt,estoratives. ET A L.A o sent her servant (we will not I ention where lie was from) for a new velvet 5 
1281,1857-09-16-seq-2.txt,"""the Public Press,"" a "" Public Joeurnal."" and wre are used to speak of an Edlitar, as a "" public servant."" These denominations alone would indicate, that an "
1282,1857-09-16-seq-2.txt,"When thme Editor th'ngh, is tdeenmed to be, as lie rely is, a public servant of the first class, and his sheet o be the exponent of the enlightenment. the intelhi "
1283,1852-05-27-seq-2.txt,"vants at home, can by their cunning have white servants here, that own a hundred slaves, and finally, I meant to caution my countrymenm, "
1284,1852-05-27-seq-2.txt,"remain in this country. The majority of these once valuable servants, are now worth less beasts upon the community amiong "
1287,1852-05-27-seq-2.txt,"FATAL CAsuAuTT.- p. Quin, narespect ereess handhing of Spirit gas.. ~A servant was tillinag the latmp from -a cnn, whean the "
1288,1854-11-09-seq-2.txt,ihiznelf Ill to the asziduous study of such ma:ters as will m-ak: ium a most eflicient publieservant ; ani we have no hesitmoirn in savitig. that hi4 Congressional 
1290,1861-03-13-seq-1.txt,"we live, this saine people have wisely given their public servants but little power for mis - chief, and have with equal wisdom provided "
1292,1856-09-03-seq-1.txt,"ter Acker, and Virgil Whitcomib. The mber of' servants average during the year out three hundred and twenty. The "
1294,1856-09-03-seq-1.txt,""" The Jenkinsa that kicked you yesterday for 'sassing' our servant girl."" .. It is unnecessary to say that the examina "
1295,1855-02-28-seq-4.txt,and EDGINGS. Besiodcs a large stock of housewife and servants: Foods. They respectfu!ly au-k those making their 
1297,1858-04-14-seq-1.txt,"voice sounded ; she had but just finished, when a servant told her ""sonic one wished to see her."" She laid down the instrument and left the room "
1298,1858-04-14-seq-1.txt,"U cially as well as morally. The medical journals U of the day, and observant foreign travellers. speak often of the physical degeneracy of the "
1299,1852-02-26-seq-1.txt,"Austrian batery,'maii1kg an 0ser""t on, J he ordered his servant to bring: him chocolate. A shot took it from his- Hand "
1300,1854-02-08-seq-4.txt,"for the -' last course,"" a verdant gentleman summoning a servant, called for "" some of that"" pointing to a dish of ice cream. The "
1301,1856-03-26-seq-2.txt,upon a grand and-superb seale-requirIng about thirty servants to attend and keep the apartments in order. 1 could content myself anywhere for 
1303,1858-05-05-seq-1.txt,"I have the honor to be, with the highest res pect, your obedient servant, Jounx A. WSJIsnrTO-rN "
1304,1852-12-22-seq-1.txt,irthen of good thIngs. Noon came but it did it bring the traveller: an len the servant came at four ta know if the pigWrand poiltry sltould be 
1305,1852-12-22-seq-1.txt,"thet lt c---ruce Mclohthll, Agna and their little girl, hter dear boyuti the acliiost frozen servant girl. As soon as the trdytillers had partaken of an iti "
1306,1859-01-19-seq-1.txt,",lace, in accordance with the usual euston a lahp bas lit. A servant girl, acconmpaging her mis ress, had sank into a proflound slumber, but "
1307,1864-06-22-seq-2.txt,"is your servant. He will follow yon like a Im3t dog. He is now your servaut and friend. You can teach him anything, it you aje'ge.n "
1308,1864-06-22-seq-2.txt,"{ng it, tip tjje tulnrflde on his tongue and ho is your servant. He will follow yon like a Im3t dog. He is now your servaut and friend. "
1309,1855-08-15-seq-2.txt,".he principlesof the f.~o N othing Order. Respectfully yourobedient servant, .Leaide,~ Aug. 2,1855. "
1310,1857-12-23-seq-3.txt,Fine Stella and WAbh-n SH \WLS ; Long and Square woolen shawls fur servants; A new i-usuply of CLOAKS and TAL.\l AS; 
1312,1855-02-14-seq-4.txt,and EDGINGS. Besides a large stock of housewife and servants: goods. They respectfu'ly sk those making their 
1314,1852-06-24-seq-3.txt,"Over one week..................... 5 00 Children and servants half price. Horse, per day.....................621 c. "
1316,1859-09-21-seq-2.txt,"a world of vexation in after years. It matters little what number of servants you keep, it is ne eassary that you 'should learn how to do these "
1317,1859-09-21-seq-2.txt,"are properly done. Beside, you may have to teach your servants in days to come, and how can you possibly teach others that which you do not un "
1320,1865-07-05-seq-2.txt,"1-huve the bonor"" to bcfsir* ea'orir obedient servant, . ^ WitLi^M H. SBW?KD. "
1321,1851-10-02-seq-1.txt,"h-our interest. It address the judgment more ihan the passionls. Your obe'nt servant, T. J. WETHlERS. "
1322,1864-10-19-seq-2.txt,"12 years of age""; house sci van;ts carpenter., aud servants n? ?? employed on thc farm ; horres, tua.os and ali other stock ; ci.tu n, woo!,.tobacco, "
1323,1864-10-19-seq-2.txt,"Williame, Dr J R Williams, Mr's R Williams, A Whitile, Miss L Whittle, G Wash (servant) C Watson, Mrs Whatley, (Sand Bar Ferry) W T "
1325,1864-05-18-seq-2.txt,"ry non-com missioned . officer has a ser vant and every servant a mule. These peopli were the first to ?how any panic, but tho "
1326,1858-12-22-seq-1.txt,"everr and dark fore.bodings, the next periodi for he stage's return came round and a servant as deupatchedl for muaster. Neighbors and "
1327,1858-12-22-seq-1.txt,"umor.4 of sickne,-s and death. The evening axed andI wauned and the servant returned vith the tidings, "" Master haint come, Mistess;, "
1328,1858-12-22-seq-1.txt,"not only to them and heirs, but to the polite I1 servant who did his m towards his entertain- tt ment. "
1329,1858-12-22-seq-1.txt,"Lady -- as she was then, tripping up) stairs, askedl a servant for the lady to whlomn the letter was directed and was answered, lie might give "
1330,1858-12-22-seq-1.txt,"lover, she caught hold of the string of the. el rang it violently, and a servant- appeared. Fromn that moment the unhnppy man lodt.bis jen "
1331,1853-12-28-seq-1.txt,"he:rt. With respect to your servants, teach then to respect and love you, while you expec "
1332,1853-12-28-seq-1.txt,"ever let your door he closed to the voice of uofering himmnity. Your servants, in par ieular, % ill have the strongest claim upon "
1335,1861-10-16-seq-2.txt,";ressuiial District, that ahile a trussed and hit iel public servant is in the Field fighti::g the aatles of his counotry. he .,hiut tbe mortitked b; "
1336,1856-08-06-seq-1.txt,"tending a religious meeting, and for this purpose taking with him his favorite servant, he started t off for the church. "
1337,1857-08-05-seq-1.txt,"ite cherry tree. Well, his father blamed all the servants for it; but lie, when he came home, declared the truth to his father. Well, often "
1338,1857-08-05-seq-1.txt,"tailor's charge on the top of that. But an observant people saw. through the patch, and the charge into the heart of an lion "
1340,1858-03-31-seq-4.txt,"Giters and Pump-sule Boots. Also, House servants Shoes, of every description. N. B.-Ladies and Mtvisses Gaiters and Slippers "
1342,1858-11-10-seq-4.txt,"tolerably quick spoken. He has been raised inJ the house, and is a valuable dining-room servant and ood ostler. d "
1343,1864-08-31-seq-2.txt,"scrvant,~and each rarrles threo meals for herself and servant, so that the provisions of the hospi tal may be devoted solely and- entirely to the "
1344,1851-10-02-seq-3.txt,"the honor you have done me. the Your obedient servant, intS N. L.. GRIFFIN. froe "
1345,1851-10-02-seq-3.txt,"another mandate might be forth-coming. This is the master speaking to the servant--and this is in struction : t he other, according to all the rules of "
1346,1857-10-28-seq-2.txt,"the titue iue'r services' will becomene:-r. Very re1eetfily, your obiediint servant, J. TfIUOMIPSON, "
1347,1855-01-24-seq-3.txt,"st been thoroughly renovated and repaired ; goodj nd faithful servants shall always be in attendance, a d the guests of the h ouse shall not want for any "
1349,1851-04-03-seq-1.txt,"interesting records of my diary, when my servant came to tell me that a young lady wished to'see me. "
1350,1851-04-03-seq-1.txt,"I immediately rang the bell, and when my servant appeared. I said "" Bring me eggs, and soap, andl water "
1351,1851-04-03-seq-1.txt,"pied by the ghastly object I had removed. In a moment my servant brought me a card,. on which was written Lord Mandel "
1352,1861-08-14-seq-2.txt,"the Bull Run correspondence of the Mississci pia: While Joe, a servant of Erskinie Wat kis, was cooking a chicken in a kitchen nea "
1353,1851-09-11-seq-3.txt,"springs, was another group of neighbors, with their servants. striving busily around the smoking pits, where the barbecue was being prepared. "
1354,1851-09-11-seq-3.txt,"There were, a thousand or twelve hundred persons-men, women, children, servants and all assembled. Thme tables were well supplied "
1357,1852-10-20-seq-3.txt,"Cotton HOSF.; Heavy Worsted and Cotton HOSE, for servants; 10-4. 12.4 and 1-1.4 sup. MIarseilles Q UILTS; "
1359,1854-07-27-seq-2.txt,"cheaper per month than lie who starts with 5 white atid 2 servants, taking the H~ack from Edgefield, the Railroad from Ninety-Six and dlepending on a lirei "
1361,1854-07-27-seq-2.txt,"well suppress. If, though, I was as stricken witle poverty as even that most afflicted servant of Godr who was given over to the temptation or the DYevil "
1362,1852-04-01-seq-2.txt,was recently trouibled just us we have been--:bhat she forthwith despatched aservant for powder and shot-that she armed 'saidwservant after night-fl 
1363,1852-04-01-seq-2.txt,she forthwith despatched aservant for powder and shot-that she armed 'saidwservant after night-fl with a double-barrelled gun-that she stationed 
1366,1854-08-10-seq-2.txt,"before turning or face uneward. As ever, your obedient servant, THE EDITOR. "
1367,1863-01-07-seq-3.txt,"Very respectfully, Your obcdient servant, JOiN -A. WINi1 R, Brig. (leg. "
1368,1855-06-27-seq-1.txt,"nquired whether John Tilotson was at onie? The servants, indignant at what iey thought his insolence, were about to "
1369,1855-06-27-seq-1.txt,"ut, exclaiming in the presence of his aston bed servants, "" It is my beloved father!"" nd falling dowvn on his knees, asked for "
1372,1858-07-21-seq-1.txt,""" Shorter Catechism,"" in the presence of their children and servants, it happened, one autumn, that the late Lord Jeffreys after the riaing of "
1373,1858-07-21-seq-1.txt,"thoroughly nonplused. After a pause, during which the servants looked on in horror at the thought that a judge should not know his cate "
1376,1852-08-04-seq-3.txt,"Over one week..................... 5 00 Children and servants half price. Horse, per day.....................62J o. "
1378,1852-08-18-seq-2.txt,"I am, dtar sir, with very great respect, your obedient servant, A. P . BUTLER. Col. I. W. HAYNE, Charleston, S. C. "
1379,1852-08-18-seq-2.txt,"it grant thy request, yet at least it might please her allow you to be her servant."" A Theban htnight ufring, ""flow he should act towtards his false "
1380,1858-09-08-seq-3.txt,Plaid LlNSiRYS-a superior article; Heavy FL A NNELS for servants. Together with a full assortmnent of 
1382,1857-06-03-seq-2.txt,"tnanimousily adopted: A faithful and distinguished public servant has fallen in the service of the State, andm~ of "
1383,1856-07-02-seq-3.txt,"received a large assortment of Blue Home spuns, for servants' sunmmer wear-handsome pat terns, and very cheap. "
1385,1861-12-18-seq-2.txt,"gantly. By a receipe published in this paper some weeks back, your humble servant made a lotit tallow tandles which should be metntionedi. The "
1386,1859-05-25-seq-1.txt,"across the country, he set out on his errand pith a guide and two servants, all on horse back, armed to the teeth. in Jose Maria my "
1388,1856-06-25-seq-9.txt,"'l'he congregation wais large, as it had been "" narated"" abroad that a new servant of the Lord was about to make his debut "
1389,1859-05-11-seq-3.txt,been out of order. My wife had no difficulty in instructing a servant in the use of it. I am fully persuaded that no invention of the age is.more 
1390,1861-05-15-seq-2.txt,"our battalions are accompanied the battle.feld ,by the devoted servants of the Cross,-that single companies are often so attended, and a few of "
1392,1858-12-15-seq-5.txt,"And respectfully inivite an examination of my Stock and prices. Also, on hand a good assortment of BILANKETh and WOOL HATS, suitable for servants. Mr. JOHN LYON is engaged in the above Establishment, and will be "
1394,1858-12-15-seq-5.txt,"tolerably quick spoken. lie has been raised in th house, and is a valuable dining-roomu servant imd aood ostler. "
1395,1858-02-17-seq-5.txt,"the Hermitage to th~e new proprietor, culled all the servants and introduced them to their fu ture master, and then conducted th~e latter to "
1396,1858-02-17-seq-5.txt,"sided, where he would meet Mr. Martin, an old, confidential servant of the defunct, and be con ducted from the railroad to the "" Hermcitage,"" "
1398,1850-03-06-seq-1.txt,"wvhich the char acier and conduct of public servants ( ho could have no voice Lf that floor,) re so freely censured, "
1400,1859-11-16-seq-1.txt,"ing in every movement the pride of a body servant in his revered master. Paint this in your mind's eye, and you have before you a "
1401,1859-11-16-seq-1.txt,"gentleman of the eighteenth century, with his servant on his way to Congress. Such as Gen. Andrew Pickens as lie passed "
1402,1855-12-19-seq-1.txt,"I am, sir, very tepestfa Uf' er friend and bediens servant,' . ' JAilES L.s ORR. Hoh. C. WV. DUDLEY. "
1403,1854-10-26-seq-3.txt,and EDGINGS. Besides a large stock of 11ousewife and servants goods. They respectfully ask those making their 
1404,1854-10-26-seq-3.txt,"FLANNELS; Heavy all Wool Red FLANNELS, forservants at low prices; "
1406,1854-10-26-seq-3.txt,""" Resolved, rTat in mietmory of this long tried and faithful servant, these resolutions have a sepa rate page oii our Church book, and that a copy of "
1409,1850-08-14-seq-2.txt,"at an early hour the following morning. When the servant af p'inte.d to call him. entered the rooi for 1a1t purpose, he was "
1410,1854-12-20-seq-1.txt,"ial friend. One day in returning from our cus 'mary walk, a servant met is, holding in his and a letter, exclaiming "" from Europe ! from 0 "
1411,1856-11-05-seq-2.txt,"s q e,.N ;ggiesW ...cents. Children.un. - der twelve years of age, and servants,, will be Radiitd 1-thatf*kets ~ The pup 8sof chari "
1413,1858-09-15-seq-4.txt,requisite to gratify the taste of the epicurean will be supplied in abundance. The servants of.the CAROTINA HOTEL are noted for their politepnd 
1415,1861-12-25-seq-1.txt,"time, when all-rich and poor. high and master and servant-ahould rtejoice toget: r to all, equally, this day, hadJ the G "
1416,1861-12-25-seq-1.txt,"n gust passe I over the rich man's face, aind in r-an instant the well-trained servant had ta ple ken the chill hy the shoulder, and was turn "
1417,1861-12-25-seq-1.txt,"t The reply was almost stern: "" My dear, let or the servant do his duty."" lgs ""Yes,"" she replied, in a pleading. tune, "
1418,1857-12-09-seq-1.txt,"has three closets full of dresses, two carriages asliver servic~e, a' set of diamonds,, six servant: nd a baby. Shie is' now thme poorest woman "
1419,1851-06-12-seq-4.txt,"I am weary of the chain.""I ""Hush, Juana! shall the.servants Hear you argue ever wrong? "
1421,1864-09-21-seq-2.txt,"? SHBRMAX'J* ARMY IX ATLANTA.-Gentle men from Atlanta, co:>l, observant and relia ble, and'who have ''-biijoyed^' several days "
1422,1863-02-25-seq-3.txt,"Soi:'.!) Carolina has lost a truo son, .;n exempta : ry niau, and an efficient public servant, in tin '? sud len death of th!.', excellent t'cn*l'-':f *n "
1423,1861-02-06-seq-3.txt,the lose that has befallen our Church and commu nity in the decease of this venerable servant of Christ. 
1424,1851-10-23-seq-4.txt,"Faney Plaid and Plain LINSEYS, for female .use servants, I leavy Sheeps GREY CLOT!! and Mixed "
1426,1854-03-15-seq-2.txt,"it is true. But why not send a small delegation any howl Among the rest, your humble servant of the Adrertiscr wouldl be glad of a pretty pretext, like this, "
1427,1855-03-14-seq-2.txt,"Mr. Pratt. I want to know whether it would be in order to direct the servants to bring in breakfast ? A Voice. "" Send Pratt a buiscuit."" Ha! ha! "
1429,1850-06-05-seq-7.txt,ing misled by his sel5ish purpose. The war ieiween the servant and his anister has re i.ulted in the annoying ridicule common to 
1430,1865-10-18-seq-3.txt,"Boives to disclose. al! to. the iandlon Summoning a servant, he said : "" Ask the landlord to step up to m "
1431,1865-10-18-seq-3.txt,"bed. Everything v, as friisii ;;i:d iiea:. cverv servant attentive, ail augured well. ^?*I kept myseif closc'ly cioked, ptified a ci "
1432,1853-07-06-seq-3.txt,"pry fur this advertisement, and you will obli-e your humble servant, BOOTS. Julr it 25 "
1433,1859-11-02-seq-1.txt,cariage stop)ped at our door. There were thee or four horses and two servants. A tleman came ini and asked to stay all night. 
1435,1857-05-06-seq-4.txt,"only ready to plant, but ready to yield cropJ that will give master and servant.a plenty of turnips and turnip greens, amtl. "
1436,1856-05-28-seq-1.txt,"o iake him by the hamnd amid wilelome him as a good and f.ithiful servant,"" wh~o has done very thing in his power toadvanee their inter "
1437,1856-04-30-seq-3.txt,"cbeap; * Blue HOME$PUNS,super. quality for servants; 10,11I and 12-4 Cott..n and Linen SiIEETINGS; "
1439,1856-08-20-seq-1.txt,"..re awaked by tne outcry. The old folks, three female servants, and two big brothers rushed to the rescues and broomsticks, "
1440,1856-08-20-seq-1.txt,"Sism, more than me ets the eye of the unob servant spectator, then the scene becomes one of vast importance-the material rite is "
1442,1852-08-04-seq-1.txt,"ire your slaves, anid 'i myself nothing more ian your servant, fd the whole of this day. Whever shall be remiss in executing your "
1443,1852-08-04-seq-1.txt,"his evening. Newv let all depart. Let my faithful servant Ninus alone remain. I have to consult him upoii affaiirs of State."" "
1444,1852-08-04-seq-1.txt,"ar of the queen. ""iThe queen is insulted by ier servant,"" exclaimed Semiramis. ""I embrace your knees to obtains my "
1445,1853-03-16-seq-1.txt,"lere are duties to be performed. Without these qualities in their public servants, more stringent laws, for the prevention or punish "
1447,1864-10-05-seq-2.txt,"contribute to the (Fas in Eind j all""slaves under 12 -years of agc ; hocse servants, carpenters,'and servants not etpployod -on tho lann,~- horses,.: "
1448,1864-10-05-seq-2.txt,"12 -years of agc ; hocse servants, carpenters,'and servants not etpployod -on tho lann,~- horses,.: males and all other ?tock ; colton, wool, tobacco,""' "
1449,1864-10-05-seq-2.txt,"omi of all kinds, draymen, dny-lab?ter?, body servants, coachmen; Ae^ including?laves i-n farms under twslv? years of ?ge. "
1452,1864-10-05-seq-2.txt,"by him, . -34. All boase servant?, carpenters, hanefieraft omi of all kinds, draymen, dny-lab?ter?, body "
1454,1864-09-21-seq-1.txt,"SHIPMAN'S ARMY IX ATLANTA.-Gt-mlc men fruta Atlanta, cool, observant and relia ble, aird who-Tiave ?i enjoyed"" several dayt "
1455,1854-09-07-seq-2.txt,"wil' be a trange an. melaenclolv miscarrinnge of cau Con in a public servantt, if Ju Ige E.IntL'S attempnit to limitt tle fee, inl soil, sho'd result inl contive3ilg "
1457,1851-10-16-seq-1.txt,".onfederney. Her people are less likely I migrate with, their men servants and mai erimts to thte new territory, than any oth "
1459,1863-01-14-seq-1.txt,r.nd excessive reliance on legislation. The observant reader will Bnd our statute books and our records of legislation in State 
1460,1856-06-25-seq-8.txt,"The congregatint was large, as it had en ""arated"" abroad that a new servant >f the Lord was about to make his debut "
1461,1856-07-30-seq-3.txt,"Ireceived a large assortment of Blue IHomi spns, for servants' summer wear-haadsome pal terns, and very cheap. "
1463,1859-03-16-seq-3.txt,"the use of it FREE OF CHARlIE. Or, If desired, lill have a servant instructed so as to work the ma ehine well, if the owner will scud thern to my houso "
1464,1856-09-17-seq-2.txt,"sissippi, passed through Augusta on Saturday afternoon last, with six or seven servants. At Atlanta he expested to meet a servant that he "
1466,1856-09-17-seq-2.txt,"afternoon last, with six or seven servants. At Atlanta he expested to meet a servant that he had directed to be seat there from Columbus, "
1467,1856-09-17-seq-2.txt,"had directed to be seat there from Columbus, but in consequence of the servant not being at Atlanta, he took the West Point train at four "
1468,1855-07-25-seq-3.txt,"out some distance to where her son and some of th servants were at work, ate supper with her family and seemed even more than usually cheerfu'; bu "
