,date,context
2235,1853-07-16-seq-2.txt,"and intended to continue their route yesterday, morning, with the two remaining servants. Just as they wero getting ready lo leave, one "
2238,1858-04-24-seq-4.txt,"Mo your Agent for Holt County, r waking from (8 to $25 per day, and your humbl servant ha 111 .de. sine the seventh dav of last January, "
2240,1850-11-30-seq-3.txt,"4. The Employer, 6. The Servant, 6. The Democrat, "
2241,1858-08-28-seq-4.txt,"tavern keeper to collect bis wsolu innnly, wile children and servants every soul of them, for he had something va.il y important to o niniuoicate. "
2244,1853-05-07-seq-2.txt,"Mr. Lewis said, this is the last meeting of our Convention. Your bumble servant has tried to do his best, and be impartial to all "
2246,1858-10-30-seq-2.txt,lege ewe it more important than that of respect' fully and TrntiVly addressing our public servants on matter pertaining to our political interest. 
2249,1850-01-12-seq-4.txt,"the law of thy nature, u Well done, good and faithful servant, enter into the joy bf tliy Lord."" Eternity ? It is here, not yonder. "
2251,1853-10-01-seq-4.txt,"Him, who lelt the tlironn ot ins glory ami took on him the form of a servant, for the sake of the hum blest African as surely as for his proudest oppres "
2253,1858-04-03-seq-2.txt,"oity with tbem, under pretence that they had x.wmu a iiiihjc ill ll.WNrK IH a servant NhA ent with then on the oars, but instead ,.f mr. "
2254,1858-04-03-seq-2.txt,"with tho exception ot an old colored man, the body servant of Mr. Bodman, whom he proposed to take to Cin""innati with him and liberate So f ir as the "
2257,1859-04-02-seq-4.txt,"Mrs Stows makes her characters talk much on ro lgious topics. Candace is a poor oolored servant in a rigid Puritan family, and must bo taught the "
2259,1854-01-28-seq-4.txt,"How loiisr will men. under thn i,r,.in.n r . ing frcodom, uphold public servants in niuiiitaiuing '""is hellish trttio in humanity r How lornr will "
2262,1851-07-26-seq-4.txt,"Soil Partt; but it will bo truly A Frf.r Paper, and not the bondservant ot nnyenuse, or party, except that of Freedom, Truth, and "
2265,1850-08-31-seq-1.txt,"The proprietor of this houso employs noun but lice negroes for servants, who nro inso lent ami appear to have ns much authority "
2266,1850-08-31-seq-1.txt,"when be complains, he is promised tho trunk tind advised tu give up the servant. If this ciiro wero submitted to, the North "
2267,1850-08-31-seq-1.txt,"ern majority in Congress tiir Compromise, they would take both trunk imd servant tell the owner it was not them, but the law of "
2268,1850-08-31-seq-1.txt,"team-bont Asia, on my way to Washington city, with my wife, child and servant girl, intondiug to tako the morning steamer tor "
2269,1850-08-31-seq-1.txt,"with my wife for the dining-room ; leaving the servant girl in charge of tho room with my sick child, not supposing lor n moment "
2270,1850-08-31-seq-1.txt,"dinner, I was astonished to h am that my servant girl bad been taken off mid uUo one my trunks, continuing the cloutliing of my "
2271,1850-08-31-seq-1.txt,"diil of n police oliicer to enable me to obtain possession of my servant girl uud trunk, but was told by the clerks of the establishment "
2272,1850-08-31-seq-1.txt,"that a police officer dare not tuke possession of tho servant girl, should be even see her iu the street. Finding it was impossible to in "
2273,1850-08-31-seq-1.txt,"en in bis house, us bo appeared quite indif ferent ubout iny getting either tho servant fill or trunk, 1 told him if ihcre was no law "
2274,1850-08-31-seq-1.txt,"in Penukylviiiiiu by which 1 could get my servant girl, 1 would try if there wus any by which 1 could obtain my trunk, or make him "
2286,1856-08-30-seq-3.txt,"ern system. Starvation quickens the genius of tho white servant, and leads to many brilliant in ventions, while plenty, and an abscence of care, "
2288,1850-05-11-seq-4.txt,"grcen, Tnll servants In livery stand In the ball, Or but one little mniden may wait on you all ; "
2291,1856-02-02-seq-1.txt,"Result or the Fugitive Law. J. M. Chanman and his servant, Wm. Rufus Tracy, have been ar rested in Chieitgy, on a charge of kidnapping a "
2293,1850-12-21-seq-4.txt,"and from gratitude, he hnd given orders to bis servant girl to give the llunclibnck regu larly his soup at thnt hour. "
2294,1850-12-21-seq-4.txt,"larly his soup at thnt hour. The servant girl wns named Rosette. She wns young, mild, huiideouic, and tender "
2297,1851-12-20-seq-3.txt,"We huve the honor to bo Your Excellency's obedient servants, I.r.ivis Taipax, N. E. Wiiitimo, "
2298,1851-12-20-seq-3.txt,"huve the honor to bo Excellency's obedient servants, Taipax, N. E. Wiiitimo, "
2299,1851-12-20-seq-3.txt,"es, believe me, Your friend and obedient servant, ! "
2305,1857-10-24-seq-1.txt,"negro, if possible, to travel in the northern part of the L nitea States, as a servant and barber to his lordship, at the rato of $100 per month. The "
2306,1857-10-24-seq-1.txt,"St. Louis went to Canada.mct the boy. and employ ed him as his servant, asslated. started on his journey, as proposed, with his new servant, and a "
2307,1857-10-24-seq-1.txt,"ed him as his servant, asslated. started on his journey, as proposed, with his new servant, and a lew aays brought the parties to St. Louis, where "
2308,1857-10-24-seq-1.txt,"to death. This negro may prove a valuable servant, but I think there ought to be some law in our State (if "
2313,1853-11-26-seq-4.txt,"Min e the nvcurreuee of thin ttngedy, Mr. Uirdsoiin has excreiM'd the uln.ost rip with his servants lie had been regarded, an we learn, lis n ""hard "
2314,1853-11-26-seq-4.txt,ho made his mipearain e. Shortly after dark one of his servants called at tho dwelling to obtain bis master's shoes for the tairooso of iilackinii theui. 
2319,1850-07-27-seq-3.txt,"ness as displayed in slave-breeding, in work ing and selling ""servants"" for missionary and other religious purposes, und in ull the "
2320,1850-07-27-seq-3.txt,"Scripturnl and practical exposition of the relation of Muster and Servant, and the du ties growing out of it."" Hero is a chance "
2321,1850-07-27-seq-3.txt,"ing wliich leads the Convention to call skives, "" Servants."" A clear statement of the reason why "
2322,1850-07-27-seq-3.txt,"Christianity authorizes the Southern ""rela tion of Muster and Servant,"" which makes murringo no more possible to the Muster's "
2323,1850-07-27-seq-3.txt,"murringo no more possible to the Muster's Servants, than to the Muster's cattle. A cleui exposition of thut Christian luw, "
2326,1856-12-13-seq-1.txt,"I ho interior raco must be treated us as a minor and a servant of the superior. This is history, it is fact ; aud it may also be regarded as prophecy. "
2327,1856-12-13-seq-1.txt,"""' ;!"" thero is that !ioi inturo wln.:h sai'.b. ""1 he servant 'that knoweth his lord's will ami (hietb it not, shall "
2330,1852-08-07-seq-1.txt,"Civilization anil its laws snv thnt licentious iiilnnaey between a man nnd his servants lend to demoralize society, und should be "
2333,1859-01-15-seq-2.txt,"Union is, that it is the owner of the slave who Is the real servant, and uot the bondsman himself. Ihey believe that the institution or Slavery, to "
2335,1860-09-15-seq-3.txt,"those opposite conclusions. The President ts brufessodly only the servant ol the people, otd hotV an applicant for tb place "
2337,1850-11-30-seq-2.txt,"Week, awaitingtlie boat lor lirowiiNville, and whilst there had a servant stolen from him by the abolitionists of that place. She was in "
2338,1850-11-30-seq-2.txt,"vant. Mr. McPheeters states that such was the affection of bis child mr this servant, and auch was the regard which the whole family "
2339,1850-11-30-seq-2.txt,"With feelings of great respect, I am, yeur obedient servant. J. R. GIDDINGS. "
2343,1855-12-08-seq-4.txt,"....... , .1. ..A..,0 I -L., gettcth not his servants,"" and in w hose igui me,""' "
2344,1855-12-08-seq-4.txt,"igui me,""' death of his servants is precious. EARLY PUNISHMENTS. "
2345,1855-12-08-seq-4.txt,"! ith the highest esteem wo desire to be literal! Your obedient servants, MEEK & SLEEK. "
2346,1855-12-08-seq-4.txt,"did, with all the loud veneration ot an old and favored servant. Don onirics, 100, ne wou.a give no narrai ve nn "
2347,1855-12-08-seq-4.txt,"I It was not many yesrs after that this simple and , i lovlnK ervant ol Christ, was gathered in peace un-, j to linn whom he loved. His name is fast passing "
2351,1855-12-08-seq-4.txt,"(Va.) J.Jl'ersoniau announces the death of a colored servant of Mr- Tucker Coles, of that county, named Scipo, aged 101 years, and says he was the dining "
2352,1855-12-08-seq-4.txt,"Scipo, aged 101 years, and says he was the dining room servant of Mr C.de.s father, after his marriago in 170 1, Before thut time ho trundled a wheelbarrow "
2359,1852-02-14-seq-2.txt,"with you in Salem nnd aro prepared to say, "" Xow Icttcst thou thy servant depart in peace for our eyes luivo seen thy salvation."" I am "
2361,1856-02-09-seq-4.txt,", the guardian and master of the wife, who stands . to kiui ia the relation of a child and a servant In virtue uf this relation, the husband is legally re "
2362,1856-02-09-seq-4.txt,"tour, lasiritcu on inu msiuc ; you ring a belt ; a colored servant looks through the latticed panel to e u an is rigoi. ii no uiscovers a well known "
2365,1855-04-14-seq-1.txt,reform our government. They nro disposed to view tlio acts of their servants with favor; thej are unwilling to roprovo them and they seldom dii 
2368,1858-06-12-seq-3.txt,"commands. ""Thou shall not reluru to his master the servant which has escaped from his master unto thee he xhnll dwell vith thec, .to."" Saith "
2370,1857-12-19-seq-3.txt,"""A Southern Lady takes an airing in her carriage; the coachman, footman, nurso and body servant all black; the fcmnles sitting bceido her; she ro "
2372,1851-06-07-seq-3.txt,"given up nirl gono for Union) when saviours and servants aro so abundant, ho might even without juopody to its intcrcsts.havo saved him "
2373,1851-06-07-seq-3.txt,"Senator. ""I accept it as the servant of Massachusetts; mindful of tho sentiments solemnly uttered by "
2374,1851-06-07-seq-3.txt,be illumined by lights which cannot bo missed. I accept it as tho servant ef tho Union ; bound to study nnd maintain with equal patriot 
2375,1851-06-07-seq-3.txt,"tho supremacy of the Constitution, but also tho "" servant of tho Union."" It does seem to us that at this time, when South Carolina has just "
2381,1854-08-12-seq-3.txt,"was quite right in iuvcring, when asked if he; would return a fugitive: ""Is thy servant a dog. that lie should do this thiii;;?"" It is the work of a "
2383,1857-06-06-seq-1.txt,"weeks before luvving, the everseer shot ono of his fellow-servants, a young man, wounding him se verely, but ns soon us he got well enough he.nlso "
2384,1857-06-06-seq-1.txt,His master wns n Presbyterian would have fami ly prsyeis with his servants but failed to im press Anthony w ith their virtue. Left behind bis 
2385,1857-06-06-seq-1.txt,"""Could not be vlcascd no how"" ""was always fret ting nnd going on"" ""the servants in the houtt were treated worse than doijs."" She wns a mem "
2389,1857-06-06-seq-1.txt,"be a sufficient guaranty of her fitness, not only to make an excellent house-servant, but also a eupe- : rior woman. True, she was quite young, only "
2394,1858-09-25-seq-1.txt,"the red mail mado him an unprofitable and a dan gerous servant. These Indian slaves fled into wilderness, which is now tlu slato of Georgia, "
2396,1850-01-19-seq-1.txt,"tions, attracting the regards of eminent men lika dimming, und making them its servants, inspiring distinguished Htntesmcn like Adami, "
2399,1859-09-17-seq-3.txt,"Please publish this, if practicable, and get all papers friendly to ue to copy. Your servants, William Tubbs, Taunton, Mass., born in Elisa "
2401,1859-09-17-seq-3.txt,"Siuthern mistress during a visit to Niagara Fall, and engaged a a servant at the Clifton House on the Canada aide. The former master of Saran "
2404,1854-10-07-seq-4.txt,"Eurunuuo not, nor do the lurks, the most ob servant aud natural people iu tho world are free from this mischievous error. It is strange to us "
2406,1850-01-19-seq-3.txt,"of tho numerous foreigners hero nuiko Slave moro undesirablo servant every day."" .V. 1"". Tribiim. , . ' . "
2408,1856-02-16-seq-2.txt,"your mandate; Iu the name of the Lord Jesus Christ, burl bnck that old servant of tl.o Lord who lias served him thirty years into the seething bell "
2409,1856-02-16-seq-2.txt,"been denied. As fur back as we chouse to go, it existed. The master brought his .body servant to the yery holders of Canada to Philadelphia, and "
2412,1855-10-06-seq-2.txt,"1 have tho honor to bo, obedient servant, Mossrs. Dr. James W. "
2413,1855-10-06-seq-2.txt,"plyfying or of adding others to them. I Very respectfully, your obodion t servant, I A. P. BUTLER. "
2416,1855-06-30-seq-2.txt,"ing in vain on hor whore she was not, took that meanest of all slave-cnt.diing servants, Deputy Cotton, and proceeded to Mr. Clark's barber-shop, "
2417,1855-06-30-seq-2.txt,"from Kentucky, last year, with his family ami servant, a girl about lo ; brought with him, as a "
2418,1855-06-30-seq-2.txt,"slavery by her mastor. But Mr. Marshall return ed, found his servant gouc, and went to Clark's house, in his absence, and, with threatening I,in. "
2423,1860-05-19-seq-1.txt,"inasmuch as only bis sister's daughter, and bis men-servants and bis maid servants lived with jim in tbe palace; and this maiden, the King's "
2424,1860-05-19-seq-1.txt,"their gold and silver, and commanded the land lords and the servants that these should fare sumptuously every day. Now the Southerners did "
2429,1852-12-11-seq-1.txt,"ried u Creole duly of llinine, and with the es tate mid servants, there came into his poses- sion n mulatto seamstress mid her daughter, "
2432,1860-09-01-seq-1.txt,"bo attended in and out of said District,nnd while there by the ne'ceoir.ry f'ervants of tlicmselves and their families, without tbeir right to hold such scr. "
2433,1860-09-01-seq-1.txt,"wages. But Mr. Douglas should remember, tljat when the servant questions the autbprity of his master and claims wages, he caiinot be trusted on "
2435,1850-03-30-seq-1.txt,"if pressed too hard, will give a recoil thut will not lenve here ono servant who knew his master's will, and did it not. "
2437,1861-04-13-seq-4.txt,"near a candle,"" I am ready to say ""good-by"" to him ; for neither myeelf nor servants shall ever be degraded into tbe task of taking care of bis need "
2440,1855-05-12-seq-3.txt,"It is to bo p:-e-tu:iieJ til it by 'inio the your render haya ecn th s, Ihey will be where ;the servant is free from hie master. "
2442,1861-04-20-seq-2.txt,"Octorooa; ""Ssnsatiooi of a Slave oo tbe Aostion Block,"" by a Family Servant; ""The Delights Cotton and Rice Culture, under the Eye of "
2443,1856-10-04-seq-4.txt,"tricity, and made them man's faithful and w illing servants running his errants, carrying lino to iiistaut places, defending his treasures. "
2446,1858-10-30-seq-1.txt,"Gul. v. 14. Masters, give unto your servants that which is just and equal; knowing that ye also have a Mat "
2447,1858-10-30-seq-1.txt,pilgrimage' Psalms cxix. 54. There you will find an account of pious servants ; yuu will tee bow faithfully Abraham's servant obeyed his mas 
2448,1858-10-30-seq-1.txt,"doom of the oppressive, in tbe same way as the duties of servants and the punishment of the un faithful ? Wheuco this difference f "
2449,1858-10-30-seq-1.txt,"him. Deut. xxiii. 15, 16. Thou shalt not oppress a hired servant that is poor and needy, whethor he be of tliybrethren, "
2451,1858-10-30-seq-1.txt,(No. 204) entitled 'A Scripture Help.' 'Servants vou also should read vour Bibles Pel haps soma of vou are in hard service unj.r! 
2453,1858-10-30-seq-1.txt,"find an account of pious servants ; yuu will tee bow faithfully Abraham's servant obeyed his mas ter, Geo. xxiv; how a servant. maid was useful to "
2454,1858-10-30-seq-1.txt,"bow faithfully Abraham's servant obeyed his mas ter, Geo. xxiv; how a servant. maid was useful to Naaman, the captain of the King of Assyria'e "
2462,1853-07-02-seq-1.txt,"reti)H)ctliilly nking a repeal of this enact mcnt at the honds of their servants, the gng nile was adopted by the House ol Represcu "
2464,1853-07-02-seq-1.txt,from the di grace ol Slavery? Thnt they ball not oak their aervanta to protect native twrn Americana who are constitutionally 
2465,1853-07-02-seq-1.txt,"to a specific 'claim.' Iu the esse of a claim for an escaping servant, the courts must act in rem, that it, upon the subject-matter in "
2468,1853-08-27-seq-4.txt,"the Sabbath in cold climates, without liro and light, thoJowish families who keep servants miiko it point to have a Gentile in their servico to do those "
2469,1853-08-27-seq-4.txt,"love his wedded Wife. Now all of this, will you, hure beforo as tho servant of tho Most high here in the sight of God in Heaven, most faithfully prom "
2470,1853-08-27-seq-4.txt,""" 1 litllo exnected to see him attain but ulmut 8 clock the servant said that man and his girl, ieUleman and Uy were waiting in the reception "
2475,1858-05-29-seq-3.txt,"to meddle, except in eutorcing tne auues ot mas ters and servants, as set forth in the Holy Scrip tures ; and whereas a strong desire for the expuno "
2477,1858-05-29-seq-3.txt,"at once have resigned my seat in the Senate, mak ing way for a servant more fortunate than myself in the precious advantages ol nealtn. i aid not "
2480,1855-04-21-seq-2.txt,"Uiirsiin, and as though she had forgotten that she win a favorite house servant, and hud a kind indul - g 'nt master. "
2481,1855-04-21-seq-2.txt,"charm, modesty; which make of her tho rude drudging, despised servant of a harsh master i tho wllit0 woman becomes, as she is fitted to be, "
2484,1856-02-02-seq-2.txt,"""I am, in behalf of the Society, . ""Sir, most ob'd't servant, ""B. FRANKLIN. "
2486,1851-12-20-seq-1.txt,"cabin is on npnrtment for a nursery, fur chil dren and servants, so constructed thut it will be impossible for children to full over-board, "
2489,1851-05-10-seq-1.txt,"Ilia aoul lovclh, nml liotii graciously strength ened the bunds of His ministering servants that llicy might fitly offe r liiin up h living "
2490,1851-05-10-seq-1.txt,"pass by! You ore no companion fur such men as these ! You wern the servants of atheistic Popes nud cruel Kings. . Go to, nud "
2491,1851-05-10-seq-1.txt,"honored and brought low! One of thine own hired servants has wrought this deed of shame, ami rent tho bosom w Inch took him "
2498,1851-10-25-seq-1.txt,"hearts ol t:ns people. 1 lie silent, unresist ing sufferings of the servants of 1'eace and Freedom and Truth these must speak. To "
2501,1860-04-14-seq-4.txt,A rich rttan promised the river Gangos ono thousand ripe mangoes. As the servants were bearing tho baskets to the river with this frnit 
2502,1860-04-14-seq-4.txt,"tired and hungry came and asked for one of tbe mangoes. Tho servants bid him go about his bu siness. He hazarded his life, and took one and "
2507,1852-11-27-seq-1.txt,"business or pleasure, through nny of Ihe Stales nltomle.1 by bis slaves or servants ; nml while bo retains tha character nnd rihf "
2510,1853-07-23-seq-1.txt,"favor this doctrine. They represent God a laying to hi servant 'cry aloud, spare not, lift up thy voice like a trumpet, and show "
2511,1853-07-23-seq-1.txt,"that the Whigs aud Democrats, backed by tho priest ondjehttrches whose servant and representative they arc, joined lo'slifla tho "
2514,1856-10-25-seq-4.txt,"Whene'er our wllios travel here, And bring their servants with them ; Aud whon we view our Southern lords, "
2515,1856-10-25-seq-4.txt,"tion. ""With great respect, jour very obedient servant. ;Signed) WM. M. LAWTON. "
2519,1858-06-19-seq-4.txt,"Mo your Agents for Holt Couutv. ar mnkin- from $8 to $25 per day, and your humble servant has made, sinoe the seventh day of last January, "
2521,1856-07-26-seq-2.txt,'Particular attention puid to the selection nf nomos lor lavorite servants. icgroc3 lor sale nt nil times. 
2522,1856-07-26-seq-2.txt,"The ""negroes"" or ""niggers,"" he said, (seldom em ploying the Virginia phrase-, ""servants"" or ""pon tile""), camo mostly from Missouri or Virginia, "
2527,1858-05-29-seq-2.txt,"rcspecfof persons with him."" We claim thnt to publish thin tract to servants and withold a tract to mnsters because nf the masters expressed op "
2528,1858-05-29-seq-2.txt,"and is now circulating a tract called Sambo and Toney, which instructs servants in their duty and bids them ""obey their mastert in all things."" A "
2529,1858-05-29-seq-2.txt,"lovely virtue and shines nowhere more tha i in a servant. Be careful to attend publio worship when you have oppoitunity, and he regular and "
2535,1856-08-30-seq-1.txt,only one iu the long scries which exhibit the free and prosperous North as the tool and tho servant of the slavcholding und declining South. We 
2537,1857-10-17-seq-4.txt,"in her arms, dying ! A brief nnd hurried word from the servant told 1110 tho sad blory. The lit tle girl bad accompanied a child undo up stairs, "
2539,1860-10-27-seq-4.txt,"court. It was not dreary to her. Had she been servant instead of mistress, ber spirit would nev er have been broken down; she never would have "
2541,1853-02-26-seq-1.txt,"bis ""chosen, holy people"" guiltless when they scourged their servants and maids to fhjuth ; and gave as the reason why they are "
2542,1853-02-26-seq-1.txt,"fhjuth ; and gave as the reason why they are pot to bo punished, thut the servants and innids whom they hud whiped to death were "
2543,1853-02-26-seq-1.txt,"Will friend Selby construe the following, ""If a man smile his servant or his maid with rod, and he die under his hand"" (im "
2546,1853-02-26-seq-1.txt,"jess, because they were his money. Will friend Selby explain this, "" Servants phey your masters."" Servants, here, it is "
2547,1853-02-26-seq-1.txt,"Will friend Selby explain this, "" Servants phey your masters."" Servants, here, it is admitted, means Roman Slaves. Does friend "
2548,1853-02-26-seq-1.txt,"right to do, Tim hidy, with her servant, wns bound to Wheeling, with the intention of making a "
2549,1853-02-26-seq-1.txt,"saying that she trusted to llio fidelity of her servant. And so they both lauded here; and hero they were ; but, Aire they r.ro not. . "
2555,1855-08-18-seq-2.txt,"The phrases 'peculiar institutions,' 'pious musters,' and 'happy servants,' dwell to bo sure, on many a consecrated lip. wd.cro logic, eloqueneo and "
2558,1850-07-06-seq-1.txt,"forbid it, for it only savs, ' thou shall not return the servant that bus escajicd,' mean ing thou shall not return him to the heathen. "
2560,1850-11-30-seq-1.txt,"""set free,"" and thut therefure tho text of scripture which says, ""Tho servant that is escaped from his master unto llieo thou "
2562,1856-02-23-seq-2.txt,"says, ""Thou shall not dciiver unto his master the servant which has escaped from his masted unto ttiee lie shall dwell w ith thee even among yon, in "
2564,1851-10-04-seq-1.txt,"it is the duly of every ciiizen, to investigate the actions of their public servants and to ex amine the laws. It those laws can bo amen "
2567,1854-12-09-seq-1.txt,"cries of the victim, on his way to tho boat, reached the servants oi ii iic.gnooi ,ng mansion, vviin "
2570,1855-05-12-seq-2.txt,", mother at the same time Mr. Lowi bought Sally and ho had found them to be good servants, nnd wished lo buy bnr, measurably to gratify her pa- "
2571,1855-05-12-seq-2.txt,"than the Shelbys. It is known, bowevor, that good servants have sometimes been sold ; and it is also known tlmt no female character is personated in "
2574,1855-05-12-seq-2.txt,"..n.i.!i : J . I ir i - r9 U"",USt ""f: a master selling his favomo servant, and SLAVERY IN THE TRACT SOCIETY. "
2578,1855-10-27-seq-2.txt,"libcrjtely : to fioiit if we must. Y'our obd't servant, an "
2580,1855-04-14-seq-2.txt,"Ohio, nnd to travel with them through the State. To enforce the rights of these family servants to remain in slavery, and to torrify Messrs. Chase, "
2581,1855-04-14-seq-2.txt,"intermeddling abolitionists. Tho Courier says that, ""many a family servant, attached to his home, his kindred aud his master. "
2585,1854-04-15-seq-4.txt,"rtniar i Heard uotlurig from her I caino to see U she was sick, nnd the servants tell me she's cono, C0.VI m UEIts i l oll me, or I shall "
2588,1859-01-01-seq-1.txt,"i?fttos of Heaven may be open to even such a blackamoor as your humble servant, SAMBO. "
2590,1857-06-06-seq-2.txt,"ingly. Also from Paul's epistle to Timothy"". ' ""Let as many servants as are under tbe y oke count their own masters worthy of all honor, that "
2591,1857-06-06-seq-2.txt,"ty, arising out of the relationship existing between master and servant, can reach the judgment or the conscience of the ministry and the churches "
2592,1857-06-06-seq-2.txt,this day wore lully assured that the relation he tween master and servant is recognized and sane tioncd by the ord ol Ood than it has been at 
2593,1857-06-06-seq-2.txt,"ently, inasmuch as tbs south is this day more fully assured that tho relation of Master nnd servant is recognized and sanctioned by tbe word of God. "
2594,1857-06-06-seq-2.txt,aroie our cnurcbes. It is not tb relation of servant ana master to which the objection is made. 
2595,1857-06-06-seq-2.txt,do that which is right in the relation contemplated. What did it soy to tho servant? that he must rebel and run away no 1 tbe invariable language 
2596,1857-06-06-seq-2.txt,"rebel and run away no 1 tbe invariable language was, ""servant obey your master."" Mr. D. then read from the 6th chapter of Paul's "
2597,1857-06-06-seq-2.txt,"Also from Paul's epistle to tbe Culossians: ""Servants, obey in all things your masters ac cording to the flesh; not with eye service as men "
