,date,context
3714,1853-11-10-seq-4.txt,"latter! Strangers, when hired as servants, were to f>e treated as Jewish hired servants; neither was to bo oppressed?Peut. xxiv, 14. Thostrangers "
3715,1853-11-10-seq-4.txt,"and proselyte* wero equal before the lawn domoHtio servants, whether Jews or pronely ten wcro procured in the came manner by volun "
3716,1853-11-10-seq-4.txt,"j, that people wero forever to be supplied witl ,f boDd servant* and bond maids' Were prose 1 lytes from idolatry to be rewarded for thei "
3717,1853-11-10-seq-4.txt,", WASHINGTON, I). d Lord to be his servants, every one that keepetl h the Sabbath from polluting it, and taketli hoi "
3718,1853-11-10-seq-4.txt,"that sitteth on the throno of David?thou and thy servants and thy people that enter in by these gates, thus saith the Lord: Kxecuto ye "
3719,1853-11-10-seq-4.txt,"throne of David, riding in chariots and on horses, he and his servants and his people But if ye will not hear these words, I Hvvear by "
3720,1853-11-10-seq-4.txt,"prievo of a few months, this besotted find infat : uatcd people oompelled their six years' servant! to continue to serve them after the oipiratior "
3721,1853-11-10-seq-4.txt,"of their term, find thus ' brought them intc i j subjection for servants and for handmaids,"" o , i course agains' their will, and without wages "
3797,1850-08-15-seq-1.txt,"man all his life, and would not ooneent, in his old age, to beoome a servant; therefore he let it all go, all but the old house and a bit of meadow nn "
3799,1858-04-29-seq-1.txt,"promised to ransom the lives of himself, his children, and his servants, at the price of two thousand crowns. "
3800,1858-04-29-seq-1.txt,"g L father, the two boys, a manservant named Gaat, and a page nam* La Vigerie. On reaching "
3801,1858-04-29-seq-1.txt,"M. de la Force, kuo* ing the importance of losing no time, immedii tely sent his man-servant, Oast, to his sis er-in-law, Madame de ? "
3802,1858-04-29-seq-1.txt,"stance. Having delivered b'l message, the servant! implored his master tt,seek safety by flight? ' "
3803,1858-04-29-seq-1.txt,"as he He sees go Hearing these word -j the servants hesitated about taking to flight"" f themselves, not know "
3804,1858-04-29-seq-1.txt,was this: MI was told there were two servants witl you; and I see neither of them. Wher<- ar. 
3805,1858-04-29-seq-1.txt,"hac arrived before them, and who rejoiced in a tra'n jf seven mounted servants. The person of quality was a zealous Papist, and talked in "
3806,1858-04-29-seq-1.txt,offer aim the protection of nis train of seven mounted servants. Jacques and the steward were 'ifraid to decline this offer. So the next 
3821,1857-05-28-seq-3.txt,"and structure, as well as by Moses, his inspired servant Like Samson, indeed, he had not been blinded through yielding to lures that led "
3823,1852-06-03-seq-1.txt,""" We fervently desire that He who hath declared unto His servant that it is righteousness which exalteth a nation, but that sin is a reproach "
3825,1858-02-11-seq-1.txt,"iteamer, was that of Heschid Pasha, one of the most eminent political servants of the Ottoman Empire. He was born in 1802. He was twice "
3828,1855-01-04-seq-4.txt,"of election, no sign conld he discerned by the 1 m<*Ht observant, indicating anything else than t: the success of the Anti-Slavery party. b "
3829,1855-01-04-seq-4.txt,"ind holding our election. Your obedient servant, A. H. Ref.der. To F. Gwinner, D. A. Ar. Grover, Robert C. "
3832,1853-09-22-seq-3.txt,'1 ihe ft i)tunny of buying slaves instead of iiring servants and denies that the condition it the English aud Irish poor is as wretched 
3835,1860-02-23-seq-2.txt,"its peculiar hardship, suggested that the men being employed as servants in the hotd where these members of Congress board, tbej might "
3836,1860-02-23-seq-2.txt,"these members of Congress board, tbej might claim them as their servants, and thus satisfy the letter of the law without paying the fen&lty. "
3837,1860-02-23-seq-2.txt,"This suggestion of the Mayor was adapted ; the men were claimed as servants by Kessrs. Potter and Covode ; and for this act of humanity, "
3844,1850-06-13-seq-3.txt,"President They advised him to take at once the ! servants of Louis Philippe, thus changing the ' Court as little as possible. This was copying his | "
3847,1859-06-16-seq-4.txt,"ortumty occurs 'With great respect, your oliedlc. ervant, J H BRAODON V J>*kPH Bt SNKTT, Km). Jj "
3848,1856-02-21-seq-4.txt,"lot give up my mill for SI 50, or more. a I am. truly, your obliged, obedient servant, e C. M. CLAY. ? "
3850,1854-01-19-seq-4.txt,a never-failing spring of delightfully cool water attached. Servants' quarters for as many hands as would over be necessary on the Farm. 
3851,1852-09-16-seq-3.txt,"I 111 the slave population. It says that the servants in the kitchen "" teach their children I . , ill tln'ir owner muter intend of miLstcr, and "
3854,1857-06-11-seq-3.txt,"e O.rygenaled Bitters. Your obedient servant. Ali.M.K SOUIII, "
3856,1858-10-21-seq-1.txt,"Christians, hut the will of Christ? Can Christ give contb.ctiug crdeis to his servants? Can he smile to see tbem kill one another??he, "
3857,1858-10-21-seq-1.txt,"step towards righte< usness has been planted on the heart of somwfaithful servant of Christ, whom it trampled under its feet for dragging "
3858,1858-10-21-seq-1.txt,"In e\the case, you will not bo a very valuable servant, and must not expect high wages. No; I will u >t put it on so low grounds?you will "
3863,1853-08-11-seq-1.txt,"well-ordered kitchen, over which presided another Bdly?Mrs. Attridge's ex-servant, and now Rosalie's maid-of-aJl-work And the "
3864,1853-08-11-seq-1.txt,"ral visitations. la it is the custom, besides giving tbeir servants n< abundant food and clothing, to give them a ?f "
3865,1853-08-11-seq-1.txt,"of land, for their own exclusive nee and oenet|t. m Not long since, tqeeting a servant of ooe of our Church members lounging idly aboqt (W the qi "
3870,1859-05-19-seq-3.txt,"having created civil war, it became necessary for Mr. Buchanan, as a faithful servant of Democracy, to take sides with slave owners. It "
3871,1859-05-19-seq-3.txt,"under the Concordat, the regulation that no Christian servant should enter a Hebrew family. This fact has been noticed by the Jewish "
3872,1859-05-19-seq-3.txt,"brew families who might wish to engage Christian servants. > The Baron Rothschild, to* whom few Euro- t "
3877,1850-06-13-seq-1.txt,"slavery; that Abraham, ami other good men among the patriarchs, had their servants; and that the writers of the New Testament did not "
3878,1850-06-13-seq-1.txt,"it. Abraham, and other good men, had their servants ; granted. This House has its servants ; hut "
3879,1850-06-13-seq-1.txt,"Abraham, and other good men, had their servants ; granted. This House has its servants ; hut did it ever occur to us, that those who keep our "
3880,1850-06-13-seq-1.txt,"were, in my opinion, the general features of the service performid hy the servants of Abraham and other good men in that period. Hut let us "
3881,1850-06-13-seq-1.txt,"and other good men in that period. Hut let us look a little into the history of Abraham's servants. In the 'dttb chapterof Genesis, we have an account "
3882,1850-06-13-seq-1.txt,"In the 'dttb chapterof Genesis, we have an account ot Abraham's sending bis servants from the land of Cannon, where he dwelt, to Mesopotamia, the "
3883,1850-06-13-seq-1.txt,"read, in the Vd verso of this chapter, that "" Abraham said unto the eldcstservantof his house, that ruled over all that he had, Put, I pray thee, thy "
3884,1850-06-13-seq-1.txt,"swear,"" &c. Mark the expression here recorded of this servant, ""that ruled over all that he had."" lie made this servant swear, by the Lord, the God "
3885,1850-06-13-seq-1.txt,"of this servant, ""that ruled over all that he had."" lie made this servant swear, by the Lord, the God of Heaven and the Hod of the earth, that he would "
3886,1850-06-13-seq-1.txt,"The oath is administered, the charge giveu, and we read in the loth verse, "" And the servant took ten camels of the camels of his master, and departed "
3887,1850-06-13-seq-1.txt,"importance. There woro other men with him, probably other fellow-servants I have sometimes thought that some patriotic Americans, even "
3888,1850-06-13-seq-1.txt,"Writ?Genesis, 10th chapter; but, is this all the history of this servant Hagar 7 This is stated in support of slavery. Rut, sir, we ought to tell the "
3889,1850-06-13-seq-1.txt,"It ia he JY""W teaches the submission and obedience of servants to their masters Suppose, sir, that any gentleman, "
3913,1852-10-21-seq-2.txt,""" And we do hereby, by virtue of an act of Assembly of this State, concerning servants and slaves, intimate and declare, if the said "
3914,1852-10-21-seq-2.txt,"through Baltimore to Philadelphia with colored attendants or servants, must give bond and security, the bond generally to be signed by a "
3919,1859-04-14-seq-1.txt,"poor dear got all the blame of that disastrous move?Mhanks to your hamble servant, who, though as deep in as she, nvas not enough of a "
3921,1859-01-27-seq-3.txt,""" From Mr. H. S. Fredericks, an intelligent and observant gentleman, who came passenger in the North Wind, at this port, from Gonaives, "
3922,1859-01-27-seq-3.txt,"as examples, the recent and unexpected search of Jewish houses for Christian servants, and . the further fact, that a young Israelite, who had j "
3926,1852-04-22-seq-1.txt,"it was the Hceno of their purest pleasures Parting also with the old servants, the jsior. and their flourishing schools. gave them an "
3929,1859-04-07-seq-4.txt,"and to teach and instruct it that it is the creature, and not the creator; that it is the servant, and not the sovereign. "
3931,1858-09-23-seq-3.txt,"such by-laws as might be required, and "" to ap- 1 point such officers and servants as they deem 8 necessary."" "
3934,1854-09-28-seq-1.txt,It is more credible that his sole aim was to gain the fomc and influence cf a Bpiritnal servant of God. This object he rcttchcd within a 
3935,1854-09-28-seq-1.txt,"thus sorved as tokens that God had restored his servant from death to life, in order that he should rule over the living disciples of Snfi. "
3938,1854-11-09-seq-4.txt,"Lewis Cass, then Secretary at War; that laborious public servant. Levi Woodbury, then Secretary of the Navy ; and that still living exemplar "
3939,1854-11-09-seq-4.txt,"I have the honor to be, gentlemen, your faithful servant, Charles 6cmver. P. S,?That there may be no mistake as to "
3940,1854-11-09-seq-4.txt,"first became penitent, and asked pardon of God for 1 all the errors of his servants and people in the lato tragedy.' Jurymen united in condemning "
3945,1853-05-12-seq-1.txt,"you not done it?"" said he, very angrily. ""You have had three or four servants here, constantly, to wait on you, while you have been as helpless "
3946,1853-05-12-seq-1.txt,"as a child."" ""Mr. I'yper, you may dismiss every servant to-day, ana 1 will take care of Adda, and do "
3947,1853-05-12-seq-1.txt,"house She rang lor the nurse, to boo what it was. But, fortunately, all tho servants woro out, listening to an organ grinder in tho street. i "
3948,1853-05-12-seq-1.txt,"Mr. Pyper manifested some signs of life, and the servants wero ordered to take liim into the ihamber below. They wero then dismissed, "
3956,1851-01-23-seq-4.txt,"One of theee is the laundry, with a hydrant at the door, ths other two are occupied hy the servants. Tht hydrant water is introduced into these oottsges ?s "
3959,1851-07-03-seq-4.txt,"carve it, he foun<l the knife rather dull, and, in a midden passion flung it down stairs after the servant who had just brought it; whereupon the "
3961,1857-10-22-seq-4.txt,"they hid fair to beggar everybody but themselves. Then they were the servants of the times, now they are the masters. Their really "
3964,1850-07-25-seq-3.txt,"happiness; therefore, no male person shall be held by law to serve any person as a servant, slave, or apprentice, after he arrives at the age of "
3965,1850-07-25-seq-3.txt,"javuagv r n vcnaiuij auui?B ?ujr J-ri CXJU, WU1I8 or black, to become "" a servant, slave, or an apprentice,"" after he is twenty-one,"" by hu own consent."" "
3968,1854-10-05-seq-4.txt,"they shall not preaoh that we most render to our servants what is just and equal, or they shall be turned out of our country.' In respeot "
3971,1852-11-25-seq-1.txt,"Yet. as some of our party speak French well, and most of the servants at the hotel, shopkeepers, and railway officers, speak English, 1 "
3974,1853-11-10-seq-1.txt,"deeds, n little army of clerks, clergyman, and servants, be set out in search of hi* domain. ""Ma foi, I cannot tind him , 1 look tree, five, "
3975,1853-11-10-seq-1.txt,"bi hare the preoedence. The minuter, backed h by the prieet and servants came up gallantly a to the oombat. With a long trunk between a "
3976,1853-11-10-seq-1.txt,"pear*' service, by the Mosaic law, unless tho ervant chose to oontinuo with his master ; in which case the master carried hira before the "
3977,1853-11-10-seq-1.txt,"lis ear into the door, (39) and from thenceforth te became a servant forever ; hut if he sent him tway free, he was bound to furnish him liherilly "
3983,1850-08-29-seq-3.txt,"The members of the House of Representatives are servants who know their Lords' will, and who mean to do it."" "
3984,1850-08-29-seq-3.txt,"members will have richly earned the title of "" servants who did their Lords' will."" Let those who will vote to surrender to Texas "
3989,1851-08-28-seq-4.txt,"With great regard, your most obedient servant, G. Tociiman. "
3990,1851-08-28-seq-4.txt,1 hare the honor to subscribe myself your Excollency's most obedient servant. G Tochman. 
3991,1851-08-28-seq-4.txt,"Very respectfully, gentlemen, Your obliged fellow servant, Thomas H. Bkntos. "
3995,1852-06-03-seq-3.txt,"' cious than office. J am, very respectfully your obsdisrit servant . John Jv VVqol. "
3997,1852-12-30-seq-1.txt,"bills in his pocket. There was no d""U in waiting, however ; it was only a servant belonging to the hotel The relief he experienced at the "
3998,1852-12-30-seq-1.txt,"said Grace, timidly. ""If you know what a look that servant gave me when 1 asked for you ! Oh, Henry, I feel so insulted, no humiliated."" "
4001,1859-04-28-seq-1.txt,"strangers and neighbors, white and black, and ; couldn't have got their servants to leave 'em, if they'd tried ; but slaveholder has got to mean "
4002,1859-04-28-seq-1.txt,"three weeks, his wife came to me in terrible trouble. A servant, who had been down the fiver with his master, had soen Bill, and he was "
4006,1852-12-30-seq-4.txt,"grateful country desires to bestow upon its distinguished servants in the field; but, in my judgment? "
4007,1852-12-30-seq-4.txt,"That Congress having hy law prohibited the harltoriog au<l secreting of fugitive servant* under a penalty payable to the claimant, no "
4011,1855-10-25-seq-1.txt,"morning, before the Captain had left his bed, his servant entered his room, and gave him a small, thin letter, sealed with a wafer. After a "
4012,1855-10-25-seq-1.txt,""" W here the deuce did you get this from? "" he asked the servant. ; "" From a boy, sir, who brought the horse; it "
4013,1855-10-25-seq-1.txt,Until thy midnight Master call tl His weary servant home. * 
4017,1858-01-14-seq-1.txt,"assiaLed k? ?/> <- ' L'- - - *' ~j jvjui uurnuw servant, it was a quiet wedding; Mary's eight handsome smiling "
4019,1854-10-05-seq-2.txt,"Last week?the Lord be praised for all liis mef ves To His unworthy servant!?I arrived . Safe at the Mission, via Westport; where "
4021,1853-10-20-seq-4.txt,"i th<3 year 1609 wo find the title of an net (22) laying an imposition upon servants and slaves imported into this country, which wive either "
4022,1853-10-20-seq-4.txt,""" Were you not in New York in 1852, and a ad some servants taken from you !"" ! tl ""I am the same person."" S "
4023,1853-10-20-seq-4.txt,"i'ith tho money so handsomely paid me for k io loss of my servants. I returned to Virginia, h lid purchased another lot of healthy young h "
4024,1853-10-20-seq-4.txt,about what it cost* me for interest on capital invested in a servant and his keep. There are some inducements to employ them ; the chief 
4032,1852-10-21-seq-3.txt,""" 1 remain, with great esteem, dear sir. your obliged humble servant, "" Granvili.k Sharpe."" "
4033,1852-10-21-seq-3.txt,"' Thou shalt not deliver unto his master the servant who is escaped from his master unto thee. He shall dwell with thee, among you, "
4036,1857-10-01-seq-1.txt,"lodged in the royal palace of Fontaineblean, sent one of her men servants to my convent, to 1 "
4037,1857-10-01-seq-1.txt,"e to nobody under Heaven for her conduct kn wards her subjects and servants, over jvho*-e he res and liberties she possessed sovereign ha "
4038,1857-10-01-seq-1.txt,"e font of holy water. The next day, the Queen I nt one hundred livres, by two of her servants, ? r masses for the repose of his soul. y "
4039,1857-10-01-seq-1.txt,"oval of what I have done. U nderstand, all of you?servants and masters, q tie people and great?that it was my sovereign ^ "
4040,1857-10-01-seq-1.txt,"heir labor of lcve forgotten by Him who, in lai lie case of the least of Ilia servants wheu sick, o\ emembr a those who visit them.?North lirit- ro "
4051,1852-12-30-seq-2.txt,"bills in his pocket There was no duu in waiting, however ; it was only a servant belonging to the hotel. The relief he experienced ut the "
4052,1852-12-30-seq-2.txt,"said Grace, timidly. ""Ifyou kuewwhut a look that servant gave me when I asked for you 1 Oh, Henry. I feel so insulted, so humiliated."" "
4055,1860-03-15-seq-1.txt,"orderly and well-eonducted, as a people; ob servant of law and police, and with all the old Beraerk spirit of turbulence and fiiibusterism, "
4056,1860-03-15-seq-1.txt,"| him back; "" you forget that you are not in New r "" If that is your servant, sir, said the Eng| lishman, in a polite way, but giving ever^ evidence "
4057,1860-03-15-seq-1.txt,"' do, and more ; and are so ungentlemanly as to ? annoy her directly in the face of her servant's 1 remonstrances."" "
4061,1851-06-12-seq-4.txt,"But hi that is greatest among you shall be your servant, and whosoever shall exalt himself shall be abased."" The custom of making distinctions between "
4062,1851-06-12-seq-4.txt,"With great reepect, I am, gentlemen, your moet obedient servant. FERMIN GROUPAZ. TRUTH IS STRANGER THAN FICTION. "
4065,1853-03-03-seq-1.txt,"girl, thinking, "" How ia it that in aonie things nhe in observant V But Rosalie, almost unconsciously. wan repeating to hrrnelf the refrain of "
4067,1851-05-29-seq-2.txt,"the two letters ? ""I accept it,"" said Mr. Sumner, ""as the servant of the Union, bound to study and maintain, "
4069,1858-11-11-seq-3.txt,"o say who shall and who shall not be elected? , ihall be, in short, ceasing to be a servant of the rill of the people, Isecome their master, their 1 "
4071,1850-06-27-seq-1.txt,""" Why?beoauee it is so dismal, coming home to a cold, dark house, with no one but the servants, though they are warm-hearted poor creatures, "
4072,1850-06-27-seq-1.txt,I know there are many degree# in the miseries of slavery. Home masters treat their servants with great kindness ; othert more severely; others 
4077,1850-09-26-seq-2.txt,">on the subject may dictate. C "" Very respectfully, your obedient servants, "" C. L. Brows, "" "
4078,1850-09-26-seq-2.txt,"mmon belong. ' "" I hare the honor to be your obedient servant, ""J. Lowkky. "
4082,1850-02-14-seq-2.txt,"These vary from the site of oven tope to that of tea-table top*, and are destined for tbe servants of the different bouses. The right to receive one "
4085,1858-07-01-seq-1.txt,"fo; ad how thiraty I was, she rang the bell, and ' sp ke to the servant ia that gentle, queenly w-i i oi hers, that he knew ha'd got to mind, "
4087,1854-08-31-seq-3.txt,"i- runaway slave of ex-President Tyler's, wl t, was his servant, and left him at the spring > It would take a oompany of soldiers to tal "
4088,1854-08-31-seq-3.txt,"and fights of Freedom. Very respectfully, you* obedient servant, D. WlLMOT. "
4089,1854-08-31-seq-3.txt,"Esq, of Fauquier oounty, Va., is the owner of 1 Henry Tyler, a valuable servant, whose wife j and nine children will be freed by the heirs of t "
4093,1854-03-23-seq-2.txt,"n Massachusetts this accursed bill has found io servants. * Sire, 1 have in Bayoane honest citizens and bravo soldiers only, but not one excutioner,' "
4094,1854-03-23-seq-2.txt,"might seem to be true. 1 am, Bir, your obedient servant, Charles Sumner. "
4098,1855-10-04-seq-1.txt,"igined that it was an especial mark of nobility i :o treat a tutor as a sort of upper servant. Af- t :er a year spent in this manner, Mannerstedt < "
4099,1855-10-04-seq-1.txt,"it is?so it is. I recollect, now,"" said the little j great man, signing to a servant to place a chair 1 for the stranger, which, however, Frank declined. "
4102,1859-05-19-seq-1.txt,and cheaper than other books; yet a pocket Bible cost half a guinea. A servant girl did very well when she got thirty shillings for a year's 
4103,1859-05-19-seq-1.txt,"country a mischance or misjortune. When servant girls, of more confidence and affection than prudence and caution, become "
4104,1859-05-19-seq-1.txt,"wished to De annoyed with the encumbrance of a servant's child. Some, indeed, out of charity, would allow the girl to remain, and raise "
4108,1853-01-20-seq-4.txt,"authorized hy Moses to enslave were white; [ tioi and the slaves, or servants, whom Paul and ma IVter enjo.ned to !>e obedient to their masters, > der "
4111,1852-05-20-seq-2.txt,"to the simple dignity which belongs or ought to belong to the servant* of a free |teople I Having simplified the style of addrcsa, suppose "
4112,1852-05-20-seq-2.txt,">e if they followed hiin. To an inquiry of the ervants, as to whether he sometimes did not neet with difficulty, he replied that he had got "
4114,1857-07-09-seq-1.txt,"the house, and treated me just as they did the other servants. This did not trouble me half so much as it did Miss Annesley, whose gentle "
4117,1855-04-12-seq-4.txt,"the ages of ten and fifteen, who, with an Irish man servant, constitute the whole household. The committee consisted of but seven "
4119,1851-06-26-seq-1.txt,"' What, our Tom??that good, faithful creature?been your faithful servant from a boy. Oh ! Mr. Shelby?and you have promised him his freedom "
4120,1851-06-26-seq-1.txt,"from that State: "" I accept it as the servant of the Union ; bound to study and maintain with equal patriotio care "
4123,1850-12-26-seq-1.txt,"ihat be himself is but the creature of the people's sill?their servant?elected to execute their purposes. In the enactment of this law, their feeing* "
4124,1850-12-26-seq-1.txt,"not reprc-entrd in this body at the puanigeof that law Their servants fled from this Hall, anJ left the interests, the rights, and the honor of their "
4125,1850-12-26-seq-1.txt,"and Pinckney of South Carolina moved to amend it so as to "" require fugitives, slates, and servants, to It delivered up like criminals."" "
4126,1850-12-26-seq-1.txt,"propriety in the public seizing and surrendering a fugitive slave or servant than a horse."" And on these suggestions Mr. Butler withdrew his proposition. "
4133,1850-05-23-seq-2.txt,"I am. gentlemen your much honored, obliged and obedient servant, Horace Mann. H1K IN A1I'CfiVAL' EKA. "
4135,1853-02-03-seq-3.txt,"men, and are not guilty of one of the sins specified. They do not hrutaliie their servant*; they do not enshroud one in iguorance ; they "
4136,1853-02-03-seq-3.txt,"might be retorted. Satan ha* no involuntary servants. He ia am Abolitionist, and 'an accuser or Hia brethren. "" "
4140,1859-10-06-seq-4.txt,"? But notwithstanding this seeming equality ^ l>etween the master and his servants, there is, ( to a close observer, a vast difference between "
4143,1850-02-07-seq-2.txt,manifestations in the law which protected the fugitive servant from beiug seixed by his master and secured to him tho protection and hospitalillna 
4144,1850-02-07-seq-2.txt,"Unless they soon awake, uud speak such a langu ge to their public servants as they cannot misunderstand, their honor and rights will "
4148,1854-09-21-seq-4.txt,"\ aotion?a result which, with the aid of the - immediate agents and servants c-f the Govern ment, constituting a large number of the Con "
4151,1853-01-13-seq-2.txt,"we were not to hang up our stockings for our annual gifts until he came home, 'l'he servantman had also gone three miles away to visit a "
4152,1853-01-13-seq-2.txt,"than sumptuous home, and troops of frien.fs, and trains of servants, and blushing bride? where, lying perdue at your sen ice, is a plenty "
4157,1856-06-19-seq-2.txt,"at this time. "" Very respectfully, your obedient servant, "" E. D. Morgan, "
4158,1856-06-19-seq-2.txt,"the object of my mission, I remain, sir, your t obedieut servant, J. B. Desplacb."" t COL. BEVTOH'S LETTER OF ACCEPTAHCE. I "
4161,1853-05-12-seq-2.txt,"tnsors only arc censured. Your obedient servant, C. M. Cj.at. P. S. I recommend the latter part of your "
4163,1850-11-14-seq-4.txt,"' compels us to deny the holy injunction, ""Thou shalt not return unto his master the servant that | has escaped unto thee. Therefore, "
4164,1850-11-14-seq-4.txt,"right of property in man, and requires each citizen to deliver, or assist in delivering, the escaped servant to his master, contrary to the express divine "
4165,1850-11-14-seq-4.txt,"I The Km piny er b The del dor 14. The State 5. The Servant III. The Teacher 15. The Neighborhood Mr. Hine has no pecuniary means to publish anything, ( "
4166,1850-11-14-seq-4.txt,"One of these is the laundry, with a hydrant at the door; the other two are occupied by the servants. The hydrant water is introduced into these cottages as "
