,date,context
0,1852-05-27-seq-1.txt,"of the constitution-and then require from all their public servants, fro'm the highest to the lowest, a strict nnfiinch "
2,1851-05-22-seq-3.txt,"proofs of your claims toth'atligkppellistion,if your servants are the only beings en -earth fromas whom you can resent an injury. -Every -cow "
4,1854-07-13-seq-2.txt,"endorse every word of it: 'a In it we meet with well trained servants, comfortable beds, ventilated rooms, fine water, "
6,1851-05-08-seq-4.txt,"never k nowvn to speak a harsh or unkintd word t a servant, it may well be said hers was a trul; lovely spirit ; nmor wvas site wanting in firtmnes "
7,1857-12-16-seq-2.txt,"render the due ineed of applause at once, to the aged and devoted public servant who now guides the helm of State. "
8,1853-03-30-seq-2.txt,"more wvarmly devoted thtan wias his management-and treatment, of the servants Ihe held, kind and humane. And to this point in his chiarcacter we would call the "
10,1855-01-03-seq-3.txt,"just been thoroughly renovated and repaired ; good I and faithful servants shall always be in attendance, t and the guests of the House shall not want for any "
12,1857-10-14-seq-4.txt,"Heavy White Dome'stic Flannels, at low price.: Superior Red Flannels, for servantLe, at very low priots. "
13,1859-03-09-seq-2.txt,"him I didgn~kow, 14that the. Ameripcans would like the younger ones or- servants. Hie said that' would be very kind. lie asked me bow many were "
15,1864-08-03-seq-1.txt,"much like that in which she would reprove a servant for breaking a china plate, "" Elizi, ?o in there and see what's damaged this "
16,1851-03-20-seq-4.txt,"sufflered amputation with the greatest courage, he saw his servant crying, or pretending to cry, in one corner of the "
17,1852-10-27-seq-3.txt,"Cottaon llOSEj eavy Worsted and Cotied JlQSE, for servants ; 10.4, l2.4 and 14-.4 sup. Marseilles Q UILTS; "
19,1861-02-06-seq-2.txt,"chiefest joy; Che sister's pride, the servants' hope, the sons who we believe "
21,1859-02-09-seq-1.txt,"I have tho honor to be, most respecfully, your. obedient servant, .. H. HA MMOND. PF.Y.FR HAWVEyr, Esq., Boston. "
22,1857-08-26-seq-4.txt,to gratify the taste of the epicurean will be supplied in abundance. The servants of the CAROLINA HOTEL are noted for their polite and attentivechar 
24,1858-05-05-seq-4.txt,"A variety of Goods for MEN and BOYS wear; PLAIDS and STRIPES for servants; French, English and American PRINTS, in "
26,1857-01-07-seq-7.txt,"New Orleans'between Jackson' and Packenham. th~ 87 A gentlenia1 observing a servant girl, who th as left handed, placinig ths kqivss and forks ona "
27,1857-01-07-seq-5.txt,"f New Orleans'between Jackson and Paekenhlam 87 A gentlenlar observitng a servant girl, who ra left hiandled, placing thy krgiv'es and forks on "
28,1858-11-24-seq-3.txt,"at Gj o'clock. ADMISSION 50 Ceuts; Children and servants, half price. V/ a "
30,1858-11-24-seq-3.txt,"tolerably quick spoken. He has been raIsed In tlh kumse, and Is a valuable dining-room servant and good ostler. "
31,1861-06-05-seq-2.txt,"ing A Present in Parting. tot, The servant sof friend lsaneseni i;rz, brought to the our offnce Monda~y mirning a bn.-ket of very fine "
32,1851-12-25-seq-2.txt,"self frielndly ; and as a mlistress, sceurinlg the al tachmn~ent of lher servants by an hlonest enok-avor I to obey thle requlirm1ent of thle Gospel, ill "" giv "
33,1851-12-25-seq-2.txt,"to obey thle requlirm1ent of thle Gospel, ill "" giv ing unto her servants that wthich was just and equal, knowing thlat shle also had a Master ill "
34,1851-12-25-seq-2.txt,"univerral jubilee, when Ihe high and the low, the old and the young, the master and the servant, men and wonien should see in each others' faces "
35,1851-12-25-seq-2.txt,"in accents of love and tenderness--let the pture servant of Godl preach the mercies of christianity, and not the terrors of the law-let the statesman "
38,1865-11-15-seq-1.txt,"on services of gold anet. - sjlver^re- presented by ttveriiri servants to Cor? Journab- .. ' v. ; !:""--; -'..-*'.' * "
40,1858-08-18-seq-1.txt,""" Well, Miss Mariani, who arc you bringing here now ?"" asked the servant womian. "" A poor boy, who is almnnst perished ; you "
41,1865-05-17-seq-2.txt,"Why, the nr-.v' tiring will be to associale with j o.;c's servant iiiaidv' ""iiut, linumtj it is merit that g?vos tm*! "
42,1865-05-17-seq-2.txt,"ti this hour of your, of our, nation's calamity, i'our obedient servant, ' J. IL JO.VKS. ? ""ARREST br G H LAMAR.-Mr. G. II. Lamar "
43,1854-06-08-seq-4.txt,"is. d So saying, lie followedl the servant intoan the kitchen ; to the great surprise of her a e "
44,1854-06-08-seq-4.txt,",, Street, arid ough itrnowv,"" as thre maid servant 2~epots ur she knocked thle bottom out of' those ty ti "
45,1857-04-08-seq-4.txt,"giving the bell-knob a cautious pull, was soon admitted by the servant girl. The following dialogze then and there took place: "
46,1857-04-08-seq-4.txt,"be over in the course of the day,"" he took his leave without subjecting the servant maid to a cross-examination. The joke got "
47,1858-06-16-seq-1.txt,"""Faithful to the teachings and example of the apostles, she has always taught servants to obey their masters, not serving to the eye merely, "
48,1858-06-16-seq-1.txt,"but as to Christ, and in His name she commands masters to treat their servants with humanity and justice, reminding them that they also have "
51,1858-06-16-seq-1.txt,The best cure for hysterics is to discharge the servant girl. Some women think they want a physician when they only need a scrub 
52,1856-07-16-seq-1.txt,"te citizens thereof. . -. - - -:.. Your obedient servant,--* - JOH N A. Wi-NSTON "
53,1858-11-17-seq-4.txt,quisite to gratify the taste of the epicurean will e supplied in abundance. The servants. of the \ 'ROLINA liOTEL arc noted for their polite and 
55,1858-11-17-seq-4.txt,"tolerably quick spoken. He has been raised in the house, and is a valuable dining-room -servant and good ostler. ---. "
56,1851-10-23-seq-2.txt,"watching the return ocf heis labor. ie is hcappy to see heis- well-fed servants ""driving thecir joctcncd teams afield"" to gathecr ice thce remnant of his crop. "
58,1851-10-02-seq-2.txt,"the honor you have done me. Your obedient servant,i N. L GRIFFIN. f "
59,1851-10-02-seq-2.txt,"another mandate might lhe forth-coming. This is the master speaking to the servant-and this is in strucetion : the other, according to all the rules of . "
60,1859-09-14-seq-2.txt,tmoey can be permitted to retain their natural icrease of servants for the cultivation and i rovement of their own soil. Dr. Lee 
62,1857-09-09-seq-2.txt,"presides ovcr thre culinary department. Thme dis cipline of tire servants too is very good-and, in: fact, everythming is conrducd about tire Iiote' a. "
64,1857-09-09-seq-2.txt,"wound, and was borne oli the field by Israel, a negro servant of Capt. Marshall. It is a corn mnicdble spirit that prompts a companion in "
65,1851-12-25-seq-1.txt,"pale brow. At this moment a servant annonncd Miss Florence Rivers, at which an universal ""' merry "
66,1865-12-06-seq-3.txt,"Also, a lot of READY-MADE CLOTHING suitable for servants, which I will sell at rory reasonable rates. "
68,1854-12-27-seq-3.txt,and EDGINGS. Besides a large stock of housewife and servants goods. They respectfully ask thoso making their 
70,1862-10-29-seq-2.txt,"ittg that tbe old hero was in the house, we sent up a servant desiring an interview, which was readily granted, and we heard the General talk for a hall "
71,1852-03-11-seq-1.txt,"danttgerous illness, I experienced a painful shoek. I flew to his house. A servant told me itn a whiicr that tno viitor "
72,1853-10-19-seq-1.txt,"Gold Ney Found. PICK ED) up ian thais Vi:!age, lay a servant, a L GOLD WATClI KEY, wiche thne ouwner "
73,1852-03-04-seq-3.txt,"ie was kindl and obliging, atreetionate to his child1ren and friends, indulgent to servants, and universally beloved by all wvho knew. "
75,1864-08-03-seq-2.txt,"ighest respect and esteem, Your obedient servant, (Signed) C. G. MEM MIN GER. "
76,1856-05-07-seq-3.txt,"cheap; th Blue HOMIESPUNS, super. quality for servants; an 10, 11 and 12-4 Cotton and Linen SHEETINGS; co "
78,1858-09-15-seq-1.txt,"earned the meed of "" well done good and faith ful servant."" 'Thaf, others, of our delegation in Congress "
79,1858-09-15-seq-1.txt,"I have the honor to be, Your obedient servant, CHARLES MCDONALD. "
80,1857-04-08-seq-1.txt,td you have Mrs. Douglas as she appeared to rour umble servant on this memorable morn T E Nr~w Barrrsu MrNISTF..-.TheO Wash 
81,1855-07-18-seq-1.txt,"disadvantage to you to know how to-bver, see a servant girl, and instruct her to do these things as you 'wouldenes them done. "
82,1851-05-01-seq-4.txt,"your house, I will go at once, and wfith. out the interference of servant."" ''he la dies roared with laughter, and took some "
83,1851-05-01-seq-4.txt,"nance Svsp1C1ous.--A servant girl whispered to neighbor Abagail, one night. "" Now "
84,1864-09-21-seq-7.txt,"con ri'tUte to the Tax in Kimi ; all slaves under 12 years of age ; kouue servants, c.rjieriter;"", ?nj servants p it -employed on tbs farm | bnrcf.., "
85,1864-09-21-seq-7.txt,"12 years of age ; kouue servants, c.rjieriter;"", ?nj servants p it -employed on tbs farm | bnrcf.., muios and ali other stock] 0?tUn, wool, tobjicce, "
86,1864-09-21-seq-7.txt,"I haye the honor to bo, Gen., Yc-y respectfully, your obdtj servant, '* ' J. B. Hoot), Gea. "
87,1864-09-21-seq-7.txt,"by bim. 3d. All house servant?, carpenters, handicraft men of all kinds, draymch. day-laborers, body "
90,1864-09-21-seq-3.txt,"SUBRMAX'S ARMY lis ATLANTA.-Gentle men from Atlanta, cool, observant aud relia ble, and'who have ""enjoyed'1 several days "
91,1859-09-21-seq-1.txt,"refuased to have it administered. AN Irish servant having entered the draw ing-roomn, with the ni-tress's favorite poodle "
92,1856-06-04-seq-3.txt,"so, the best plan fur the spiritual iustiuetion of r servants. S. P. GETZ1im, MoDPRA-roa. "
93,1856-06-04-seq-3.txt,"'avillion h1BOBBNETTfS leavy PRI NT1S, at very low prices, for servants: (hinon Gula PLAIDS, Lancaster GINGHAM.:. "
94,1856-06-04-seq-3.txt,"Heavy COTTONADES, of various styles, fis iale servants : Pain u hite, Brown. Buff and Fancy DRII. "
95,1856-06-04-seq-3.txt,"(hinon Gula PLAIDS, Lancaster GINGHAM.:. nd Marboro PLAIDS for female servante; Heavy COTTONADES, of various styles, fis "
100,1859-02-09-seq-3.txt,been out of order. My wife had no difflcul-y in in.structing a servant in the use of it. I am fully persuaded that no invention of the age is more 
101,1851-02-13-seq-1.txt,"nothing, for I have contrived to send your wife and servants out of the way."" "" Monster! is it thus you repay the "
103,1851-02-13-seq-1.txt,"not finding her husband in his usual place, she desired the servant to tap at the office door, which was his usual signal. The "
104,1851-02-13-seq-1.txt,"door, which was his usual signal. The servant did so, and receiving no answer, brought back word that his master was "
105,1851-02-13-seq-1.txt,"with the messenger, accompanied by a female servant and her infant, leaving the house in charge of the man servant, not "
106,1851-02-13-seq-1.txt,"female servant and her infant, leaving the house in charge of the man servant, not without some reluctance, as he had been "
107,1851-02-13-seq-1.txt,"On entering the sitting-room, Mrs. M. rang for the man servant, but no one an swered. Putting her infant to sleep in "
108,1851-02-13-seq-1.txt,"husband. Eleven o'clock struck-twelve -one, and neither master nor servant re turned. Poor Margaret could no longer "
109,1851-02-13-seq-1.txt,"There was a witness to this scene-thre man servant, who had been corrupted by Fane, and who sharred the contents of the "
110,1855-02-14-seq-3.txt,"just been thoroughly renovated and repaired ; good and faithful servants shall always be in attendance, and the guests of the House shall not want for any "
112,1862-09-03-seq-3.txt,"tue rou:ts well ve:itilated ntind sertuiiuusly den, i e servants a:ttentive and polit anti what is l-e-t -f a; the landlord I-' a gaoi Southern u. .n. "
114,1851-08-07-seq-1.txt,"liness. Now, what gave to that servant of Christ a power so strange over a people "
115,1851-08-07-seq-1.txt,ayes were >ores. to sigmify t le oh iga. tions of the servant to harken to the com mand of his master -Rings were after 
116,1863-01-07-seq-4.txt,"t~3 May 0yo b'ctme a bceliever in our Lord IJesus Christ, whose. servant I prctfcess mys self'; ands may we amitt in heaven, if 1,v-e "
117,1856-12-10-seq-4.txt,"arrangement on Monday the 10th of No vembei we bundled up the children, servants and biggage and rolled out the old Court "
119,1859-07-06-seq-2.txt,The price of admission will be.50 ets. Children and servants half price. Negro Killed. 
121,1856-07-23-seq-1.txt,"of this towc, says the Charlottesville Advocate, had one of. his servants to runaway last Monday, and having strong reason to auspect that he had "
122,1856-07-23-seq-1.txt,here is a t1delity to a master which implies too tie relf-respect in the servant. Air. Cramplon e ipears to have wanted self-respect in the kind 
124,1856-07-23-seq-1.txt,"further. I am, respe.tfully, your friend and 6 dient servant, Jous IL Savios lion. Preston S. Brooks. "
125,1857-03-11-seq-4.txt,111 green tea. AT TABLE.-Instruct your servants al rays to serve a guest at the left hand ; 
127,1853-03-16-seq-5.txt,"to the landlord's surprise in a few minutes the servant returned to inquire for his mas. ter, which of the forks of the road to take "
128,1856-05-14-seq-1.txt,"response to the bell ringing, by a more in ordinarily well-d'ressed male servant. s the minister within !"" hurredly Aske4 hp "
129,1854-03-29-seq-1.txt,"tiani era'-that it was sanctioned by ou r Savi our, w~no enjoined upon servants obedience to their masters; that itwas to be found in "
131,1858-07-14-seq-1.txt,"mud devotion for assistance from on High ott htis' ellow-servants. Afier- prayer such kis.ing and tl 'my as was manifested by the -friendIs of each, of "
132,1858-07-14-seq-1.txt,"Louple to be united in thle holy bonwls of matri- s mnony by Iter. -Join Rosser, servant of Mnijor b Johmn Rosser, of Camden, South Caiolina. h "
134,1854-11-16-seq-2.txt,any) must attach to the public of whotn we are only the servant. Deceptive Pills. 
135,1852-08-25-seq-1.txt,"inside a parlor,' which communicated. The servants W to bed, the house was shut up for the t, and the supper tray, "
137,1852-08-25-seq-1.txt,"with this letter. Very respectfully, your obedient servant, Enwi DaLiox. "
138,1852-08-25-seq-1.txt,"I am, with high esteem, your most obe. Jient servant, FANK. PIERCE. EDwIN D LroN, Esq., Washington, D. C. "
139,1858-04-28-seq-2.txt,"SAbut they areiaferior rie-'plautation hands generally, '. or (what is worse,) spoiled city servants. IN FOR IT. "
141,1858-07-21-seq-3.txt,requisite to gratify the taste of the epicurean will be suppllicd in abaundance. The servant4 of the C\ROLINA HOTEL nare noted for thbeir polite and 
143,1858-07-21-seq-3.txt,"tolerably quick spoken. He has been raised in the house, and Is a valuable dining-room servant and good ostler. "
144,1857-07-29-seq-3.txt,to gratify the taste of the epicurean will be supplied in abundance. The servants of the CAROLINA HOTEL are noted for their polite and attentivechar 
146,1859-07-27-seq-5.txt,been out of order. My wife had no difficulty in instructing a servant in the use of it. I amh fully persuaded that no invention of the age is more 
147,1855-02-14-seq-2.txt,"without physicians, and those that have physi cians are without servants and medicine ; but the people !ay it is breause so many wounded "
148,1855-02-14-seq-2.txt,"and fine attention. Yetow Jucus there, one of the smartest servants in Augusta, and Joe waited on us. When you go down, call for Joe. But besides Joe, "
151,1855-02-14-seq-2.txt,"trustees!? With all your learning don't forget to learn liberality to that hard-run public servant, thcparinter. E on. 3. L,. Orr. "
152,1855-02-14-seq-2.txt,"affairs; and was the last of the family thit retired to bed on Sunday night. When the servant went to call her up for breakfast next morning, she was "
153,1861-07-10-seq-2.txt,"..-opie gaVe the election. The people them Aves, not their servants, can rever-e the de isinl as priv.etu Cit izens. Bumtte Executive "
155,1852-04-01-seq-3.txt,was recently troubled just as wve have been--:bat she forthwith despatcedt a servant for powder amnd shot-that she armed saidl servant after night-fall 
156,1852-04-01-seq-3.txt,she forthwith despatcedt a servant for powder amnd shot-that she armed saidl servant after night-fall with a double-barrelled gun-that i-le stationed 
157,1852-03-04-seq-1.txt,"the Courier: "" A servant called on the gentleman in question yesterday morning and handed him "
158,1852-03-04-seq-1.txt,"which she requested him to collect and give the amount to the servant. He, not for a moment suspecting any fraud, went to the "
159,1855-05-02-seq-2.txt,to his old home to pass the remnant of his dlays. Slav the aged servant be yet spared many years to dispense the teachings of his Master among the erring sons of 
160,1861-09-18-seq-1.txt,"I am. sir; very respees[lilly, Your uledient servaut, [Signed j .M L. Bomu. "
161,1863-10-07-seq-2.txt,"af the time of the assault. Respectfully, TOUT obedient servant, G. T. BEAUREGARD. ? "
162,1859-04-20-seq-1.txt,"border slave States have always used negroes mostly for house servants, and to work in the farm during seed and herrest time, which are the only "
164,1859-04-20-seq-1.txt,"li e, I do not doubt: Very reepcctfully, yotti tibedieht servant; IIowKrLL Coas, Esq. "
165,1854-06-22-seq-1.txt,"eet. a'moet adored by tier pairents, petted and ca rssed by her ftii nis and servants, breathing an .i tosphere of hnttury, and sutrroutnded from her "
167,1865-10-11-seq-5.txt,"founded mock turtles on me !' (glT* A servant being sent to match a china plate, returned with one of an en "
168,1864-04-21-seq-1.txt,"ed thanks to fry good friends, "" I subscribo myself Their rory obliged servant, SAMUEL STEVENS. "
169,1864-04-21-seq-1.txt,"articles at the same generous rates. One gen* tientan employs a servant to catch shad, and seHs thom to refugees at- 50 cents each, al "
170,1856-08-13-seq-2.txt,"the same for publiontion. Very respeetfull your ob't servants, LOUDON BUTLER) "
172,1852-06-03-seq-2.txt,"sins were forgiven him, and exhorted his fello' Iservants to takIce warning, from his example, an from that hour to preptare fbr. eternity. Hie wr "
174,1857-01-28-seq-2.txt,"Presently' they JII(ll came haec;. Lucy and r nmothier, and all thec maiid servants, f'rom t inn. besid.-s my~ telow-studaenits and fish "
176,1856-06-25-seq-4.txt,"Also, the beit plans fok~ the spiritual instuection of our servants. S. P. GETZEN, MonRAa'roai. t "
177,1856-06-25-seq-4.txt,"reeeved a large assortment of Mlue lUome spuns, for servants' sunimer wear-,bandsome pat-, ' terns, and very eep. "
178,1856-06-25-seq-4.txt,"henp;. Blue O.1\2SPUNS, super. quality for servants; 10, I1 and 12-4 Cotton and Linen.SiI EETINGS; "
182,1855-03-14-seq-4.txt,"and EDGING3 3esides a large stock of lo ttgeirife *0 servants"" foods. They respectfully Asit tiobb finlift fMeiro "
184,1858-08-18-seq-3.txt,Plaid LINS EYS-a superior at ticle; Heavy FL XNNELS for servants. Together with a full assortment of' 
186,1856-07-09-seq-4.txt,"lep; Blue HIOMESPUNS, super. quatlity for servants ; 10, 11 and 12-4 Cottont and Linen SiIEETINOS; "
188,1851-11-13-seq-1.txt,"join them, and on his arrival found them all dead,servants included, with the exception of the child here mentioned. In less than "
190,1854-05-11-seq-5.txt,"another, and so on, until they use up the patch. Very respectfully, your obediett servant, GEoRGE D. Nonuis.I "
191,1859-03-16-seq-1.txt,"Squires the tenore for her attendant. Scarcely were these seated, before a servant entered, leading a young man of about 22 or 23 years "
192,1859-03-16-seq-1.txt,"brought forth much amusement. ie confined his conversationi exclusively to the servant, and occasionally would step and listen when Stra "
193,1859-03-16-seq-1.txt,"""Limuby, my darling I"" said his mother; and the servant was called to wipe Limhy's mug, and piek tile pudding from the floor. Limby "
194,1865-12-27-seq-2.txt,"I have the honor tu be, very respectfully, your obedient servant, U. S. GRANT, Lieut. Gen. "
195,1852-10-06-seq-1.txt,"!!age was owing to the circumstance that few servant~s wvere present, and succeeded stopping the fire before it had done much "
196,1858-06-09-seq-4.txt,"A variety of Geods for MEN and BOYS wear; PLAIDS and STRIPES for servants ; French, English and American PRINTS, in "
198,1854-08-31-seq-1.txt,"ded that it should not be "" cnis:rued to afect apireWntices uder ige, or servants bought for tittle.' "
199,1854-08-31-seq-1.txt,"dimee themi in America. It is an easy matter ini at free government, to hold public servants to a strict ac couintability to law ; anid where life and "
202,1857-11-11-seq-4.txt,"1I. avy Wh'ate Domaestie Flannels. at low prices: up.eror Ried Flannel'i for servanta, at very low The publie are respect nilby ,rested1 to call and dla1 "
204,1859-03-30-seq-4.txt,en out of order. My wife had no difficulty in structing'k servant in the use of it-. I anm fully ersuaded that no invention of the age is mere 
205,1859-08-03-seq-1.txt,"down; a few drops were sprinkled on the floor, and the affrighited servants drew b-tek. The snake unwound himself, and made for "
206,1859-08-03-seq-1.txt,"Maxey, as he bound from his chair, and fell senseless into the arms of one of his servants. In another instant we were all dispersed, the "
207,1859-08-03-seq-1.txt,"spilt on the floor."" Churchill cautiously gave the order, and a servant slipped out of the room. ""Don't stir I Northcote, you moved "
210,1859-08-03-seq-1.txt,""" Here, John,"" said the gentleman to his servant on horseback, in the rear, ""come forward, and just take hold of my horse whilst "
211,1861-11-27-seq-2.txt,"re enemy on Mr. Stoddard's premises, direc ng the servants in driving up the cattle and orses. They had two mules. in one of the "
213,1861-11-27-seq-2.txt,"ther confidencae and support. Very truly, your obedien' servant. WHIT. WALKrER, "
214,1854-11-29-seq-4.txt,and EDGINGS. Tks*les a large rstoc of housewife and servants .h:. Thmey respectfu'ly ak those making their 
216,1858-07-07-seq-4.txt,"A variety of Goods for MEN and BOYS wear; PLA IDS and STRIPlES for servants ; French, English and American PRINTS, in "
218,1856-10-08-seq-3.txt,"or ag't. W. Huarris, W. Haltawanger, M1. N.110o1 . lingsworth. H enry, servant to .\r. Adams. Jl.-T1. Jones, J. "
219,1858-10-27-seq-3.txt,requisite to gratify the taste of the epicurean will be supplied in abundance. The servante of the C A ROLINA I IOTEL are noted for their polite and 
221,1855-08-08-seq-1.txt,dings in Philadelphia growing out of the kidnapping of Mr. Wheeler's servants. AWhen we read such accounts we confess 
223,1855-08-08-seq-1.txt,"Br.ACE.I,, who cholked the lady -in tb. cars and robbed her of a servant girl, has. been married to Lucy Stcine., Justice la "
224,1853-02-16-seq-2.txt,"I have the honor to be. very respe-etfullv, your obedient servant, F. W. PICKENS. Messrs. H. A. JONES, J. J. MARTIN, C. II. "
225,1859-08-10-seq-1.txt,"wife applied to him for work in his family in the capacity of servant girl. The situa tion was given her, and she now does the "
226,1859-08-10-seq-1.txt,"superior, I am, your obediont servant, * Tuo~zas Fax. "
227,1858-06-16-seq-2.txt,"our low country; these old gentlemen ought to lace, but do not, they are past the age. Maid servants in trim caps, having in charge children of all ages, from "
229,1853-12-07-seq-3.txt,when the decree went forth' that the measure of hier .dnties was full and the servant was catted to tier reward. 
230,1853-12-07-seq-3.txt,"tiensan. "" Keep cool,"" if your servant hsas been disobe dient or imnpnsdent. Don't catch up a fence-rai "
231,1864-04-06-seq-2.txt,"cervices eleven dolk-.rs by the m?ritb, and bis ca ptain's .servant gets thirty-five. A targe part cf the lime his feet have been on the "
232,1854-08-24-seq-3.txt,"Their table, although not at all elegant, is comnfurta he arid cleanly, their servants are attentive arid well bsehaved, thir ice isfreely atteservice of visitors, "
234,1858-12-22-seq-4.txt,"And respectfully invite an examination of my Stock and prices. Also, on hand a good assortment of BLANKETS and WOOL HATS, suitable for servants. Mr. JOHN LYON is engaged in the above Establishment, and will be "
236,1858-12-22-seq-4.txt,"tolerably quIck spoken. He has been raised In the house, and is a valuable dining-room servant tad good ostler. "
237,1856-07-09-seq-1.txt,"I have the honor to be, Respectfully, your obliged servant, P. S. BROOKS. "
238,1859-07-20-seq-4.txt,".interst from date, a very. likely Xer girl, about 17 years of age, a goodl house servant, and perfectly sound. Also a fine young XNegro fellow, "
239,1859-07-20-seq-4.txt,becen out of order. My wife hatd no difliculty ini instructing a servant in the use of it. I amn fully persuadedl that nto invention of the age is more 
240,1852-01-29-seq-2.txt,"occurred from a candle in the iands of a little t servant girl, sent by the fhmily, (as was their custom) to remain with the child, but circum "
241,1858-12-15-seq-4.txt,equisito to gratify thu taste of the epicurean will )e supplied in abundance. The servants of the IAROLINA 110TEL are noted for their polite and 
243,1852-07-21-seq-1.txt,""" Thanks, senor; I will, accept your invi- i ition; but your servant need not dismount."" I And the young man disappears for a mo. I "
244,1855-07-11-seq-4.txt,"take of a Barbecue with our Negroes, (as it is customary to give our servants such treats when the crop is laid* by,) and we would be "
