,date,context
236,1853-06-04-seq-1.txt,"Persons stopping at h»*» house will find clean beds, good lure, and attentive servants; and! mav lecl confident that their hornet will receive "
238,1852-06-19-seq-1.txt,"VII thuse partieulnrt the doctor heard irom the servants and neighbor*, and the interest bo f«it foi the child thus singulailv "
240,1860-06-30-seq-3.txt,"prnf t, who are inflating the abodes of j our heretofore happy servants, and »tir ring up their mind* to revolt, or to run "
241,1860-06-30-seq-3.txt,"ing of tlia' word—a word that is applied inaptly to negro servants. Aft towns, and more especially the town* on and t "
244,1853-05-28-seq-1.txt,"They havo experienced cook* and attentive servant*, and the comfort of hoarder* will he especially attended to by the proprietor*. Mr. ' "
245,1857-02-21-seq-2.txt,"I am voiy respectfully, V our obi servant, KDVVaRL) CI \KK. "
246,1857-02-21-seq-2.txt,"II K Runnels, w e fir..I ,% consistent demos crat, a f;i:lhfuJ public servant, an enemy to monopodia of every character and descrip "
247,1850-08-31-seq-2.txt,"eration, I have the honor to be your Excel lency's most obedient servant P II Brll. "
248,1850-08-31-seq-2.txt,"I have the honor t<» be, yy ith entire regard, vour I'.xcellenc v's most obedient servant, da\ii:l w kiistkk. "
249,1854-09-09-seq-1.txt,"Is nol this m> palace? Saw you not my servants ( You are my guest! "" "" V\ ill you not fit down nm! tell n»e "
