,date,context
3068,1858-08-14-seq-1.txt,"for admission in duo form, lie would vote for its admission, whether slave or free. In conclusion, he said his advieo to the I "
3069,1858-08-14-seq-1.txt,but one Southern man (Mr. Atchison) expected Kansas to beeotne a slave State. The hill established a great principle?it wiped 
3070,1858-08-14-seq-1.txt,"had shown its faith by its works. ""With roI gard to slavery, ho thought it bettor protected now under the Government than it had "
3071,1858-08-14-seq-1.txt,"that Mr. Blah's '.'trui, near this place, iHno present cultiv:1! <1 by slave labor, but this does not nlt< r ...tonally the last picture >f "
3072,1850-05-31-seq-3.txt,"crew of 11 persons, 30 passengers, nnd 647 slaves, was captured on the 20th February Inst, by the British steamship "
3074,1850-05-31-seq-3.txt,"American vessels in the p6rt which had been condemned for being in the slave trade. One of these, the barque Pilot, "
3075,1860-08-18-seq-1.txt,"no cording to I'^publican faith, that no one no) he rightfully held in slavery. Shivery, then, is a great wrong. "
3076,1860-08-18-seq-1.txt,will be hound to exercise its constitutional powers to destroy slavery in the States. It I would be considered entirely constitutional by 
3077,1860-08-18-seq-1.txt,"I 10 iiiiiiicucc tnc South by moral means to nbol\ ish slavery. Ami as soon as the admission of j now free States, and the change of status of "
3078,1860-08-18-seq-1.txt,"| Republican party would be{ sure to demand such cluing-1, and ubolis'i slavery in the | States. The Republican party has but one "
3079,1860-08-18-seq-1.txt,"ton, "" 1 tell yon here ""to-night, that the agitation of human slavery will continue while the j foot of a sl-'ve presses the soil of the Ainerij "
3080,1860-08-18-seq-1.txt,"used to build up a Republican party in the border slave-States; and the Federal judiciary would be. remodeled, so Ciat the dogmas of "
3081,1850-08-02-seq-5.txt,Tho 'It'til urea of ihe Santa Fo con- i; j^tituripn relative to slavery ib worthy ' of especial consideration. 'J lie im- 8 
3082,1850-08-02-seq-5.txt,pression hasgon; abroad thai il aboli>he : .slavery lolally and absolutely. J C Rut this is a nrstake. Tho coustitu 
3083,1850-08-02-seq-5.txt,"Rut this is a nrstake. Tho coustitu tion only prohibits slavery when tin? person held as a slave iso\er twenty- "" "
3084,1850-08-02-seq-5.txt,"tion only prohibits slavery when tin? person held as a slave iso\er twenty- "" one years old, if a mule, and over "" "
3085,1850-08-02-seq-5.txt,"eighteen yeurjj* if a legale. I nder 11 those ages respectively, slavery is ^ d'roelly and unequivocally rei-Qgn'-sed "
3086,1850-08-02-seq-5.txt,"c aey, rtianifested great regard for ilml worst species of white slavery which exists in Mexico under the. "
3087,1850-08-02-seq-5.txt,"ton shall no held hy law to serve any A pe;v>on as a servant, slave- or appreu- i tice, after he arrives at the age of 'M "
3088,1850-08-02-seq-5.txt,"of peonage?the- wor*t form' of, slavery?hy whidh an American free ( man may become. to all iut""ijfsand . ? "
3089,1857-06-20-seq-6.txt,"j me ; nnd 1 live here with my maidens, unmolested. There is a guard of slaves at the Crate, but tliev onlv nnnenr nl n KiiYtinl iif "
3091,1857-06-20-seq-6.txt,"She raised ft conch to her lips, nnd n shrill sound soon filled the air. The slave girls. Scarcely understanding the motive, ngnin "
3092,1857-06-20-seq-6.txt,"Kodadad. The muezzin chanted the hour of noon. The merchant cnlled to his slave to bring another pipe, l'resently, n bundle "
3093,1857-07-11-seq-4.txt,"Believe mo, we (women) are not so much slaves to the tyranny of husbands, dinners, childrMi and servants as to ourselves and "
3095,1857-07-11-seq-4.txt,That will not bVhr a feather's weight Of slavery's elm in for nil or fjreat; That truly spooks from (Jod wiiliin ; 
3096,1850-05-17-seq-4.txt,Ah negro's wrongs wero told; While the white slave was dying Who gain'd their father's gold! 
3097,1858-05-29-seq-1.txt,"Ai:iio * . 4.I.D, vuiivumuuuu wiiu one oi Iils slaves; and also by a citizeh of our villogd, whilst "
3099,1858-05-29-seq-1.txt,"off his premises by him. He made no ?ocret of his anti slavery sentiments, and hud in conversation denounced the conduct,of "
3100,1858-05-29-seq-1.txt,"Slate, or its Citizens, to attempt to reopen tlie African slave trade while thai State is onp of the United States of America. "
3101,1858-05-29-seq-1.txt,"vessels in the CJtflfof Mexico by British ovuiscrs^ on the pretence of overhauling slavers, still continues, accompanied by downright "
3102,1858-05-29-seq-1.txt,"tfons is not peculiar to Oregon. fthas pre-' vailed in tho slave States, and also in free States bordering upon tnom. But in Oregon "
3103,1850-08-09-seq-1.txt,"country, denounces the institution of slavery as a wronjr, an evil, and a curse?who recently said, in th<; 1. ni; "
3104,1850-08-09-seq-1.txt,"his life before he would vote for the extension of slavery. Who is Mr. Ixhetif A true-hearted, noble-minded "
3105,1850-04-12-seq-2.txt,"sustaining the course which Gen. C'hss ! , has taken on the question of slavery; and I rejected resolutions offered by Mr. Luch "
3106,1850-04-12-seq-2.txt,"Mr Caldwin concluded liis remniks acr 'in-t the fu^itbe slave hill. Mr Underwood followed, on th.e other "
3107,1850-04-12-seq-2.txt,"considsration of the committee, a compromise plan for the settlement of the slavery question "
3108,1850-04-12-seq-2.txt,//e asserted the cons'itu:ional authority ol Congress !o restrict slavery. ylll conventions and movements for the purposes 
3109,1850-04-12-seq-2.txt,He argued that'.he constitution did not establish slaver**; it must exist hy positive enactments; a ul therefore it did not exist 
3110,1857-06-06-seq-5.txt,"county, Ohio, charged with harboring fuai live slaves nine months ago. The arrests were made on Wednesday "
3112,1861-02-23-seq-3.txt,Tlie returns of the national census show a very material growth of tho slave population >1-1 ' .... 
3113,1861-02-23-seq-3.txt,"which mny surprise many who supposed that slavery w is declining findur, the pressure of abolition propagandist!), virulent denunciation "
3114,1861-02-23-seq-3.txt,"Htrtto, except Delaware, Maryland and Missouri, the increase of the slave population has i boon nearly in the n iiiic ratio as that of the "
3115,1861-02-23-seq-3.txt,". fro5 population, white ?i)d colored; and in the aggregate the growth of the slave population in the fifteen Southern States has kept "
3116,1861-02-23-seq-3.txt,"iik.i I wc-wene told J.liat. ,?lavery \yiw rapidly .dyiiijr out, the number of slave# has increased from 87,422, in 1850, .to 115,(519, in the "
3117,1861-02-23-seq-3.txt,"great loss 'Vom this cause. So mueh for the decade uf slavery. . A Fkmat.k Warrior.?A widow, whose "
3118,1860-11-10-seq-3.txt,"sop tlie liny of .iot?iieo coming, when millions ' : of enfranchised slaves will roml tiie heavens j with their shouts : and all this under tlie forms "
3120,1859-10-29-seq-4.txt,and that was wliv lie was here; but that ho preferred to live in (Jeorgia in slavery till the lay of hit? death. than to live in Philadelphia 1 
3121,1859-10-29-seq-4.txt,"was free to .?tnrvo; hut had lie been a fugi- I tive slave oscaped from his master, inoba 1 would have been uround to protect him. and | "
3122,1859-10-29-seq-4.txt,"because he is "" not property,"" and run oil a slave from his master bocai^o ""he is property,"" ami when Ihoy ?ot him no fiir "
3123,1850-09-27-seq-4.txt,We shall he much stronger than at present?our slaves being employed in the industrial pursuits of the 
3124,1850-09-27-seq-4.txt,"Like the States of Greece, whilst our lands are tilled by the slaves who are not required for purposes of "
3126,1850-09-27-seq-4.txt,"upon an assailable point, needing no pay, furnished by slave labor with continued supplies, supported at the "
3128,1850-09-27-seq-4.txt,and war at the same time. Wlieneverour slave population shall have increased so as to incommode 
3129,1850-09-27-seq-4.txt,"mont in relation to the bill for abolislrnpr the slave trade, which passed ( the Senate on Saturday It is ar- d "
3130,1850-09-27-seq-4.txt,"in its terms, it will effectually abolish slavery in tho District by the judicial v construction thereof?because any C "
3131,1850-09-27-seq-4.txt,attempt to substantiate a difference f( between buying a slave for use and buy ing one for sale cannot be sustain.' 
3132,1857-09-12-seq-1.txt,"lie was a democrat of. the old school, and as jrood a pro-slavery man as could be found in tho Territory, lie differed from man) "
3133,1857-09-12-seq-1.txt,"in tho Territory, lie differed from man) so-called pro-slaver)' moil, however. lit inndo hi;* ido-w upon tho "" peculiar institu "
3134,1861-08-03-seq-2.txt,"at to nnd unconditional emancipation of all per sons held un slaves in any of tho nfore said f?fcltcs, under thc laws thereof, and also "
3135,1861-08-03-seq-2.txt,"suppress tho salvolioldcrs rebellion,"" after setting forth iii a proutnbl?y that slavery had culminated in n robelliou, and that tltf. p?os "
3137,1857-06-13-seq-2.txt,"show h population of 1 20.279 souls,of whom ! 2,824 are colored, 1,582 being slaves.? ! There are 65,740 white males, an J 58.252 "
3138,1857-06-13-seq-2.txt,"June, and, it is thought, will result favorably for the pfo-slavery interest. There arc 9,751 legal voters in the territory. "
3140,1850-03-09-seq-5.txt,"domain, and by restoring, as the Federal Constitution contemplated, fugitive slaves. 7'ho ?Southhas no compromiso to offer. 2'he question, "
3142,1857-11-21-seq-2.txt,"issue, and repudiating all sectional parties and platforms concerning domestic slavery whicn sock to embroil tho States and incite "
3143,1857-11-21-seq-2.txt,"tho only sound and safe solution of the ""slavery question"" upon which the great national idea of tho people of this "
3144,1857-11-21-seq-2.txt,"conservatism of the Union?non-intorferencc by Congress with slavery in State ami Territory, or in the Iiistrict of Columbia. "
3145,1857-11-21-seq-2.txt,"of Territories, and to tin admission of now States, with or without domestic slavery, us they may elect?the equal rights of "
3146,1857-11-21-seq-2.txt,"to form a Constitutiort, with or without do- | inefitio slavery, and be admitted into the Union upon terms of perfect equality with "
3147,1857-11-21-seq-2.txt,"law. ^Next to this, will bo th? Kansas Constitution, if pro-slavery, and not rafiftall | by tbc people. Tho third great subject t| "
3148,1860-09-22-seq-1.txt,"those who'asaert that Territorial Legislature** have no power to oxcludo slave property, and athat Congress should interfere for its pro^lion "
3149,1860-09-22-seq-1.txt,"or ten days ago, through the confessions of a captured runaway slave. He stated that there was in the neighborhood of Talladega "
3150,1858-11-27-seq-2.txt,in promoting the afety and comfort of fugir(j live slaves. This bequest is probably the ^ os urst 01 me Kiiuk in tins country. 
3151,1858-11-27-seq-2.txt,"Mr. Coroner G antt. hold an inquest over ]y j t ho dead body of Jincey, a slave, the prop- ( ortyofMr. C. F. Seeua, on the 20th inst., ifes "
3153,1858-11-27-seq-2.txt,"North American w\ys that the demand in North for works relating to slavery, whether in the nature,of fiction or ethical "
3154,1865-12-16-seq-1.txt,"six dissenting votos, the'Congressional amend ment abolishing slavery. Five judges have' been elected-fill gdbd selections, ^hreo of "
3155,1860-04-28-seq-2.txt,"gross tax of the district being $9,39"">.33. The number of slaves returned is i.179.? Number of births, white: males. 199; females, ! "
3156,1860-04-28-seq-2.txt,"liages, white, 92. Deaths, white, males, .r>0 : , females, 53; slaves, males, 21; females, 21. | The number of acres of land was given last year. ^ "
3157,1860-04-28-seq-2.txt,"Number of births, white: males. 199; females, ! 181; slavos, males, 111; females, 107 ; mar-| liages, white, 92. Deaths, white, males, .r>0 : , "
3158,1860-04-28-seq-2.txt,ed adissentingopinion. The deoismn is adverse ! to the right* of n muster to hold his slavo.% in j Iruitxilu through the State of Now York. The | 
3161,1860-04-28-seq-2.txt,"of Appeals of New York has decided tho heminon slave ctise. nllirmitig tho judgment of the Court below, by the concurring opinions of nil 1 "
3162,1860-09-29-seq-3.txt,"TERMS OF SALE. Tho slaves on a credit of twelve months, with interest from date, the purchaser'to K'vo bond "
3163,1860-09-29-seq-3.txt,"securities, and to receive possession of the land ami slaves whon these terms nre complied with. and to pay for all rocossury papors. "
3166,1861-07-13-seq-1.txt,"j be ng1*v* surrendered by their farmers to slave culture und to thc production of slaves, and j Boston and New York become once more "
3167,1861-07-13-seq-1.txt,"; tho markets of D?ston and New York, am , lill theta with slaves, is pure nonsense am ! icily. No man knows this better lhan Wm "
3168,1861-07-13-seq-1.txt,"\ fields of Massachusetts and New York shall j be ng1*v* surrendered by their farmers to slave culture und to thc production of slaves, and "
3171,1861-07-13-seq-1.txt,"torts have been made for several years bao to divide the State, and make a slave Still out of thc Southern section, embodying tin "
3172,1850-01-12-seq-3.txt,when the North will no longer bow the neck to the slavocracy of the South. I am done. She cannot be satisfied with a 
3173,1850-01-12-seq-3.txt,under a pledge to pack the committees for the benefit of the slave holding interosLs of the ?S?outh. But the time has conic I 
3174,1859-12-03-seq-2.txt,"Legislature, tlio 10th instant, by Mr. Grisham, of tlie futuro introduction of slaves from abroad into tlie State ; and to legalize "
3175,1859-12-03-seq-2.txt,"$0,000, in Washington city, fyr stealing slaves. . ' | I>bepk*T Wiii.li ur thk Wohi.d.?Tbo nrtc-1 "
3176,1859-12-03-seq-2.txt,"white man being kept on a plantation khore there arc quantity of slaves, all i!:e ear round. The suggestion is a good 0110, "
3177,1859-12-03-seq-2.txt,Kkpv.ntant Krcrrivkm.?Some of tho runaway slaves who came North are greatly I disappointed at tho condition of the free 
3178,1859-12-03-seq-2.txt,"State, several years ago, and bccamo tho owner of slaves, niado a visit to tlio North, thtre yearn ago, bringing with liirt "
3179,1859-12-03-seq-2.txt,Dant/.lor offered resolutions in favor of reopening the African slave trade. Mr. Wilson gave notice that on tnesday 
3180,1859-12-03-seq-2.txt,prominent candidate for tho position. The re-opening of the African slave trado is already mooted in tho Legislature. The 
3185,1859-12-03-seq-2.txt,"for tlio purpose of taking the initiatory stcjw for bein;* sold into slaver}*. She had b<*eu in Philadelphia, and experienced the "" ad "
3187,1860-05-26-seq-2.txt,"?\'as created last week by tho arrest at Aurora, Indiana, of two fugitive slaves from Hamilton, i Ivy-, by their masters. A party of abolitionists I "
3188,1860-05-26-seq-2.txt,"| Number ami names, ngo and cox of whiles ; X 1 mtml>ei* of slaves, sex anil age. color, profession, T trade, malo or female. of all persons over 1? "
3189,1860-05-26-seq-2.txt,"liama and Mississippi. A platform opposed t< slavery, favoring tho tariff, internal improve inont, Ac., was adopted. Hon. Aiiraiiam I,in "
3190,1860-05-26-seq-2.txt,"unrestricted right of expansion to the extent of; population. Tliey hold that slavery eaii ?nd will go, miller its operation, wherever tiie people want ' "
3192,1860-05-26-seq-2.txt,| State* .should not disregard t lie < tone and wishes of the border slave States. The politicians1 arc watchin}: with intense interest the 
3194,1851-01-11-seq-3.txt,"ricftsub ui n*t jhu. o, ioui. wlit those WHO OWN NO slaves arb mors deeply INTERESTED IN "
3195,1851-01-11-seq-3.txt,But we propose to show why those of our citizens who own no slaves ehouMcf all men most strenuously 
3196,1851-01-11-seq-3.txt,purpose let us suppose that the three million of slaves in the South were o be emancipated to-morrow. What 
3197,1851-01-11-seq-3.txt,"sink into the same stolid ignorance. Those who had owned slaves and lands would be enabled, by gathering "
3198,1851-01-11-seq-3.txt,"Calhoun, from the degraded children I of his father's slaves. ' "
3200,1851-01-11-seq-3.txt,opposing the progress OF ABOLItion than the owners OP slave! thbmselveo.?An honest but uniiv 
3203,1851-01-11-seq-3.txt,"The cultivated lands are now chiefly in the hands of slave owners, and will be likely to remain "
3206,1851-01-11-seq-3.txt,a bill -o repea' (lie fugitive slave'a\v bnl was 'u ' gnnii y vo'e I loWn ?Cdurior 
3207,1859-02-12-seq-2.txt,"course before ninny years have passed. Tl institution of slavery or the Union must ii ovitabiy full, and, for oursolf, >%u juvfci tl. "
3208,1860-08-11-seq-4.txt,whose highest ambition is fo be reckoned amongst your slaves. From theso 1 demand ?from tlio carpet-bag aforesaid?rccengc ! 
3210,1850-03-22-seq-4.txt,"at nil, at all."" A clergyman in New England, when slaves were owned here, had a negro by tho name "
3212,1860-12-15-seq-3.txt,"""Washington, December 9.'?The Sena tors iroui llio slave JStates hold n caucus today fur the purpose of consultation mid interchange "
3213,1858-05-01-seq-4.txt,"The South is often accused of an oversonsitivenefis of) the subject of slavery?of beiii? morbidly Irritable upon it. And, sir, "
3214,1860-03-10-seq-2.txt,"i<k \vk.vworth, Koh. ""21?'itvqnior Modar; has votoed tin* hill aholishin;' slavory f"" th Territory of lvaii?ii*?. Tho L'^islaturo has ta "
3215,1860-03-10-seq-2.txt,"resolutions equally opposed to si|itattersovereignty nnd a slave code lor ilie territories. Tltey were I Introduced in tlie Senate l?y Mr. Davis, nnd may j "
3216,1860-03-10-seq-2.txt,"Of this number. I,08(,U1H, arc white*, ""?11,151 slave* and "">'J, 118 free negroes. VeTokd -(< vernoi- .Mn^oflitiliasvetood a bank "
3217,1860-03-10-seq-2.txt,": tlioir former homo, in the vicinity of Helena ; Ark., intending to return to slavery, preferring | that condition to the liberty they enjoy in the "
3218,1851-05-17-seq-4.txt,"citiliou of gentlemen, who own nearly a thousand slaves, and are worth ! several hundred thousand dollars.? "
3219,1851-05-17-seq-4.txt,"run away/and sentenced follows: ? Atistin tho slave of Mrs. Allen, Asa lho slave of T. E. Owen, each "
3220,1851-05-17-seq-4.txt,"? Atistin tho slave of Mrs. Allen, Asa lho slave of T. E. Owen, each to receive one hundred and fifty lashes "
3221,1851-05-17-seq-4.txt,"and leave the State; and Taffy, the slave of John White, to receive twenty-five lashes, and l>edischarged. "
3223,1850-05-31-seq-1.txt,"Wc nro indebted tci ttoil. James L. On* for n copy of bis speech on the slavery quostion, delivered in the llouso of ltep* "
3224,1850-05-31-seq-1.txt,"which I digressed longer than I intended. Whether slavery bo a sin or not, is a quel lion with which this Government has "
3225,1850-05-31-seq-1.txt,"to abide by the Constitution, in letter and spirit, then his warfare against slavery is ended; he must ground bis arms, nnd "
3226,1850-05-31-seq-1.txt,cease to amtate. It is a matter of indiff crcnce to us \yLother you consider slavery vitfUi ov wmnfp wo. nlrmo must be 
3227,1850-05-31-seq-1.txt,"morality, nor jr.dtiee. The scripture ar-, gument in f-?vor. of slavery is unanswo.ra- j ble; but, still argumeutnovor reaches the "
3228,1850-09-06-seq-4.txt,"! angua, instead of burning the four 1 slave s he had in tow, returned the i (ire of the fort, battered it down, and "
3229,1861-07-13-seq-2.txt,"tion, Delaware, alone, however, of all thoj' slavo StJtos, responding. A few rogimouuV hnvo been raised in slavo States by iud?vtdjj "
3230,1861-07-13-seq-2.txt,"slavo StJtos, responding. A few rogimouuV hnvo been raised in slavo States by iud?vtdjj uni onterpriso, and exooptcd. "
3231,1861-04-06-seq-2.txt,"cr.icy by States which have not secotlcil, but 'n utterly rejecting all non-slaveholding Stales from j 1(| forming an alliance with oilr Confederacy. I 1; "
3232,1861-04-06-seq-2.txt,"of tho want of a law prohibiting, not onty the imp trtation of slaves into tho Southern Confed- j, cr.icy by States which have not secotlcil, but 'n "
3233,1861-04-06-seq-2.txt,"of las' week informs ue of the trial and conv.ic- nu tion o'? slavo. tho property of Col. Jesse Mc- 08 Gke, for 1 ouse-brcaking and attempt on his ou "
3234,1861-04-06-seq-2.txt,"^ , <uicy of >pini?:i oxists'ns to tho policy of ro-op- ^ ening tlic African slave trade, and also because ^ of tho want of a law prohibiting, not onty the "
3237,1850-07-12-seq-4.txt,"take it, and command with sovereign ! authority. All here are your slaves,; and 1 myself am nothing more than "
3238,1850-07-12-seq-4.txt,The secretary approached; two slaves placed a little table before! him. ! 
3239,1850-07-12-seq-4.txt,"decree. Write now, 'Under penalty of death, the governor of the slaves of the palace is ordered to resign the "
3240,1850-07-12-seq-4.txt,of the palace is ordered to resign the command of the slaves into the hands of the person who shall present to 
3241,1850-07-12-seq-4.txt,"I every time I meet him; the second, i the chief of the slaves, I hate because j lie threatens me with rivals: the third, j "
3242,1850-07-12-seq-4.txt,"others of a lower rank flowers ~\nd fruits, and the slaves, having nothing to give, gave nothing. Among these , "
3243,1850-07-12-seq-4.txt,"Ninus, smiling, put himself into tli hands of the slaves.^ ""Take him out ~ the saloon, lead "
3244,1850-07-12-seq-4.txt,"await my orders."" The slaves obeyed, and Ninus followed them, laughing, into the courl "
3245,1850-07-12-seq-4.txt,"mistress; ""I am at present only a slave whom y^u love. I reign not: 1 merely charm. When 1 give an order "
3252,1850-07-12-seq-4.txt,"had been prepared for the occasion, a slave brought her a plate in which was the head of the decapitated "
3253,1850-07-12-seq-4.txt,"""Ye.;,"" they replied. The./i/e was very gay. A slave 11 n Villnr Ktr i Iir? 1 "
3254,1850-07-12-seq-4.txt,"she, in a loud voice, ""such an insult on I ho part of a slave. Slave, prepare thyself to die."" "
3257,1861-06-15-seq-2.txt,of War soulos thc policy of that govornmont in relation to tho treatment of slaves by those in command of tho United States military forces 
3259,1861-06-15-seq-2.txt,"round officers, considering military operations in n Stuio by the. laws of which slavery is sanc tioned. Thc government cannot rc'cpgrd % the "
3260,1859-04-09-seq-2.txt,"that such person owes service or labor, as a slave to the party claiming him. shall be punished by imprisonment, in the State Prison, "
3261,1859-04-09-seq-2.txt,"bo unconstitutional, but would nullify the fugitive slave law cnactctl by Congress. After much discussion, iu which Mr. Ccswing "
3262,1859-04-09-seq-2.txt,"nnnnswemMo of nil #Tgth2m4 ^ behalf of slavery, nnd which no dHnfac cwmntcntator, or (private ChriMiniy ovrir thought of "
3263,1861-08-03-seq-3.txt,"ia Virginia, and of thoso Congressmen who practi cally assert in their speeches that slavo-lioldors, whet hov Union men or Secessionists, bavo no "
3264,1859-02-05-seq-1.txt,"Africa bv the agency of negroes made semij civilized by slavery, freed and sent back, as there would be of taming the whole race "
3265,1861-03-09-seq-2.txt,"<d>)eetionul>lo principles upon which he was elected, (interforonoe with slavery in the States) ho proceeds with an argument to sh nv that the Un ' "
3266,1861-03-09-seq-2.txt,"ni'wt unanimously. ami carry the "" irrepressiblo conflict"" into the border slave State*. Com- j promises will be impossible tlion?conservative "
3267,1861-03-09-seq-2.txt,"men will be overslaughed. What then will (lie < border slave States do ? Secede ! yes, but why ' not now, before you are dishonored and demoralized? "
3268,1861-03-09-seq-2.txt,[Jonfcdernoy rather than goto war with them. Ile thought that the slave States remaining I in the Union were of more importance tljan } 
3269,1861-03-09-seq-2.txt,of an organization more radical on tho lubjoet of slavery than anything yet known to political movements in the United State* 
3270,1861-03-09-seq-2.txt,"I as to rnv other"". To the nr? nos?iion. then, that slave*, vhose etiseR c<)Ai? wi(liin the terms of this chiUH?3, shall l?o delivered up, their oaths "
3271,1861-03-09-seq-2.txt,"difference is not a very material one. If ihe slave is to he surrendered, it c?ii he of hut little j I vMirvtpinivc UI llllll or IU OUIWR IIV WH14?|I nil* "
3272,1861-03-09-seq-2.txt,"to be""Introduced. so thai n free man be not in anv ed*c surrendered as a slave ; and might it hot 1ji> well, at the same tinu*. to provide by "
3273,1859-11-19-seq-1.txt,"very small habitations, or barraoonns of! I slaves on the ennst. nro f1.n'nnl? nf i - -4 ?f,"""" ?' , "
3275,1859-09-24-seq-4.txt,"who hail bought her ami her lather as slaves. "" My agony at tliesc circumstances culminated "
3277,1859-09-24-seq-4.txt,"tin j more A Moorish slave came nrotind from the ronr of the building, and assured his fellow "
3278,1859-03-05-seq-2.txt,"ltrol thirty-ono stations in its bounds, mostfor the benefit of the slaves in the low in try. The collections for this purpose is "
3280,1859-03-05-seq-2.txt,"i sword. However, his talk was good and Llio point. He was against tho slave trade, in tno Wanderer case, whilo in tho Union, "
3281,1859-03-05-seq-2.txt,"as high as 50,000. It is thin activity in th,o Internal slave trade that haa given uegroea I tholkr nnprocadented pricos. "
3282,1850-07-05-seq-2.txt,No sooner had plans for the settlement of the slavery difllculties been mooted in the two lldllSHS t hnn I hi>> niTiinnt ?1m*? 
3283,1850-07-05-seq-2.txt,"and tho men of tho Revolution. To tho , times when, Tyranny -seeking to enslave the free, i. nati >n nroso iu tho mnjosty of "
3284,1850-07-05-seq-2.txt,"1 a State constitution, the State ipay be admitted vitb qr without slavery, as tho f people may provide. "
