,date,context
1160,1858-09-02-seq-1.txt,"nhalt know hereafter. Follow me; and whert I am, there shall also my servant be. He tha^ cometh ta me shall never hunger."" He cam? "
1161,1858-09-02-seq-1.txt,"was not cn'y forbearing and forgiving, but considerate usually, and strictly observant of th?ir rules of punctilio and etiquette. "
1164,1855-10-18-seq-2.txt,know where! In theory the people are mas tcrs?the otticers of Government their servants ; ( but in practice the reverse is the truth. The 
1167,1855-08-23-seq-3.txt,"and many others. The wife, four children, and j servant girl of Major Woods died within one hour from the time the first was attacked. Mr. "
1169,1856-05-22-seq-5.txt,"remarks of the editor, and oblige your obedient servant, John Ai.i.isox. aw import awt optwtow "
1171,1854-12-14-seq-2.txt,"44 One instance in my own family : A Catholic German servant girl, of mature years, and thought well of by us, told my wife, on the rooming "
1173,1855-08-02-seq-1.txt,"severer test, in her whole life, I'll wager, than ' a iikJ baking of bread or an untidy servant? i he- people have none of Aunt Huldah's "
1175,1850-08-29-seq-5.txt,"thirteen; nor was there anything in their conduct, or in that of the servants, which seemed in the least unnatural Bnt the young man whs "
1178,1858-10-14-seq-4.txt,"nd in their joys and Borrows; that we will bear lese servants of Christ and their fanailies on ur hearts before the Thione of Graec, and "
1179,1858-10-14-seq-4.txt,"ofsuhjeca: among which are the rights of Husband and Wife, Alitor*. Masters, Apprentices and Servants; laws relating o the Descmt of Property, Wills and Testaments. "
1182,1858-04-15-seq-3.txt,"youth,' gamma Bukht, and on the other by a conhden ial servant, and coiled himself into a small be Tdle upon the cushion assigned to him. "
1184,1853-07-14-seq-3.txt,"ruake, I am told, the most faithful and deroted servants. One croole land owner of my acquaintance, who had passed some years "
1185,1853-07-14-seq-3.txt,"application to fugitive slaves, exclusive of any and all other description of runaway servants In 1837, this clauso of the Constitution was before "
1186,1853-07-14-seq-3.txt,"that apprentiocs, redemptioncrs, and other servants, were all that wcro included in the clause in question?"" slaves "" not being in the "
1193,1856-02-28-seq-4.txt,"deep,' from the fact, that, by association, it is a reduction of the white servant to tho level of thoir colored fcllow-mcnials.' "
1194,1856-02-28-seq-4.txt,"devoted follower than Your obedient servant, C. M. Cl.AT. "
1197,1854-11-30-seq-4.txt,"ourage to assume their rights, and they have lone so, and tanght their servants, too, a lesson ivhich will not soon be forgotten. "
1200,1858-07-08-seq-1.txt,"he believed that she mighr-make him the prof itable servant of her ambi on, supporting the comparative weakness of \ s character by the "
1202,1851-09-11-seq-4.txt,"Virfinia. They bare procured the heat ha'd of mueic and most capable servant* that can be found, without retard to prioe. "
1204,1859-10-20-seq-1.txt,"age is labor and its organisation. But so far are the servants, and more especially the higher grades of laborers, such as the educated, from "
1207,1856-12-18-seq-3.txt,"And I am, very respectfully, your obedient servant, William Henry Hprlbitt. Brevoort House, "
1209,1859-02-10-seq-1.txt,"voices, from the first day they came, about our servants being so happy, aud our being so good to them ! So they are happy, and so we "
1210,1859-02-10-seq-1.txt,"'ike a dog, uuuoticed aud apparently forgotten ; but not, Herman believed, unobservant; for at rhio time 1 e began to remark that he breathed "
1211,1859-02-10-seq-1.txt,"of the plantatioiroa^pl such of our grown- > np servants as I thoFigPJ proper?sometimes i extempore, and sometimes out of the Class- i "
1212,1859-02-10-seq-1.txt,"vou know some masters and mistresses at tin North, who would treat their servants with un due severity, if they had them completely a "
1220,1858-05-20-seq-1.txt,"? emulator >ould not resist the temptation of ac iairing * pa, even l?y thb ssertffee of servants."" [e conjted to sell the children of his triba "
1221,1858-05-20-seq-1.txt,"nore pie to give the goods, for which the jeople ? w part wit^ their servants, in ex change r ivory and other products of the country, "
1226,1859-07-21-seq-1.txt,"and every relation of life. The discipline of the school is milder, t,,e condition of a servant more inde^'^'cut, ami parental restraint "
1227,1859-07-21-seq-1.txt,"girl, who lived at a considerable distance. J Several servants were coming to him, asking, ""What will I do? What will 1 do, master?"" "
1228,1859-07-21-seq-1.txt,"son's. He owns that old horse and two cows, and he keeps one servant; all the rest is borrow*, d."" "
1229,1859-07-21-seq-1.txt,"fast, where he overtoolW-eua the second day. He sent his servant in , to whom the courageous bridegroom tal'ieu with great freedom. "
1230,1859-07-21-seq-1.txt,McNaught was coining to take his daughter from him by force. He ordered his servant to see that the pistols were in good condition. 
1231,1859-07-21-seq-1.txt,"he had heard was true, and he ordered the servant to shoot. The servant had more discretion than his master, tind had loaded one of "
1232,1859-07-21-seq-1.txt,"young man repaired to Col. Knox's. To the servant he announced his name, and said he wanted to set; Col. Knox. Instead of having "
1241,1859-06-02-seq-3.txt,"When the applicant is to be accompanied by his wife, children, op servants, or by females under his protection, it t?i|l ba sufljcient to "
1244,1853-06-16-seq-3.txt,"was another side of that question in his own thoughts, for he is a frank as well as an observant and shrewd man?gavo me some facts "
1246,1852-06-17-seq-4.txt,"itiu<U IhihmIj of no reputation, and took upon i him the form of a servant, and m um nnulr in the < likeness of men He wa* emphatically trim*- i "
1248,1857-07-23-seq-1.txt,"loughtless we are, to be sure?they will board i r have servants. What are they at mending Id clothes ? But here we are again at fault? f "
1249,1857-07-23-seq-1.txt,"Hame which was so mighty in the olden dayR, under God's servant, George Fox?certainly the greatest religious hero and reformer since "
1253,1859-09-15-seq-2.txt,""" Patience, James,"" said Swinton; and "" Dinner,"" said a servant at the same moment ; so I was fain to marshal my hostess to "
1255,1856-11-20-seq-3.txt,"return in the spring. i remain, dear, sir, your obedient servant, L. DOOLITTLE. "
1257,1858-01-14-seq-2.txt,"you may receive relative to such expeditions. 1 am, sir. vour obedient servant. Lewis Cass. "
1258,1858-01-14-seq-2.txt,"each of thoee ports. I am, respectfully, your obedient servant, Isaac Toucey. "
1261,1858-04-22-seq-1.txt,"spiritualit, and power. By the tbservant, even little things are not overlooks ? For instance, let us go up to the "
1263,1858-04-22-seq-1.txt,"W4 servitude : the man who has m'nial offices 10 perform. is the. state or the servant, I cart not whether he u while or bind Servitude or Slavery grow* out of t v organic structure "
1266,1855-03-15-seq-2.txt,"- - 31,470 Clergymen lam.ers - - '.a""*' Servant* (female"" lanaers Other occupations . "
1267,1850-07-11-seq-4.txt,where the master had power over the life of the servant?he did not rehufce it or denounce it as a crime. And I trust that I will be pardoned for 
1268,1850-07-11-seq-4.txt,"do not I. In all new countries where labor is 1 dear, and domestic servants particularly are not J to be obtained, if law allows, the oonveniences and 1 "
1269,1850-07-11-seq-4.txt,"mend It to my frienda and the public, Yoer nbeilient aervant, J. M. JUUIUlMonti. Sumdi, "
1270,1850-07-11-seq-4.txt,"One of theae la the laundry, with a hydrant at thedoor^th other two are occupied by the servants. Tbe hydrant water is Introduced Into theateot'egea "
1276,1859-08-25-seq-3.txt,"of acres of land cleaved and limbered, the ntim- , ber and ages of his servants, the number and value of his horses and mules, the number of hi "
1279,1858-06-17-seq-3.txt,"April, en route to Salt Lake city, accompanied i by Colonel Kane as his guide, and two servants. In passing through the settlements, he was 1 "
1282,1852-03-25-seq-1.txt,"was to personate tho character of a Creole lady, and Einmeline tbat of her servant. Brought up from early life in connection "
1283,1852-03-25-seq-1.txt,"""Oh. certainly, George Harris: 1 know him well He married a servant of my mother's, hot has o*oH|>ed, now. to ( anada ' "
1286,1858-01-28-seq-4.txt,"state of the nation. It happened that a onfidential servant slept in an adjacent bed, 'ho, finding that his master could not sleep, "
1288,1858-12-02-seq-4.txt,""" We have high authority for saying that the ' man who does not regard and treat his servants ' as mere articles of projiertv, who /ecogniscs ! "
1291,1851-07-10-seq-5.txt,"With great respect, I am, gentlemen, your most obedient servant, KEKMIN UHOliPAZ. TRUTH IS STRANGER THAN FICTION. "
1293,1852-07-01-seq-5.txt,"tbe whole of a double room or isquiring extra altemlai.c?,wiil be charged accordingly. Hoard of private >ervants, ?11 per we k. Children always r.eeivel conditionally "
1294,1856-10-16-seq-1.txt,"'rom mental or physical exertion. Very respectfully, your obedient servant, Caspar Wister. "
1296,1852-11-18-seq-2.txt,"Vorthington, with startling energy, ""between sabel and her servants 1 To hor, it is loss of osition, fortune, the fair hopes of life, perhaps "
1299,1850-02-14-seq-4.txt,"is supplied fr >in an exclusive spring of cold water. The servants and bath attendants have beeu selected with the greatest care, ami all accustomed to the ecouomy of an "
1302,1858-09-02-seq-3.txt,"1"" JVBWW miuioio I have around me ej ellent servants, born or grown fray in the ho e, serving without wag^s "
1303,1858-09-02-seq-3.txt,", Brr wn called upon an undertaker, and requesti ed him to bury the body of one of his servants, t named Emily A. Thompson, who bad just died "
1308,1856-09-04-seq-4.txt,"then ask the question honestly, 'What would 1 that my servant, thus placed in power, would do to me?' Surely, (if I durst.) I would say. "
1310,1851-08-28-seq-1.txt,""" It's undoubtedly the intention of Providence ' that the African race should be servant*?kept in 1 a low condition,"" aaid a grave looking gentleman i "
1311,1851-08-28-seq-1.txt,"in black, a clergyman, seated by the i abm-door? , < 4 cursed be Canaan, a servant of servants shall he be,' the scripture says '' L "
1315,1853-09-08-seq-1.txt,"turning abruptly upon her. "" Your humble servant, sir, I attempt no High fx!"" "
1317,1859-02-17-seq-4.txt,"themselves are the subjects of an aristocratic few, and the nominal servants of the people are in reality their dictators. "
1318,1859-02-17-seq-4.txt,"along in that great city?first living out :e a servant. ana aitcrwarus renting a room, m 1 taking in washing and ironing?ave! k<>? I "
1322,1852-04-29-seq-2.txt,"for a motley horde of degraded, ignorant bond servants. The bill of Mr. Peachy is wrong in principle, "
1323,1852-04-29-seq-2.txt,"Restrictions of law and government make nil servants ; but human tieeh to be dealt in as property, is not consistent or compatible "
1328,1858-09-23-seq-5.txt,"the colored race of man shall * 'c for the rest, i in the capacity of bond or hir< servants. It t is a decree that pervades Lb iominions of I "
1331,1857-08-06-seq-3.txt,":iia euuruj. r rom ine wnoie memoir, we gauier that he vu a zealous servant of his master, and, with his heart aroused by a sense of the "
1333,1857-11-05-seq-2.txt,"daties arising from the relation of master and servant may come within the recognisance of the church, the relation itself, and Slavery, as "
1334,1857-11-05-seq-2.txt,"of the Tsad. We quote the latter : 41 The same evening, one of the servant* whom I had left with Mr. Oferweg came and "
1335,1857-11-05-seq-2.txt,"41 At an early hour on Sunday morning, Mr. Overweg'8 chief servant came to me with the sad news that the state of my friend was very "
1339,1850-04-18-seq-1.txt,"should be reduced to slavery.' And,ringing the bell for her eervant^ Mrs. Armstrong dismissed me."" "
1340,1859-03-17-seq-2.txt,"$1 ,250. She was recommended as sTcotton hand and house servant. For Uje Nat;oust Kf?. "
1341,1859-03-17-seq-2.txt,"Pilnitz C j.'.entioii. - ipp'.h-d from the Pi..* >' Chancery, by some trusted servant of the P j siau monarchy, who was, nevertheless, in.: "
1344,1853-11-17-seq-4.txt,"In the pa?sago wo h ive quoted from Leviti , ouh, respecting foreign servants, the -frith verse ; i* as follows: ''And ye sliall take them as an "
1345,1853-11-17-seq-4.txt,"is. that tiie Jews were to take und hold foreign servants us hereditary slaves, and treat them accordingly, hut that they should not "
1346,1853-11-17-seq-4.txt,"them accordingly, hut that they should not treat Hebrew servants in the same manner? that is. with rigor. "
1347,1853-11-17-seq-4.txt,"Now, how can such an implied permission hi treat foreign servants with rigor, coupled with an express prohibitum to treat Hebrew "
1348,1853-11-17-seq-4.txt,"with an express prohibitum to treat Hebrew servants in the same m inner, he reconciled with the various laws and declarations we Inn"" "
1349,1853-11-17-seq-4.txt,"first, the gratuitous application of the ti rm how/men to toreign servants, connected with expressions conveying the idea of hereditary slavery "
1350,1853-11-17-seq-4.txt,"to the sentence the meaning, you must not 0 treat your Hebrew servants. who arc your p brethren, with rigor, like these foreign bond- ? "
1351,1853-11-17-seq-4.txt,words conclude the whole law respecting for- << sign servants; not a syllable on the subjectbeing faun I in any subsequent part of the pen- j 
1352,1853-11-17-seq-4.txt,"tally dis'onneuted w.th the regulations re peet- | ing foreign--servants. H iving dismi-* d thos , regulations. Mo- s proceeds to lay down tin- | "
1353,1853-11-17-seq-4.txt,"contrast. Thin theory regarded the foreign servants as slaves, uud bunco liut is hero introduced to intimate a d stn.ction hetw.eu them "
1354,1853-11-17-seq-4.txt,to intimate a d stn.ction hetw.eu them uud Hebrew servants. I'lic tolly of this at tempted distinction is rendered still more tip. | 
1355,1853-11-17-seq-4.txt,"Some writers havo conceived tho idea, that dthough tho t-ervice of the Hebrew servant v.is only lor six years that of tho stranger "
1356,1853-11-17-seq-4.txt,"lie saiuo law fir Jew and strangor. The opinion that foreign servants wero to servo Irom the tunc of their engagement till the Jubilee, "
1357,1853-11-17-seq-4.txt,no dooht arose from the fact that the law authori/ing the employment of foreign servants is lound in the saino chapter with the institut 
1358,1853-11-17-seq-4.txt,"said t>t the sij~ yriu term, it has hoeu inferred that the term did not apply to such servants, hut it so happens, that in the whole hook of "
1359,1853-11-17-seq-4.txt,"the institution of the Juhilec, contains also the law ot redemption of Hebrew servants, and by which tlui wapes to he paid hack aro to he "
1360,1853-11-17-seq-4.txt,"equal justice l e inferred that the Hebrew as well us the f rei -n servant was to servo till tho Jubilee i> have already remarked, that the "
1361,1853-11-17-seq-4.txt,"against the abolitioui-t* of Israel; and every one ot tie in who enticed a servant, bound for w.i your t i leave In* master, was to die the "
1362,1853-11-17-seq-4.txt,"ed that it is neither the theft, nor the liberation of a servant or slate. that is to be punishcd with death. The larceny here made capi- ! "
1363,1853-11-17-seq-4.txt,"distance, and there forcibly held as a s x years1 servant under a pretend* d contract. As base monev is often a subject of traffic among confederates. "
1364,1853-11-17-seq-4.txt,"to them, ' ye are cursed, and tliere shall none of you be tree! from being bondmen (servants) and hewers of wood and drawers of wat r lor "
1365,1853-11-17-seq-4.txt,"make no bondmen, but tlcy were men of war , and his servants."" It is scarcely necossary to say, that the distinction here between bond "
1366,1853-11-17-seq-4.txt,"say, that the distinction here between bond men and servants, so marked, so palpable, is tho conceit of the translators. In the original "
1367,1853-11-17-seq-4.txt,"it is: ""Of tho children of Israel did Solomon rnako no servants, but they were men of war and his servants ' That is, of the children of | "
1368,1853-11-17-seq-4.txt,"rnako no servants, but they were men of war and his servants ' That is, of the children of | Israel did Solomon exact no compulsory labor, "
1369,1853-11-17-seq-4.txt,"in accordance witn inn law. on, ami, me Moabiton became DavidV servant#, and brought gifts.""'?II Sam. viii, 2 The same in said of the "
1370,1853-11-17-seq-4.txt,"As a general rule, the relation of master and servant was indissoluble for the period of six years. This tended to protect both lrom "
1371,1853-11-17-seq-4.txt,"was relieved front the inconvenience of being unexpectedly abandoned by his servant-, while his inability to dismiss them encouraged on his "
1372,1853-11-17-seq-4.txt,"kindness, and a feeling of common interest. ! ( The servants were all family servant?, and in a far more literal sense than in any other age i "
1373,1853-11-17-seq-4.txt,"or country. This system, moreover, secured the . < servant a safe and peaceful refuge amid the 1 infirmities of declining years. In the bosom | | "
1374,1853-11-17-seq-4.txt,"rank ; and of that easy, friendly intimacy be- c tween master and servant, encouraged by the t Jewish laws. The lung and thorough domes- f "
1375,1853-11-17-seq-4.txt,"Jewish laws. The lung and thorough domes- f tication of the Hebrew servant, his participa- * tion in all religious rites, his presence with his j "
1376,1853-11-17-seq-4.txt,to unite in raising him from the condition of ! t a servant to that of a companion. | ( It is painfully startling to turn suddenly | t 
1377,1853-11-17-seq-4.txt,"from tho contemplation of tho highly-favored i r Hebrew servant, to that of the American J slave?a vendible beast of burden. Had we "
1433,1852-04-15-seq-1.txt,"""You see I am prompt to our appointment,"" and led the way to the hull door, where a servant held both horses ready for them to mount. "
1435,1858-03-18-seq-2.txt,"of ' a donatio mortis causa,' made to the negro by a lady, on whom he had attended as servant ' for several years, by the permission of his 1 "
1437,1859-01-13-seq-2.txt,"with his head resting on an arm of the sofa. The servant, on ringing the dinner bell, observed that he did not appear to notice it. "
1439,1854-08-03-seq-4.txt,"to pass in these latter times that, contrary to Scripture, the servant is greater than his master. I am yet to le&rn whether tho Legislature "
1441,1850-09-12-seq-1.txt,"and even for that term not as a bondman, but as a hired servant, and in the end he must be sent out liberally provided for. When an alien, or "
1442,1850-09-12-seq-1.txt,"stranger, sojourning among the Hebrews, had purchased a Hebrew servant, the next day, or the next hour, his friend might present the price paid "
1443,1850-09-12-seq-1.txt,"and justify; under which, though he be a irother in Christ, your servant is as much your imperty as your house, or your horse?under "
1444,1850-09-12-seq-1.txt,"lot necessarily perpetual, except in the case of he servant's ohatinate tenacity of heathenUm, nd refusing to lie amalgamated with God's "
1449,1857-10-01-seq-4.txt,"Aey must point out ;pe duties of masters to iieir servants, as well as the duties of husbands their wives, parent*; to their children, or cit-ens "
1452,1858-07-29-seq-3.txt,"prayer seemed to be breathed with fervor and devotion for assistance from on high to his fellow-servants. After prayer, such kissing and "
1455,1857-11-19-seq-1.txt,"and composed, orders coffee. A few minutes past twelve, the servants hear the hall door , close, go up stairs, and tind on the hall table ( "
1458,1859-08-04-seq-2.txt,"mraded in at once. Arrayed in Court dresses, 1 hey stood like servants in livery, in semi-cir- ^ rle; the Emperor enters the reception cham- c "
1461,1852-12-23-seq-2.txt,"I am, sir, very respectfully, your i obedient servant, Daniel Webster. To R. M. Walsh, Esq., ft., Jpc. "
1463,1854-03-02-seq-2.txt,KB CHASE AND THE PEOPLE OP OHIO. Ohio has had no more faithful servant in Dongrese than Mr. Chase. Devoted as he is 
1465,1859-08-25-seq-4.txt,"f acres of land cleared and timbered, the numer and ages of his servants, the nnmbcr and aloe of his horses and mules, the number of "
1468,1859-06-30-seq-1.txt,"IVhile I played the deteiter 'I't e much-abused world, lowe'tr with its servants or slaves it may he, lias never been cruel or treacheious to me. "
1471,1856-03-06-seq-2.txt,"I subscribe myself, very respectfully, jour obedient servant, B. Stantox. WASHINGTON, D. C. "
1472,1856-03-06-seq-2.txt,"I am, with great truth and regard, sir, your most obedient, humble servant, Clarkxkon. Had Mr. Buchanan instructions to accept no "
1475,1854-04-20-seq-1.txt,"The first question is, whether the People of the United Stales, by their agents and servants in ^ongrcBi assemnieu. navs r.no constitutional "
1476,1854-04-20-seq-1.txt,"people of the United States, expressed through heir agents and servants in Congress. If these things do not demonstrate the exist "
1481,1852-11-25-seq-4.txt,"XXXIV. Itnt stay, saiil he. as then the servant name With evening innil, "" I am hy no means sum "
1482,1852-11-25-seq-4.txt,"or pleasure, through any of the States, attended by bis slaves, or servants ; and while he retains the character and rights of a citizen of a slave "
1483,1852-11-25-seq-4.txt,"mulatto, or person of color, the same being a slave or a servant owing service or labor to any otlier persons, whether they reside in this "
1484,1852-11-25-seq-4.txt,"wise hinder or prevent the lawful owner or owners of such slaves or servants from retaking them in a law ful manner, every such person so j "
1491,1851-01-09-seq-4.txt,"maxims of political expediency, and his unblemished integrity as a public servant. Mr. Hale's visit to Cincinnati was made by invitation "
1492,1851-01-09-seq-4.txt,"it to my friend* and the public. Your obedient servant, J. M. JKSUKI'N, Hrre is another, nearer home: "
1495,1854-10-12-seq-4.txt,"years of ago; and of the remainder, 172 were iarm laborers, 99 were servant maids, 17 were farmers, 26 were miners and colliers, and "
1497,1857-08-13-seq-4.txt,"loons, aud the tailor's charge on the top of that, j But an observant people saw through the patch and the charge into the heart of an honest "
1499,1859-12-01-seq-2.txt,"is from everlasting to everlasting; may He, who liberated His servant David from the murderous sword, who opened a way in the sea and "
1501,1857-04-23-seq-3.txt,"ot melt in his moutb, wa. an easy prey, indeed, 1 d is now a most uiet'ui servant; the more so, ecause he keeps nw a show of independence. "
1503,1858-10-07-seq-4.txt,"a friend. After the examination, supper was brought by an unsophisticated servant, and re I moved by the same individual. While the table "
1504,1858-10-07-seq-4.txt,"I moved by the same individual. While the table was being cleared, the servant a9ked what waa to be done witii the anemones, and was told to "
1505,1858-10-07-seq-4.txt,"of subjects; among which are the rights of Husband und Wife, Minors, Masters, Apprentices and Servants; law* relating to the Descent ol Property. Wills and Testaments. "
1508,1855-09-20-seq-4.txt,"the people are sovereign, and we are their servants. Shall we attempt to change our relative positions with the people, and poise the "
1509,1855-09-20-seq-4.txt,"to "" receive our favors?"" Is it fraud to prevent, the household servants of the young bride from being sold to pay the "
1514,1855-03-01-seq-1.txt,"lave priest stand up side by side, and say, Servants, obey your masters,' and such like ;ospel is all we hear. But as soon as a slave "
1515,1858-05-13-seq-1.txt,"The Marquis, having unpacked the hamper with the aid of his servant and the painter's wife, now betook himself to the little kitchen, "
1517,1851-07-10-seq-1.txt,"manner. For some singular reason, an imireseion seemed to reign kmong the servants gen* (>7, ??? mUmU wouhynot l^g narlicularly diaibliged "
1520,1854-10-19-seq-4.txt,"Mthin, Mercer, and Hardwick, a bed room servant, and Wadd'ngtcn, Rani, and Baker, waiter*. "
1522,1858-06-10-seq-4.txt,"who are themselves responsible for the public liberties ; and that this exhortation to servants to obey their masters, and to subjects to respect "
1523,1858-06-10-seq-4.txt,"True, there is, in one sense, a property in an i apprentice and hired servant, as in all contract | rights. The people have a property in our ser- 1 "
1527,1851-07-03-seq-5.txt,"carve it, he found the knife rather dull, and, in a sudden passion flung it down stairs after the servant who had just brought it; whereupon the "
1528,1851-07-03-seq-5.txt,"With great respect, I am, gentlemen, your most obedient [ servant, PBRMIN OROOPAZ. ' TRUTH IS STRANGF.R THAN FICTION. "
1531,1859-03-31-seq-2.txt,"the differdnt iiiititutions and cint< \,<v- I critical and observant eye. The 1 tn;i. I Spain hold of course the chef lieu, w.i .V. i- I "
1533,1850-11-21-seq-1.txt,"Uliter County, Sm Jertry, 18.r?0. rswaaniho IIohxstv.?A colored servant sweeping out a bachelor's room found a sixpence "
1534,1850-11-21-seq-1.txt,"Kegina waa standing at the upper end of the room, nttended by two maidservants, to whom she wan giving tome direction, and who, as we "
1535,1850-11-21-seq-1.txt,"And now the door was thrown open, and the servant announced, ""Mrs O'Blemmis, Miss O'lileinmis, Miss Bridget O'Blemmisand those "
1541,1853-09-01-seq-2.txt,at Shanghai olnirges tho insurrection upon the a Protestant missionaries and the servants of tho ei Knglish house in Canton ; and the Catholic in- ei 
