,date,context
2268,1851-04-17-seq-4.txt,"for themselves. The servants and hath attendants have been seleeted with the greatest care, ami are ail accustomed to the economy of "
2273,1859-01-06-seq-2.txt,"is, that it is the owner of the slave who is the real servant, and not the bondsman himself. They believe that the institution of Slavery, "
2275,1850-03-14-seq-2.txt,"6tu?otnn O'Riley."" ' "" A governess ' a domestic! a hired servant /"" ' I'ritaniiia O'Riley 1 a beautiful, graceful, ele.andbtml.r-rw "
2277,1853-02-17-seq-4.txt,"of the act ot 1717, chap 13. relating . to servant* and slaves,"" to meet a most singular ease, the particulars of which a correspond- j "
2278,1853-02-17-seq-4.txt,"of Lucy Brown in favor of Elijah Mix, as his servant and waiting-maid, until she should attain the age of twenty-one years, executed "
2281,1851-01-30-seq-2.txt,"of a President nnd Vice President, nominally Democratic, but in reality servants of the Slave Power, by the aid of slaveholding votes. To obtain "
2284,1858-08-26-seq-1.txt,"man serve me, let him follow me, and where 1 am there shall also my servant be.' If yon wil serve him therefore in this world, you can se< "
2286,1855-11-15-seq-1.txt,"It was a grand levee day, and the 1 >v.se was free, even to all the junior servants i the trade, overseers, et ceitra. The Mert "
2289,1856-02-14-seq-1.txt,"from that day to thijt, vat only my master's i faithful servant, and no more. As soon as 1 3 was able to travel, my master sent me with you i "
2291,1854-02-23-seq-4.txt,"r holds in his hand the destiny of nations, has - declared, by his inspired servant, that "" he who F ruleth over men, must be just, ruling in the "
2293,1850-05-30-seq-4.txt,"masters and mistresses enjoying themselves inside A port'y servant threw open the glazed door, and I found myself in the entry. Half a dozen lackeys, "
2294,1850-05-30-seq-4.txt,"The great evil that afflicts us?that preventi population, and makes the poor the servant of thi oapitalist?is the accumulation of land in th< "
2295,1850-05-30-seq-4.txt,"of the charges, and his rensons for doing so. With much respect, your obedient servant, R. H. Stanton. "
2296,1850-05-30-seq-4.txt,"should you think proper to do go. Very respectfully, your obedient servant, J. R. Underwood. "
2297,1850-05-30-seq-4.txt,"him to do bo. I have tho honor of being your obedient servant. Isaac Siiekn. Hon. It H. Stanton, Washington, II. C. "
2298,1850-05-30-seq-4.txt,"own misconduct or want of caution, 11 being passengers and Gil servants of the company; il8 ! were trespassers, killed by improperly crossing "
2299,1850-05-30-seq-4.txt,"of the victims, only two have occurred, and those 1 are among the servants of companies orcontructk ors. Of the persons injured owing to their own "
2300,1850-05-30-seq-4.txt,"i misconduct or want of caution, 10 were pusseut gers and 37 servants of companies or contractors; f and of those injured from causes beyond their "
2301,1850-05-30-seq-4.txt,"crossing or standing on the railway, who 3 wer^ neither passengers nor servants of the coni? pany, and one child was injured by an engine "
2315,1853-07-07-seq-4.txt,"to make their heroes, or, more commonly heroines, the victims of their servants, who expect not only to be paid a pittance for their laww, "
2316,1853-07-07-seq-4.txt,Let them not dream of banishing their servants from the family table or parlor. Let he principles of Christianity govern in thin . 
2321,1850-05-02-seq-2.txt,"The patronage of the people is worth more than that of their servants. We beg of Mr. Mangum, should he hero.ifter, in pushing his scheme of a "
2324,1857-08-20-seq-2.txt,"them: they marry no wives; they allow no servants ; they adopt children, and by turns serve one another. The elders, chcsen freely "
2325,1857-08-20-seq-2.txt,"esteemed domination of any kind injurious to both master and servant, and because all men were brothers; and they worshipped God in a "
2326,1857-08-20-seq-2.txt,"e bucket and chain, and is paved; is drawn > by a servant, who, when he finis that he cs drawn up a man instead of a bucket of "
2331,1855-01-04-seq-3.txt,7. 'Hie Industrial Sellout. Dedieution III Ohio. K Dome-lie Servants. Dumfttir Suminartf !l. T?in|>eraiiee Jubilee. Haiti Motr />?f 
2332,1850-06-27-seq-2.txt,"I have the honor to be, very respectfully, your obedient servant, Robert S. Neighbou rs, "
2334,1858-03-18-seq-4.txt,"extraordinary for sovereigns to use towards a servant already arraigned before the tribunal of the popular mind, for high crimes and misde "
2336,1854-02-09-seq-4.txt,"liter is simply this: there, the people can get servants?no "" help,'' as thoy are called in 5 section of country where I was born?and, "
2339,1854-07-13-seq-1.txt,"""But the many stars rise and set, and few are the eyes observant of their glory, or of their fading and going down. Millions are "
2341,1851-09-25-seq-3.txt,this afternoon put into my hands l>y one of the servants of the hotel. The anxiety which you manifest to maintain the laws of the land and 
2342,1851-09-25-seq-3.txt,"have lieen put in their htuuU I 'try recently, a volume of Sermon* for Servant* ha* Ixien issued in Virginia, under the *uiiction of that "
2345,1851-08-14-seq-1.txt,"hia own handa, and restating pertinaciously all offers from the various servants to relieve him of them. He looked round tke bar-room with rather "
2346,1851-08-14-seq-1.txt,"gentlemanly man sat on the seat, with a colored servant driving. The whole party examined the new comer with "
2347,1851-08-14-seq-1.txt,"chamber, where a new-mode Are was crackling, snd various servants flying about, pulling finishing touches to the arrangements. "
2348,1851-08-14-seq-1.txt,"touches to the arrangements. When all was done, and the servants departed, the young man deliberately locked the door, and "
2356,1855-08-30-seq-1.txt,"dnefi and strange in deportment. Assisted by bis .servant, the old gentleman slowly ascended tiie steps of the house; and no sooner was he "
2358,1855-05-17-seq-5.txt,"He said that the whole Territory might be reclaimed for Christ, if his servants would go forth with great zeal and faith to the work. "
2359,1855-05-17-seq-5.txt,"among slave masters the bondman is no longer called a slave, but a servant?thus, by a soft substitution, concealing and condemning "
2363,1852-07-22-seq-1.txt,"""I would have you to know that 1 um accustomed to Ik' abeyeil by servants.' "" Belinda's arms flew on from tbo dough she "
2364,1852-07-22-seq-1.txt,"*'And I'd have you to know,ma'am, that I sunt nobody's servant nor slave / leastways your'a ' I've s|Miko it. nnd I wont take fun k 1 "
2365,1852-07-22-seq-1.txt,"sobbing wife "" I ought to have told you that Northern girls will not hear the name of servant."" "" But she is my servant,'' said Kmily, indig "
2366,1852-07-22-seq-1.txt,"Northern girls will not hear the name of servant."" "" But she is my servant,'' said Kmily, indig nantly. "" She bound herself to serve ine, for "
2367,1852-07-22-seq-1.txt,"u Well, they make a distinction. Tlio fact is?hem !-?you know negroes are called servants among your people, and our free-born "
2375,1859-04-28-seq-3.txt,"portuntty occurs. With great respect, your obedtriit servant, J. II liHAUDON Joseph Bvastrrr, Ksq. "
2377,1851-05-08-seq-1.txt,"For twice two wore of night* and day*, The observant ravage race Hare rnark'd with wonder and with fhar "
2379,1858-11-11-seq-5.txt,"Church, New London. interference of one of his own servants, who stepped in to protect his master. Another of "
2382,1854-10-26-seq-1.txt,"disturbed. I fulfilled his request with a trem bling heart, but an unsteady voice; observant of which, the stranger inquired whether Mr. "
2384,1859-09-15-seq-1.txt,"madam,"" said he, 441 shall be very grateful."" Lizzie called to one of the servant women. 44 You look hungry?are you not?"" asked she, "
2385,1859-09-15-seq-1.txt,"that I had acted with great discretion ' and kindness, of which she had not been inobservant ; and that the time would come when < "
2388,1850-04-18-seq-4.txt,"and soul-crushing master, is nevertheless a most agreeable and invaluable servant. Though a mortal's sp in of life is too short to embrace excellence "
2389,1850-04-18-seq-4.txt,"the time for "" compromise"" is past forever ! Very truly, your obedient servant, C. M. Ci.ay. "
2390,1850-04-18-seq-4.txt,"is supplied from an exclusive spring of cold water. The servants and bath attendants have been selected with the greatest care, and all accustomed to the economy of an "
2395,1857-01-15-seq-1.txt,"with him during these travels, whether as to clothing, horse, saddle, ar.d bridle: servant he had none. Fe ieraiist as he was in politics, "
2397,1859-09-29-seq-2.txt,"Holds to the old doctrine of tyrants and oppressors, that some men were born to be servants, ar d some to be masters. It has abandoned the "
2400,1852-08-05-seq-4.txt,"the pale-faced race at Gilliboh, some doubtless never, until they set eyes on your humble servant. The consequence you may judge I was "
2402,1850-10-17-seq-5.txt,"the emancipation policy of the Hebrew*, who, in- c steel of driving the manumitted servant away, g sought. by granting high privileges, especially of f "
2403,1850-10-17-seq-5.txt,"One of these is the laundry, with a hydrant at the door; the other two are occupied hy the servants. The hydrant water is introduced into these cottages ae "
2407,1858-07-29-seq-1.txt,"Herman's bell rang; and Patrick, the man- i servant, was dispatched with a note to the lodgings of Mr. Grubb, and presently brought back "
2408,1858-07-29-seq-1.txt,"were made openly, with the knowledge and by < advice of counsel. The aervanta of Bacon, with- . out his knowledge, obtained some by hints to 1 "
2410,1858-10-14-seq-1.txt,"over the ouds, if your captain asks you why you fci ed his servant, your fellow-soldier in the ohuf h militant, shall you dare to speak "
2411,1858-10-14-seq-1.txt,"enormities; but when he - announced that it was his intention to marry his servant, one result of which step might well have been that "
2412,1858-10-14-seq-1.txt,"see them. None were admitted without an or der, except noblemau's servants. Webster, being ignorant of the rule, requested admittance. "
2417,1850-06-27-seq-3.txt,"Ins of these Is the laundry, with ah)draut at tb* door; the ither two arc occupied by tb* servants. The hydrant water Is Introduced Into these cottages as "
2420,1854-09-07-seq-1.txt,"1 can go in and see, but you will be going where _ I nobody wants you?that's what your servant w . thinks;"" and, curtsying with mock oivility, she "
2422,1852-10-14-seq-1.txt,"and directed it?.not to Mr. Ruby, but to Col. Leroy. despatched it by a servant, and walked out into the garden. "
2423,1852-10-14-seq-1.txt,"""Ho told mo,"" Haid A agitata, trying to clear har voice, ' that my aervanta were free from encumbrance, and that the Mile of them w ould "
2424,1852-10-14-seq-1.txt,"upon ""the face of the dead."" Augusta had re- ; solved to rescue her servants, at any sacrifice, 1 from the fate of those whom her poor brother "
2428,1858-08-12-seq-3.txt,"With great respect, I remain your obedient servant, Craufe W. Field. The Preparations for Opening the Line?A General "
2430,1852-09-09-seq-1.txt,"them in a slave State willingly. They already want a servant to wadi their feet, to hand a gourd of water, ^e., which in my opinon is "
2432,1856-07-17-seq-4.txt,"l consider the cause of constitutional Freedom. I l Very respectfully, your obedient servant, > J. C. Fremont. H "
2434,1850-06-06-seq-3.txt,"3. Written declaration of masters or patrons that servants, or workmen, have worked for thein three years, residing in the saw house. "
2435,1850-06-06-seq-3.txt,"gtve nek fattier or master vtie privilege or sending his sons or servants to the polls, but this is left entirely to him, for there is no way of forcing "
2440,1850-10-10-seq-4.txt,the power of the National Government in the Territories No one contends that the fugitive-servant clause of the Constitution applies to slaves escaped 
2441,1850-10-10-seq-4.txt,"the Constitution That instrument stipulated for the surrender of servants escaped from one , Stub into another. The Ordinance provided for "
2442,1850-10-10-seq-4.txt,", Stub into another. The Ordinance provided for the surrender of servants escaped from the or initial States into the only Territory of the United States "
2443,1850-10-10-seq-4.txt,"then existing This provision was confined, it will he observed, to servants escaped from the original ; States. The Constitution and the Ordinance "
2444,1850-10-10-seq-4.txt,"a Territory of the United Slutes"" lie urged that the fugitive servant clause of the Constitution does not iutroduce or establish any slavery "
2453,1857-01-22-seq-1.txt,"style. One turbaned Indian, with several other servants, waited at the table. The plate was superb, and the dinner lh? most rcr/.-er<-h . "
2454,1857-01-22-seq-1.txt,"Parliament is in session lie lives in London, in his town house. Qlm he basal' of servants,and they wear the gnudie?t livery wl dt "
2459,1854-12-07-seq-1.txt,"down to a chin tipt off with a sprinkling of red- ] dish beard. He appeared observant of all we j said, and smiled once or twice, as though highly 1 "
2461,1859-06-30-seq-2.txt,"who are unable to buy slaves, and in the city of Baltimore and other towns, as domestic servants. You propose to drive them from the "
2464,1854-12-21-seq-4.txt,"A true Catholic cannot bo a true republican, or a trustworthy public servant; politically speaking, ha is not Kis own master; nor can he "
2466,1857-01-01-seq-4.txt,"depends. T am, with great respect, yonr obedjeut servant, M. Blair. ANNUAL MESSAGE OF THE GOVEBNOH OF "
2468,1856-12-25-seq-2.txt,"the sovereigns of the land, und the President is their servant?they the potter, and he the clay? and neither he nor Congress can deprive them "
2469,1856-12-25-seq-2.txt,"have added that Abraham was also a reeder, for he had many "" servants"" born own house. lie further declared that "
2470,1856-12-25-seq-2.txt,"of threescore wives, cites Abraham as a Polygamist, and insists that he was the servant of the "" Most High,"" and was ju?tifed, not by faith, but "
2471,1856-12-25-seq-2.txt,"or usurpation. Bear in mind that public men are your tervant*. not your masters, dependent ou you for ths official breath which they inhale. "
2476,1851-10-09-seq-3.txt,"lalior. With great regard. I am your ol?edient servant, G. Tochman. "
2478,1856-05-15-seq-3.txt,"ynopsit of the evidence of Thursday: A iiuinher of the servants belonging to the ""Otel were first examined. Their testimony "
2479,1856-05-15-seq-3.txt,"hut, it being past the usual hour, he was ""donned by the servant that he could not have h meal without an order from the office. Mr. "
2480,1856-05-15-seq-3.txt,"h meal without an order from the office. Mr. ""rbert directed several servants who spoke to m ""u the subject to retire, csdling them harsh "
2481,1856-05-15-seq-3.txt,"in a scuffle, and thought it was a general fight among the servants of the hotel. He beheld one of the servants knock down Mr. Gardiner "
2482,1856-05-15-seq-3.txt,"among the servants of the hotel. He beheld one of the servants knock down Mr. Gardiner with a chair, and he saw three servants striking "
2483,1856-05-15-seq-3.txt,"one of the servants knock down Mr. Gardiner with a chair, and he saw three servants striking Mr. Herbert and holding him by the wrists. "
2484,1856-05-15-seq-3.txt,"After Herbert fired his pistol, the other two servants still clinched him. Mr. Smith rushed forward with a cane, sayinjj, 'If you "
2498,1856-05-22-seq-1.txt,"Nothingism flourishes, this unconstitutional Order are the faithful servants of the Slave Dynasty, their leaders preventing the disenthralment "
2501,1855-02-01-seq-2.txt,"cation, and remain, with the highest respect, your obedient servant, Robert B. IIall. Hon. Henry Wilson. "
2503,1859-05-12-seq-2.txt,"prison. Among these was u poor English boy, formerly servant of the Ex-British Chargf- drAt faires, named George Selby. He was thrown in "
2505,1853-05-12-seq-4.txt,"Resolved, That tho importing slaves and conriot servants is injurious to this colony, as it ibstructs the population of it with freemen and "
2506,1853-05-12-seq-4.txt,"not. Paul did not send Onesimus back to Philemon as a slave, or eren servant, but "" above a servant, a brother beloved,"" <w. "
2507,1853-05-12-seq-4.txt,"as a slave, or eren servant, but "" above a servant, a brother beloved,"" <w. A beautiful trait in Paul's Christian character "
2512,1854-07-06-seq-1.txt,"lestrcying its strong impulses. He became, in u ;he course of years, tho trusted servant of his b smployer; and at last was cheered by the per- el "
2513,1854-07-06-seq-1.txt,"will make no effort at dominion. <3 Your obedient servant, c Abei.ard Guthrie. 1 "
2514,1854-07-06-seq-1.txt,"Mr. BUTLER. Why, yes. \ Mr. SUMNER. ""Is thy servant a dog, that he should do this thing?"" I "
2518,1857-06-11-seq-1.txt,"master Philip's child would live there a "" "" Servant, Alice,"" I said, seeing her hesitate; "" but, as you say, I am glad I am there?twice "
2519,1858-01-28-seq-1.txt,"the richest to the poorest, from the aged to the youthful, and servants as well as masters, receive and give presents ; bonbons, playthings, "
2520,1858-01-28-seq-1.txt,"He continued, however, to go, accompanied by a man-servant, saying that it was a precaution he took to have some one at hand to call "
2521,1858-01-28-seq-1.txt,"shot that felled Guillot to the ground, ,-iere he expired in tlje arms of his servant. Such is the resume of the trial, the details of "
2522,1858-01-28-seq-1.txt,"Womeo to companies 200 kervants ..... 390 A Employees 1,894 ei "
2527,1859-10-13-seq-1.txt,Beed in a mill. Little incidents occurred which showed that the natives were as observant of character as their visiters. 
2528,1859-10-13-seq-1.txt,"uid cigarettes. At last, getting surprised at r not seeing any of the servants return, they went % )ut in their turn, and, finding all' quiet, ad- fj "
2532,1854-09-21-seq-2.txt,"itolioy of it sound and good. Well dono, good nid faithful servants?yonr double-dealing jath a wisdom in it that quito communds it to "
2535,1853-12-01-seq-4.txt,tered a* required or I L-t all the negro servants bo rnfc on the m snrno !<>' ting u-' white servants and apprentices pi 
2536,1853-12-01-seq-4.txt,"I L-t all the negro servants bo rnfc on the m snrno !<>' ting u-' white servants and apprentices pi no*' are hi resfeet to food. raiment, oorrec- tli "
2537,1853-12-01-seq-4.txt,"0. If. at the ago of twenty-seven years, the m master ot a negro or mill -rto servant bo tin- h willing to pay Ins freedom dues, above men- oi "
2538,1853-12-01-seq-4.txt,"direeti-1, and i ty into eourt five dollars, for the tl servant and th weapon let the court direct him w to be hired by the overs e;s of the peor for the "
2545,1854-06-08-seq-1.txt,"liecugeion was still raging loud and furiously, 0 vhen a servant suddenly entered the apart- tl uent, and, in hurried tones, exclaimed? si "
2547,1857-12-03-seq-1.txt,"uio mans, WILII ?Uli 1U UttUU, UU ;k'ik inlo the arms of a servant, and breathed i<t hk?t a few moments afterwards. His young "
2549,1850-04-04-seq-1.txt,"enough lo anawer the question propoaed by (he I Almighty to hia servant long ago, when he asked him If he ""ran dim over the way of the lightning of ! "
2551,1857-12-31-seq-3.txt,"prescribed by the Constitutional Covention. I am, sir, respectfully, your obedient servant, Lewis Cass, Secretary. "
2553,1850-03-14-seq-4.txt,said that he saw no propriety in one set of public servants giving instructions and reading lectures to another set of public servants. To their own 
2554,1850-03-14-seq-4.txt,"servants giving instructions and reading lectures to another set of public servants. To their own master all of them must stand or fall, and that "
2559,1851-11-06-seq-2.txt,"cess on both sides?tlie owner growing more SH and more cruel, as the servant more and more 89B callous. Whipping and ahusc are like lamia- ^^B "
2560,1851-11-06-seq-2.txt,Tojisy wan at first despised and contemned by the uii|<er servants. They soon found reason to alter their opinion. It was very soon 
2564,1853-07-21-seq-1.txt,"upset stools?do you hear ?"" And soon after entered a slovenly man servant in a ragged shirt and trowscrs, and bringing "
2565,1853-07-21-seq-1.txt,"to stand there eavesdropping, eh ? That's a field nigger, Mark! Every decent house servant, man and maid, that we had in the world, "
2566,1853-07-21-seq-1.txt,and then he took a great fancy to purchase a beautiful maid servant from Clement Sutherland?I dare say you remember the girl?she 
2567,1853-07-21-seq-1.txt,"Oriole, with half a dote* of the Kkeliest of the house servants, both men and maids, wero seised, and put up at auction. Well, when Oriole "
2573,1852-08-12-seq-1.txt,"she looked pale and sad. I grieved to leave her with only her maid and man-servant, dovoted though they he?feeling that she whose "
2575,1859-03-24-seq-1.txt,".tint to intercede on behalf of one of his - .runts ; he calls another of bis servants, and ? .jo*i. - liim to afford yuu any iuforination you "
2576,1859-03-24-seq-1.txt,"n in the ec-urt, and to intercede on bee of hi.- servants, who's a pretty bad >iiti > < ?. His client won't take it upon him "
2577,1859-03-24-seq-1.txt,"""k-u!. 1-ov Sam having repeatedly endeav* < ""i touicne up the other servants to insubor: "" ' p. Hid caused 11iin a good deal of incon ii/w "
2578,1859-03-24-seq-1.txt,"luan. they don't customarily go pry; -..-iping about amonir his servants, to . v hu.: .-caudal concerning him they can "
2579,1859-03-24-seq-1.txt,bav# Sooe nothing violent? Of a ealm will nntroubled nervant* they. And w*a ah oat their i.Acea ' ' ' 
2580,1859-03-24-seq-1.txt,"' So, St. Dominique keeps a watch, does he ? "" u Yes; sare; two or three of ze house-servants takes watch an >'afch Qft ze gallery he call "
2581,1859-03-24-seq-1.txt,"there are few who do nut know enough to season their English. Your humole servant doear not claim to be a Latin scholar, but, betiold, "
2593,1855-05-17-seq-6.txt,"others. And the whole body of citizens is too large from which to select for public servants the most fit. A or B may be voted for, not he "
2594,1855-05-17-seq-6.txt,"en placed in our hands for publication : ""We rang, handed the servant our cards., 10, after looking at them, showed us through "
2598,1855-04-12-seq-1.txt,"! the pro-slavery men of the South and their a | docile servants of the North, that the freemen - i of Michigan assembled and organized the He- I "
2601,1850-12-12-seq-4.txt,"One of these is the laundry, with a hydrant at the door; the other two are occupied by the servants. The hydrant water is introduced into these cottages as "
2602,1850-12-12-seq-4.txt,"i. The Employer U The l>*l>tnr II. The State 3. The Servant lit The Tear her IB Th? Neigble.rho.-l Mr Hlne hae ne peeunlary mean* to publi-h anything, "
2605,1857-10-08-seq-4.txt,"pale cheek was tinged with a faint rose color, which the observant artist would fain have immortalized, but could not, for the trembling of "
2607,1856-03-13-seq-1.txt,"required Valentine's services at that hour at home. On inquiring for his servant upon i these occasions, and receiving the answer that "
2608,1856-03-13-seq-1.txt,"siderate and indulgent, and more arrogant and I exacting towards his poor servant; and that 1 servant had a daily struggle with his own in- t "
2609,1856-03-13-seq-1.txt,"exacting towards his poor servant; and that 1 servant had a daily struggle with his own in- t In wild and dark and gloomy glen, "
2613,1855-03-01-seq-2.txt,"Your answer at your earliest convenience will oblige your obedient servant, Vespasian Eli.is, "
2615,1859-03-03-seq-1.txt,""" No, sir; she is at the Nortr- at present"" *' Was this a favorite servant?"" 44 I do not know. Not that-*- am aware of."" "
2616,1859-03-03-seq-1.txt,"I and I purposed from that time, as our hercdiI tary servant had just deceased, to employ free ! help exclusively. But they were aspiring and "
2619,1858-11-18-seq-1.txt,"t ire of theiu all herself, with a younger brother, uiio lived with her. and one or two servants. >hc bustled about, and eharned. and gardened. "
2620,1858-11-18-seq-1.txt,"i . in. I've knowrt that woman actually go dow n i111.i their kitchens, amoinr their strange servant-, and do up inuslius.or make cake, or anything "
2624,1852-01-08-seq-4.txt,"letter, duted Paris. December 8, 1851: ; n "" One of our female servants is married to a ?i non-coniniissioned officer in one of the regiments ! h "
2627,1857-03-26-seq-3.txt,"y< ur path, 1 subsctibe myself, very respectful iy, your obedient servant, C. Robinson. Coj>t. John Brown. "
2628,1857-03-26-seq-3.txt,"For some time past, a colored man has been residing as a servant with a gentleman in busi ness m tniB city, Dut residing in a neignbonng "
2631,1856-04-24-seq-4.txt,"_ -r . ninwtu BUVCIOOI ICglglation never was exacted by the mere servants of a free people for the government of their masters, by "
2632,1856-04-24-seq-4.txt,"they who enacted it were not the representstivss and servants of the free poople whom by their l*ws they insult, snd seek to enslave. "
2633,1856-04-24-seq-4.txt,"not give up iny mil for #150, or more 1 am, truly, your obliged, obedient servant, C. M C|.A\ "
2639,1850-05-02-seq-1.txt,"Relieve me. truly and respectfully, your most obedient servant, C. M. Ci.ay. Mtitltson Co, Ay., April d, 1S-10. "
2641,1851-11-20-seq-1.txt,"doing sort; hut what? "" "" Why, elevate your own servants for a sjieeimen,"" said Alfred, with a halt-scornful smile. "
2642,1851-11-20-seq-1.txt,"llat, and tell them to stand up under it. as tell me to elevate my servants under all the super e - ,1 r?. "
2643,1851-11-20-seq-1.txt,"me! I may like him well enough: hut you don't love y^nr servant*.'' "" I do iap?i."" "
