,no_reuse,pair_index1,pair_index2,pair_date1,pair_date2,pair_text1,pair_text2
107,5,1233,1234,1857-08-28-seq-2.txt,1857-08-28-seq-2.txt,head a glance ahead discuss slavery question conclude n follow the slavery agitation regard,slavery question conclude n follow the slavery agitation regard menns procure power parlie fr ction
108,7,1239,1240,1850-05-03-seq-1.txt,1850-05-03-seq-1.txt,law 1793 iiip recovery fugiiive slave shall afford security lo south 4mi to abolih slave trade,slave shall afford security lo south 4mi to abolih slave trade district ol columbia extend l lie law
109,8,1250,1269,1858-09-17-seq-1.txt,1858-09-17-seq-1.txt,3 the revival slave trndo would ruinously impair value slave nnd de stroy eulturo short staple cotton,institution incubus nmong they 3 the revival slave trndo would ruinously impair value slave nnd de
110,5,1257,1258,1858-09-17-seq-1.txt,1858-09-17-seq-1.txt,witness scene op board misi sispi slaver tho conduct inter state slavetrade congressional interference,sispi slaver tho conduct inter state slavetrade congressional interference which however objectionable prac
111,8,1261,1262,1858-09-17-seq-1.txt,1858-09-17-seq-1.txt,become cutthront pirate we hnve aicklv sensibilitie sobj ct slavery will bold slavery n nn exist institution,aicklv sensibilitie sobj ct slavery will bold slavery n nn exist institution innd defensible economically
112,3,1277,4642,1861-05-17-seq-1.txt,1861-02-15-seq-2.txt,state have jurisdiction crime 3 a slave one state escape another shall bo deliver claim,confederacy art 4 third clause sec 2 a slave one state escape another shall
113,5,1284,1285,1857-12-04-seq-2.txt,1857-12-04-seq-2.txt,action tha kansas convention io srrb mill th slavery cause th people   thie force th free slate man lo vot ror,thie force th free slate man lo vot ror th constitution without slavery whieh fa otherwise unobjectionable tha nlnn in nnlj
114,4,1286,1294,1862-12-19-seq-2.txt,1862-12-19-seq-2.txt,good among reason cause fugitive slave would turn abolish slavery south,cause fugitive slave would turn abolish slavery south therefore great controlling mo
115,6,1338,1339,1856-06-27-seq-2.txt,1856-06-27-seq-2.txt,future something else prompt toil move aspiration besides slavery anti slavery denounce aa lame submis,move aspiration besides slavery anti slavery denounce aa lame submis sionisls untrue north south
116,3,1355,3707,1862-01-03-seq-1.txt,1861-12-20-seq-2.txt,itllimnee tho mind ef lincoln hia exception peculiar slavery pro position mr cameron,influence over mind lincoln exception peculiar slavery pro position mr cameron
117,3,1359,2628,1851-03-28-seq-3.txt,1851-04-04-seq-3.txt,ihe 25lli february las negro man runaway slave call bis name jamks glass,ihe 25th february las negro man runaway slave call name jamks olass
118,5,1363,1364,1856-10-17-seq-1.txt,1856-10-17-seq-1.txt,northern city record horrible death n fugitive slave it say   we tearful slave case,n fugitive slave it say   we tearful slave case day since a slave man closely pack
119,7,1364,1365,1856-10-17-seq-1.txt,1856-10-17-seq-1.txt,n fugitive slave it say   we tearful slave case day since a slave man closely pack,we tearful slave case day since a slave man closely pack box not   box mark good
120,3,1367,2751,1857-02-13-seq-4.txt,1857-02-20-seq-4.txt,r 7 174 76 79 tbe follow negro slave wit reuben age 40 yeara   amy age 46 yeara charle age,73 74 76 79 follow negro slave wit reuben age 40 year amy age 43 year charles age
121,3,1413,1890,1854-07-28-seq-4.txt,1854-08-11-seq-4.txt,foot sort inch lush 1 lie owner say slave herehy notify come ward prove property pay charge aim take,foot 8 9 inch liieh the owner say slave hereby notify come ward prove property pay charge take
122,3,1413,2108,1854-07-28-seq-4.txt,1854-08-18-seq-4.txt,foot sort inch lush 1 lie owner say slave herehy notify come ward prove property pay charge aim take,foot 8 tf inch hiuh the owner say slave hereby notify come ward prove property pay charge take
123,3,1413,2706,1854-07-28-seq-4.txt,1854-06-23-seq-4.txt,foot sort inch lush 1 lie owner say slave herehy notify come ward prove property pay charge aim take,foot 8 9 inch high the owner say slave hereby notify come ward prove property pay charge take
124,3,1413,3567,1854-07-28-seq-4.txt,1854-06-09-seq-4.txt,foot sort inch lush 1 lie owner say slave herehy notify come ward prove property pay charge aim take,foot 8 tf inch hiiili the owner say slave hereby notify come ward prove property pay charge take
125,3,1413,4109,1854-07-28-seq-4.txt,1854-04-21-seq-3.txt,foot sort inch lush 1 lie owner say slave herehy notify come ward prove property pay charge aim take,foot 8   inch high the owner say slave hereby notify come ward prove property pay charge lake
126,3,1413,4224,1854-07-28-seq-4.txt,1854-07-07-seq-4.txt,foot sort inch lush 1 lie owner say slave herehy notify come ward prove property pay charge aim take,foot 8 9 inch high the owner say slave hereby notify come ward prove property pay charge take
127,3,1413,5034,1854-07-28-seq-4.txt,1854-08-04-seq-4.txt,foot sort inch lush 1 lie owner say slave herehy notify come ward prove property pay charge aim take,foot 8 9 inch hitrh the owner say slave hereby notify come ward prove property pay charge take
128,3,1443,1444,1860-11-02-seq-2.txt,1860-11-02-seq-2.txt,enforcement law mean giv ing slaveholder south unrestricted right spread slavery,ing slaveholder south unrestricted right spread slavery nil territory free nnd pro
129,4,1446,1447,1860-11-02-seq-2.txt,1860-11-02-seq-2.txt,free labor how man pref erence freo labor slave voto slaveextende candidate tho,erence freo labor slave voto slaveextende candidate tho presidency confess ignor
130,6,1458,1459,1855-11-09-seq-2.txt,1855-11-09-seq-2.txt,congress ought lo legislate upon stinjcct ol slavery either iii state territory slavery n niunici,stinjcct ol slavery either iii state territory slavery n niunici regulation nnu govern
131,5,1465,1472,1850-10-11-seq-1.txt,1850-10-11-seq-1.txt,increase security slavery 8lave displace supply ihe place ol iree inlmliihiiis leseu ihe vole,slave population constitution increase security slavery 8lave displace supply ihe place ol
132,9,1468,1469,1850-10-11-seq-1.txt,1850-10-11-seq-1.txt,owe pasagn congress ihe fugitive slave hill nnd power give tho slave owner lo enter free stair,fugitive slave hill nnd power give tho slave owner lo enter free stair lake possession runaway properly
133,7,1483,1484,1854-11-17-seq-1.txt,1854-11-17-seq-1.txt,history ever record misery slavery fashion nnd arbitrary de mand society inllict upon man slavery,slavery fashion nnd arbitrary de mand society inllict upon man slavery gall tlinn servitude
134,7,1497,1498,1856-10-24-seq-2.txt,1856-10-24-seq-2.txt,north south in north iain charge n pro slavery man seek lii extend slavery freo territory,charge n pro slavery man seek lii extend slavery freo territory thu south I accuse un
135,6,1501,1502,1856-10-24-seq-2.txt,1856-10-24-seq-2.txt,report democratic paper say they cull mo proslavery man but I nm like you oppose slavery rejoice,they cull mo proslavery man but I nm like you opposed slavery rejoice thu policy make slnvehold
136,4,1514,1519,1860-09-21-seq-1.txt,1860-09-21-seq-1.txt,tlio sufiject   1   r thoo slave und thatiiiey eter nally volunteer defend slave,slave und thatiiiey eter nally volunteer defend slave hold neighbor themselves we
137,4,1515,1516,1860-09-21-seq-1.txt,1860-09-21-seq-1.txt,general rule constitute tho great mass large slaveholder never yet introduce slavery subject poli,large slaveholder never yet introduce slavery subject poli tic never denounce democratic
138,5,1529,3765,1855-01-12-seq-2.txt,1855-03-23-seq-1.txt,times ono whito laborer equal val ue five slave throw door wide open invite free labor walk iu try,wilberforce times one white in borer equal value five slave throw door wide open invite free labor
139,3,1534,3770,1855-01-12-seq-2.txt,1855-03-23-seq-1.txt,liberality nud self reliant strength slave free state the farmer freely permit northern capitalist come,note great liberality anfl self reliant strength slave free state the former freely permit northern cap
140,3,1535,3771,1855-01-12-seq-2.txt,1855-03-23-seq-1.txt,permit northern capitalist come free labor compete slave labor the latter pass law prohibit,italist come in in free labor com nete slave labor the latter pass law prohibit southern capitalist com
141,7,1537,1538,1855-01-12-seq-2.txt,1855-01-12-seq-2.txt,inform we english conscience never suffer much slavery iu bra I zil n slavery uuited state ificn,never suffer much slavery iu bra I zil n slavery uuited states ificn morat dispatch
142,6,1544,1545,1854-06-02-seq-1.txt,1854-06-02-seq-1.txt,torinl legislature utah pass law authorize slavery nil respect exist ony slave state I rend,authorize slavery nil respect exist ony slave state I rend statute emigrant nro allow
143,5,1569,1595,1857-12-18-seq-2.txt,1857-12-18-seq-2.txt,slavery shall exist stato kansas except right property slave ihe territory shall manner,tion expressly declare no slavery shall exist stato kansas except right property slave
144,3,1620,1621,1856-09-12-seq-2.txt,1856-09-12-seq-2.txt,organ democracy louisiana he slavery bay south slavery say north,he slavery bay south slavery say north approve kansas bill say toomb
145,3,1646,2823,1856-08-15-seq-1.txt,1861-01-11-seq-2.txt,territory likk thosk statk shall de cide thrmselve whether slavery shall shall exist within limit hark,power earth rightfully determine whether slavery shall shall exist within limit
146,5,1659,1661,1855-12-07-seq-1.txt,1855-12-07-seq-1.txt,south slavery wipe republic they strip three million slave worth 000 each plantation must,but thu condition south slavery wipe republic they strip three million slave
147,5,1667,1668,1861-12-20-seq-1.txt,1861-12-20-seq-1.txt,probable ellect upon publio sentiment border slave stale the federal policy slavery question insidi,border slave stale the federal policy slavery question insidi ously enunciutct feature
148,7,1672,1674,1857-03-27-seq-1.txt,1857-03-27-seq-1.txt,w th pro slavery constitution jrt two slave mr jones un ion hall city run away sunday,lielf kansas come thu union w th pro slavery constitution jrt two slave mr jones un
149,7,1716,1717,1860-01-20-seq-1.txt,1860-01-20-seq-1.txt,try free state furnish exclusively 5281091 free nnd slave state 84 417303 nnd slave state exclusively,5281091 free nnd slave state 84 417303 nnd slave state exclusively 188093400 out thoso furnish
150,4,1752,1753,1855-10-12-seq-3.txt,1855-10-12-seq-3.txt,200 at iiiow springs 100 vote poll pro slavery candidate governor shannon votid proslavery,poll pro slavery candidate governor shannon votid proslavery ticket le ii nail tunnit al
151,7,1755,1756,1857-09-04-seq-2.txt,1857-09-04-seq-2.txt,mission kansas inion settle slavery question it buy the execution fugitive slave law stand,settle slavery question it buy the execution fugitive slave law stand e issue run sore slow sie
152,5,1811,1812,1859-04-01-seq-2.txt,1859-04-01-seq-2.txt,question postpone   must fanatical proslavery man an one side fanatical antislaveryman,must fanatical proslavery man an one side fanatical antislaveryman othor usurp publio atten
153,4,1825,1831,1857-05-22-seq-2.txt,1857-05-22-seq-2.txt,slaveholder neither bring send slave within limit hold property oaw standard may 8,state ohio here soil free soil slaveholder neither bring send slave within limit hold
154,4,1890,2107,1854-08-11-seq-4.txt,1854-04-14-seq-3.txt,foot 8 9 inch liieh the owner say slave hereby notify come ward prove property pay charge take,foot 8 l inch high the owner say slave hereby notify come for ward prove property pay charge aud tako
155,9,1890,2108,1854-08-11-seq-4.txt,1854-08-18-seq-4.txt,foot 8 9 inch liieh the owner say slave hereby notify come ward prove property pay charge take,foot 8 tf inch hiuh the owner say slave hereby notify come ward prove property pay charge take
156,5,1890,2573,1854-08-11-seq-4.txt,1854-08-25-seq-4.txt,foot 8 9 inch liieh the owner say slave hereby notify come ward prove property pay charge take,font sfru innliaa link tl say slave hereby notify come ward prove property pay chnrtre take
157,9,1890,2706,1854-08-11-seq-4.txt,1854-06-23-seq-4.txt,foot 8 9 inch liieh the owner say slave hereby notify come ward prove property pay charge take,foot 8 9 inch high the owner say slave hereby notify come ward prove property pay charge take
158,9,1890,3567,1854-08-11-seq-4.txt,1854-06-09-seq-4.txt,foot 8 9 inch liieh the owner say slave hereby notify come ward prove property pay charge take,foot 8 tf inch hiiili the owner say slave hereby notify come ward prove property pay charge take
159,8,1890,4109,1854-08-11-seq-4.txt,1854-04-21-seq-3.txt,foot 8 9 inch liieh the owner say slave hereby notify come ward prove property pay charge take,foot 8   inch high the owner say slave hereby notify come ward prove property pay charge lake
160,9,1890,4224,1854-08-11-seq-4.txt,1854-07-07-seq-4.txt,foot 8 9 inch liieh the owner say slave hereby notify come ward prove property pay charge take,foot 8 9 inch high the owner say slave hereby notify come ward prove property pay charge take
161,4,1890,4507,1854-08-11-seq-4.txt,1854-05-26-seq-4.txt,foot 8 9 inch liieh the owner say slave hereby notify come ward prove property pay charge take,foot 8 or inchcsliidi the owner say slave hereby notify come for wnrd prove property pay charge take
162,5,1890,4959,1854-08-11-seq-4.txt,1854-07-21-seq-4.txt,foot 8 9 inch liieh the owner say slave hereby notify come ward prove property pay charge take,foot 8 9 inch hiirh tho owner say slave hereby notify come ward prove property pav charge take
163,9,1890,5034,1854-08-11-seq-4.txt,1854-08-04-seq-4.txt,foot 8 9 inch liieh the owner say slave hereby notify come ward prove property pay charge take,foot 8 9 inch hitrh the owner say slave hereby notify come ward prove property pay charge take
164,5,1911,1912,1861-07-12-seq-2.txt,1861-07-12-seq-2.txt,tation delaware alone however tbe slave state respond call a slave state regiment,tbe slave state respond call a slave state regiment raise individual enterprise ac
165,6,1928,2629,1857-11-13-seq-3.txt,1857-12-25-seq-4.txt,weigh 175 180 lbs dark color th owner say slave request ed come forward prove property pay,weigh 175 180 lbs dark color owner eaid slave request ed come forward prove property pay
166,5,1928,3568,1857-11-13-seq-3.txt,1858-01-15-seq-4.txt,weigh 175 180 lbs dark color th owner say slave request ed come forward prove property pay,weigh 176 180 lbs dark color the owner say slave request ed come forward prove property nay
167,4,1928,4900,1857-11-13-seq-3.txt,1857-11-20-seq-3.txt,weigh 175 180 lbs dark color th owner say slave request ed come forward prove property pay,weigh ahout 173 180 ihs dark color the owner say slave request ed come forward prove properly pay
168,6,1928,5084,1857-11-13-seq-3.txt,1857-12-18-seq-4.txt,weigh 175 180 lbs dark color th owner say slave request ed come forward prove property pay,end weigh 176 180 lbs dark oolor tha owner say slave request ed come forward prove property pay
169,6,1961,1962,1858-06-04-seq-2.txt,1858-06-04-seq-2.txt,southern confederacy african slave trade revive would lose twothird value slave property de,slave trade revive would lose twothird value slave property de rive additional increase value
170,5,1990,1991,1860-10-26-seq-2.txt,1860-10-26-seq-2.txt,much money 30 per cent every man interested slave property nnd every man believe slavery right,interested slave property nnd every man believe slavery right ought bo perpotuutod stand
171,3,2005,2006,1861-01-25-seq-1.txt,1861-01-25-seq-1.txt,stitution provide lhat congress hereafter interfere slave ry winre exist local law as lo,ry winre exist local law as lo question slavery territory mr seward go will expect
172,8,2017,2018,1854-06-23-seq-3.txt,1854-06-23-seq-3.txt,these calkd little labor beyond serfs nnd slave theso make serfs slave nnd these place every sensuous,serfs nnd slave theso make serfs slave nnd these place every sensuous luxury within grasp man debauch
173,6,2031,2032,1861-06-21-seq-1.txt,1861-06-21-seq-1.txt,hear 1110 add he uproar ious applause slavery ought bo abolish slavery must lio abolish,ious applause slavery ought bo abolish slavery must lio abolish slavery abolish slavery shall bo
174,6,2032,2033,1861-06-21-seq-1.txt,1861-06-21-seq-1.txt,ious applause slavery ought bo abolish slavery must lio abolish slavery abolish slavery shall bo,abolish slavery must lio abolish slavery abolish slavery shall bo abolish slavery bo abolish
175,5,2033,2034,1861-06-21-seq-1.txt,1861-06-21-seq-1.txt,abolish slavery must lio abolish slavery abolish slavery shall bo abolish slavery bo abolish,slavery abolish slavery shall bo abolish slavery bo abolish wnr if believo work
176,6,2050,2051,1853-06-24-seq-1.txt,1853-06-24-seq-1.txt,new german democratic national anti slavery paper washington city some tho northern antislavery society furnish,slavery paper washington city some tho northern antislavery society furnish mean commence with
177,5,2059,2061,1857-02-06-seq-2.txt,1857-02-06-seq-2.txt,queation transcend issue lend in pro alavery demncrata rally active proslavery whig combine,in pro alavery demncrata rally active proslavery whig combine detent mr pulmbutio vain he elect
178,4,2102,2103,1855-10-12-seq-2.txt,1855-10-12-seq-2.txt,york post 1st determine opposition tho extension encroachment slavery 2d no slavery tho territory,tho extension encroachment slavery 2d no slavery tho territories union 3d sympathy cooperation
179,4,2107,2108,1854-04-14-seq-3.txt,1854-08-18-seq-4.txt,foot 8 l inch high the owner say slave hereby notify come for ward prove property pay charge aud tako,foot 8 tf inch hiuh the owner say slave hereby notify come ward prove property pay charge take
180,6,2107,2706,1854-04-14-seq-3.txt,1854-06-23-seq-4.txt,foot 8 l inch high the owner say slave hereby notify come for ward prove property pay charge aud tako,foot 8 9 inch high the owner say slave hereby notify come ward prove property pay charge take
181,4,2107,3567,1854-04-14-seq-3.txt,1854-06-09-seq-4.txt,foot 8 l inch high the owner say slave hereby notify come for ward prove property pay charge aud tako,foot 8 tf inch hiiili the owner say slave hereby notify come ward prove property pay charge take
182,4,2107,4054,1854-04-14-seq-3.txt,1854-04-07-seq-3.txt,foot 8 l inch high the owner say slave hereby notify come for ward prove property pay charge aud tako,foot   inch high the owner say slave hereby notify conic tor ward prove properly pay charge take
183,6,2107,4109,1854-04-14-seq-3.txt,1854-04-21-seq-3.txt,foot 8 l inch high the owner say slave hereby notify come for ward prove property pay charge aud tako,foot 8   inch high the owner say slave hereby notify come ward prove property pay charge lake
184,6,2107,4224,1854-04-14-seq-3.txt,1854-07-07-seq-4.txt,foot 8 l inch high the owner say slave hereby notify come for ward prove property pay charge aud tako,foot 8 9 inch high the owner say slave hereby notify come ward prove property pay charge take
185,4,2107,4507,1854-04-14-seq-3.txt,1854-05-26-seq-4.txt,foot 8 l inch high the owner say slave hereby notify come for ward prove property pay charge aud tako,foot 8 or inchcsliidi the owner say slave hereby notify come for wnrd prove property pay charge take
186,4,2107,5034,1854-04-14-seq-3.txt,1854-08-04-seq-4.txt,foot 8 l inch high the owner say slave hereby notify come for ward prove property pay charge aud tako,foot 8 9 inch hitrh the owner say slave hereby notify come ward prove property pay charge take
187,5,2108,2573,1854-08-18-seq-4.txt,1854-08-25-seq-4.txt,foot 8 tf inch hiuh the owner say slave hereby notify come ward prove property pay charge take,font sfru innliaa link tl say slave hereby notify come ward prove property pay chnrtre take
188,9,2108,2706,1854-08-18-seq-4.txt,1854-06-23-seq-4.txt,foot 8 tf inch hiuh the owner say slave hereby notify come ward prove property pay charge take,foot 8 9 inch high the owner say slave hereby notify come ward prove property pay charge take
189,9,2108,3567,1854-08-18-seq-4.txt,1854-06-09-seq-4.txt,foot 8 tf inch hiuh the owner say slave hereby notify come ward prove property pay charge take,foot 8 tf inch hiiili the owner say slave hereby notify come ward prove property pay charge take
190,8,2108,4109,1854-08-18-seq-4.txt,1854-04-21-seq-3.txt,foot 8 tf inch hiuh the owner say slave hereby notify come ward prove property pay charge take,foot 8   inch high the owner say slave hereby notify come ward prove property pay charge lake
191,9,2108,4224,1854-08-18-seq-4.txt,1854-07-07-seq-4.txt,foot 8 tf inch hiuh the owner say slave hereby notify come ward prove property pay charge take,foot 8 9 inch high the owner say slave hereby notify come ward prove property pay charge take
192,4,2108,4507,1854-08-18-seq-4.txt,1854-05-26-seq-4.txt,foot 8 tf inch hiuh the owner say slave hereby notify come ward prove property pay charge take,foot 8 or inchcsliidi the owner say slave hereby notify come for wnrd prove property pay charge take
193,5,2108,4959,1854-08-18-seq-4.txt,1854-07-21-seq-4.txt,foot 8 tf inch hiuh the owner say slave hereby notify come ward prove property pay charge take,foot 8 9 inch hiirh tho owner say slave hereby notify come ward prove property pav charge take
194,9,2108,5034,1854-08-18-seq-4.txt,1854-08-04-seq-4.txt,foot 8 tf inch hiuh the owner say slave hereby notify come ward prove property pay charge take,foot 8 9 inch hitrh the owner say slave hereby notify come ward prove property pay charge take
195,8,2138,2139,1861-01-25-seq-2.txt,1861-01-25-seq-2.txt,atitution permanent linn slave nnd freo territory 2d thnt con fress shnll never nholish slavery,slave nnd freo territory 2d thnt con fress shnll never nholish slavery istrict columbia nny district
196,5,2145,2146,1857-01-23-seq-2.txt,1857-01-23-seq-2.txt,mill prospect make kansas slave state climate die inimical slavery why then,kansas slave state climate die inimical slavery why then georgia democratic leader make ao
197,3,2206,2207,1860-11-02-seq-1.txt,1860-11-02-seq-1.txt,bell a mo eensisleiu de termine proslavery man ever hold seat senate he east tver fifty vote directly,senate he east tver fifty vote directly utgainst freedom slaver   j   ft the man beat abe llneoln
198,3,2216,2220,1859-07-15-seq-1.txt,1859-07-15-seq-1.txt,slave state unless number slave greatly increase a great keiosntg an order,ry repudiate idea create slave state unless number slave greatly increase
199,6,2252,2253,1858-08-06-seq-2.txt,1858-08-06-seq-2.txt,york herald writer predict early extinction slavery virginia soy tody slavery stand upon stron,early extinction slavery virginia soy tody slavery stand upon stron ger basis virginia former pe
200,3,2266,2267,1862-12-05-seq-1.txt,1862-12-05-seq-1.txt,iiot disturb dock arsenal fort place within slave hold sttile slavery,fort place within slave hold sttile slavery territory whole life waa dedi
201,6,2286,2294,1857-05-01-seq-2.txt,1857-05-01-seq-2.txt,part tho instructor youth pnlmy day greece nnd rome slave iesop slave tile philosopher epicte,day greece nnd rome slave iesop slave tile philosopher epicte tus wns n slave a inrgo proportion
202,3,2287,2294,1857-05-01-seq-2.txt,1857-05-01-seq-2.txt,tus wns n slave a inrgo proportion primitive chi istians weru slave and n suredly nothing thu mere bond,day greece nnd rome slave iesop slave tile philosopher epicte tus wns n slave a inrgo proportion
203,10,2287,2295,1857-05-01-seq-2.txt,1857-05-01-seq-2.txt,tus wns n slave a inrgo proportion primitive chi istians weru slave and n suredly nothing thu mere bond,iesop slave tile philosopher epicte tus wns n slave a inrgo proportion primitive chi istians weru slave and n
204,8,2294,2295,1857-05-01-seq-2.txt,1857-05-01-seq-2.txt,day greece nnd rome slave iesop slave tile philosopher epicte tus wns n slave a inrgo proportion,iesop slave tile philosopher epicte tus wns n slave a inrgo proportion primitive chi istians weru slave and n
205,7,2301,2303,1855-11-09-seq-3.txt,1855-11-09-seq-3.txt,sfcunit stficijicutiuii for nctualiy en gage ill lliu business assist slave makinig escape slave lo free,gage ill lliu business assist slave makinig escape slave lo free territory whicli contrary tlio law
206,5,2309,2310,1856-06-06-seq-1.txt,1856-06-06-seq-1.txt,union state decide question slavery nnd majority eiti zen theu favor slavery would,slavery nnd majority eiti zen theu favor slavery would unhesitatingly vote admission tlio
207,4,2313,2314,1856-06-06-seq-1.txt,1856-06-06-seq-1.txt,native population since thut time groutcr slaveholde non slaveholding slate they would main,groutcr slaveholde non slaveholding slate they would main taine increase ascendency
208,4,2316,3640,1860-10-12-seq-4.txt,1860-10-26-seq-4.txt,tu estate john cunningham deed sell decree sell court say slave sell credit six month except tho,estate john cunningham deed sell decree buid court say slavej sell credit six month except tho
209,5,2324,2334,1861-02-01-seq-1.txt,1861-02-01-seq-1.txt,first a declaratory amendment african slave hold institu tion of slaveholde state shall,african slave hold institu tion of slaveholde state shall recognise property entitle
210,5,2328,2329,1861-02-01-seq-1.txt,1861-02-01-seq-1.txt,prohibit hinder transportation slave one state another territory slave ore law per,slave one state another territory slave ore law per mitted hold whether transpor
211,4,2343,2344,1861-02-01-seq-1.txt,1861-02-01-seq-1.txt,sea sixth in addition fugitive slave olause provide slave,sixth in addition fugitive slave olause provide slave domande executive authority
212,5,2365,2366,1856-06-13-seq-1.txt,1856-06-13-seq-1.txt,out the coiaequenco be kansas slave territory probably ask admission into union slave state,slave territory probably ask admission into union slave state if see reason
