,no_reuse,pair_index1,pair_index2,pair_date1,pair_date2,pair_text1,pair_text2
213,4,2375,2376,1862-04-11-seq-1.txt,1862-04-11-seq-1.txt,bind wherever jurisdiction extend abolish slavery und moreover bind admit slave state,abolish slavery und moreover bind admit slave state union when therefore state
214,5,2438,2441,1854-05-05-seq-1.txt,1854-05-05-seq-1.txt,set example free nil slave they resolve upon method indemnify tho slave,nil slave they resolve upon method indemnify tho slave owner tho throe year ull claim
215,4,2444,2452,1859-11-18-seq-3.txt,1859-11-18-seq-3.txt,lind proslavery agitator south cry aloud slavo code territory tho revival tho african,till one put down lind proslavery agitator south cry aloud slavo code
216,3,2461,2462,1859-11-25-seq-2.txt,1859-11-25-seq-2.txt,stato exempt execution sale one slave family mean increase number slaveholder,one slave family mean increase number slaveholder tho proposition might work well
217,6,2543,2544,1856-01-25-seq-1.txt,1856-01-25-seq-1.txt,decide question themselves he would admit without slaver I say slavery would go there never,admit without slaver I say slavery would go there never urge ss reason vote
218,5,2573,2706,1854-08-25-seq-4.txt,1854-06-23-seq-4.txt,font sfru innliaa link tl say slave hereby notify come ward prove property pay chnrtre take,foot 8 9 inch high the owner say slave hereby notify come ward prove property pay charge take
219,5,2573,3567,1854-08-25-seq-4.txt,1854-06-09-seq-4.txt,font sfru innliaa link tl say slave hereby notify come ward prove property pay chnrtre take,foot 8 tf inch hiiili the owner say slave hereby notify come ward prove property pay charge take
220,5,2573,4109,1854-08-25-seq-4.txt,1854-04-21-seq-3.txt,font sfru innliaa link tl say slave hereby notify come ward prove property pay chnrtre take,foot 8   inch high the owner say slave hereby notify come ward prove property pay charge lake
221,5,2573,4224,1854-08-25-seq-4.txt,1854-07-07-seq-4.txt,font sfru innliaa link tl say slave hereby notify come ward prove property pay chnrtre take,foot 8 9 inch high the owner say slave hereby notify come ward prove property pay charge take
222,4,2573,4959,1854-08-25-seq-4.txt,1854-07-21-seq-4.txt,font sfru innliaa link tl say slave hereby notify come ward prove property pay chnrtre take,foot 8 9 inch hiirh tho owner say slave hereby notify come ward prove property pav charge take
223,5,2573,5034,1854-08-25-seq-4.txt,1854-08-04-seq-4.txt,font sfru innliaa link tl say slave hereby notify come ward prove property pay chnrtre take,foot 8 9 inch hitrh the owner say slave hereby notify come ward prove property pay charge take
224,4,2574,3439,1857-12-04-seq-3.txt,1858-01-08-seq-4.txt,weilis 174 sn 180 iba dark color the owner say slave request ed forwsrd prove property pay,weigh 178 180 ip dark color the owner say slave request ed come forwurd prove property pay
225,4,2574,3568,1857-12-04-seq-3.txt,1858-01-15-seq-4.txt,weilis 174 sn 180 iba dark color the owner say slave request ed forwsrd prove property pay,weigh 176 180 lbs dark color the owner say slave request ed come forward prove property nay
226,3,2574,3656,1857-12-04-seq-3.txt,1858-02-19-seq-4.txt,weilis 174 sn 180 iba dark color the owner say slave request ed forwsrd prove property pay,end wixhs 175 1m0 lbs dark color the owner say slave request ad come forward prove property pay
227,4,2574,4900,1857-12-04-seq-3.txt,1857-11-20-seq-3.txt,weilis 174 sn 180 iba dark color the owner say slave request ed forwsrd prove property pay,weigh ahout 173 180 ihs dark color the owner say slave request ed come forward prove properly pay
228,6,2591,2592,1852-09-17-seq-2.txt,1852-09-17-seq-2.txt,tho south except serve anti slavery state congress ho vote right n slaveholder en,anti slavery state congress ho vote right n slaveholder en joyment ol in property ijistrict
229,3,2629,3568,1857-12-25-seq-4.txt,1858-01-15-seq-4.txt,weigh 175 180 lbs dark color owner eaid slave request ed come forward prove property pay,weigh 176 180 lbs dark color the owner say slave request ed come forward prove property nay
230,4,2629,5084,1857-12-25-seq-4.txt,1857-12-18-seq-4.txt,weigh 175 180 lbs dark color owner eaid slave request ed come forward prove property pay,end weigh 176 180 lbs dark oolor tha owner say slave request ed come forward prove property pay
231,3,2683,2684,1858-04-09-seq-2.txt,1858-04-09-seq-2.txt,this case importance slaveholder the njcute overseer plead defence slave,slaveholder the njcute overseer plead defence slave resist authority irave tho blow
232,6,2697,2698,1852-12-03-seq-2.txt,1852-12-03-seq-2.txt,inst tho purpose devising mean well secure slave property kentucky they urge formation slave protection,well secure slave property kentucky they urge formation slave protection societies county state especial
233,9,2706,3567,1854-06-23-seq-4.txt,1854-06-09-seq-4.txt,foot 8 9 inch high the owner say slave hereby notify come ward prove property pay charge take,foot 8 tf inch hiiili the owner say slave hereby notify come ward prove property pay charge take
234,4,2706,4054,1854-06-23-seq-4.txt,1854-04-07-seq-3.txt,foot 8 9 inch high the owner say slave hereby notify come ward prove property pay charge take,foot   inch high the owner say slave hereby notify conic tor ward prove properly pay charge take
235,10,2706,4109,1854-06-23-seq-4.txt,1854-04-21-seq-3.txt,foot 8 9 inch high the owner say slave hereby notify come ward prove property pay charge take,foot 8   inch high the owner say slave hereby notify come ward prove property pay charge lake
236,14,2706,4224,1854-06-23-seq-4.txt,1854-07-07-seq-4.txt,foot 8 9 inch high the owner say slave hereby notify come ward prove property pay charge take,foot 8 9 inch high the owner say slave hereby notify come ward prove property pay charge take
237,4,2706,4507,1854-06-23-seq-4.txt,1854-05-26-seq-4.txt,foot 8 9 inch high the owner say slave hereby notify come ward prove property pay charge take,foot 8 or inchcsliidi the owner say slave hereby notify come for wnrd prove property pay charge take
238,5,2706,4959,1854-06-23-seq-4.txt,1854-07-21-seq-4.txt,foot 8 9 inch high the owner say slave hereby notify come ward prove property pay charge take,foot 8 9 inch hiirh tho owner say slave hereby notify come ward prove property pav charge take
239,9,2706,5034,1854-06-23-seq-4.txt,1854-08-04-seq-4.txt,foot 8 9 inch high the owner say slave hereby notify come ward prove property pay charge take,foot 8 9 inch hitrh the owner say slave hereby notify come ward prove property pay charge take
240,4,2726,2727,1856-12-05-seq-1.txt,1856-12-05-seq-1.txt,re organization union tins rue braska antinebraska proslavery nnd nnti slavery disunion union,braska antinebraska proslavery nnd nnti slavery disunion union editor then would complete expo
241,4,2733,2737,1853-09-02-seq-3.txt,1853-09-02-seq-3.txt,union admit domestic slavery shall decree emancipation slave final extinction involuntary servi,provide law that whenever state union admit domestic slavery shall decree emancipation slave
242,6,2741,2742,1855-10-12-seq-1.txt,1855-10-12-seq-1.txt,single idea opposition extension slavery the whig party always oppose extension slavery hut op,slavery the whig party always oppose extension slavery hut op position always insie constitu
243,5,2748,2749,1855-10-12-seq-1.txt,1855-10-12-seq-1.txt,dodge ot wilmot proviso exclusion slavery nil thu territory nnd admission slave suite they,slavery nil thu territory nnd admission slave suite they refuse even n vole thank thu admini
244,3,2751,4564,1857-02-20-seq-4.txt,1857-01-16-seq-3.txt,73 74 76 79 follow negro slave wit reuben age 40 year amy age 43 year charles age,7x 74 76 79 follow negro slave wit lleuhen age 40 your amy age 45 year charles age
245,3,2751,4685,1857-02-20-seq-4.txt,1857-02-06-seq-4.txt,73 74 76 79 follow negro slave wit reuben age 40 year amy age 43 year charles age,7 74 76 76 tha follow negro slavee ta wit reuben age 40 year amy age 44 yeere charle age
246,5,2773,2774,1859-12-16-seq-1.txt,1859-12-16-seq-1.txt,rendezvous border suite there danger slave color people the slave take refuse take,danger slave color people the slave take refuse take arm first man kill
247,5,2799,2800,1860-10-05-seq-3.txt,1860-10-05-seq-3.txt,I believe unsound upon   slavery question far institution ot negro slavery abstractly concern,  slavery question far institution ot negro slavery abstractly concern fuvorublo I
248,3,2826,2827,1861-01-11-seq-2.txt,1861-01-11-seq-2.txt,porly upon whose revolutionary banner inscribe no slave state slave territory return,inscribe no slave state slave territory return fugitive hi master an irrepressible
249,5,2843,2844,1861-01-11-seq-2.txt,1861-01-11-seq-2.txt,assail right neighbor 2d in addition fugitive slave clause provide slave hns,2d in addition fugitive slave clause provide slave hns demand kxecutive author
250,6,2862,2863,1858-05-07-seq-2.txt,1858-05-07-seq-2.txt,scoundrel he catch take slave tho north wus vice verta nnd slave take south,slave tho north wus vice verta nnd slave take south richmond south
251,5,2865,2869,1859-09-23-seq-2.txt,1859-09-23-seq-2.txt,slave trade insuperable to go far 4000000 slave twen tyfive year will 8000000 iu,tho objection revival african slave trade insuperable to go far 4000000 slave twen
252,4,2879,2880,1856-10-10-seq-3.txt,1856-10-10-seq-3.txt,noy belong party its object extenlion slavery tho fact clear ly nddmittcd hint mr b be prn tlavery,ly nddmittcd hint mr b be prn tlavery man democracy pro slavery party rend follow take
253,10,2910,2911,1856-03-28-seq-1.txt,1856-03-28-seq-1.txt,alphabetical order civil district 1st the number nf slave tax fo person 2d the value say slave 3d,1st the number nf slave tax fo person 2d the value say slave 3d the specie property distignnte ill article
254,4,2943,2944,1854-09-08-seq-2.txt,1854-09-08-seq-2.txt,majort free eold man mr humes jane slave mr dickinson martha slave rev sevier,jane slave mr dickinson martha slave rev sevier mitt naomi white daughter geom white
255,6,2953,2956,1852-03-26-seq-2.txt,1852-03-26-seq-2.txt,slave law lately pass thd california assembly provide slave bring state prior adoption state,california siaverv the fugitive slave law lately pass thd california assembly provide slave bring
256,3,2980,4271,1858-01-22-seq-2.txt,1858-02-12-seq-2.txt,in house bill provide voluntary enslavement free person color considerable discussion pass,this bill provide voluntary enslavement free person color allow aa age eighteen year ts
257,4,2983,2984,1854-11-10-seq-3.txt,1854-11-10-seq-3.txt,lias story gentleman missouri stop city slave man tho nntislavery folk hear,stop city slave man tho nntislavery folk hear slave tender hospitality winter
258,5,2984,2985,1854-11-10-seq-3.txt,1854-11-10-seq-3.txt,stop city slave man tho nntislavery folk hear slave tender hospitality winter,man tho nntislavery folk hear slave tender hospitality winter canada nnd decline leave
259,5,2993,2995,1859-02-04-seq-2.txt,1859-02-04-seq-2.txt,votee hia powerful ability large fortune anlialavery cause yst desire grasp cuba slavery elsvelrade all,anlialavery cause yst desire grasp cuba slavery elsvelrade all sudder death pbihter mr john
260,5,3004,3013,1859-10-28-seq-3.txt,1859-10-28-seq-3.txt,nave idea specially depu ted almighty hberato slave kill slaveholder it always con,ted almighty hberato slave kill slaveholder it always con ceded conscientious
261,9,3022,3023,1857-02-27-seq-2.txt,1857-02-27-seq-2.txt,rica ia hell off morally physically sor illy ihe worat abuse slave in ihe united slates slaver be slavery,sor illy ihe worat abuse slave in ihe united slates slaver be slavery deed horrible kind cruel
262,5,3072,3073,1850-03-08-seq-2.txt,1850-03-08-seq-2.txt,select committee ihirleen six choose fron ihe nnnslaveholding six ihe slavebolding slate nnd,choose fron ihe nnnslaveholding six ihe slavebolding slate nnd twelve select thirtpentll member lie
263,4,3104,3105,1858-03-19-seq-2.txt,1858-03-19-seq-2.txt,nnd prejudice class denomi nate slave by vote slave place high office,nate slave by vote slave place high office nnd ill become stigmatise
264,5,3110,3111,1858-03-19-seq-2.txt,1858-03-19-seq-2.txt,high place I care whether call slavery servitude man nial office perform slave thf ser,slavery servitude man nial office perform slave thf ser vant 1 care whether llnck
265,16,3127,3128,1850-07-26-seq-1.txt,1850-07-26-seq-1.txt,mixed moiher longue spice otjhence e nave scet generrl taylor dead language ft thus chance though attack n slaveholder pro one day read aloud mas1 slavery man noith cordially suppor,dead language ft thus chance though attack n slaveholder pro one day read aloud mas1 slavery man noith cordially suppor ter aslonished ihe irans I eu na mpnani eiecteu ny man op
266,6,3150,3151,1850-06-28-seq-2.txt,1850-06-28-seq-2.txt,fnut tho territory united states fix cliarneter slavery slavery after this will moy well regnrd,fix cliarneter slavery slavery after this will moy well regnrd mr websters fugitive slnve bill concoct
267,5,3203,3204,1855-04-20-seq-3.txt,1855-04-20-seq-3.txt,the new york senate adopt resold tion denounce nebraska bill slavery fugitive slave billnnd knowothingiain,tion denounce nebraska bill slavery fugitive slave billnnd knowothingiain the washington union annoiincca official
268,8,3225,3231,1859-08-05-seq-1.txt,1859-08-05-seq-1.txt,country slavery exist thenefcfo slave ulaim su pal iori trover tho fixe bio ks mid cuiisuiitljt   exhibit tictheir,both here in the hpantsbamerican country slavery exist thenefcfo slave ulaim su pal iori trover tho fixe
269,5,3226,3234,1859-08-05-seq-1.txt,1859-08-05-seq-1.txt,compete production cf tli creat staple consequently slave product slave labor bcarahigh,tli creat staple consequently slave product slave labor bcarahigh price lu ie midst this pro
270,5,3307,3308,1856-08-01-seq-1.txt,1856-08-01-seq-1.txt,luture haye destroy ny tne pressure slavery since maxim slavery establish no union without slavery,slavery since maxim slavery establish no union without slavery friend humanity oblige lament
271,3,3328,3331,1862-09-12-seq-1.txt,1862-09-12-seq-1.txt,would it I could save by free slave I would it 1 I could save freeing aiiej,save destroy slavery if I could savd union without free slave I would it I could save by
272,8,3330,3331,1862-09-12-seq-1.txt,1862-09-12-seq-1.txt,save union nnd either save destroy slavery if I could savd union without free slave I,save destroy slavery if I could savd union without free slave I would it I could save by
273,3,3357,3358,1850-03-22-seq-1.txt,1850-03-22-seq-1.txt,sufficient population nnd thai n slavery exist texas si time nexation slaveholding,slavery exist texas si time nexation slaveholding slale
274,3,3393,3394,1861-07-19-seq-1.txt,1861-07-19-seq-1.txt,stale ot confederacy slave property right property say slave shall,slave property right property say slave shall thereby impair   1
275,6,3404,3405,1855-04-27-seq-2.txt,1855-04-27-seq-2.txt,territory nre favor toleration slavery there tin ugh majority nre nnd may continue nonslaveholder,slavery there tin ugh majority nre nnd may continue nonslaveholder the territory fast fill tip nnd promise
276,5,3413,3414,1855-08-31-seq-2.txt,1855-08-31-seq-2.txt,emigration alone fill tcirito rlcs nuti slavery voter nnd prevent admission slave state,rlcs nuti slavery voter nnd prevent admission slave state every pass year biinga free common
277,5,3439,3568,1858-01-08-seq-4.txt,1858-01-15-seq-4.txt,weigh 178 180 ip dark color the owner say slave request ed come forwurd prove property pay,weigh 176 180 lbs dark color the owner say slave request ed come forward prove property nay
278,3,3439,3656,1858-01-08-seq-4.txt,1858-02-19-seq-4.txt,weigh 178 180 ip dark color the owner say slave request ed come forwurd prove property pay,end wixhs 175 1m0 lbs dark color the owner say slave request ad come forward prove property pay
279,5,3439,4900,1858-01-08-seq-4.txt,1857-11-20-seq-3.txt,weigh 178 180 ip dark color the owner say slave request ed come forwurd prove property pay,weigh ahout 173 180 ihs dark color the owner say slave request ed come forward prove properly pay
280,3,3457,3464,1863-05-01-seq-1.txt,1863-05-01-seq-1.txt,abolition slavery pass confiscation bill five slave guilty treason free la,count in order toaccomplish purpose abolition slavery pass confiscation bill five slave
281,3,3497,3498,1857-01-23-seq-1.txt,1857-01-23-seq-1.txt,result would follow h think slaveholde state citizen nnnslaveholde state would giv,slaveholde state citizen nnnslaveholde state would giv privilege make law
282,4,3500,3501,1857-01-23-seq-1.txt,1857-01-23-seq-1.txt,declare he oppose extension slavery wa thorough anti slavery man inhabitant,extension slavery wa thorough anti slavery man inhabitant kansas 0ipobe introduction
283,6,3549,3552,1858-05-28-seq-3.txt,1858-05-28-seq-3.txt,york the one conclave want slave traffic reopen want slave set tree one side want free trade tnxn,illuminate antislavery extreme new york the one conclave want slave traffic reopen want slave
284,6,3551,3552,1858-05-28-seq-3.txt,1858-05-28-seq-3.txt,trenie montgomery alnbamn illuminate antislavery extreme new york the one conclave want slave,illuminate antislavery extreme new york the one conclave want slave traffic reopen want slave
285,8,3567,4109,1854-06-09-seq-4.txt,1854-04-21-seq-3.txt,foot 8 tf inch hiiili the owner say slave hereby notify come ward prove property pay charge take,foot 8   inch high the owner say slave hereby notify come ward prove property pay charge lake
286,9,3567,4224,1854-06-09-seq-4.txt,1854-07-07-seq-4.txt,foot 8 tf inch hiiili the owner say slave hereby notify come ward prove property pay charge take,foot 8 9 inch high the owner say slave hereby notify come ward prove property pay charge take
287,4,3567,4507,1854-06-09-seq-4.txt,1854-05-26-seq-4.txt,foot 8 tf inch hiiili the owner say slave hereby notify come ward prove property pay charge take,foot 8 or inchcsliidi the owner say slave hereby notify come for wnrd prove property pay charge take
288,5,3567,4959,1854-06-09-seq-4.txt,1854-07-21-seq-4.txt,foot 8 tf inch hiiili the owner say slave hereby notify come ward prove property pay charge take,foot 8 9 inch hiirh tho owner say slave hereby notify come ward prove property pav charge take
289,9,3567,5034,1854-06-09-seq-4.txt,1854-08-04-seq-4.txt,foot 8 tf inch hiiili the owner say slave hereby notify come ward prove property pay charge take,foot 8 9 inch hitrh the owner say slave hereby notify come ward prove property pay charge take
290,4,3568,3656,1858-01-15-seq-4.txt,1858-02-19-seq-4.txt,weigh 176 180 lbs dark color the owner say slave request ed come forward prove property nay,end wixhs 175 1m0 lbs dark color the owner say slave request ad come forward prove property pay
291,7,3568,4900,1858-01-15-seq-4.txt,1857-11-20-seq-3.txt,weigh 176 180 lbs dark color the owner say slave request ed come forward prove property nay,weigh ahout 173 180 ihs dark color the owner say slave request ed come forward prove properly pay
292,6,3568,5084,1858-01-15-seq-4.txt,1857-12-18-seq-4.txt,weigh 176 180 lbs dark color the owner say slave request ed come forward prove property nay,end weigh 176 180 lbs dark oolor tha owner say slave request ed come forward prove property pay
293,8,3586,3587,1855-07-20-seq-1.txt,1855-07-20-seq-1.txt,mission union reeog   nition slavery in short be bo slavery agitation in congress and yet,  nition slavery in short be bo slavery agitation in congress and yet cause national sentiment drive
294,6,3602,3603,1860-01-06-seq-1.txt,1860-01-06-seq-1.txt,lieve virtually promise fire eater slave code deem nece sary protect slavery tho territory,eater slave code deem nece sary protect slavery tho territory he declare h wnl oppose legis
295,6,3606,3607,1860-01-06-seq-1.txt,1860-01-06-seq-1.txt,would object reopen tho slave trade dislike mr buchanans view slave trade favor,tho slave trade dislike mr buchanans view slave trade favor union
296,6,3617,3623,1858-03-05-seq-2.txt,1858-03-05-seq-2.txt,sert slave trade haa already reopen cargoe slave hsve srrive aold depot pearl river,new orle ars feb 26 the delta ss sert slave trade haa already reopen cargoe slave hsve srrive
297,3,3654,3655,1850-09-06-seq-1.txt,1850-09-06-seq-1.txt,ea viikwfwftrttiiif roaltv fum live slave decision wn inadn yester day hut tj morning judjjh pearson decid,day hut tj morning judjjh pearson decid ed ttv moiitinac f horse bv slave rpusi ecnpiiir
298,3,3656,4900,1858-02-19-seq-4.txt,1857-11-20-seq-3.txt,end wixhs 175 1m0 lbs dark color the owner say slave request ad come forward prove property pay,weigh ahout 173 180 ihs dark color the owner say slave request ed come forward prove properly pay
299,4,3678,3679,1859-03-25-seq-2.txt,1859-03-25-seq-2.txt,united states celebrate case dre scott right slave holder statute slavery tho,dre scott right slave holder statute slavery tho territory willing abido
300,6,3718,3720,1857-10-09-seq-1.txt,1857-10-09-seq-1.txt,great slave market africa supply slave obtain king hit jabon country prisoner war con,london paper savs lago great slave market africa supply slave obtain king hit jabon
301,8,3738,3739,1854-03-03-seq-2.txt,1854-03-03-seq-2.txt,ing south iermite become slave territory n slavo state make so if suited slave culture nature,slave territory n slavo state make so if suited slave culture nature secure settlement slaveholder if
302,6,3739,3740,1854-03-03-seq-2.txt,1854-03-03-seq-2.txt,slave territory n slavo state make so if suited slave culture nature secure settlement slaveholder if,so if suited slave culture nature secure settlement slaveholder if otherwise tho immigration free
303,7,3788,3798,1858-08-13-seq-2.txt,1858-08-13-seq-2.txt,shall dispute it but world slave mart except name there slave except name city new york,another name fur slave trade we shall dispute it but world slave mart except name there slave
304,4,3792,3799,1858-08-13-seq-2.txt,1858-08-13-seq-2.txt,reality and bad matter slave free country clamor loud slavery onefourth n,slave free country clamor loud slavery onefourth n well care fnr n southern slnve
305,7,3794,3795,1858-08-13-seq-2.txt,1858-08-13-seq-2.txt,drunken folly mismanagement ihe slave j n law state make tho teller liquor slave liable,slave j n law state make tho teller liquor slave liable consequence use
306,8,3797,3798,1858-08-13-seq-2.txt,1858-08-13-seq-2.txt,it may coolie trade another name fur slave trade we shall dispute it but world slave,another name fur slave trade we shall dispute it but world slave mart except name there slave
307,3,3844,3854,1862-11-07-seq-1.txt,1862-11-07-seq-1.txt,slave rivit they as slave themselves crush wrong dre uncle tom,save rivite chain slave rivit they as slave themselves crush
308,3,3848,3849,1862-11-07-seq-1.txt,1862-11-07-seq-1.txt,ler talker tourist torian moralist see slave country effect slavery,torian moralist see slave country effect slavery phenomena slight reflection
309,6,3852,3853,1862-11-07-seq-1.txt,1862-11-07-seq-1.txt,civilize it a dispensation slavery the west india colonie flour ishe slavery prevail thev,slavery the west india colonie flour ishe slavery prevail thev go ruin white man
310,12,3874,3874,1850-02-15-seq-1.txt,1850-02-15-seq-1.txt,imaginary line 3 g deg 30 min slavery interdict positively north 3 g deg 30 min freedom,imaginary line 3 g deg 30 min slavery interdict positively north 3 g deg 30 min freedom
311,6,3956,3965,1855-12-28-seq-1.txt,1855-12-28-seq-1.txt,tho abolition slavery not be allow long sell buy slave egypt possession private,decision come divan relative tho abolition slavery not be allow long sell buy slave
312,6,3957,3958,1855-12-28-seq-1.txt,1855-12-28-seq-1.txt,worth philadelphia upon tho subject slavery relation tha union how get rid slavery reverend gentle,slavery relation tha union how get rid slavery reverend gentle man confess be problem perplexing
313,4,3973,3981,1850-02-08-seq-2.txt,1850-02-08-seq-2.txt,resolve that congress power prohibit obstruct trade slave tween slavehnlding state admit,prohibit obstruct trade slave tween slavehnlding state admit ting exclude slave one ano
314,5,3974,3981,1850-02-08-seq-2.txt,1850-02-08-seq-2.txt,tween slavehnlding state admit ting exclude slave one ano ther depend exclusively upon,prohibit obstruct trade slave tween slavehnlding state admit ting exclude slave one ano
315,5,3977,3978,1850-02-08-seq-2.txt,1850-02-08-seq-2.txt,restriction tespect exclusion introduction slavery within boun darie hetolvetl that slavery ex,introduction slavery within boun darie hetolvetl that slavery ex ist law likely introduc
316,5,3985,3996,1859-09-16-seq-2.txt,1859-09-16-seq-2.txt,would drain farming state slave maintain regard cali fornia slavery could go thero,slave maintain regard cali fornia slavery could go thero without law advance establish
317,4,3988,4005,1859-09-16-seq-2.txt,1859-09-16-seq-2.txt,tho right territorial legislature exclude slave 1 even practically effectively subversive slaveholder,exclude slave 1 even practically effectively subversive slaveholder doctrine maintain mr
318,7,4021,4022,1856-02-29-seq-1.txt,1856-02-29-seq-1.txt,information necessary expose fairly meet tho sophistry pro slavery demo gogne make issue slavery freedom,meet tho sophistry pro slavery demo gogne make issue slavery freedom next presidential campaign they
319,3,4050,4051,1854-04-07-seq-3.txt,1854-04-07-seq-3.txt,necessary arrangement convey slave seaport town luite state transport slave,slave seaport town luite state transport slave western coast africa provide
320,4,4054,4109,1854-04-07-seq-3.txt,1854-04-21-seq-3.txt,foot   inch high the owner say slave hereby notify conic tor ward prove properly pay charge take,foot 8   inch high the owner say slave hereby notify come ward prove property pay charge lake
