,no_reuse,pair_index1,pair_index2,pair_date1,pair_date2,pair_text1,pair_text2
0,6,22,25,1852-09-02-seq-1.txt,1852-09-02-seq-1.txt,well pray use servant wait upon we 1 the servant send open gate,servant wait upon we 1 the servant send open gate thciuy pass out weal whistling
1,3,52,208,1850-09-26-seq-4.txt,1850-09-12-seq-3.txt,heretofore extend it solicit bj fublic humble servant n b patron thi home carry,bcreioforo extend it ia solicit rublica humblo servant n   b patron thi home carry
2,5,106,107,1857-07-03-seq-4.txt,1857-07-03-seq-4.txt,answrr be lht i n n si printi thv   the servantii ere insh   bofil stationrm,mr hiirnck sajs   aa empury ahotit hlaek servant answrr be lht i n n si printi thv
3,10,148,149,1859-05-06-seq-4.txt,1859-05-06-seq-4.txt,weak iift mo up say lic ttcrnly servant tbe servant takca hold liia hcad raucs,iift mo up say lic ttcrnly servant tbe servant takca hold liia hcad raucs liim little lic tric riso still furtlior
4,8,222,223,1850-05-23-seq-2.txt,1850-05-23-seq-2.txt,villc essex county new york nune ration fervant girl poison eat green co pose ihe ie plant the servant,fervant girl poison eat green co pose ihe ie plant the servant die whole family seriously til
5,4,342,343,1859-01-07-seq-2.txt,1859-01-07-seq-2.txt,uiuiiiui iiuiuaiei tauuii iu svo mm ouu uuy ring tho bcll nnd tho servant camo tho door tho llcv tell inform mr s,tho door tho llcv tell inform mr s servant tho lord wisbe havo au illtcrview he tho mimanirrwaa dclivcr
6,6,369,370,1859-02-25-seq-1.txt,1859-02-25-seq-1.txt,elogant carriage stand beforo tho atran1 young orunwieselonians deelare gers house aservant rich livery hold good right tho good knglish ing tho stop two gontlcman ontercd man world vulgar spiritual,ing tho stop two gontlcman ontercd man world vulgar spiritual carriage thc servant spring boot bo way in ghort general complaint hind aud thc carriage imagine   1 gentlemanly breode behavior
